[I 2026-01-17 14:48:49,148] A new study created in memory with name: no-name-2d01a1be-3503-4d9b-913b-f46e731a1455
/home/sjoon/projects/brain_connectivity_classifier/masterthesis_venv2/lib/python3.11/site-packages/sklearn/linear_model/_logistic.py:1272: FutureWarning: 'multi_class' was deprecated in version 1.5 and will be removed in 1.8. From then on, it will always use 'multinomial'. Leave it to its default value to avoid this warning.
  warnings.warn(
[I 2026-01-17 14:49:03,569] Trial 0 finished with value: 0.8590756704980843 and parameters: {'C': 0.0028854813096126047, 'max_iter': 266, 'solver': 'newton-cg'}. Best is trial 0 with value: 0.8590756704980843.
/home/sjoon/projects/brain_connectivity_classifier/masterthesis_venv2/lib/python3.11/site-packages/sklearn/linear_model/_logistic.py:1272: FutureWarning: 'multi_class' was deprecated in version 1.5 and will be removed in 1.8. From then on, it will always use 'multinomial'. Leave it to its default value to avoid this warning.
  warnings.warn(
[I 2026-01-17 14:49:36,337] Trial 1 finished with value: 0.9106800766283525 and parameters: {'C': 0.02034961622498155, 'max_iter': 399, 'solver': 'lbfgs'}. Best is trial 1 with value: 0.9106800766283525.
/home/sjoon/projects/brain_connectivity_classifier/masterthesis_venv2/lib/python3.11/site-packages/sklearn/linear_model/_logistic.py:1272: FutureWarning: 'multi_class' was deprecated in version 1.5 and will be removed in 1.8. From then on, it will always use 'multinomial'. Leave it to its default value to avoid this warning.
  warnings.warn(
[I 2026-01-17 14:49:49,221] Trial 2 finished with value: 0.7780172413793104 and parameters: {'C': 0.0013063372103949843, 'max_iter': 326, 'solver': 'newton-cg'}. Best is trial 1 with value: 0.9106800766283525.
/home/sjoon/projects/brain_connectivity_classifier/masterthesis_venv2/lib/python3.11/site-packages/sklearn/linear_model/_logistic.py:1272: FutureWarning: 'multi_class' was deprecated in version 1.5 and will be removed in 1.8. From then on, it will always use 'multinomial'. Leave it to its default value to avoid this warning.
  warnings.warn(
[I 2026-01-17 14:50:26,163] Trial 3 finished with value: 0.8908045977011494 and parameters: {'C': 0.01041560504864896, 'max_iter': 109, 'solver': 'lbfgs'}. Best is trial 1 with value: 0.9106800766283525.
/home/sjoon/projects/brain_connectivity_classifier/masterthesis_venv2/lib/python3.11/site-packages/sklearn/linear_model/_logistic.py:1272: FutureWarning: 'multi_class' was deprecated in version 1.5 and will be removed in 1.8. From then on, it will always use 'multinomial'. Leave it to its default value to avoid this warning.
  warnings.warn(
[I 2026-01-17 14:50:40,556] Trial 4 finished with value: 0.9195402298850575 and parameters: {'C': 0.0416828871122416, 'max_iter': 166, 'solver': 'newton-cg'}. Best is trial 4 with value: 0.9195402298850575.
/home/sjoon/projects/brain_connectivity_classifier/masterthesis_venv2/lib/python3.11/site-packages/sklearn/linear_model/_logistic.py:1272: FutureWarning: 'multi_class' was deprecated in version 1.5 and will be removed in 1.8. From then on, it will always use 'multinomial'. Leave it to its default value to avoid this warning.
  warnings.warn(
[I 2026-01-17 14:50:52,584] Trial 5 finished with value: 0.9074473180076629 and parameters: {'C': 2.487462779300572, 'max_iter': 478, 'solver': 'newton-cg'}. Best is trial 4 with value: 0.9195402298850575.
/home/sjoon/projects/brain_connectivity_classifier/masterthesis_venv2/lib/python3.11/site-packages/sklearn/linear_model/_logistic.py:1272: FutureWarning: 'multi_class' was deprecated in version 1.5 and will be removed in 1.8. From then on, it will always use 'multinomial'. Leave it to its default value to avoid this warning.
  warnings.warn(
[I 2026-01-17 14:51:07,960] Trial 6 finished with value: 0.9104406130268199 and parameters: {'C': 0.060678305383428034, 'max_iter': 294, 'solver': 'newton-cg'}. Best is trial 4 with value: 0.9195402298850575.
/home/sjoon/projects/brain_connectivity_classifier/masterthesis_venv2/lib/python3.11/site-packages/sklearn/linear_model/_logistic.py:1272: FutureWarning: 'multi_class' was deprecated in version 1.5 and will be removed in 1.8. From then on, it will always use 'multinomial'. Leave it to its default value to avoid this warning.
  warnings.warn(
[I 2026-01-17 14:51:24,148] Trial 7 finished with value: 0.9026580459770115 and parameters: {'C': 0.015560158006902589, 'max_iter': 152, 'solver': 'newton-cg'}. Best is trial 4 with value: 0.9195402298850575.
/home/sjoon/projects/brain_connectivity_classifier/masterthesis_venv2/lib/python3.11/site-packages/sklearn/linear_model/_logistic.py:1272: FutureWarning: 'multi_class' was deprecated in version 1.5 and will be removed in 1.8. From then on, it will always use 'multinomial'. Leave it to its default value to avoid this warning.
  warnings.warn(
[I 2026-01-17 14:51:47,197] Trial 8 finished with value: 0.9218151340996169 and parameters: {'C': 0.07987032801740344, 'max_iter': 278, 'solver': 'lbfgs'}. Best is trial 8 with value: 0.9218151340996169.
/home/sjoon/projects/brain_connectivity_classifier/masterthesis_venv2/lib/python3.11/site-packages/sklearn/linear_model/_logistic.py:1272: FutureWarning: 'multi_class' was deprecated in version 1.5 and will be removed in 1.8. From then on, it will always use 'multinomial'. Leave it to its default value to avoid this warning.
  warnings.warn(
[I 2026-01-17 14:52:01,703] Trial 9 finished with value: 0.9106800766283525 and parameters: {'C': 4.371317012469823, 'max_iter': 232, 'solver': 'newton-cg'}. Best is trial 8 with value: 0.9218151340996169.
/home/sjoon/projects/brain_connectivity_classifier/masterthesis_venv2/lib/python3.11/site-packages/sklearn/linear_model/_logistic.py:1272: FutureWarning: 'multi_class' was deprecated in version 1.5 and will be removed in 1.8. From then on, it will always use 'multinomial'. Leave it to its default value to avoid this warning.
  warnings.warn(
[I 2026-01-17 14:52:23,725] Trial 10 finished with value: 0.9117576628352491 and parameters: {'C': 0.46141959069413924, 'max_iter': 175, 'solver': 'lbfgs'}. Best is trial 8 with value: 0.9218151340996169.
/home/sjoon/projects/brain_connectivity_classifier/masterthesis_venv2/lib/python3.11/site-packages/sklearn/linear_model/_logistic.py:1272: FutureWarning: 'multi_class' was deprecated in version 1.5 and will be removed in 1.8. From then on, it will always use 'multinomial'. Leave it to its default value to avoid this warning.
  warnings.warn(
[I 2026-01-17 14:52:47,423] Trial 11 finished with value: 0.9068486590038314 and parameters: {'C': 0.24469116729061696, 'max_iter': 179, 'solver': 'lbfgs'}. Best is trial 8 with value: 0.9218151340996169.
/home/sjoon/projects/brain_connectivity_classifier/masterthesis_venv2/lib/python3.11/site-packages/sklearn/linear_model/_logistic.py:1272: FutureWarning: 'multi_class' was deprecated in version 1.5 and will be removed in 1.8. From then on, it will always use 'multinomial'. Leave it to its default value to avoid this warning.
  warnings.warn(
[I 2026-01-17 14:53:12,014] Trial 12 finished with value: 0.9213362068965517 and parameters: {'C': 0.11047293815668785, 'max_iter': 124, 'solver': 'lbfgs'}. Best is trial 8 with value: 0.9218151340996169.
/home/sjoon/projects/brain_connectivity_classifier/masterthesis_venv2/lib/python3.11/site-packages/sklearn/linear_model/_logistic.py:1272: FutureWarning: 'multi_class' was deprecated in version 1.5 and will be removed in 1.8. From then on, it will always use 'multinomial'. Leave it to its default value to avoid this warning.
  warnings.warn(
[I 2026-01-17 14:53:32,895] Trial 13 finished with value: 0.9216954022988506 and parameters: {'C': 0.23991721308358127, 'max_iter': 106, 'solver': 'lbfgs'}. Best is trial 8 with value: 0.9218151340996169.
/home/sjoon/projects/brain_connectivity_classifier/masterthesis_venv2/lib/python3.11/site-packages/sklearn/linear_model/_logistic.py:1272: FutureWarning: 'multi_class' was deprecated in version 1.5 and will be removed in 1.8. From then on, it will always use 'multinomial'. Leave it to its default value to avoid this warning.
  warnings.warn(
[I 2026-01-17 14:53:54,904] Trial 14 finished with value: 0.9096024904214559 and parameters: {'C': 1.2563591951576638, 'max_iter': 219, 'solver': 'lbfgs'}. Best is trial 8 with value: 0.9218151340996169.
/home/sjoon/projects/brain_connectivity_classifier/masterthesis_venv2/lib/python3.11/site-packages/sklearn/linear_model/_logistic.py:1272: FutureWarning: 'multi_class' was deprecated in version 1.5 and will be removed in 1.8. From then on, it will always use 'multinomial'. Leave it to its default value to avoid this warning.
  warnings.warn(
[I 2026-01-17 14:54:20,228] Trial 15 finished with value: 0.9209770114942529 and parameters: {'C': 0.598049701914481, 'max_iter': 353, 'solver': 'lbfgs'}. Best is trial 8 with value: 0.9218151340996169.
/home/sjoon/projects/brain_connectivity_classifier/masterthesis_venv2/lib/python3.11/site-packages/sklearn/linear_model/_logistic.py:1272: FutureWarning: 'multi_class' was deprecated in version 1.5 and will be removed in 1.8. From then on, it will always use 'multinomial'. Leave it to its default value to avoid this warning.
  warnings.warn(
[I 2026-01-17 14:54:38,568] Trial 16 finished with value: 0.9209770114942529 and parameters: {'C': 9.078506802415761, 'max_iter': 134, 'solver': 'lbfgs'}. Best is trial 8 with value: 0.9218151340996169.
/home/sjoon/projects/brain_connectivity_classifier/masterthesis_venv2/lib/python3.11/site-packages/sklearn/linear_model/_logistic.py:1272: FutureWarning: 'multi_class' was deprecated in version 1.5 and will be removed in 1.8. From then on, it will always use 'multinomial'. Leave it to its default value to avoid this warning.
  warnings.warn(
[I 2026-01-17 14:55:01,645] Trial 17 finished with value: 0.9113984674329502 and parameters: {'C': 0.18629457402526176, 'max_iter': 212, 'solver': 'lbfgs'}. Best is trial 8 with value: 0.9218151340996169.
/home/sjoon/projects/brain_connectivity_classifier/masterthesis_venv2/lib/python3.11/site-packages/sklearn/linear_model/_logistic.py:1272: FutureWarning: 'multi_class' was deprecated in version 1.5 and will be removed in 1.8. From then on, it will always use 'multinomial'. Leave it to its default value to avoid this warning.
  warnings.warn(
[I 2026-01-17 14:55:38,383] Trial 18 finished with value: 0.8648227969348659 and parameters: {'C': 0.005031302350071497, 'max_iter': 110, 'solver': 'lbfgs'}. Best is trial 8 with value: 0.9218151340996169.
/home/sjoon/projects/brain_connectivity_classifier/masterthesis_venv2/lib/python3.11/site-packages/sklearn/linear_model/_logistic.py:1272: FutureWarning: 'multi_class' was deprecated in version 1.5 and will be removed in 1.8. From then on, it will always use 'multinomial'. Leave it to its default value to avoid this warning.
  warnings.warn(
[I 2026-01-17 14:56:10,174] Trial 19 finished with value: 0.9148706896551724 and parameters: {'C': 0.043598477588010894, 'max_iter': 254, 'solver': 'lbfgs'}. Best is trial 8 with value: 0.9218151340996169.
/home/sjoon/projects/brain_connectivity_classifier/masterthesis_venv2/lib/python3.11/site-packages/sklearn/linear_model/_logistic.py:1272: FutureWarning: 'multi_class' was deprecated in version 1.5 and will be removed in 1.8. From then on, it will always use 'multinomial'. Leave it to its default value to avoid this warning.
  warnings.warn(
[I 2026-01-17 14:56:31,388] Trial 20 finished with value: 0.9110392720306514 and parameters: {'C': 0.6283419606767527, 'max_iter': 100, 'solver': 'lbfgs'}. Best is trial 8 with value: 0.9218151340996169.
/home/sjoon/projects/brain_connectivity_classifier/masterthesis_venv2/lib/python3.11/site-packages/sklearn/linear_model/_logistic.py:1272: FutureWarning: 'multi_class' was deprecated in version 1.5 and will be removed in 1.8. From then on, it will always use 'multinomial'. Leave it to its default value to avoid this warning.
  warnings.warn(
[I 2026-01-17 14:56:55,186] Trial 21 finished with value: 0.9183429118773946 and parameters: {'C': 0.1259869621092303, 'max_iter': 134, 'solver': 'lbfgs'}. Best is trial 8 with value: 0.9218151340996169.
/home/sjoon/projects/brain_connectivity_classifier/masterthesis_venv2/lib/python3.11/site-packages/sklearn/linear_model/_logistic.py:1272: FutureWarning: 'multi_class' was deprecated in version 1.5 and will be removed in 1.8. From then on, it will always use 'multinomial'. Leave it to its default value to avoid this warning.
  warnings.warn(
[I 2026-01-17 14:57:14,459] Trial 22 finished with value: 0.9112787356321839 and parameters: {'C': 0.11980681287634914, 'max_iter': 127, 'solver': 'lbfgs'}. Best is trial 8 with value: 0.9218151340996169.
/home/sjoon/projects/brain_connectivity_classifier/masterthesis_venv2/lib/python3.11/site-packages/sklearn/linear_model/_logistic.py:1272: FutureWarning: 'multi_class' was deprecated in version 1.5 and will be removed in 1.8. From then on, it will always use 'multinomial'. Leave it to its default value to avoid this warning.
  warnings.warn(
[I 2026-01-17 14:57:34,784] Trial 23 finished with value: 0.9246886973180076 and parameters: {'C': 0.37671435435431555, 'max_iter': 191, 'solver': 'lbfgs'}. Best is trial 23 with value: 0.9246886973180076.
/home/sjoon/projects/brain_connectivity_classifier/masterthesis_venv2/lib/python3.11/site-packages/sklearn/linear_model/_logistic.py:1272: FutureWarning: 'multi_class' was deprecated in version 1.5 and will be removed in 1.8. From then on, it will always use 'multinomial'. Leave it to its default value to avoid this warning.
  warnings.warn(
[I 2026-01-17 14:57:59,725] Trial 24 finished with value: 0.9201388888888888 and parameters: {'C': 0.3016073576885767, 'max_iter': 197, 'solver': 'lbfgs'}. Best is trial 23 with value: 0.9246886973180076.
/home/sjoon/projects/brain_connectivity_classifier/masterthesis_venv2/lib/python3.11/site-packages/sklearn/linear_model/_logistic.py:1272: FutureWarning: 'multi_class' was deprecated in version 1.5 and will be removed in 1.8. From then on, it will always use 'multinomial'. Leave it to its default value to avoid this warning.
  warnings.warn(
[I 2026-01-17 14:58:19,625] Trial 25 finished with value: 0.9154693486590039 and parameters: {'C': 1.2949971244514804, 'max_iter': 299, 'solver': 'lbfgs'}. Best is trial 23 with value: 0.9246886973180076.
/home/sjoon/projects/brain_connectivity_classifier/masterthesis_venv2/lib/python3.11/site-packages/sklearn/linear_model/_logistic.py:1272: FutureWarning: 'multi_class' was deprecated in version 1.5 and will be removed in 1.8. From then on, it will always use 'multinomial'. Leave it to its default value to avoid this warning.
  warnings.warn(
[I 2026-01-17 14:58:42,766] Trial 26 finished with value: 0.9183429118773946 and parameters: {'C': 1.3197626665474402, 'max_iter': 148, 'solver': 'lbfgs'}. Best is trial 23 with value: 0.9246886973180076.
/home/sjoon/projects/brain_connectivity_classifier/masterthesis_venv2/lib/python3.11/site-packages/sklearn/linear_model/_logistic.py:1272: FutureWarning: 'multi_class' was deprecated in version 1.5 and will be removed in 1.8. From then on, it will always use 'multinomial'. Leave it to its default value to avoid this warning.
  warnings.warn(
[I 2026-01-17 14:59:14,262] Trial 27 finished with value: 0.9202586206896551 and parameters: {'C': 0.04687747895143783, 'max_iter': 382, 'solver': 'lbfgs'}. Best is trial 23 with value: 0.9246886973180076.
/home/sjoon/projects/brain_connectivity_classifier/masterthesis_venv2/lib/python3.11/site-packages/sklearn/linear_model/_logistic.py:1272: FutureWarning: 'multi_class' was deprecated in version 1.5 and will be removed in 1.8. From then on, it will always use 'multinomial'. Leave it to its default value to avoid this warning.
  warnings.warn(
[I 2026-01-17 14:59:31,928] Trial 28 finished with value: 0.9207375478927203 and parameters: {'C': 0.4531471221858927, 'max_iter': 254, 'solver': 'lbfgs'}. Best is trial 23 with value: 0.9246886973180076.
/home/sjoon/projects/brain_connectivity_classifier/masterthesis_venv2/lib/python3.11/site-packages/sklearn/linear_model/_logistic.py:1272: FutureWarning: 'multi_class' was deprecated in version 1.5 and will be removed in 1.8. From then on, it will always use 'multinomial'. Leave it to its default value to avoid this warning.
  warnings.warn(
[I 2026-01-17 15:00:01,432] Trial 29 finished with value: 0.9190613026819924 and parameters: {'C': 0.02658501776609081, 'max_iter': 289, 'solver': 'lbfgs'}. Best is trial 23 with value: 0.9246886973180076.
/home/sjoon/projects/brain_connectivity_classifier/masterthesis_venv2/lib/python3.11/site-packages/sklearn/linear_model/_logistic.py:1272: FutureWarning: 'multi_class' was deprecated in version 1.5 and will be removed in 1.8. From then on, it will always use 'multinomial'. Leave it to its default value to avoid this warning.
  warnings.warn(
[I 2026-01-17 15:00:22,140] Trial 30 finished with value: 0.9149904214559387 and parameters: {'C': 0.22447162582810154, 'max_iter': 194, 'solver': 'lbfgs'}. Best is trial 23 with value: 0.9246886973180076.
/home/sjoon/projects/brain_connectivity_classifier/masterthesis_venv2/lib/python3.11/site-packages/sklearn/linear_model/_logistic.py:1272: FutureWarning: 'multi_class' was deprecated in version 1.5 and will be removed in 1.8. From then on, it will always use 'multinomial'. Leave it to its default value to avoid this warning.
  warnings.warn(
[I 2026-01-17 15:00:43,696] Trial 31 finished with value: 0.9148706896551724 and parameters: {'C': 0.07694662817686804, 'max_iter': 118, 'solver': 'lbfgs'}. Best is trial 23 with value: 0.9246886973180076.
/home/sjoon/projects/brain_connectivity_classifier/masterthesis_venv2/lib/python3.11/site-packages/sklearn/linear_model/_logistic.py:1272: FutureWarning: 'multi_class' was deprecated in version 1.5 and will be removed in 1.8. From then on, it will always use 'multinomial'. Leave it to its default value to avoid this warning.
  warnings.warn(
[I 2026-01-17 15:01:03,935] Trial 32 finished with value: 0.9171455938697318 and parameters: {'C': 0.10855511160926892, 'max_iter': 148, 'solver': 'lbfgs'}. Best is trial 23 with value: 0.9246886973180076.
/home/sjoon/projects/brain_connectivity_classifier/masterthesis_venv2/lib/python3.11/site-packages/sklearn/linear_model/_logistic.py:1272: FutureWarning: 'multi_class' was deprecated in version 1.5 and will be removed in 1.8. From then on, it will always use 'multinomial'. Leave it to its default value to avoid this warning.
  warnings.warn(
[I 2026-01-17 15:01:24,428] Trial 33 finished with value: 0.9176245210727969 and parameters: {'C': 0.17018627231383676, 'max_iter': 100, 'solver': 'lbfgs'}. Best is trial 23 with value: 0.9246886973180076.
/home/sjoon/projects/brain_connectivity_classifier/masterthesis_venv2/lib/python3.11/site-packages/sklearn/linear_model/_logistic.py:1272: FutureWarning: 'multi_class' was deprecated in version 1.5 and will be removed in 1.8. From then on, it will always use 'multinomial'. Leave it to its default value to avoid this warning.
  warnings.warn(
[I 2026-01-17 15:02:10,502] Trial 34 finished with value: 0.8961925287356322 and parameters: {'C': 0.009302038159456964, 'max_iter': 116, 'solver': 'lbfgs'}. Best is trial 23 with value: 0.9246886973180076.
/home/sjoon/projects/brain_connectivity_classifier/masterthesis_venv2/lib/python3.11/site-packages/sklearn/linear_model/_logistic.py:1272: FutureWarning: 'multi_class' was deprecated in version 1.5 and will be removed in 1.8. From then on, it will always use 'multinomial'. Leave it to its default value to avoid this warning.
  warnings.warn(
[I 2026-01-17 15:02:45,721] Trial 35 finished with value: 0.9152298850574713 and parameters: {'C': 0.027710548987645307, 'max_iter': 127, 'solver': 'lbfgs'}. Best is trial 23 with value: 0.9246886973180076.
/home/sjoon/projects/brain_connectivity_classifier/masterthesis_venv2/lib/python3.11/site-packages/sklearn/linear_model/_logistic.py:1272: FutureWarning: 'multi_class' was deprecated in version 1.5 and will be removed in 1.8. From then on, it will always use 'multinomial'. Leave it to its default value to avoid this warning.
  warnings.warn(
[I 2026-01-17 15:02:59,903] Trial 36 finished with value: 0.7944204980842912 and parameters: {'C': 0.0016905953133224834, 'max_iter': 443, 'solver': 'newton-cg'}. Best is trial 23 with value: 0.9246886973180076.
/home/sjoon/projects/brain_connectivity_classifier/masterthesis_venv2/lib/python3.11/site-packages/sklearn/linear_model/_logistic.py:1272: FutureWarning: 'multi_class' was deprecated in version 1.5 and will be removed in 1.8. From then on, it will always use 'multinomial'. Leave it to its default value to avoid this warning.
  warnings.warn(
[I 2026-01-17 15:03:21,692] Trial 37 finished with value: 0.9339080459770115 and parameters: {'C': 0.340307130832763, 'max_iter': 163, 'solver': 'lbfgs'}. Best is trial 37 with value: 0.9339080459770115.
/home/sjoon/projects/brain_connectivity_classifier/masterthesis_venv2/lib/python3.11/site-packages/sklearn/linear_model/_logistic.py:1272: FutureWarning: 'multi_class' was deprecated in version 1.5 and will be removed in 1.8. From then on, it will always use 'multinomial'. Leave it to its default value to avoid this warning.
  warnings.warn(
[I 2026-01-17 15:03:31,847] Trial 38 finished with value: 0.9018199233716475 and parameters: {'C': 0.9057606086598462, 'max_iter': 237, 'solver': 'newton-cg'}. Best is trial 37 with value: 0.9339080459770115.
/home/sjoon/projects/brain_connectivity_classifier/masterthesis_venv2/lib/python3.11/site-packages/sklearn/linear_model/_logistic.py:1272: FutureWarning: 'multi_class' was deprecated in version 1.5 and will be removed in 1.8. From then on, it will always use 'multinomial'. Leave it to its default value to avoid this warning.
  warnings.warn(
