[I 2026-01-17 16:05:33,283] Trial 30 finished with value: 0.9127155172413793 and parameters: {'C': 0.4117564897150965, 'max_iter': 243, 'solver': 'lbfgs'}. Best is trial 11 with value: 0.9285201149425287.
/home/sjoon/projects/brain_connectivity_classifier/masterthesis_venv2/lib/python3.11/site-packages/sklearn/linear_model/_logistic.py:1272: FutureWarning: 'multi_class' was deprecated in version 1.5 and will be removed in 1.8. From then on, it will always use 'multinomial'. Leave it to its default value to avoid this warning.
  warnings.warn(
[I 2026-01-17 16:05:52,164] Trial 31 finished with value: 0.9143917624521073 and parameters: {'C': 0.11099913325011287, 'max_iter': 171, 'solver': 'lbfgs'}. Best is trial 11 with value: 0.9285201149425287.
/home/sjoon/projects/brain_connectivity_classifier/masterthesis_venv2/lib/python3.11/site-packages/sklearn/linear_model/_logistic.py:1272: FutureWarning: 'multi_class' was deprecated in version 1.5 and will be removed in 1.8. From then on, it will always use 'multinomial'. Leave it to its default value to avoid this warning.
  warnings.warn(
[I 2026-01-17 16:06:11,348] Trial 32 finished with value: 0.9201388888888888 and parameters: {'C': 0.18467718080069342, 'max_iter': 201, 'solver': 'lbfgs'}. Best is trial 11 with value: 0.9285201149425287.
/home/sjoon/projects/brain_connectivity_classifier/masterthesis_venv2/lib/python3.11/site-packages/sklearn/linear_model/_logistic.py:1272: FutureWarning: 'multi_class' was deprecated in version 1.5 and will be removed in 1.8. From then on, it will always use 'multinomial'. Leave it to its default value to avoid this warning.
  warnings.warn(
[I 2026-01-17 16:06:31,948] Trial 33 finished with value: 0.9121168582375478 and parameters: {'C': 0.603122421801668, 'max_iter': 170, 'solver': 'lbfgs'}. Best is trial 11 with value: 0.9285201149425287.
/home/sjoon/projects/brain_connectivity_classifier/masterthesis_venv2/lib/python3.11/site-packages/sklearn/linear_model/_logistic.py:1272: FutureWarning: 'multi_class' was deprecated in version 1.5 and will be removed in 1.8. From then on, it will always use 'multinomial'. Leave it to its default value to avoid this warning.
  warnings.warn(
[I 2026-01-17 16:06:50,593] Trial 34 finished with value: 0.9158285440613027 and parameters: {'C': 1.305292331742032, 'max_iter': 146, 'solver': 'lbfgs'}. Best is trial 11 with value: 0.9285201149425287.
/home/sjoon/projects/brain_connectivity_classifier/masterthesis_venv2/lib/python3.11/site-packages/sklearn/linear_model/_logistic.py:1272: FutureWarning: 'multi_class' was deprecated in version 1.5 and will be removed in 1.8. From then on, it will always use 'multinomial'. Leave it to its default value to avoid this warning.
  warnings.warn(
[I 2026-01-17 16:07:10,184] Trial 35 finished with value: 0.9049329501915708 and parameters: {'C': 0.44586464818969485, 'max_iter': 124, 'solver': 'lbfgs'}. Best is trial 11 with value: 0.9285201149425287.
/home/sjoon/projects/brain_connectivity_classifier/masterthesis_venv2/lib/python3.11/site-packages/sklearn/linear_model/_logistic.py:1272: FutureWarning: 'multi_class' was deprecated in version 1.5 and will be removed in 1.8. From then on, it will always use 'multinomial'. Leave it to its default value to avoid this warning.
  warnings.warn(
[I 2026-01-17 16:07:30,898] Trial 36 finished with value: 0.9228927203065134 and parameters: {'C': 0.16158346810605975, 'max_iter': 151, 'solver': 'lbfgs'}. Best is trial 11 with value: 0.9285201149425287.
/home/sjoon/projects/brain_connectivity_classifier/masterthesis_venv2/lib/python3.11/site-packages/sklearn/linear_model/_logistic.py:1272: FutureWarning: 'multi_class' was deprecated in version 1.5 and will be removed in 1.8. From then on, it will always use 'multinomial'. Leave it to its default value to avoid this warning.
  warnings.warn(
[I 2026-01-17 16:07:44,976] Trial 37 finished with value: 0.9133141762452107 and parameters: {'C': 0.8445123681207722, 'max_iter': 153, 'solver': 'newton-cg'}. Best is trial 11 with value: 0.9285201149425287.
/home/sjoon/projects/brain_connectivity_classifier/masterthesis_venv2/lib/python3.11/site-packages/sklearn/linear_model/_logistic.py:1272: FutureWarning: 'multi_class' was deprecated in version 1.5 and will be removed in 1.8. From then on, it will always use 'multinomial'. Leave it to its default value to avoid this warning.
  warnings.warn(
[I 2026-01-17 16:08:04,655] Trial 38 finished with value: 0.9157088122605364 and parameters: {'C': 2.7030650359373443, 'max_iter': 187, 'solver': 'lbfgs'}. Best is trial 11 with value: 0.9285201149425287.
/home/sjoon/projects/brain_connectivity_classifier/masterthesis_venv2/lib/python3.11/site-packages/sklearn/linear_model/_logistic.py:1272: FutureWarning: 'multi_class' was deprecated in version 1.5 and will be removed in 1.8. From then on, it will always use 'multinomial'. Leave it to its default value to avoid this warning.
  warnings.warn(
[I 2026-01-17 16:08:24,087] Trial 39 finished with value: 0.9188218390804598 and parameters: {'C': 0.34446599270376727, 'max_iter': 139, 'solver': 'lbfgs'}. Best is trial 11 with value: 0.9285201149425287.
/home/sjoon/projects/brain_connectivity_classifier/masterthesis_venv2/lib/python3.11/site-packages/sklearn/linear_model/_logistic.py:1272: FutureWarning: 'multi_class' was deprecated in version 1.5 and will be removed in 1.8. From then on, it will always use 'multinomial'. Leave it to its default value to avoid this warning.
  warnings.warn(
[I 2026-01-17 16:08:38,047] Trial 40 finished with value: 0.9019396551724138 and parameters: {'C': 0.0384771551086819, 'max_iter': 123, 'solver': 'newton-cg'}. Best is trial 11 with value: 0.9285201149425287.
/home/sjoon/projects/brain_connectivity_classifier/masterthesis_venv2/lib/python3.11/site-packages/sklearn/linear_model/_logistic.py:1272: FutureWarning: 'multi_class' was deprecated in version 1.5 and will be removed in 1.8. From then on, it will always use 'multinomial'. Leave it to its default value to avoid this warning.
  warnings.warn(
[I 2026-01-17 16:09:02,036] Trial 41 finished with value: 0.9212164750957854 and parameters: {'C': 0.15938116298681718, 'max_iter': 160, 'solver': 'lbfgs'}. Best is trial 11 with value: 0.9285201149425287.
/home/sjoon/projects/brain_connectivity_classifier/masterthesis_venv2/lib/python3.11/site-packages/sklearn/linear_model/_logistic.py:1272: FutureWarning: 'multi_class' was deprecated in version 1.5 and will be removed in 1.8. From then on, it will always use 'multinomial'. Leave it to its default value to avoid this warning.
  warnings.warn(
[I 2026-01-17 16:09:30,325] Trial 42 finished with value: 0.9275622605363985 and parameters: {'C': 0.08771686787992952, 'max_iter': 159, 'solver': 'lbfgs'}. Best is trial 11 with value: 0.9285201149425287.
/home/sjoon/projects/brain_connectivity_classifier/masterthesis_venv2/lib/python3.11/site-packages/sklearn/linear_model/_logistic.py:1272: FutureWarning: 'multi_class' was deprecated in version 1.5 and will be removed in 1.8. From then on, it will always use 'multinomial'. Leave it to its default value to avoid this warning.
  warnings.warn(
[I 2026-01-17 16:09:52,924] Trial 43 finished with value: 0.9181034482758621 and parameters: {'C': 0.09295935151305167, 'max_iter': 157, 'solver': 'lbfgs'}. Best is trial 11 with value: 0.9285201149425287.
/home/sjoon/projects/brain_connectivity_classifier/masterthesis_venv2/lib/python3.11/site-packages/sklearn/linear_model/_logistic.py:1272: FutureWarning: 'multi_class' was deprecated in version 1.5 and will be removed in 1.8. From then on, it will always use 'multinomial'. Leave it to its default value to avoid this warning.
  warnings.warn(
[I 2026-01-17 16:10:38,788] Trial 44 finished with value: 0.8670977011494253 and parameters: {'C': 0.004158772484241488, 'max_iter': 212, 'solver': 'lbfgs'}. Best is trial 11 with value: 0.9285201149425287.
/home/sjoon/projects/brain_connectivity_classifier/masterthesis_venv2/lib/python3.11/site-packages/sklearn/linear_model/_logistic.py:1272: FutureWarning: 'multi_class' was deprecated in version 1.5 and will be removed in 1.8. From then on, it will always use 'multinomial'. Leave it to its default value to avoid this warning.
  warnings.warn(
[I 2026-01-17 16:11:00,064] Trial 45 finished with value: 0.9052921455938697 and parameters: {'C': 0.5173819924205204, 'max_iter': 128, 'solver': 'lbfgs'}. Best is trial 11 with value: 0.9285201149425287.
/home/sjoon/projects/brain_connectivity_classifier/masterthesis_venv2/lib/python3.11/site-packages/sklearn/linear_model/_logistic.py:1272: FutureWarning: 'multi_class' was deprecated in version 1.5 and will be removed in 1.8. From then on, it will always use 'multinomial'. Leave it to its default value to avoid this warning.
  warnings.warn(
[I 2026-01-17 16:11:34,006] Trial 46 finished with value: 0.9064894636015326 and parameters: {'C': 0.015061154673926725, 'max_iter': 109, 'solver': 'lbfgs'}. Best is trial 11 with value: 0.9285201149425287.
/home/sjoon/projects/brain_connectivity_classifier/masterthesis_venv2/lib/python3.11/site-packages/sklearn/linear_model/_logistic.py:1272: FutureWarning: 'multi_class' was deprecated in version 1.5 and will be removed in 1.8. From then on, it will always use 'multinomial'. Leave it to its default value to avoid this warning.
  warnings.warn(
[I 2026-01-17 16:11:51,592] Trial 47 finished with value: 0.9276819923371648 and parameters: {'C': 0.25841743172946297, 'max_iter': 346, 'solver': 'lbfgs'}. Best is trial 11 with value: 0.9285201149425287.
/home/sjoon/projects/brain_connectivity_classifier/masterthesis_venv2/lib/python3.11/site-packages/sklearn/linear_model/_logistic.py:1272: FutureWarning: 'multi_class' was deprecated in version 1.5 and will be removed in 1.8. From then on, it will always use 'multinomial'. Leave it to its default value to avoid this warning.
  warnings.warn(
[I 2026-01-17 16:12:09,779] Trial 48 finished with value: 0.914272030651341 and parameters: {'C': 4.592194667849293, 'max_iter': 342, 'solver': 'lbfgs'}. Best is trial 11 with value: 0.9285201149425287.
/home/sjoon/projects/brain_connectivity_classifier/masterthesis_venv2/lib/python3.11/site-packages/sklearn/linear_model/_logistic.py:1272: FutureWarning: 'multi_class' was deprecated in version 1.5 and will be removed in 1.8. From then on, it will always use 'multinomial'. Leave it to its default value to avoid this warning.
  warnings.warn(
