[I 2026-01-17 15:25:57,652] Trial 15 finished with value: 0.7911877394636015 and parameters: {'C': 0.0012303483522539905, 'max_iter': 367, 'solver': 'newton-cg'}. Best is trial 14 with value: 0.91977969348659.
/home/sjoon/projects/brain_connectivity_classifier/masterthesis_venv2/lib/python3.11/site-packages/sklearn/linear_model/_logistic.py:1272: FutureWarning: 'multi_class' was deprecated in version 1.5 and will be removed in 1.8. From then on, it will always use 'multinomial'. Leave it to its default value to avoid this warning.
  warnings.warn(
[I 2026-01-17 15:26:11,495] Trial 16 finished with value: 0.9161877394636015 and parameters: {'C': 1.4565037605783118, 'max_iter': 347, 'solver': 'newton-cg'}. Best is trial 14 with value: 0.91977969348659.
/home/sjoon/projects/brain_connectivity_classifier/masterthesis_venv2/lib/python3.11/site-packages/sklearn/linear_model/_logistic.py:1272: FutureWarning: 'multi_class' was deprecated in version 1.5 and will be removed in 1.8. From then on, it will always use 'multinomial'. Leave it to its default value to avoid this warning.
  warnings.warn(
[I 2026-01-17 15:26:24,168] Trial 17 finished with value: 0.922294061302682 and parameters: {'C': 0.17600677357969377, 'max_iter': 430, 'solver': 'newton-cg'}. Best is trial 17 with value: 0.922294061302682.
/home/sjoon/projects/brain_connectivity_classifier/masterthesis_venv2/lib/python3.11/site-packages/sklearn/linear_model/_logistic.py:1272: FutureWarning: 'multi_class' was deprecated in version 1.5 and will be removed in 1.8. From then on, it will always use 'multinomial'. Leave it to its default value to avoid this warning.
  warnings.warn(
[I 2026-01-17 15:26:36,553] Trial 18 finished with value: 0.9113984674329502 and parameters: {'C': 0.21671223318020763, 'max_iter': 452, 'solver': 'newton-cg'}. Best is trial 17 with value: 0.922294061302682.
/home/sjoon/projects/brain_connectivity_classifier/masterthesis_venv2/lib/python3.11/site-packages/sklearn/linear_model/_logistic.py:1272: FutureWarning: 'multi_class' was deprecated in version 1.5 and will be removed in 1.8. From then on, it will always use 'multinomial'. Leave it to its default value to avoid this warning.
  warnings.warn(
[I 2026-01-17 15:26:50,356] Trial 19 finished with value: 0.9080459770114943 and parameters: {'C': 1.7353774836107525, 'max_iter': 373, 'solver': 'newton-cg'}. Best is trial 17 with value: 0.922294061302682.
/home/sjoon/projects/brain_connectivity_classifier/masterthesis_venv2/lib/python3.11/site-packages/sklearn/linear_model/_logistic.py:1272: FutureWarning: 'multi_class' was deprecated in version 1.5 and will be removed in 1.8. From then on, it will always use 'multinomial'. Leave it to its default value to avoid this warning.
  warnings.warn(
[I 2026-01-17 15:27:03,313] Trial 20 finished with value: 0.9121168582375478 and parameters: {'C': 0.019136455953109012, 'max_iter': 426, 'solver': 'newton-cg'}. Best is trial 17 with value: 0.922294061302682.
/home/sjoon/projects/brain_connectivity_classifier/masterthesis_venv2/lib/python3.11/site-packages/sklearn/linear_model/_logistic.py:1272: FutureWarning: 'multi_class' was deprecated in version 1.5 and will be removed in 1.8. From then on, it will always use 'multinomial'. Leave it to its default value to avoid this warning.
  warnings.warn(
[I 2026-01-17 15:27:17,527] Trial 21 finished with value: 0.9048132183908046 and parameters: {'C': 0.10061361636405919, 'max_iter': 304, 'solver': 'newton-cg'}. Best is trial 17 with value: 0.922294061302682.
/home/sjoon/projects/brain_connectivity_classifier/masterthesis_venv2/lib/python3.11/site-packages/sklearn/linear_model/_logistic.py:1272: FutureWarning: 'multi_class' was deprecated in version 1.5 and will be removed in 1.8. From then on, it will always use 'multinomial'. Leave it to its default value to avoid this warning.
  warnings.warn(
[I 2026-01-17 15:27:30,941] Trial 22 finished with value: 0.9131944444444444 and parameters: {'C': 0.04351493723788819, 'max_iter': 163, 'solver': 'newton-cg'}. Best is trial 17 with value: 0.922294061302682.
/home/sjoon/projects/brain_connectivity_classifier/masterthesis_venv2/lib/python3.11/site-packages/sklearn/linear_model/_logistic.py:1272: FutureWarning: 'multi_class' was deprecated in version 1.5 and will be removed in 1.8. From then on, it will always use 'multinomial'. Leave it to its default value to avoid this warning.
  warnings.warn(
[I 2026-01-17 15:27:43,634] Trial 23 finished with value: 0.9167863984674329 and parameters: {'C': 0.20307227024926122, 'max_iter': 404, 'solver': 'newton-cg'}. Best is trial 17 with value: 0.922294061302682.
/home/sjoon/projects/brain_connectivity_classifier/masterthesis_venv2/lib/python3.11/site-packages/sklearn/linear_model/_logistic.py:1272: FutureWarning: 'multi_class' was deprecated in version 1.5 and will be removed in 1.8. From then on, it will always use 'multinomial'. Leave it to its default value to avoid this warning.
  warnings.warn(
[I 2026-01-17 15:27:59,767] Trial 24 finished with value: 0.8881704980842912 and parameters: {'C': 0.005648442537881318, 'max_iter': 336, 'solver': 'newton-cg'}. Best is trial 17 with value: 0.922294061302682.
/home/sjoon/projects/brain_connectivity_classifier/masterthesis_venv2/lib/python3.11/site-packages/sklearn/linear_model/_logistic.py:1272: FutureWarning: 'multi_class' was deprecated in version 1.5 and will be removed in 1.8. From then on, it will always use 'multinomial'. Leave it to its default value to avoid this warning.
  warnings.warn(
[I 2026-01-17 15:28:11,445] Trial 25 finished with value: 0.9110392720306514 and parameters: {'C': 0.41940214735209463, 'max_iter': 268, 'solver': 'newton-cg'}. Best is trial 17 with value: 0.922294061302682.
/home/sjoon/projects/brain_connectivity_classifier/masterthesis_venv2/lib/python3.11/site-packages/sklearn/linear_model/_logistic.py:1272: FutureWarning: 'multi_class' was deprecated in version 1.5 and will be removed in 1.8. From then on, it will always use 'multinomial'. Leave it to its default value to avoid this warning.
  warnings.warn(
[I 2026-01-17 15:28:23,782] Trial 26 finished with value: 0.9275622605363985 and parameters: {'C': 0.03352340999365558, 'max_iter': 495, 'solver': 'newton-cg'}. Best is trial 26 with value: 0.9275622605363985.
/home/sjoon/projects/brain_connectivity_classifier/masterthesis_venv2/lib/python3.11/site-packages/sklearn/linear_model/_logistic.py:1272: FutureWarning: 'multi_class' was deprecated in version 1.5 and will be removed in 1.8. From then on, it will always use 'multinomial'. Leave it to its default value to avoid this warning.
  warnings.warn(
[I 2026-01-17 15:28:37,436] Trial 27 finished with value: 0.9103208812260536 and parameters: {'C': 0.024529810731751537, 'max_iter': 495, 'solver': 'newton-cg'}. Best is trial 26 with value: 0.9275622605363985.
/home/sjoon/projects/brain_connectivity_classifier/masterthesis_venv2/lib/python3.11/site-packages/sklearn/linear_model/_logistic.py:1272: FutureWarning: 'multi_class' was deprecated in version 1.5 and will be removed in 1.8. From then on, it will always use 'multinomial'. Leave it to its default value to avoid this warning.
  warnings.warn(
[I 2026-01-17 15:28:51,698] Trial 28 finished with value: 0.9170258620689655 and parameters: {'C': 0.12210723342610916, 'max_iter': 429, 'solver': 'newton-cg'}. Best is trial 26 with value: 0.9275622605363985.
/home/sjoon/projects/brain_connectivity_classifier/masterthesis_venv2/lib/python3.11/site-packages/sklearn/linear_model/_logistic.py:1272: FutureWarning: 'multi_class' was deprecated in version 1.5 and will be removed in 1.8. From then on, it will always use 'multinomial'. Leave it to its default value to avoid this warning.
  warnings.warn(
[I 2026-01-17 15:29:08,693] Trial 29 finished with value: 0.9020593869731801 and parameters: {'C': 0.0104625768518045, 'max_iter': 405, 'solver': 'newton-cg'}. Best is trial 26 with value: 0.9275622605363985.
/home/sjoon/projects/brain_connectivity_classifier/masterthesis_venv2/lib/python3.11/site-packages/sklearn/linear_model/_logistic.py:1272: FutureWarning: 'multi_class' was deprecated in version 1.5 and will be removed in 1.8. From then on, it will always use 'multinomial'. Leave it to its default value to avoid this warning.
  warnings.warn(
[I 2026-01-17 15:29:20,739] Trial 30 finished with value: 0.9124760536398467 and parameters: {'C': 0.8307760059248107, 'max_iter': 483, 'solver': 'newton-cg'}. Best is trial 26 with value: 0.9275622605363985.
/home/sjoon/projects/brain_connectivity_classifier/masterthesis_venv2/lib/python3.11/site-packages/sklearn/linear_model/_logistic.py:1272: FutureWarning: 'multi_class' was deprecated in version 1.5 and will be removed in 1.8. From then on, it will always use 'multinomial'. Leave it to its default value to avoid this warning.
  warnings.warn(
[I 2026-01-17 15:29:33,271] Trial 31 finished with value: 0.9118773946360154 and parameters: {'C': 0.06585322849702069, 'max_iter': 228, 'solver': 'newton-cg'}. Best is trial 26 with value: 0.9275622605363985.
/home/sjoon/projects/brain_connectivity_classifier/masterthesis_venv2/lib/python3.11/site-packages/sklearn/linear_model/_logistic.py:1272: FutureWarning: 'multi_class' was deprecated in version 1.5 and will be removed in 1.8. From then on, it will always use 'multinomial'. Leave it to its default value to avoid this warning.
  warnings.warn(
[I 2026-01-17 15:29:44,509] Trial 32 finished with value: 0.9131944444444444 and parameters: {'C': 0.045538818064157265, 'max_iter': 328, 'solver': 'newton-cg'}. Best is trial 26 with value: 0.9275622605363985.
/home/sjoon/projects/brain_connectivity_classifier/masterthesis_venv2/lib/python3.11/site-packages/sklearn/linear_model/_logistic.py:1272: FutureWarning: 'multi_class' was deprecated in version 1.5 and will be removed in 1.8. From then on, it will always use 'multinomial'. Leave it to its default value to avoid this warning.
  warnings.warn(
[I 2026-01-17 15:29:58,352] Trial 33 finished with value: 0.9179837164750958 and parameters: {'C': 0.16616554764316988, 'max_iter': 257, 'solver': 'newton-cg'}. Best is trial 26 with value: 0.9275622605363985.
/home/sjoon/projects/brain_connectivity_classifier/masterthesis_venv2/lib/python3.11/site-packages/sklearn/linear_model/_logistic.py:1272: FutureWarning: 'multi_class' was deprecated in version 1.5 and will be removed in 1.8. From then on, it will always use 'multinomial'. Leave it to its default value to avoid this warning.
  warnings.warn(
[I 2026-01-17 15:30:13,684] Trial 34 finished with value: 0.9218151340996169 and parameters: {'C': 0.06996758689417608, 'max_iter': 208, 'solver': 'newton-cg'}. Best is trial 26 with value: 0.9275622605363985.
/home/sjoon/projects/brain_connectivity_classifier/masterthesis_venv2/lib/python3.11/site-packages/sklearn/linear_model/_logistic.py:1272: FutureWarning: 'multi_class' was deprecated in version 1.5 and will be removed in 1.8. From then on, it will always use 'multinomial'. Leave it to its default value to avoid this warning.
  warnings.warn(
[I 2026-01-17 15:30:24,908] Trial 35 finished with value: 0.9139128352490421 and parameters: {'C': 0.36778055590441855, 'max_iter': 201, 'solver': 'newton-cg'}. Best is trial 26 with value: 0.9275622605363985.
/home/sjoon/projects/brain_connectivity_classifier/masterthesis_venv2/lib/python3.11/site-packages/sklearn/linear_model/_logistic.py:1272: FutureWarning: 'multi_class' was deprecated in version 1.5 and will be removed in 1.8. From then on, it will always use 'multinomial'. Leave it to its default value to avoid this warning.
  warnings.warn(
[I 2026-01-17 15:30:38,160] Trial 36 finished with value: 0.9237308429118773 and parameters: {'C': 0.10198974229245611, 'max_iter': 292, 'solver': 'newton-cg'}. Best is trial 26 with value: 0.9275622605363985.
/home/sjoon/projects/brain_connectivity_classifier/masterthesis_venv2/lib/python3.11/site-packages/sklearn/linear_model/_logistic.py:1272: FutureWarning: 'multi_class' was deprecated in version 1.5 and will be removed in 1.8. From then on, it will always use 'multinomial'. Leave it to its default value to avoid this warning.
  warnings.warn(
[I 2026-01-17 15:31:10,795] Trial 37 finished with value: 0.9237308429118773 and parameters: {'C': 0.030033324263617617, 'max_iter': 301, 'solver': 'lbfgs'}. Best is trial 26 with value: 0.9275622605363985.
/home/sjoon/projects/brain_connectivity_classifier/masterthesis_venv2/lib/python3.11/site-packages/sklearn/linear_model/_logistic.py:1272: FutureWarning: 'multi_class' was deprecated in version 1.5 and will be removed in 1.8. From then on, it will always use 'multinomial'. Leave it to its default value to avoid this warning.
  warnings.warn(
[I 2026-01-17 15:31:55,284] Trial 38 finished with value: 0.8575191570881227 and parameters: {'C': 0.0043527625057542116, 'max_iter': 301, 'solver': 'lbfgs'}. Best is trial 26 with value: 0.9275622605363985.
/home/sjoon/projects/brain_connectivity_classifier/masterthesis_venv2/lib/python3.11/site-packages/sklearn/linear_model/_logistic.py:1272: FutureWarning: 'multi_class' was deprecated in version 1.5 and will be removed in 1.8. From then on, it will always use 'multinomial'. Leave it to its default value to avoid this warning.
  warnings.warn(
[I 2026-01-17 15:32:29,144] Trial 39 finished with value: 0.8947557471264368 and parameters: {'C': 0.010729075761186702, 'max_iter': 286, 'solver': 'lbfgs'}. Best is trial 26 with value: 0.9275622605363985.
/home/sjoon/projects/brain_connectivity_classifier/masterthesis_venv2/lib/python3.11/site-packages/sklearn/linear_model/_logistic.py:1272: FutureWarning: 'multi_class' was deprecated in version 1.5 and will be removed in 1.8. From then on, it will always use 'multinomial'. Leave it to its default value to avoid this warning.
  warnings.warn(
[I 2026-01-17 15:32:59,700] Trial 40 finished with value: 0.9105603448275862 and parameters: {'C': 0.032211200846572266, 'max_iter': 378, 'solver': 'lbfgs'}. Best is trial 26 with value: 0.9275622605363985.
/home/sjoon/projects/brain_connectivity_classifier/masterthesis_venv2/lib/python3.11/site-packages/sklearn/linear_model/_logistic.py:1272: FutureWarning: 'multi_class' was deprecated in version 1.5 and will be removed in 1.8. From then on, it will always use 'multinomial'. Leave it to its default value to avoid this warning.
  warnings.warn(
[I 2026-01-17 15:33:23,012] Trial 41 finished with value: 0.9258860153256705 and parameters: {'C': 0.08180334721791664, 'max_iter': 174, 'solver': 'lbfgs'}. Best is trial 26 with value: 0.9275622605363985.
/home/sjoon/projects/brain_connectivity_classifier/masterthesis_venv2/lib/python3.11/site-packages/sklearn/linear_model/_logistic.py:1272: FutureWarning: 'multi_class' was deprecated in version 1.5 and will be removed in 1.8. From then on, it will always use 'multinomial'. Leave it to its default value to avoid this warning.
  warnings.warn(
[I 2026-01-17 15:33:43,391] Trial 42 finished with value: 0.9236111111111112 and parameters: {'C': 0.08674869458770468, 'max_iter': 161, 'solver': 'lbfgs'}. Best is trial 26 with value: 0.9275622605363985.
/home/sjoon/projects/brain_connectivity_classifier/masterthesis_venv2/lib/python3.11/site-packages/sklearn/linear_model/_logistic.py:1272: FutureWarning: 'multi_class' was deprecated in version 1.5 and will be removed in 1.8. From then on, it will always use 'multinomial'. Leave it to its default value to avoid this warning.
  warnings.warn(
[I 2026-01-17 15:34:07,790] Trial 43 finished with value: 0.922294061302682 and parameters: {'C': 0.08046685851576764, 'max_iter': 173, 'solver': 'lbfgs'}. Best is trial 26 with value: 0.9275622605363985.
/home/sjoon/projects/brain_connectivity_classifier/masterthesis_venv2/lib/python3.11/site-packages/sklearn/linear_model/_logistic.py:1272: FutureWarning: 'multi_class' was deprecated in version 1.5 and will be removed in 1.8. From then on, it will always use 'multinomial'. Leave it to its default value to avoid this warning.
  warnings.warn(
[I 2026-01-17 15:34:37,403] Trial 44 finished with value: 0.9049329501915708 and parameters: {'C': 0.026449722130697417, 'max_iter': 139, 'solver': 'lbfgs'}. Best is trial 26 with value: 0.9275622605363985.
/home/sjoon/projects/brain_connectivity_classifier/masterthesis_venv2/lib/python3.11/site-packages/sklearn/linear_model/_logistic.py:1272: FutureWarning: 'multi_class' was deprecated in version 1.5 and will be removed in 1.8. From then on, it will always use 'multinomial'. Leave it to its default value to avoid this warning.
  warnings.warn(
[I 2026-01-17 15:35:13,436] Trial 45 finished with value: 0.9097222222222222 and parameters: {'C': 0.015007273023675416, 'max_iter': 164, 'solver': 'lbfgs'}. Best is trial 26 with value: 0.9275622605363985.
/home/sjoon/projects/brain_connectivity_classifier/masterthesis_venv2/lib/python3.11/site-packages/sklearn/linear_model/_logistic.py:1272: FutureWarning: 'multi_class' was deprecated in version 1.5 and will be removed in 1.8. From then on, it will always use 'multinomial'. Leave it to its default value to avoid this warning.
  warnings.warn(
[I 2026-01-17 15:35:42,028] Trial 46 finished with value: 0.9172653256704981 and parameters: {'C': 0.05052003820562129, 'max_iter': 229, 'solver': 'lbfgs'}. Best is trial 26 with value: 0.9275622605363985.
/home/sjoon/projects/brain_connectivity_classifier/masterthesis_venv2/lib/python3.11/site-packages/sklearn/linear_model/_logistic.py:1272: FutureWarning: 'multi_class' was deprecated in version 1.5 and will be removed in 1.8. From then on, it will always use 'multinomial'. Leave it to its default value to avoid this warning.
  warnings.warn(
[I 2026-01-17 15:36:03,867] Trial 47 finished with value: 0.9173850574712644 and parameters: {'C': 0.11639618279830875, 'max_iter': 148, 'solver': 'lbfgs'}. Best is trial 26 with value: 0.9275622605363985.
/home/sjoon/projects/brain_connectivity_classifier/masterthesis_venv2/lib/python3.11/site-packages/sklearn/linear_model/_logistic.py:1272: FutureWarning: 'multi_class' was deprecated in version 1.5 and will be removed in 1.8. From then on, it will always use 'multinomial'. Leave it to its default value to avoid this warning.
  warnings.warn(
[I 2026-01-17 15:36:46,556] Trial 48 finished with value: 0.8781130268199234 and parameters: {'C': 0.006826563723561659, 'max_iter': 182, 'solver': 'lbfgs'}. Best is trial 26 with value: 0.9275622605363985.
/home/sjoon/projects/brain_connectivity_classifier/masterthesis_venv2/lib/python3.11/site-packages/sklearn/linear_model/_logistic.py:1272: FutureWarning: 'multi_class' was deprecated in version 1.5 and will be removed in 1.8. From then on, it will always use 'multinomial'. Leave it to its default value to avoid this warning.
  warnings.warn(
[I 2026-01-17 15:37:10,627] Trial 49 finished with value: 0.9068486590038314 and parameters: {'C': 0.3087965872558756, 'max_iter': 123, 'solver': 'lbfgs'}. Best is trial 26 with value: 0.9275622605363985.
/home/sjoon/projects/brain_connectivity_classifier/masterthesis_venv2/lib/python3.11/site-packages/sklearn/linear_model/_logistic.py:1272: FutureWarning: 'multi_class' was deprecated in version 1.5 and will be removed in 1.8. From then on, it will always use 'multinomial'. Leave it to its default value to avoid this warning.
  warnings.warn(
[Parallel(n_jobs=-1)]: Using backend LokyBackend with 32 concurrent workers.
[I 2026-01-17 15:37:31,625] A new study created in memory with name: no-name-b4c70b81-cf8c-40e8-8e97-a9aad5f323de
/home/sjoon/projects/brain_connectivity_classifier/masterthesis_venv2/lib/python3.11/site-packages/sklearn/linear_model/_logistic.py:1272: FutureWarning: 'multi_class' was deprecated in version 1.5 and will be removed in 1.8. From then on, it will always use 'multinomial'. Leave it to its default value to avoid this warning.
  warnings.warn(
[I 2026-01-17 15:37:44,438] Trial 0 finished with value: 0.9061302681992337 and parameters: {'C': 1.3656185367897316, 'max_iter': 277, 'solver': 'newton-cg'}. Best is trial 0 with value: 0.9061302681992337.
/home/sjoon/projects/brain_connectivity_classifier/masterthesis_venv2/lib/python3.11/site-packages/sklearn/linear_model/_logistic.py:1272: FutureWarning: 'multi_class' was deprecated in version 1.5 and will be removed in 1.8. From then on, it will always use 'multinomial'. Leave it to its default value to avoid this warning.
  warnings.warn(
[I 2026-01-17 15:37:59,542] Trial 1 finished with value: 0.9080459770114943 and parameters: {'C': 0.017877539345607523, 'max_iter': 452, 'solver': 'newton-cg'}. Best is trial 1 with value: 0.9080459770114943.
/home/sjoon/projects/brain_connectivity_classifier/masterthesis_venv2/lib/python3.11/site-packages/sklearn/linear_model/_logistic.py:1272: FutureWarning: 'multi_class' was deprecated in version 1.5 and will be removed in 1.8. From then on, it will always use 'multinomial'. Leave it to its default value to avoid this warning.
  warnings.warn(
[I 2026-01-17 15:38:19,420] Trial 2 finished with value: 0.9123563218390804 and parameters: {'C': 4.47599053757093, 'max_iter': 208, 'solver': 'lbfgs'}. Best is trial 2 with value: 0.9123563218390804.
/home/sjoon/projects/brain_connectivity_classifier/masterthesis_venv2/lib/python3.11/site-packages/sklearn/linear_model/_logistic.py:1272: FutureWarning: 'multi_class' was deprecated in version 1.5 and will be removed in 1.8. From then on, it will always use 'multinomial'. Leave it to its default value to avoid this warning.
  warnings.warn(
