[I 2026-01-17 15:51:43,676] Trial 42 finished with value: 0.9183429118773946 and parameters: {'C': 0.40684941598118946, 'max_iter': 139, 'solver': 'newton-cg'}. Best is trial 35 with value: 0.9233716475095786.
/home/sjoon/projects/brain_connectivity_classifier/masterthesis_venv2/lib/python3.11/site-packages/sklearn/linear_model/_logistic.py:1272: FutureWarning: 'multi_class' was deprecated in version 1.5 and will be removed in 1.8. From then on, it will always use 'multinomial'. Leave it to its default value to avoid this warning.
  warnings.warn(
[I 2026-01-17 15:52:10,299] Trial 43 finished with value: 0.9189415708812261 and parameters: {'C': 0.05399563587414457, 'max_iter': 215, 'solver': 'lbfgs'}. Best is trial 35 with value: 0.9233716475095786.
/home/sjoon/projects/brain_connectivity_classifier/masterthesis_venv2/lib/python3.11/site-packages/sklearn/linear_model/_logistic.py:1272: FutureWarning: 'multi_class' was deprecated in version 1.5 and will be removed in 1.8. From then on, it will always use 'multinomial'. Leave it to its default value to avoid this warning.
  warnings.warn(
[I 2026-01-17 15:52:30,220] Trial 44 finished with value: 0.9179837164750958 and parameters: {'C': 0.2991684743182054, 'max_iter': 178, 'solver': 'lbfgs'}. Best is trial 35 with value: 0.9233716475095786.
/home/sjoon/projects/brain_connectivity_classifier/masterthesis_venv2/lib/python3.11/site-packages/sklearn/linear_model/_logistic.py:1272: FutureWarning: 'multi_class' was deprecated in version 1.5 and will be removed in 1.8. From then on, it will always use 'multinomial'. Leave it to its default value to avoid this warning.
  warnings.warn(
[I 2026-01-17 15:52:39,673] Trial 45 finished with value: 0.9249281609195402 and parameters: {'C': 0.15011245709706866, 'max_iter': 155, 'solver': 'newton-cg'}. Best is trial 45 with value: 0.9249281609195402.
/home/sjoon/projects/brain_connectivity_classifier/masterthesis_venv2/lib/python3.11/site-packages/sklearn/linear_model/_logistic.py:1272: FutureWarning: 'multi_class' was deprecated in version 1.5 and will be removed in 1.8. From then on, it will always use 'multinomial'. Leave it to its default value to avoid this warning.
  warnings.warn(
[I 2026-01-17 15:52:49,234] Trial 46 finished with value: 0.9178639846743295 and parameters: {'C': 0.15419739084904413, 'max_iter': 203, 'solver': 'newton-cg'}. Best is trial 45 with value: 0.9249281609195402.
/home/sjoon/projects/brain_connectivity_classifier/masterthesis_venv2/lib/python3.11/site-packages/sklearn/linear_model/_logistic.py:1272: FutureWarning: 'multi_class' was deprecated in version 1.5 and will be removed in 1.8. From then on, it will always use 'multinomial'. Leave it to its default value to avoid this warning.
  warnings.warn(
[I 2026-01-17 15:53:01,970] Trial 47 finished with value: 0.9043342911877394 and parameters: {'C': 0.024437782646402298, 'max_iter': 158, 'solver': 'newton-cg'}. Best is trial 45 with value: 0.9249281609195402.
/home/sjoon/projects/brain_connectivity_classifier/masterthesis_venv2/lib/python3.11/site-packages/sklearn/linear_model/_logistic.py:1272: FutureWarning: 'multi_class' was deprecated in version 1.5 and will be removed in 1.8. From then on, it will always use 'multinomial'. Leave it to its default value to avoid this warning.
  warnings.warn(
[I 2026-01-17 15:53:11,312] Trial 48 finished with value: 0.9076867816091954 and parameters: {'C': 0.061489851337251586, 'max_iter': 193, 'solver': 'newton-cg'}. Best is trial 45 with value: 0.9249281609195402.
/home/sjoon/projects/brain_connectivity_classifier/masterthesis_venv2/lib/python3.11/site-packages/sklearn/linear_model/_logistic.py:1272: FutureWarning: 'multi_class' was deprecated in version 1.5 and will be removed in 1.8. From then on, it will always use 'multinomial'. Leave it to its default value to avoid this warning.
  warnings.warn(
[I 2026-01-17 15:53:22,928] Trial 49 finished with value: 0.9160680076628352 and parameters: {'C': 3.6118923201247886, 'max_iter': 121, 'solver': 'newton-cg'}. Best is trial 45 with value: 0.9249281609195402.
/home/sjoon/projects/brain_connectivity_classifier/masterthesis_venv2/lib/python3.11/site-packages/sklearn/linear_model/_logistic.py:1272: FutureWarning: 'multi_class' was deprecated in version 1.5 and will be removed in 1.8. From then on, it will always use 'multinomial'. Leave it to its default value to avoid this warning.
  warnings.warn(
[Parallel(n_jobs=-1)]: Using backend LokyBackend with 32 concurrent workers.
[I 2026-01-17 15:53:45,276] A new study created in memory with name: no-name-44465e5e-0e34-487c-bbe1-aaeabeed5b02
/home/sjoon/projects/brain_connectivity_classifier/masterthesis_venv2/lib/python3.11/site-packages/sklearn/linear_model/_logistic.py:1272: FutureWarning: 'multi_class' was deprecated in version 1.5 and will be removed in 1.8. From then on, it will always use 'multinomial'. Leave it to its default value to avoid this warning.
  warnings.warn(
[I 2026-01-17 15:54:17,216] Trial 0 finished with value: 0.8484195402298851 and parameters: {'C': 0.0028441591049060163, 'max_iter': 480, 'solver': 'lbfgs'}. Best is trial 0 with value: 0.8484195402298851.
/home/sjoon/projects/brain_connectivity_classifier/masterthesis_venv2/lib/python3.11/site-packages/sklearn/linear_model/_logistic.py:1272: FutureWarning: 'multi_class' was deprecated in version 1.5 and will be removed in 1.8. From then on, it will always use 'multinomial'. Leave it to its default value to avoid this warning.
  warnings.warn(
[I 2026-01-17 15:54:38,192] Trial 1 finished with value: 0.9027777777777778 and parameters: {'C': 0.676737983619307, 'max_iter': 362, 'solver': 'lbfgs'}. Best is trial 1 with value: 0.9027777777777778.
/home/sjoon/projects/brain_connectivity_classifier/masterthesis_venv2/lib/python3.11/site-packages/sklearn/linear_model/_logistic.py:1272: FutureWarning: 'multi_class' was deprecated in version 1.5 and will be removed in 1.8. From then on, it will always use 'multinomial'. Leave it to its default value to avoid this warning.
  warnings.warn(
[I 2026-01-17 15:55:01,724] Trial 2 finished with value: 0.9118773946360154 and parameters: {'C': 0.6669972526855809, 'max_iter': 148, 'solver': 'lbfgs'}. Best is trial 2 with value: 0.9118773946360154.
/home/sjoon/projects/brain_connectivity_classifier/masterthesis_venv2/lib/python3.11/site-packages/sklearn/linear_model/_logistic.py:1272: FutureWarning: 'multi_class' was deprecated in version 1.5 and will be removed in 1.8. From then on, it will always use 'multinomial'. Leave it to its default value to avoid this warning.
  warnings.warn(
[I 2026-01-17 15:55:34,386] Trial 3 finished with value: 0.8481800766283525 and parameters: {'C': 0.002482583241528884, 'max_iter': 162, 'solver': 'lbfgs'}. Best is trial 2 with value: 0.9118773946360154.
/home/sjoon/projects/brain_connectivity_classifier/masterthesis_venv2/lib/python3.11/site-packages/sklearn/linear_model/_logistic.py:1272: FutureWarning: 'multi_class' was deprecated in version 1.5 and will be removed in 1.8. From then on, it will always use 'multinomial'. Leave it to its default value to avoid this warning.
  warnings.warn(
[I 2026-01-17 15:55:56,193] Trial 4 finished with value: 0.8817049808429118 and parameters: {'C': 0.005520476332498233, 'max_iter': 438, 'solver': 'newton-cg'}. Best is trial 2 with value: 0.9118773946360154.
/home/sjoon/projects/brain_connectivity_classifier/masterthesis_venv2/lib/python3.11/site-packages/sklearn/linear_model/_logistic.py:1272: FutureWarning: 'multi_class' was deprecated in version 1.5 and will be removed in 1.8. From then on, it will always use 'multinomial'. Leave it to its default value to avoid this warning.
  warnings.warn(
[I 2026-01-17 15:56:14,093] Trial 5 finished with value: 0.9183429118773946 and parameters: {'C': 6.5712914521521935, 'max_iter': 122, 'solver': 'lbfgs'}. Best is trial 5 with value: 0.9183429118773946.
/home/sjoon/projects/brain_connectivity_classifier/masterthesis_venv2/lib/python3.11/site-packages/sklearn/linear_model/_logistic.py:1272: FutureWarning: 'multi_class' was deprecated in version 1.5 and will be removed in 1.8. From then on, it will always use 'multinomial'. Leave it to its default value to avoid this warning.
  warnings.warn(
[I 2026-01-17 15:56:25,996] Trial 6 finished with value: 0.9127155172413793 and parameters: {'C': 2.674006332791668, 'max_iter': 306, 'solver': 'newton-cg'}. Best is trial 5 with value: 0.9183429118773946.
/home/sjoon/projects/brain_connectivity_classifier/masterthesis_venv2/lib/python3.11/site-packages/sklearn/linear_model/_logistic.py:1272: FutureWarning: 'multi_class' was deprecated in version 1.5 and will be removed in 1.8. From then on, it will always use 'multinomial'. Leave it to its default value to avoid this warning.
  warnings.warn(
[I 2026-01-17 15:56:45,992] Trial 7 finished with value: 0.9161877394636015 and parameters: {'C': 0.11232957583917665, 'max_iter': 133, 'solver': 'lbfgs'}. Best is trial 5 with value: 0.9183429118773946.
/home/sjoon/projects/brain_connectivity_classifier/masterthesis_venv2/lib/python3.11/site-packages/sklearn/linear_model/_logistic.py:1272: FutureWarning: 'multi_class' was deprecated in version 1.5 and will be removed in 1.8. From then on, it will always use 'multinomial'. Leave it to its default value to avoid this warning.
  warnings.warn(
[I 2026-01-17 15:56:58,519] Trial 8 finished with value: 0.7509578544061303 and parameters: {'C': 0.0011025751793016115, 'max_iter': 415, 'solver': 'newton-cg'}. Best is trial 5 with value: 0.9183429118773946.
/home/sjoon/projects/brain_connectivity_classifier/masterthesis_venv2/lib/python3.11/site-packages/sklearn/linear_model/_logistic.py:1272: FutureWarning: 'multi_class' was deprecated in version 1.5 and will be removed in 1.8. From then on, it will always use 'multinomial'. Leave it to its default value to avoid this warning.
  warnings.warn(
[I 2026-01-17 15:57:11,806] Trial 9 finished with value: 0.9048132183908046 and parameters: {'C': 0.9545115569638085, 'max_iter': 153, 'solver': 'newton-cg'}. Best is trial 5 with value: 0.9183429118773946.
/home/sjoon/projects/brain_connectivity_classifier/masterthesis_venv2/lib/python3.11/site-packages/sklearn/linear_model/_logistic.py:1272: FutureWarning: 'multi_class' was deprecated in version 1.5 and will be removed in 1.8. From then on, it will always use 'multinomial'. Leave it to its default value to avoid this warning.
  warnings.warn(
[I 2026-01-17 15:57:33,736] Trial 10 finished with value: 0.9106800766283525 and parameters: {'C': 8.425650416857687, 'max_iter': 228, 'solver': 'lbfgs'}. Best is trial 5 with value: 0.9183429118773946.
/home/sjoon/projects/brain_connectivity_classifier/masterthesis_venv2/lib/python3.11/site-packages/sklearn/linear_model/_logistic.py:1272: FutureWarning: 'multi_class' was deprecated in version 1.5 and will be removed in 1.8. From then on, it will always use 'multinomial'. Leave it to its default value to avoid this warning.
  warnings.warn(
[I 2026-01-17 15:58:07,784] Trial 11 finished with value: 0.9285201149425287 and parameters: {'C': 0.03997785541283189, 'max_iter': 102, 'solver': 'lbfgs'}. Best is trial 11 with value: 0.9285201149425287.
/home/sjoon/projects/brain_connectivity_classifier/masterthesis_venv2/lib/python3.11/site-packages/sklearn/linear_model/_logistic.py:1272: FutureWarning: 'multi_class' was deprecated in version 1.5 and will be removed in 1.8. From then on, it will always use 'multinomial'. Leave it to its default value to avoid this warning.
  warnings.warn(
[I 2026-01-17 15:58:37,864] Trial 12 finished with value: 0.9187021072796935 and parameters: {'C': 0.03319062572060115, 'max_iter': 104, 'solver': 'lbfgs'}. Best is trial 11 with value: 0.9285201149425287.
/home/sjoon/projects/brain_connectivity_classifier/masterthesis_venv2/lib/python3.11/site-packages/sklearn/linear_model/_logistic.py:1272: FutureWarning: 'multi_class' was deprecated in version 1.5 and will be removed in 1.8. From then on, it will always use 'multinomial'. Leave it to its default value to avoid this warning.
  warnings.warn(
[I 2026-01-17 15:59:09,829] Trial 13 finished with value: 0.9103208812260536 and parameters: {'C': 0.02603472980014387, 'max_iter': 202, 'solver': 'lbfgs'}. Best is trial 11 with value: 0.9285201149425287.
/home/sjoon/projects/brain_connectivity_classifier/masterthesis_venv2/lib/python3.11/site-packages/sklearn/linear_model/_logistic.py:1272: FutureWarning: 'multi_class' was deprecated in version 1.5 and will be removed in 1.8. From then on, it will always use 'multinomial'. Leave it to its default value to avoid this warning.
  warnings.warn(
[I 2026-01-17 15:59:36,600] Trial 14 finished with value: 0.9204980842911877 and parameters: {'C': 0.06100092127961649, 'max_iter': 102, 'solver': 'lbfgs'}. Best is trial 11 with value: 0.9285201149425287.
/home/sjoon/projects/brain_connectivity_classifier/masterthesis_venv2/lib/python3.11/site-packages/sklearn/linear_model/_logistic.py:1272: FutureWarning: 'multi_class' was deprecated in version 1.5 and will be removed in 1.8. From then on, it will always use 'multinomial'. Leave it to its default value to avoid this warning.
  warnings.warn(
[I 2026-01-17 15:59:57,028] Trial 15 finished with value: 0.9113984674329502 and parameters: {'C': 0.11533391094075615, 'max_iter': 101, 'solver': 'lbfgs'}. Best is trial 11 with value: 0.9285201149425287.
/home/sjoon/projects/brain_connectivity_classifier/masterthesis_venv2/lib/python3.11/site-packages/sklearn/linear_model/_logistic.py:1272: FutureWarning: 'multi_class' was deprecated in version 1.5 and will be removed in 1.8. From then on, it will always use 'multinomial'. Leave it to its default value to avoid this warning.
  warnings.warn(
[I 2026-01-17 16:00:28,567] Trial 16 finished with value: 0.9107998084291188 and parameters: {'C': 0.027124222118469696, 'max_iter': 193, 'solver': 'lbfgs'}. Best is trial 11 with value: 0.9285201149425287.
/home/sjoon/projects/brain_connectivity_classifier/masterthesis_venv2/lib/python3.11/site-packages/sklearn/linear_model/_logistic.py:1272: FutureWarning: 'multi_class' was deprecated in version 1.5 and will be removed in 1.8. From then on, it will always use 'multinomial'. Leave it to its default value to avoid this warning.
  warnings.warn(
[I 2026-01-17 16:00:48,591] Trial 17 finished with value: 0.9173850574712644 and parameters: {'C': 0.23234383716774495, 'max_iter': 264, 'solver': 'lbfgs'}. Best is trial 11 with value: 0.9285201149425287.
/home/sjoon/projects/brain_connectivity_classifier/masterthesis_venv2/lib/python3.11/site-packages/sklearn/linear_model/_logistic.py:1272: FutureWarning: 'multi_class' was deprecated in version 1.5 and will be removed in 1.8. From then on, it will always use 'multinomial'. Leave it to its default value to avoid this warning.
  warnings.warn(
[I 2026-01-17 16:01:00,401] Trial 18 finished with value: 0.8967911877394636 and parameters: {'C': 0.010798039859553046, 'max_iter': 115, 'solver': 'newton-cg'}. Best is trial 11 with value: 0.9285201149425287.
/home/sjoon/projects/brain_connectivity_classifier/masterthesis_venv2/lib/python3.11/site-packages/sklearn/linear_model/_logistic.py:1272: FutureWarning: 'multi_class' was deprecated in version 1.5 and will be removed in 1.8. From then on, it will always use 'multinomial'. Leave it to its default value to avoid this warning.
  warnings.warn(
[I 2026-01-17 16:01:28,868] Trial 19 finished with value: 0.9152298850574713 and parameters: {'C': 0.056816600552021555, 'max_iter': 177, 'solver': 'lbfgs'}. Best is trial 11 with value: 0.9285201149425287.
/home/sjoon/projects/brain_connectivity_classifier/masterthesis_venv2/lib/python3.11/site-packages/sklearn/linear_model/_logistic.py:1272: FutureWarning: 'multi_class' was deprecated in version 1.5 and will be removed in 1.8. From then on, it will always use 'multinomial'. Leave it to its default value to avoid this warning.
  warnings.warn(
[I 2026-01-17 16:01:49,379] Trial 20 finished with value: 0.9264846743295019 and parameters: {'C': 0.22288178623655489, 'max_iter': 129, 'solver': 'lbfgs'}. Best is trial 11 with value: 0.9285201149425287.
/home/sjoon/projects/brain_connectivity_classifier/masterthesis_venv2/lib/python3.11/site-packages/sklearn/linear_model/_logistic.py:1272: FutureWarning: 'multi_class' was deprecated in version 1.5 and will be removed in 1.8. From then on, it will always use 'multinomial'. Leave it to its default value to avoid this warning.
  warnings.warn(
[I 2026-01-17 16:02:10,256] Trial 21 finished with value: 0.9157088122605364 and parameters: {'C': 0.3094979425929212, 'max_iter': 132, 'solver': 'lbfgs'}. Best is trial 11 with value: 0.9285201149425287.
/home/sjoon/projects/brain_connectivity_classifier/masterthesis_venv2/lib/python3.11/site-packages/sklearn/linear_model/_logistic.py:1272: FutureWarning: 'multi_class' was deprecated in version 1.5 and will be removed in 1.8. From then on, it will always use 'multinomial'. Leave it to its default value to avoid this warning.
  warnings.warn(
[I 2026-01-17 16:02:29,322] Trial 22 finished with value: 0.9161877394636015 and parameters: {'C': 0.22945550866347253, 'max_iter': 113, 'solver': 'lbfgs'}. Best is trial 11 with value: 0.9285201149425287.
/home/sjoon/projects/brain_connectivity_classifier/masterthesis_venv2/lib/python3.11/site-packages/sklearn/linear_model/_logistic.py:1272: FutureWarning: 'multi_class' was deprecated in version 1.5 and will be removed in 1.8. From then on, it will always use 'multinomial'. Leave it to its default value to avoid this warning.
  warnings.warn(
[I 2026-01-17 16:03:05,828] Trial 23 finished with value: 0.9049329501915708 and parameters: {'C': 0.014832598018415206, 'max_iter': 133, 'solver': 'lbfgs'}. Best is trial 11 with value: 0.9285201149425287.
/home/sjoon/projects/brain_connectivity_classifier/masterthesis_venv2/lib/python3.11/site-packages/sklearn/linear_model/_logistic.py:1272: FutureWarning: 'multi_class' was deprecated in version 1.5 and will be removed in 1.8. From then on, it will always use 'multinomial'. Leave it to its default value to avoid this warning.
  warnings.warn(
[I 2026-01-17 16:03:29,927] Trial 24 finished with value: 0.9129549808429118 and parameters: {'C': 0.07442540609907276, 'max_iter': 104, 'solver': 'lbfgs'}. Best is trial 11 with value: 0.9285201149425287.
/home/sjoon/projects/brain_connectivity_classifier/masterthesis_venv2/lib/python3.11/site-packages/sklearn/linear_model/_logistic.py:1272: FutureWarning: 'multi_class' was deprecated in version 1.5 and will be removed in 1.8. From then on, it will always use 'multinomial'. Leave it to its default value to avoid this warning.
  warnings.warn(
[I 2026-01-17 16:04:06,144] Trial 25 finished with value: 0.9025383141762452 and parameters: {'C': 0.010376035814395208, 'max_iter': 117, 'solver': 'lbfgs'}. Best is trial 11 with value: 0.9285201149425287.
/home/sjoon/projects/brain_connectivity_classifier/masterthesis_venv2/lib/python3.11/site-packages/sklearn/linear_model/_logistic.py:1272: FutureWarning: 'multi_class' was deprecated in version 1.5 and will be removed in 1.8. From then on, it will always use 'multinomial'. Leave it to its default value to avoid this warning.
  warnings.warn(
[I 2026-01-17 16:04:18,203] Trial 26 finished with value: 0.9188218390804598 and parameters: {'C': 0.05207844589023054, 'max_iter': 100, 'solver': 'newton-cg'}. Best is trial 11 with value: 0.9285201149425287.
/home/sjoon/projects/brain_connectivity_classifier/masterthesis_venv2/lib/python3.11/site-packages/sklearn/linear_model/_logistic.py:1272: FutureWarning: 'multi_class' was deprecated in version 1.5 and will be removed in 1.8. From then on, it will always use 'multinomial'. Leave it to its default value to avoid this warning.
  warnings.warn(
[I 2026-01-17 16:04:36,893] Trial 27 finished with value: 0.9118773946360154 and parameters: {'C': 1.7829625191909488, 'max_iter': 143, 'solver': 'lbfgs'}. Best is trial 11 with value: 0.9285201149425287.
/home/sjoon/projects/brain_connectivity_classifier/masterthesis_venv2/lib/python3.11/site-packages/sklearn/linear_model/_logistic.py:1272: FutureWarning: 'multi_class' was deprecated in version 1.5 and will be removed in 1.8. From then on, it will always use 'multinomial'. Leave it to its default value to avoid this warning.
  warnings.warn(
[I 2026-01-17 16:04:56,732] Trial 28 finished with value: 0.9207375478927203 and parameters: {'C': 0.15581249293203336, 'max_iter': 170, 'solver': 'lbfgs'}. Best is trial 11 with value: 0.9285201149425287.
/home/sjoon/projects/brain_connectivity_classifier/masterthesis_venv2/lib/python3.11/site-packages/sklearn/linear_model/_logistic.py:1272: FutureWarning: 'multi_class' was deprecated in version 1.5 and will be removed in 1.8. From then on, it will always use 'multinomial'. Leave it to its default value to avoid this warning.
  warnings.warn(
[I 2026-01-17 16:05:15,187] Trial 29 finished with value: 0.9237308429118773 and parameters: {'C': 0.39910232760788833, 'max_iter': 175, 'solver': 'lbfgs'}. Best is trial 11 with value: 0.9285201149425287.
/home/sjoon/projects/brain_connectivity_classifier/masterthesis_venv2/lib/python3.11/site-packages/sklearn/linear_model/_logistic.py:1272: FutureWarning: 'multi_class' was deprecated in version 1.5 and will be removed in 1.8. From then on, it will always use 'multinomial'. Leave it to its default value to avoid this warning.
  warnings.warn(
