[I 2026-01-17 15:14:49,881] Trial 27 finished with value: 0.9133141762452107 and parameters: {'C': 0.04016403735535536, 'max_iter': 344, 'solver': 'newton-cg'}. Best is trial 21 with value: 0.9273227969348659.
/home/sjoon/projects/brain_connectivity_classifier/masterthesis_venv2/lib/python3.11/site-packages/sklearn/linear_model/_logistic.py:1272: FutureWarning: 'multi_class' was deprecated in version 1.5 and will be removed in 1.8. From then on, it will always use 'multinomial'. Leave it to its default value to avoid this warning.
  warnings.warn(
[I 2026-01-17 15:15:22,473] Trial 28 finished with value: 0.8215996168582376 and parameters: {'C': 0.0018728273229010584, 'max_iter': 114, 'solver': 'lbfgs'}. Best is trial 21 with value: 0.9273227969348659.
/home/sjoon/projects/brain_connectivity_classifier/masterthesis_venv2/lib/python3.11/site-packages/sklearn/linear_model/_logistic.py:1272: FutureWarning: 'multi_class' was deprecated in version 1.5 and will be removed in 1.8. From then on, it will always use 'multinomial'. Leave it to its default value to avoid this warning.
  warnings.warn(
[I 2026-01-17 15:16:06,218] Trial 29 finished with value: 0.8870929118773946 and parameters: {'C': 0.011531538419253565, 'max_iter': 178, 'solver': 'lbfgs'}. Best is trial 21 with value: 0.9273227969348659.
/home/sjoon/projects/brain_connectivity_classifier/masterthesis_venv2/lib/python3.11/site-packages/sklearn/linear_model/_logistic.py:1272: FutureWarning: 'multi_class' was deprecated in version 1.5 and will be removed in 1.8. From then on, it will always use 'multinomial'. Leave it to its default value to avoid this warning.
  warnings.warn(
[I 2026-01-17 15:16:17,627] Trial 30 finished with value: 0.9097222222222222 and parameters: {'C': 0.6217776703244814, 'max_iter': 248, 'solver': 'newton-cg'}. Best is trial 21 with value: 0.9273227969348659.
/home/sjoon/projects/brain_connectivity_classifier/masterthesis_venv2/lib/python3.11/site-packages/sklearn/linear_model/_logistic.py:1272: FutureWarning: 'multi_class' was deprecated in version 1.5 and will be removed in 1.8. From then on, it will always use 'multinomial'. Leave it to its default value to avoid this warning.
  warnings.warn(
[I 2026-01-17 15:16:27,166] Trial 31 finished with value: 0.915110153256705 and parameters: {'C': 0.21111156129834366, 'max_iter': 155, 'solver': 'newton-cg'}. Best is trial 21 with value: 0.9273227969348659.
/home/sjoon/projects/brain_connectivity_classifier/masterthesis_venv2/lib/python3.11/site-packages/sklearn/linear_model/_logistic.py:1272: FutureWarning: 'multi_class' was deprecated in version 1.5 and will be removed in 1.8. From then on, it will always use 'multinomial'. Leave it to its default value to avoid this warning.
  warnings.warn(
[I 2026-01-17 15:16:37,020] Trial 32 finished with value: 0.9178639846743295 and parameters: {'C': 0.13271483174423304, 'max_iter': 131, 'solver': 'newton-cg'}. Best is trial 21 with value: 0.9273227969348659.
/home/sjoon/projects/brain_connectivity_classifier/masterthesis_venv2/lib/python3.11/site-packages/sklearn/linear_model/_logistic.py:1272: FutureWarning: 'multi_class' was deprecated in version 1.5 and will be removed in 1.8. From then on, it will always use 'multinomial'. Leave it to its default value to avoid this warning.
  warnings.warn(
[I 2026-01-17 15:16:46,864] Trial 33 finished with value: 0.9204980842911877 and parameters: {'C': 0.03699912165942314, 'max_iter': 169, 'solver': 'newton-cg'}. Best is trial 21 with value: 0.9273227969348659.
/home/sjoon/projects/brain_connectivity_classifier/masterthesis_venv2/lib/python3.11/site-packages/sklearn/linear_model/_logistic.py:1272: FutureWarning: 'multi_class' was deprecated in version 1.5 and will be removed in 1.8. From then on, it will always use 'multinomial'. Leave it to its default value to avoid this warning.
  warnings.warn(
[I 2026-01-17 15:16:59,907] Trial 34 finished with value: 0.915948275862069 and parameters: {'C': 0.03935335293671562, 'max_iter': 112, 'solver': 'newton-cg'}. Best is trial 21 with value: 0.9273227969348659.
/home/sjoon/projects/brain_connectivity_classifier/masterthesis_venv2/lib/python3.11/site-packages/sklearn/linear_model/_logistic.py:1272: FutureWarning: 'multi_class' was deprecated in version 1.5 and will be removed in 1.8. From then on, it will always use 'multinomial'. Leave it to its default value to avoid this warning.
  warnings.warn(
[I 2026-01-17 15:17:11,649] Trial 35 finished with value: 0.8977490421455939 and parameters: {'C': 0.016067954211441655, 'max_iter': 197, 'solver': 'newton-cg'}. Best is trial 21 with value: 0.9273227969348659.
/home/sjoon/projects/brain_connectivity_classifier/masterthesis_venv2/lib/python3.11/site-packages/sklearn/linear_model/_logistic.py:1272: FutureWarning: 'multi_class' was deprecated in version 1.5 and will be removed in 1.8. From then on, it will always use 'multinomial'. Leave it to its default value to avoid this warning.
  warnings.warn(
[I 2026-01-17 15:17:23,644] Trial 36 finished with value: 0.9195402298850575 and parameters: {'C': 0.065375842111932, 'max_iter': 174, 'solver': 'newton-cg'}. Best is trial 21 with value: 0.9273227969348659.
/home/sjoon/projects/brain_connectivity_classifier/masterthesis_venv2/lib/python3.11/site-packages/sklearn/linear_model/_logistic.py:1272: FutureWarning: 'multi_class' was deprecated in version 1.5 and will be removed in 1.8. From then on, it will always use 'multinomial'. Leave it to its default value to avoid this warning.
  warnings.warn(
[I 2026-01-17 15:17:54,185] Trial 37 finished with value: 0.9113984674329502 and parameters: {'C': 0.03539082536142322, 'max_iter': 122, 'solver': 'lbfgs'}. Best is trial 21 with value: 0.9273227969348659.
/home/sjoon/projects/brain_connectivity_classifier/masterthesis_venv2/lib/python3.11/site-packages/sklearn/linear_model/_logistic.py:1272: FutureWarning: 'multi_class' was deprecated in version 1.5 and will be removed in 1.8. From then on, it will always use 'multinomial'. Leave it to its default value to avoid this warning.
  warnings.warn(
[I 2026-01-17 15:18:08,054] Trial 38 finished with value: 0.8916427203065134 and parameters: {'C': 0.006465048989345663, 'max_iter': 285, 'solver': 'newton-cg'}. Best is trial 21 with value: 0.9273227969348659.
/home/sjoon/projects/brain_connectivity_classifier/masterthesis_venv2/lib/python3.11/site-packages/sklearn/linear_model/_logistic.py:1272: FutureWarning: 'multi_class' was deprecated in version 1.5 and will be removed in 1.8. From then on, it will always use 'multinomial'. Leave it to its default value to avoid this warning.
  warnings.warn(
[I 2026-01-17 15:18:25,956] Trial 39 finished with value: 0.9173850574712644 and parameters: {'C': 0.17339596464387966, 'max_iter': 149, 'solver': 'lbfgs'}. Best is trial 21 with value: 0.9273227969348659.
/home/sjoon/projects/brain_connectivity_classifier/masterthesis_venv2/lib/python3.11/site-packages/sklearn/linear_model/_logistic.py:1272: FutureWarning: 'multi_class' was deprecated in version 1.5 and will be removed in 1.8. From then on, it will always use 'multinomial'. Leave it to its default value to avoid this warning.
  warnings.warn(
[I 2026-01-17 15:18:35,979] Trial 40 finished with value: 0.9236111111111112 and parameters: {'C': 1.0496852346011918, 'max_iter': 224, 'solver': 'newton-cg'}. Best is trial 21 with value: 0.9273227969348659.
/home/sjoon/projects/brain_connectivity_classifier/masterthesis_venv2/lib/python3.11/site-packages/sklearn/linear_model/_logistic.py:1272: FutureWarning: 'multi_class' was deprecated in version 1.5 and will be removed in 1.8. From then on, it will always use 'multinomial'. Leave it to its default value to avoid this warning.
  warnings.warn(
[I 2026-01-17 15:18:46,824] Trial 41 finished with value: 0.9139128352490421 and parameters: {'C': 4.318566708058718, 'max_iter': 218, 'solver': 'newton-cg'}. Best is trial 21 with value: 0.9273227969348659.
/home/sjoon/projects/brain_connectivity_classifier/masterthesis_venv2/lib/python3.11/site-packages/sklearn/linear_model/_logistic.py:1272: FutureWarning: 'multi_class' was deprecated in version 1.5 and will be removed in 1.8. From then on, it will always use 'multinomial'. Leave it to its default value to avoid this warning.
  warnings.warn(
[I 2026-01-17 15:18:56,849] Trial 42 finished with value: 0.9072078544061303 and parameters: {'C': 3.4446504019775444, 'max_iter': 186, 'solver': 'newton-cg'}. Best is trial 21 with value: 0.9273227969348659.
/home/sjoon/projects/brain_connectivity_classifier/masterthesis_venv2/lib/python3.11/site-packages/sklearn/linear_model/_logistic.py:1272: FutureWarning: 'multi_class' was deprecated in version 1.5 and will be removed in 1.8. From then on, it will always use 'multinomial'. Leave it to its default value to avoid this warning.
  warnings.warn(
[I 2026-01-17 15:19:06,148] Trial 43 finished with value: 0.9177442528735632 and parameters: {'C': 0.4246802171904196, 'max_iter': 485, 'solver': 'newton-cg'}. Best is trial 21 with value: 0.9273227969348659.
/home/sjoon/projects/brain_connectivity_classifier/masterthesis_venv2/lib/python3.11/site-packages/sklearn/linear_model/_logistic.py:1272: FutureWarning: 'multi_class' was deprecated in version 1.5 and will be removed in 1.8. From then on, it will always use 'multinomial'. Leave it to its default value to avoid this warning.
  warnings.warn(
[I 2026-01-17 15:19:15,687] Trial 44 finished with value: 0.9111590038314177 and parameters: {'C': 0.9159709483309312, 'max_iter': 228, 'solver': 'newton-cg'}. Best is trial 21 with value: 0.9273227969348659.
/home/sjoon/projects/brain_connectivity_classifier/masterthesis_venv2/lib/python3.11/site-packages/sklearn/linear_model/_logistic.py:1272: FutureWarning: 'multi_class' was deprecated in version 1.5 and will be removed in 1.8. From then on, it will always use 'multinomial'. Leave it to its default value to avoid this warning.
  warnings.warn(
[I 2026-01-17 15:19:26,646] Trial 45 finished with value: 0.9118773946360154 and parameters: {'C': 1.0368967443994397, 'max_iter': 253, 'solver': 'newton-cg'}. Best is trial 21 with value: 0.9273227969348659.
/home/sjoon/projects/brain_connectivity_classifier/masterthesis_venv2/lib/python3.11/site-packages/sklearn/linear_model/_logistic.py:1272: FutureWarning: 'multi_class' was deprecated in version 1.5 and will be removed in 1.8. From then on, it will always use 'multinomial'. Leave it to its default value to avoid this warning.
  warnings.warn(
[I 2026-01-17 15:19:37,457] Trial 46 finished with value: 0.9129549808429118 and parameters: {'C': 0.07274311058970058, 'max_iter': 169, 'solver': 'newton-cg'}. Best is trial 21 with value: 0.9273227969348659.
/home/sjoon/projects/brain_connectivity_classifier/masterthesis_venv2/lib/python3.11/site-packages/sklearn/linear_model/_logistic.py:1272: FutureWarning: 'multi_class' was deprecated in version 1.5 and will be removed in 1.8. From then on, it will always use 'multinomial'. Leave it to its default value to avoid this warning.
  warnings.warn(
[I 2026-01-17 15:20:09,856] Trial 47 finished with value: 0.8515325670498084 and parameters: {'C': 0.0037173133622810093, 'max_iter': 269, 'solver': 'lbfgs'}. Best is trial 21 with value: 0.9273227969348659.
/home/sjoon/projects/brain_connectivity_classifier/masterthesis_venv2/lib/python3.11/site-packages/sklearn/linear_model/_logistic.py:1272: FutureWarning: 'multi_class' was deprecated in version 1.5 and will be removed in 1.8. From then on, it will always use 'multinomial'. Leave it to its default value to avoid this warning.
  warnings.warn(
[I 2026-01-17 15:20:23,662] Trial 48 finished with value: 0.9022988505747126 and parameters: {'C': 0.012509862277863524, 'max_iter': 128, 'solver': 'newton-cg'}. Best is trial 21 with value: 0.9273227969348659.
/home/sjoon/projects/brain_connectivity_classifier/masterthesis_venv2/lib/python3.11/site-packages/sklearn/linear_model/_logistic.py:1272: FutureWarning: 'multi_class' was deprecated in version 1.5 and will be removed in 1.8. From then on, it will always use 'multinomial'. Leave it to its default value to avoid this warning.
  warnings.warn(
[I 2026-01-17 15:20:41,731] Trial 49 finished with value: 0.9207375478927203 and parameters: {'C': 0.400348287233877, 'max_iter': 207, 'solver': 'lbfgs'}. Best is trial 21 with value: 0.9273227969348659.
/home/sjoon/projects/brain_connectivity_classifier/masterthesis_venv2/lib/python3.11/site-packages/sklearn/linear_model/_logistic.py:1272: FutureWarning: 'multi_class' was deprecated in version 1.5 and will be removed in 1.8. From then on, it will always use 'multinomial'. Leave it to its default value to avoid this warning.
  warnings.warn(
[Parallel(n_jobs=-1)]: Using backend LokyBackend with 32 concurrent workers.
[I 2026-01-17 15:20:59,051] A new study created in memory with name: no-name-2b1f058f-f92a-41b5-9ff3-cb3e8d168866
/home/sjoon/projects/brain_connectivity_classifier/masterthesis_venv2/lib/python3.11/site-packages/sklearn/linear_model/_logistic.py:1272: FutureWarning: 'multi_class' was deprecated in version 1.5 and will be removed in 1.8. From then on, it will always use 'multinomial'. Leave it to its default value to avoid this warning.
  warnings.warn(
[I 2026-01-17 15:21:20,020] Trial 0 finished with value: 0.9109195402298851 and parameters: {'C': 9.037453045307826, 'max_iter': 242, 'solver': 'lbfgs'}. Best is trial 0 with value: 0.9109195402298851.
/home/sjoon/projects/brain_connectivity_classifier/masterthesis_venv2/lib/python3.11/site-packages/sklearn/linear_model/_logistic.py:1272: FutureWarning: 'multi_class' was deprecated in version 1.5 and will be removed in 1.8. From then on, it will always use 'multinomial'. Leave it to its default value to avoid this warning.
  warnings.warn(
[I 2026-01-17 15:21:34,992] Trial 1 finished with value: 0.9193007662835249 and parameters: {'C': 0.0599622587133535, 'max_iter': 214, 'solver': 'newton-cg'}. Best is trial 1 with value: 0.9193007662835249.
/home/sjoon/projects/brain_connectivity_classifier/masterthesis_venv2/lib/python3.11/site-packages/sklearn/linear_model/_logistic.py:1272: FutureWarning: 'multi_class' was deprecated in version 1.5 and will be removed in 1.8. From then on, it will always use 'multinomial'. Leave it to its default value to avoid this warning.
  warnings.warn(
[I 2026-01-17 15:22:07,856] Trial 2 finished with value: 0.8481800766283525 and parameters: {'C': 0.002909396057508643, 'max_iter': 274, 'solver': 'lbfgs'}. Best is trial 1 with value: 0.9193007662835249.
/home/sjoon/projects/brain_connectivity_classifier/masterthesis_venv2/lib/python3.11/site-packages/sklearn/linear_model/_logistic.py:1272: FutureWarning: 'multi_class' was deprecated in version 1.5 and will be removed in 1.8. From then on, it will always use 'multinomial'. Leave it to its default value to avoid this warning.
  warnings.warn(
[I 2026-01-17 15:22:26,964] Trial 3 finished with value: 0.907088122605364 and parameters: {'C': 9.180931329804336, 'max_iter': 213, 'solver': 'lbfgs'}. Best is trial 1 with value: 0.9193007662835249.
/home/sjoon/projects/brain_connectivity_classifier/masterthesis_venv2/lib/python3.11/site-packages/sklearn/linear_model/_logistic.py:1272: FutureWarning: 'multi_class' was deprecated in version 1.5 and will be removed in 1.8. From then on, it will always use 'multinomial'. Leave it to its default value to avoid this warning.
  warnings.warn(
[I 2026-01-17 15:22:45,395] Trial 4 finished with value: 0.9117576628352491 and parameters: {'C': 8.017025468558087, 'max_iter': 295, 'solver': 'lbfgs'}. Best is trial 1 with value: 0.9193007662835249.
/home/sjoon/projects/brain_connectivity_classifier/masterthesis_venv2/lib/python3.11/site-packages/sklearn/linear_model/_logistic.py:1272: FutureWarning: 'multi_class' was deprecated in version 1.5 and will be removed in 1.8. From then on, it will always use 'multinomial'. Leave it to its default value to avoid this warning.
  warnings.warn(
[I 2026-01-17 15:22:59,927] Trial 5 finished with value: 0.9175047892720306 and parameters: {'C': 0.10934495147517145, 'max_iter': 119, 'solver': 'newton-cg'}. Best is trial 1 with value: 0.9193007662835249.
/home/sjoon/projects/brain_connectivity_classifier/masterthesis_venv2/lib/python3.11/site-packages/sklearn/linear_model/_logistic.py:1272: FutureWarning: 'multi_class' was deprecated in version 1.5 and will be removed in 1.8. From then on, it will always use 'multinomial'. Leave it to its default value to avoid this warning.
  warnings.warn(
[I 2026-01-17 15:23:35,002] Trial 6 finished with value: 0.890205938697318 and parameters: {'C': 0.009354759507486167, 'max_iter': 186, 'solver': 'lbfgs'}. Best is trial 1 with value: 0.9193007662835249.
/home/sjoon/projects/brain_connectivity_classifier/masterthesis_venv2/lib/python3.11/site-packages/sklearn/linear_model/_logistic.py:1272: FutureWarning: 'multi_class' was deprecated in version 1.5 and will be removed in 1.8. From then on, it will always use 'multinomial'. Leave it to its default value to avoid this warning.
  warnings.warn(
[I 2026-01-17 15:23:54,079] Trial 7 finished with value: 0.9064894636015326 and parameters: {'C': 4.927176912697252, 'max_iter': 143, 'solver': 'lbfgs'}. Best is trial 1 with value: 0.9193007662835249.
/home/sjoon/projects/brain_connectivity_classifier/masterthesis_venv2/lib/python3.11/site-packages/sklearn/linear_model/_logistic.py:1272: FutureWarning: 'multi_class' was deprecated in version 1.5 and will be removed in 1.8. From then on, it will always use 'multinomial'. Leave it to its default value to avoid this warning.
  warnings.warn(
[I 2026-01-17 15:24:14,699] Trial 8 finished with value: 0.9122365900383141 and parameters: {'C': 0.25352249141085603, 'max_iter': 192, 'solver': 'lbfgs'}. Best is trial 1 with value: 0.9193007662835249.
/home/sjoon/projects/brain_connectivity_classifier/masterthesis_venv2/lib/python3.11/site-packages/sklearn/linear_model/_logistic.py:1272: FutureWarning: 'multi_class' was deprecated in version 1.5 and will be removed in 1.8. From then on, it will always use 'multinomial'. Leave it to its default value to avoid this warning.
  warnings.warn(
[I 2026-01-17 15:24:36,033] Trial 9 finished with value: 0.912595785440613 and parameters: {'C': 0.06775665627513389, 'max_iter': 245, 'solver': 'lbfgs'}. Best is trial 1 with value: 0.9193007662835249.
/home/sjoon/projects/brain_connectivity_classifier/masterthesis_venv2/lib/python3.11/site-packages/sklearn/linear_model/_logistic.py:1272: FutureWarning: 'multi_class' was deprecated in version 1.5 and will be removed in 1.8. From then on, it will always use 'multinomial'. Leave it to its default value to avoid this warning.
  warnings.warn(
[I 2026-01-17 15:24:50,801] Trial 10 finished with value: 0.9091235632183908 and parameters: {'C': 0.7535815926355863, 'max_iter': 478, 'solver': 'newton-cg'}. Best is trial 1 with value: 0.9193007662835249.
/home/sjoon/projects/brain_connectivity_classifier/masterthesis_venv2/lib/python3.11/site-packages/sklearn/linear_model/_logistic.py:1272: FutureWarning: 'multi_class' was deprecated in version 1.5 and will be removed in 1.8. From then on, it will always use 'multinomial'. Leave it to its default value to avoid this warning.
  warnings.warn(
[I 2026-01-17 15:25:07,630] Trial 11 finished with value: 0.9152298850574713 and parameters: {'C': 0.0358497315752199, 'max_iter': 102, 'solver': 'newton-cg'}. Best is trial 1 with value: 0.9193007662835249.
/home/sjoon/projects/brain_connectivity_classifier/masterthesis_venv2/lib/python3.11/site-packages/sklearn/linear_model/_logistic.py:1272: FutureWarning: 'multi_class' was deprecated in version 1.5 and will be removed in 1.8. From then on, it will always use 'multinomial'. Leave it to its default value to avoid this warning.
  warnings.warn(
[I 2026-01-17 15:25:19,400] Trial 12 finished with value: 0.9081657088122606 and parameters: {'C': 0.44736475527213354, 'max_iter': 101, 'solver': 'newton-cg'}. Best is trial 1 with value: 0.9193007662835249.
/home/sjoon/projects/brain_connectivity_classifier/masterthesis_venv2/lib/python3.11/site-packages/sklearn/linear_model/_logistic.py:1272: FutureWarning: 'multi_class' was deprecated in version 1.5 and will be removed in 1.8. From then on, it will always use 'multinomial'. Leave it to its default value to avoid this warning.
  warnings.warn(
[I 2026-01-17 15:25:32,891] Trial 13 finished with value: 0.9088840996168582 and parameters: {'C': 0.016691123385296113, 'max_iter': 137, 'solver': 'newton-cg'}. Best is trial 1 with value: 0.9193007662835249.
/home/sjoon/projects/brain_connectivity_classifier/masterthesis_venv2/lib/python3.11/site-packages/sklearn/linear_model/_logistic.py:1272: FutureWarning: 'multi_class' was deprecated in version 1.5 and will be removed in 1.8. From then on, it will always use 'multinomial'. Leave it to its default value to avoid this warning.
  warnings.warn(
[I 2026-01-17 15:25:46,927] Trial 14 finished with value: 0.91977969348659 and parameters: {'C': 0.1539338559030977, 'max_iter': 348, 'solver': 'newton-cg'}. Best is trial 14 with value: 0.91977969348659.
/home/sjoon/projects/brain_connectivity_classifier/masterthesis_venv2/lib/python3.11/site-packages/sklearn/linear_model/_logistic.py:1272: FutureWarning: 'multi_class' was deprecated in version 1.5 and will be removed in 1.8. From then on, it will always use 'multinomial'. Leave it to its default value to avoid this warning.
  warnings.warn(
