[I 2026-01-17 16:12:22,570] Trial 49 finished with value: 0.915948275862069 and parameters: {'C': 0.03861372873281579, 'max_iter': 431, 'solver': 'newton-cg'}. Best is trial 11 with value: 0.9285201149425287.
/home/sjoon/projects/brain_connectivity_classifier/masterthesis_venv2/lib/python3.11/site-packages/sklearn/linear_model/_logistic.py:1272: FutureWarning: 'multi_class' was deprecated in version 1.5 and will be removed in 1.8. From then on, it will always use 'multinomial'. Leave it to its default value to avoid this warning.
  warnings.warn(
[Parallel(n_jobs=-1)]: Using backend LokyBackend with 32 concurrent workers.
/home/sjoon/projects/brain_connectivity_classifier/masterthesis_venv2/lib/python3.11/site-packages/sklearn/linear_model/_logistic.py:1272: FutureWarning: 'multi_class' was deprecated in version 1.5 and will be removed in 1.8. From then on, it will always use 'multinomial'. Leave it to its default value to avoid this warning.
  warnings.warn(
/home/sjoon/projects/brain_connectivity_classifier/masterthesis_venv2/lib/python3.11/site-packages/sklearn/linear_model/_logistic.py:1272: FutureWarning: 'multi_class' was deprecated in version 1.5 and will be removed in 1.8. From then on, it will always use 'multinomial'. Leave it to its default value to avoid this warning.
  warnings.warn(
/home/sjoon/projects/brain_connectivity_classifier/masterthesis_venv2/lib/python3.11/site-packages/sklearn/linear_model/_logistic.py:1272: FutureWarning: 'multi_class' was deprecated in version 1.5 and will be removed in 1.8. From then on, it will always use 'multinomial'. Leave it to its default value to avoid this warning.
  warnings.warn(
/home/sjoon/projects/brain_connectivity_classifier/masterthesis_venv2/lib/python3.11/site-packages/sklearn/linear_model/_logistic.py:1272: FutureWarning: 'multi_class' was deprecated in version 1.5 and will be removed in 1.8. From then on, it will always use 'multinomial'. Leave it to its default value to avoid this warning.
  warnings.warn(
/home/sjoon/projects/brain_connectivity_classifier/masterthesis_venv2/lib/python3.11/site-packages/sklearn/linear_model/_logistic.py:1272: FutureWarning: 'multi_class' was deprecated in version 1.5 and will be removed in 1.8. From then on, it will always use 'multinomial'. Leave it to its default value to avoid this warning.
  warnings.warn(
/home/sjoon/projects/brain_connectivity_classifier/masterthesis_venv2/lib/python3.11/site-packages/sklearn/linear_model/_logistic.py:1272: FutureWarning: 'multi_class' was deprecated in version 1.5 and will be removed in 1.8. From then on, it will always use 'multinomial'. Leave it to its default value to avoid this warning.
  warnings.warn(
/home/sjoon/projects/brain_connectivity_classifier/masterthesis_venv2/lib/python3.11/site-packages/sklearn/linear_model/_logistic.py:1272: FutureWarning: 'multi_class' was deprecated in version 1.5 and will be removed in 1.8. From then on, it will always use 'multinomial'. Leave it to its default value to avoid this warning.
  warnings.warn(
/home/sjoon/projects/brain_connectivity_classifier/masterthesis_venv2/lib/python3.11/site-packages/sklearn/linear_model/_logistic.py:1272: FutureWarning: 'multi_class' was deprecated in version 1.5 and will be removed in 1.8. From then on, it will always use 'multinomial'. Leave it to its default value to avoid this warning.
  warnings.warn(
/home/sjoon/projects/brain_connectivity_classifier/masterthesis_venv2/lib/python3.11/site-packages/sklearn/linear_model/_logistic.py:1272: FutureWarning: 'multi_class' was deprecated in version 1.5 and will be removed in 1.8. From then on, it will always use 'multinomial'. Leave it to its default value to avoid this warning.
  warnings.warn(
/home/sjoon/projects/brain_connectivity_classifier/masterthesis_venv2/lib/python3.11/site-packages/sklearn/linear_model/_logistic.py:1272: FutureWarning: 'multi_class' was deprecated in version 1.5 and will be removed in 1.8. From then on, it will always use 'multinomial'. Leave it to its default value to avoid this warning.
  warnings.warn(
/home/sjoon/projects/brain_connectivity_classifier/masterthesis_venv2/lib/python3.11/site-packages/sklearn/linear_model/_logistic.py:1272: FutureWarning: 'multi_class' was deprecated in version 1.5 and will be removed in 1.8. From then on, it will always use 'multinomial'. Leave it to its default value to avoid this warning.
  warnings.warn(
/home/sjoon/projects/brain_connectivity_classifier/masterthesis_venv2/lib/python3.11/site-packages/sklearn/linear_model/_logistic.py:1272: FutureWarning: 'multi_class' was deprecated in version 1.5 and will be removed in 1.8. From then on, it will always use 'multinomial'. Leave it to its default value to avoid this warning.
  warnings.warn(
/home/sjoon/projects/brain_connectivity_classifier/masterthesis_venv2/lib/python3.11/site-packages/sklearn/linear_model/_logistic.py:1272: FutureWarning: 'multi_class' was deprecated in version 1.5 and will be removed in 1.8. From then on, it will always use 'multinomial'. Leave it to its default value to avoid this warning.
  warnings.warn(
/home/sjoon/projects/brain_connectivity_classifier/masterthesis_venv2/lib/python3.11/site-packages/sklearn/linear_model/_logistic.py:1272: FutureWarning: 'multi_class' was deprecated in version 1.5 and will be removed in 1.8. From then on, it will always use 'multinomial'. Leave it to its default value to avoid this warning.
  warnings.warn(
/home/sjoon/projects/brain_connectivity_classifier/masterthesis_venv2/lib/python3.11/site-packages/sklearn/linear_model/_logistic.py:1272: FutureWarning: 'multi_class' was deprecated in version 1.5 and will be removed in 1.8. From then on, it will always use 'multinomial'. Leave it to its default value to avoid this warning.
  warnings.warn(
/home/sjoon/projects/brain_connectivity_classifier/masterthesis_venv2/lib/python3.11/site-packages/sklearn/linear_model/_logistic.py:1272: FutureWarning: 'multi_class' was deprecated in version 1.5 and will be removed in 1.8. From then on, it will always use 'multinomial'. Leave it to its default value to avoid this warning.
  warnings.warn(
/home/sjoon/projects/brain_connectivity_classifier/masterthesis_venv2/lib/python3.11/site-packages/sklearn/linear_model/_logistic.py:1272: FutureWarning: 'multi_class' was deprecated in version 1.5 and will be removed in 1.8. From then on, it will always use 'multinomial'. Leave it to its default value to avoid this warning.
  warnings.warn(
/home/sjoon/projects/brain_connectivity_classifier/masterthesis_venv2/lib/python3.11/site-packages/sklearn/linear_model/_logistic.py:1272: FutureWarning: 'multi_class' was deprecated in version 1.5 and will be removed in 1.8. From then on, it will always use 'multinomial'. Leave it to its default value to avoid this warning.
  warnings.warn(
/home/sjoon/projects/brain_connectivity_classifier/masterthesis_venv2/lib/python3.11/site-packages/sklearn/linear_model/_logistic.py:1272: FutureWarning: 'multi_class' was deprecated in version 1.5 and will be removed in 1.8. From then on, it will always use 'multinomial'. Leave it to its default value to avoid this warning.
  warnings.warn(
/home/sjoon/projects/brain_connectivity_classifier/masterthesis_venv2/lib/python3.11/site-packages/sklearn/linear_model/_logistic.py:1272: FutureWarning: 'multi_class' was deprecated in version 1.5 and will be removed in 1.8. From then on, it will always use 'multinomial'. Leave it to its default value to avoid this warning.
  warnings.warn(
/home/sjoon/projects/brain_connectivity_classifier/masterthesis_venv2/lib/python3.11/site-packages/sklearn/linear_model/_logistic.py:1272: FutureWarning: 'multi_class' was deprecated in version 1.5 and will be removed in 1.8. From then on, it will always use 'multinomial'. Leave it to its default value to avoid this warning.
  warnings.warn(
/home/sjoon/projects/brain_connectivity_classifier/masterthesis_venv2/lib/python3.11/site-packages/sklearn/linear_model/_logistic.py:1272: FutureWarning: 'multi_class' was deprecated in version 1.5 and will be removed in 1.8. From then on, it will always use 'multinomial'. Leave it to its default value to avoid this warning.
  warnings.warn(
/home/sjoon/projects/brain_connectivity_classifier/masterthesis_venv2/lib/python3.11/site-packages/sklearn/linear_model/_logistic.py:1272: FutureWarning: 'multi_class' was deprecated in version 1.5 and will be removed in 1.8. From then on, it will always use 'multinomial'. Leave it to its default value to avoid this warning.
  warnings.warn(
/home/sjoon/projects/brain_connectivity_classifier/masterthesis_venv2/lib/python3.11/site-packages/sklearn/linear_model/_logistic.py:1272: FutureWarning: 'multi_class' was deprecated in version 1.5 and will be removed in 1.8. From then on, it will always use 'multinomial'. Leave it to its default value to avoid this warning.
  warnings.warn(
/home/sjoon/projects/brain_connectivity_classifier/masterthesis_venv2/lib/python3.11/site-packages/sklearn/linear_model/_logistic.py:1272: FutureWarning: 'multi_class' was deprecated in version 1.5 and will be removed in 1.8. From then on, it will always use 'multinomial'. Leave it to its default value to avoid this warning.
  warnings.warn(
/home/sjoon/projects/brain_connectivity_classifier/masterthesis_venv2/lib/python3.11/site-packages/sklearn/linear_model/_logistic.py:1272: FutureWarning: 'multi_class' was deprecated in version 1.5 and will be removed in 1.8. From then on, it will always use 'multinomial'. Leave it to its default value to avoid this warning.
  warnings.warn(
/home/sjoon/projects/brain_connectivity_classifier/masterthesis_venv2/lib/python3.11/site-packages/sklearn/linear_model/_logistic.py:1272: FutureWarning: 'multi_class' was deprecated in version 1.5 and will be removed in 1.8. From then on, it will always use 'multinomial'. Leave it to its default value to avoid this warning.
  warnings.warn(
/home/sjoon/projects/brain_connectivity_classifier/masterthesis_venv2/lib/python3.11/site-packages/sklearn/linear_model/_logistic.py:1272: FutureWarning: 'multi_class' was deprecated in version 1.5 and will be removed in 1.8. From then on, it will always use 'multinomial'. Leave it to its default value to avoid this warning.
  warnings.warn(
/home/sjoon/projects/brain_connectivity_classifier/masterthesis_venv2/lib/python3.11/site-packages/sklearn/linear_model/_logistic.py:1272: FutureWarning: 'multi_class' was deprecated in version 1.5 and will be removed in 1.8. From then on, it will always use 'multinomial'. Leave it to its default value to avoid this warning.
  warnings.warn(
/home/sjoon/projects/brain_connectivity_classifier/masterthesis_venv2/lib/python3.11/site-packages/sklearn/linear_model/_logistic.py:1272: FutureWarning: 'multi_class' was deprecated in version 1.5 and will be removed in 1.8. From then on, it will always use 'multinomial'. Leave it to its default value to avoid this warning.
  warnings.warn(
/home/sjoon/projects/brain_connectivity_classifier/masterthesis_venv2/lib/python3.11/site-packages/sklearn/linear_model/_logistic.py:1272: FutureWarning: 'multi_class' was deprecated in version 1.5 and will be removed in 1.8. From then on, it will always use 'multinomial'. Leave it to its default value to avoid this warning.
  warnings.warn(
/home/sjoon/projects/brain_connectivity_classifier/masterthesis_venv2/lib/python3.11/site-packages/sklearn/linear_model/_logistic.py:1272: FutureWarning: 'multi_class' was deprecated in version 1.5 and will be removed in 1.8. From then on, it will always use 'multinomial'. Leave it to its default value to avoid this warning.
  warnings.warn(
/home/sjoon/projects/brain_connectivity_classifier/masterthesis_venv2/lib/python3.11/site-packages/sklearn/linear_model/_logistic.py:1272: FutureWarning: 'multi_class' was deprecated in version 1.5 and will be removed in 1.8. From then on, it will always use 'multinomial'. Leave it to its default value to avoid this warning.
  warnings.warn(
/home/sjoon/projects/brain_connectivity_classifier/masterthesis_venv2/lib/python3.11/site-packages/sklearn/linear_model/_logistic.py:1272: FutureWarning: 'multi_class' was deprecated in version 1.5 and will be removed in 1.8. From then on, it will always use 'multinomial'. Leave it to its default value to avoid this warning.
  warnings.warn(
/home/sjoon/projects/brain_connectivity_classifier/masterthesis_venv2/lib/python3.11/site-packages/sklearn/linear_model/_logistic.py:1272: FutureWarning: 'multi_class' was deprecated in version 1.5 and will be removed in 1.8. From then on, it will always use 'multinomial'. Leave it to its default value to avoid this warning.
  warnings.warn(
/home/sjoon/projects/brain_connectivity_classifier/masterthesis_venv2/lib/python3.11/site-packages/sklearn/linear_model/_logistic.py:1272: FutureWarning: 'multi_class' was deprecated in version 1.5 and will be removed in 1.8. From then on, it will always use 'multinomial'. Leave it to its default value to avoid this warning.
  warnings.warn(
/home/sjoon/projects/brain_connectivity_classifier/masterthesis_venv2/lib/python3.11/site-packages/sklearn/linear_model/_logistic.py:1272: FutureWarning: 'multi_class' was deprecated in version 1.5 and will be removed in 1.8. From then on, it will always use 'multinomial'. Leave it to its default value to avoid this warning.
  warnings.warn(
/home/sjoon/projects/brain_connectivity_classifier/masterthesis_venv2/lib/python3.11/site-packages/sklearn/linear_model/_logistic.py:1272: FutureWarning: 'multi_class' was deprecated in version 1.5 and will be removed in 1.8. From then on, it will always use 'multinomial'. Leave it to its default value to avoid this warning.
  warnings.warn(
/home/sjoon/projects/brain_connectivity_classifier/masterthesis_venv2/lib/python3.11/site-packages/sklearn/linear_model/_logistic.py:1272: FutureWarning: 'multi_class' was deprecated in version 1.5 and will be removed in 1.8. From then on, it will always use 'multinomial'. Leave it to its default value to avoid this warning.
  warnings.warn(
/home/sjoon/projects/brain_connectivity_classifier/masterthesis_venv2/lib/python3.11/site-packages/sklearn/linear_model/_logistic.py:1272: FutureWarning: 'multi_class' was deprecated in version 1.5 and will be removed in 1.8. From then on, it will always use 'multinomial'. Leave it to its default value to avoid this warning.
  warnings.warn(
/home/sjoon/projects/brain_connectivity_classifier/masterthesis_venv2/lib/python3.11/site-packages/sklearn/linear_model/_logistic.py:1272: FutureWarning: 'multi_class' was deprecated in version 1.5 and will be removed in 1.8. From then on, it will always use 'multinomial'. Leave it to its default value to avoid this warning.
  warnings.warn(
/home/sjoon/projects/brain_connectivity_classifier/masterthesis_venv2/lib/python3.11/site-packages/sklearn/linear_model/_logistic.py:1272: FutureWarning: 'multi_class' was deprecated in version 1.5 and will be removed in 1.8. From then on, it will always use 'multinomial'. Leave it to its default value to avoid this warning.
  warnings.warn(
/home/sjoon/projects/brain_connectivity_classifier/masterthesis_venv2/lib/python3.11/site-packages/sklearn/linear_model/_logistic.py:1272: FutureWarning: 'multi_class' was deprecated in version 1.5 and will be removed in 1.8. From then on, it will always use 'multinomial'. Leave it to its default value to avoid this warning.
  warnings.warn(
/home/sjoon/projects/brain_connectivity_classifier/masterthesis_venv2/lib/python3.11/site-packages/sklearn/linear_model/_logistic.py:1272: FutureWarning: 'multi_class' was deprecated in version 1.5 and will be removed in 1.8. From then on, it will always use 'multinomial'. Leave it to its default value to avoid this warning.
  warnings.warn(
/home/sjoon/projects/brain_connectivity_classifier/masterthesis_venv2/lib/python3.11/site-packages/sklearn/linear_model/_logistic.py:1272: FutureWarning: 'multi_class' was deprecated in version 1.5 and will be removed in 1.8. From then on, it will always use 'multinomial'. Leave it to its default value to avoid this warning.
  warnings.warn(
/home/sjoon/projects/brain_connectivity_classifier/masterthesis_venv2/lib/python3.11/site-packages/sklearn/linear_model/_logistic.py:1272: FutureWarning: 'multi_class' was deprecated in version 1.5 and will be removed in 1.8. From then on, it will always use 'multinomial'. Leave it to its default value to avoid this warning.
  warnings.warn(
/home/sjoon/projects/brain_connectivity_classifier/masterthesis_venv2/lib/python3.11/site-packages/sklearn/linear_model/_logistic.py:1272: FutureWarning: 'multi_class' was deprecated in version 1.5 and will be removed in 1.8. From then on, it will always use 'multinomial'. Leave it to its default value to avoid this warning.
  warnings.warn(
/home/sjoon/projects/brain_connectivity_classifier/masterthesis_venv2/lib/python3.11/site-packages/sklearn/linear_model/_logistic.py:1272: FutureWarning: 'multi_class' was deprecated in version 1.5 and will be removed in 1.8. From then on, it will always use 'multinomial'. Leave it to its default value to avoid this warning.
  warnings.warn(
/home/sjoon/projects/brain_connectivity_classifier/masterthesis_venv2/lib/python3.11/site-packages/sklearn/linear_model/_logistic.py:1272: FutureWarning: 'multi_class' was deprecated in version 1.5 and will be removed in 1.8. From then on, it will always use 'multinomial'. Leave it to its default value to avoid this warning.
  warnings.warn(
/home/sjoon/projects/brain_connectivity_classifier/masterthesis_venv2/lib/python3.11/site-packages/sklearn/linear_model/_logistic.py:1272: FutureWarning: 'multi_class' was deprecated in version 1.5 and will be removed in 1.8. From then on, it will always use 'multinomial'. Leave it to its default value to avoid this warning.
  warnings.warn(
/home/sjoon/projects/brain_connectivity_classifier/masterthesis_venv2/lib/python3.11/site-packages/sklearn/linear_model/_logistic.py:1272: FutureWarning: 'multi_class' was deprecated in version 1.5 and will be removed in 1.8. From then on, it will always use 'multinomial'. Leave it to its default value to avoid this warning.
  warnings.warn(
/home/sjoon/projects/brain_connectivity_classifier/masterthesis_venv2/lib/python3.11/site-packages/sklearn/linear_model/_logistic.py:1272: FutureWarning: 'multi_class' was deprecated in version 1.5 and will be removed in 1.8. From then on, it will always use 'multinomial'. Leave it to its default value to avoid this warning.
  warnings.warn(
/home/sjoon/projects/brain_connectivity_classifier/masterthesis_venv2/lib/python3.11/site-packages/sklearn/linear_model/_logistic.py:1272: FutureWarning: 'multi_class' was deprecated in version 1.5 and will be removed in 1.8. From then on, it will always use 'multinomial'. Leave it to its default value to avoid this warning.
  warnings.warn(
/home/sjoon/projects/brain_connectivity_classifier/masterthesis_venv2/lib/python3.11/site-packages/sklearn/linear_model/_logistic.py:1272: FutureWarning: 'multi_class' was deprecated in version 1.5 and will be removed in 1.8. From then on, it will always use 'multinomial'. Leave it to its default value to avoid this warning.
  warnings.warn(
/home/sjoon/projects/brain_connectivity_classifier/masterthesis_venv2/lib/python3.11/site-packages/sklearn/linear_model/_logistic.py:1272: FutureWarning: 'multi_class' was deprecated in version 1.5 and will be removed in 1.8. From then on, it will always use 'multinomial'. Leave it to its default value to avoid this warning.
  warnings.warn(
/home/sjoon/projects/brain_connectivity_classifier/masterthesis_venv2/lib/python3.11/site-packages/sklearn/linear_model/_logistic.py:1272: FutureWarning: 'multi_class' was deprecated in version 1.5 and will be removed in 1.8. From then on, it will always use 'multinomial'. Leave it to its default value to avoid this warning.
  warnings.warn(
/home/sjoon/projects/brain_connectivity_classifier/masterthesis_venv2/lib/python3.11/site-packages/sklearn/linear_model/_logistic.py:1272: FutureWarning: 'multi_class' was deprecated in version 1.5 and will be removed in 1.8. From then on, it will always use 'multinomial'. Leave it to its default value to avoid this warning.
  warnings.warn(
/home/sjoon/projects/brain_connectivity_classifier/masterthesis_venv2/lib/python3.11/site-packages/sklearn/linear_model/_logistic.py:1272: FutureWarning: 'multi_class' was deprecated in version 1.5 and will be removed in 1.8. From then on, it will always use 'multinomial'. Leave it to its default value to avoid this warning.
  warnings.warn(
/home/sjoon/projects/brain_connectivity_classifier/masterthesis_venv2/lib/python3.11/site-packages/sklearn/linear_model/_logistic.py:1272: FutureWarning: 'multi_class' was deprecated in version 1.5 and will be removed in 1.8. From then on, it will always use 'multinomial'. Leave it to its default value to avoid this warning.
  warnings.warn(
/home/sjoon/projects/brain_connectivity_classifier/masterthesis_venv2/lib/python3.11/site-packages/sklearn/linear_model/_logistic.py:1272: FutureWarning: 'multi_class' was deprecated in version 1.5 and will be removed in 1.8. From then on, it will always use 'multinomial'. Leave it to its default value to avoid this warning.
  warnings.warn(
/home/sjoon/projects/brain_connectivity_classifier/masterthesis_venv2/lib/python3.11/site-packages/sklearn/linear_model/_logistic.py:1272: FutureWarning: 'multi_class' was deprecated in version 1.5 and will be removed in 1.8. From then on, it will always use 'multinomial'. Leave it to its default value to avoid this warning.
  warnings.warn(
/home/sjoon/projects/brain_connectivity_classifier/masterthesis_venv2/lib/python3.11/site-packages/sklearn/linear_model/_logistic.py:1272: FutureWarning: 'multi_class' was deprecated in version 1.5 and will be removed in 1.8. From then on, it will always use 'multinomial'. Leave it to its default value to avoid this warning.
  warnings.warn(
/home/sjoon/projects/brain_connectivity_cl