[I 2026-01-17 15:03:44,780] Trial 39 finished with value: 0.9244492337164751 and parameters: {'C': 0.34279326624155393, 'max_iter': 160, 'solver': 'newton-cg'}. Best is trial 37 with value: 0.9339080459770115.
/home/sjoon/projects/brain_connectivity_classifier/masterthesis_venv2/lib/python3.11/site-packages/sklearn/linear_model/_logistic.py:1272: FutureWarning: 'multi_class' was deprecated in version 1.5 and will be removed in 1.8. From then on, it will always use 'multinomial'. Leave it to its default value to avoid this warning.
  warnings.warn(
[I 2026-01-17 15:03:57,276] Trial 40 finished with value: 0.9112787356321839 and parameters: {'C': 2.5421048455368003, 'max_iter': 163, 'solver': 'newton-cg'}. Best is trial 37 with value: 0.9339080459770115.
/home/sjoon/projects/brain_connectivity_classifier/masterthesis_venv2/lib/python3.11/site-packages/sklearn/linear_model/_logistic.py:1272: FutureWarning: 'multi_class' was deprecated in version 1.5 and will be removed in 1.8. From then on, it will always use 'multinomial'. Leave it to its default value to avoid this warning.
  warnings.warn(
[I 2026-01-17 15:04:07,208] Trial 41 finished with value: 0.9073275862068966 and parameters: {'C': 0.39920390374425546, 'max_iter': 193, 'solver': 'newton-cg'}. Best is trial 37 with value: 0.9339080459770115.
/home/sjoon/projects/brain_connectivity_classifier/masterthesis_venv2/lib/python3.11/site-packages/sklearn/linear_model/_logistic.py:1272: FutureWarning: 'multi_class' was deprecated in version 1.5 and will be removed in 1.8. From then on, it will always use 'multinomial'. Leave it to its default value to avoid this warning.
  warnings.warn(
[I 2026-01-17 15:04:19,696] Trial 42 finished with value: 0.9131944444444444 and parameters: {'C': 0.324555570125643, 'max_iter': 162, 'solver': 'newton-cg'}. Best is trial 37 with value: 0.9339080459770115.
/home/sjoon/projects/brain_connectivity_classifier/masterthesis_venv2/lib/python3.11/site-packages/sklearn/linear_model/_logistic.py:1272: FutureWarning: 'multi_class' was deprecated in version 1.5 and will be removed in 1.8. From then on, it will always use 'multinomial'. Leave it to its default value to avoid this warning.
  warnings.warn(
[I 2026-01-17 15:04:31,220] Trial 43 finished with value: 0.9106800766283525 and parameters: {'C': 0.07178845186776646, 'max_iter': 180, 'solver': 'newton-cg'}. Best is trial 37 with value: 0.9339080459770115.
/home/sjoon/projects/brain_connectivity_classifier/masterthesis_venv2/lib/python3.11/site-packages/sklearn/linear_model/_logistic.py:1272: FutureWarning: 'multi_class' was deprecated in version 1.5 and will be removed in 1.8. From then on, it will always use 'multinomial'. Leave it to its default value to avoid this warning.
  warnings.warn(
[I 2026-01-17 15:04:42,351] Trial 44 finished with value: 0.9093630268199234 and parameters: {'C': 0.9047540440394705, 'max_iter': 207, 'solver': 'newton-cg'}. Best is trial 37 with value: 0.9339080459770115.
/home/sjoon/projects/brain_connectivity_classifier/masterthesis_venv2/lib/python3.11/site-packages/sklearn/linear_model/_logistic.py:1272: FutureWarning: 'multi_class' was deprecated in version 1.5 and will be removed in 1.8. From then on, it will always use 'multinomial'. Leave it to its default value to avoid this warning.
  warnings.warn(
[I 2026-01-17 15:04:52,181] Trial 45 finished with value: 0.9119971264367817 and parameters: {'C': 2.1690744557867956, 'max_iter': 316, 'solver': 'newton-cg'}. Best is trial 37 with value: 0.9339080459770115.
/home/sjoon/projects/brain_connectivity_classifier/masterthesis_venv2/lib/python3.11/site-packages/sklearn/linear_model/_logistic.py:1272: FutureWarning: 'multi_class' was deprecated in version 1.5 and will be removed in 1.8. From then on, it will always use 'multinomial'. Leave it to its default value to avoid this warning.
  warnings.warn(
[I 2026-01-17 15:05:14,939] Trial 46 finished with value: 0.9104406130268199 and parameters: {'C': 0.1659119473543703, 'max_iter': 143, 'solver': 'lbfgs'}. Best is trial 37 with value: 0.9339080459770115.
/home/sjoon/projects/brain_connectivity_classifier/masterthesis_venv2/lib/python3.11/site-packages/sklearn/linear_model/_logistic.py:1272: FutureWarning: 'multi_class' was deprecated in version 1.5 and will be removed in 1.8. From then on, it will always use 'multinomial'. Leave it to its default value to avoid this warning.
  warnings.warn(
[I 2026-01-17 15:05:37,279] Trial 47 finished with value: 0.9246886973180076 and parameters: {'C': 0.7255118581144846, 'max_iter': 179, 'solver': 'lbfgs'}. Best is trial 37 with value: 0.9339080459770115.
/home/sjoon/projects/brain_connectivity_classifier/masterthesis_venv2/lib/python3.11/site-packages/sklearn/linear_model/_logistic.py:1272: FutureWarning: 'multi_class' was deprecated in version 1.5 and will be removed in 1.8. From then on, it will always use 'multinomial'. Leave it to its default value to avoid this warning.
  warnings.warn(
[I 2026-01-17 15:05:49,709] Trial 48 finished with value: 0.9164272030651341 and parameters: {'C': 0.6151194592907621, 'max_iter': 173, 'solver': 'newton-cg'}. Best is trial 37 with value: 0.9339080459770115.
/home/sjoon/projects/brain_connectivity_classifier/masterthesis_venv2/lib/python3.11/site-packages/sklearn/linear_model/_logistic.py:1272: FutureWarning: 'multi_class' was deprecated in version 1.5 and will be removed in 1.8. From then on, it will always use 'multinomial'. Leave it to its default value to avoid this warning.
  warnings.warn(
[I 2026-01-17 15:06:09,265] Trial 49 finished with value: 0.9027777777777778 and parameters: {'C': 3.412069788239589, 'max_iter': 235, 'solver': 'lbfgs'}. Best is trial 37 with value: 0.9339080459770115.
/home/sjoon/projects/brain_connectivity_classifier/masterthesis_venv2/lib/python3.11/site-packages/sklearn/linear_model/_logistic.py:1272: FutureWarning: 'multi_class' was deprecated in version 1.5 and will be removed in 1.8. From then on, it will always use 'multinomial'. Leave it to its default value to avoid this warning.
  warnings.warn(
[Parallel(n_jobs=-1)]: Using backend LokyBackend with 32 concurrent workers.
[I 2026-01-17 15:06:31,386] A new study created in memory with name: no-name-cc15ab84-f73a-4b1e-8241-53183b0e32c3
/home/sjoon/projects/brain_connectivity_classifier/masterthesis_venv2/lib/python3.11/site-packages/sklearn/linear_model/_logistic.py:1272: FutureWarning: 'multi_class' was deprecated in version 1.5 and will be removed in 1.8. From then on, it will always use 'multinomial'. Leave it to its default value to avoid this warning.
  warnings.warn(
[I 2026-01-17 15:06:48,186] Trial 0 finished with value: 0.9066091954022989 and parameters: {'C': 2.1845832259915205, 'max_iter': 118, 'solver': 'lbfgs'}. Best is trial 0 with value: 0.9066091954022989.
/home/sjoon/projects/brain_connectivity_classifier/masterthesis_venv2/lib/python3.11/site-packages/sklearn/linear_model/_logistic.py:1272: FutureWarning: 'multi_class' was deprecated in version 1.5 and will be removed in 1.8. From then on, it will always use 'multinomial'. Leave it to its default value to avoid this warning.
  warnings.warn(
[I 2026-01-17 15:07:02,360] Trial 1 finished with value: 0.9131944444444444 and parameters: {'C': 0.02736801827846297, 'max_iter': 266, 'solver': 'newton-cg'}. Best is trial 1 with value: 0.9131944444444444.
/home/sjoon/projects/brain_connectivity_classifier/masterthesis_venv2/lib/python3.11/site-packages/sklearn/linear_model/_logistic.py:1272: FutureWarning: 'multi_class' was deprecated in version 1.5 and will be removed in 1.8. From then on, it will always use 'multinomial'. Leave it to its default value to avoid this warning.
  warnings.warn(
[I 2026-01-17 15:07:23,975] Trial 2 finished with value: 0.9154693486590039 and parameters: {'C': 0.10954930794959702, 'max_iter': 313, 'solver': 'lbfgs'}. Best is trial 2 with value: 0.9154693486590039.
/home/sjoon/projects/brain_connectivity_classifier/masterthesis_venv2/lib/python3.11/site-packages/sklearn/linear_model/_logistic.py:1272: FutureWarning: 'multi_class' was deprecated in version 1.5 and will be removed in 1.8. From then on, it will always use 'multinomial'. Leave it to its default value to avoid this warning.
  warnings.warn(
[I 2026-01-17 15:07:36,728] Trial 3 finished with value: 0.915948275862069 and parameters: {'C': 0.05135776127610299, 'max_iter': 120, 'solver': 'newton-cg'}. Best is trial 3 with value: 0.915948275862069.
/home/sjoon/projects/brain_connectivity_classifier/masterthesis_venv2/lib/python3.11/site-packages/sklearn/linear_model/_logistic.py:1272: FutureWarning: 'multi_class' was deprecated in version 1.5 and will be removed in 1.8. From then on, it will always use 'multinomial'. Leave it to its default value to avoid this warning.
  warnings.warn(
[I 2026-01-17 15:07:57,333] Trial 4 finished with value: 0.9048132183908046 and parameters: {'C': 5.934756183514231, 'max_iter': 414, 'solver': 'lbfgs'}. Best is trial 3 with value: 0.915948275862069.
/home/sjoon/projects/brain_connectivity_classifier/masterthesis_venv2/lib/python3.11/site-packages/sklearn/linear_model/_logistic.py:1272: FutureWarning: 'multi_class' was deprecated in version 1.5 and will be removed in 1.8. From then on, it will always use 'multinomial'. Leave it to its default value to avoid this warning.
  warnings.warn(
[I 2026-01-17 15:08:07,722] Trial 5 finished with value: 0.9195402298850575 and parameters: {'C': 0.3526371437712786, 'max_iter': 125, 'solver': 'newton-cg'}. Best is trial 5 with value: 0.9195402298850575.
/home/sjoon/projects/brain_connectivity_classifier/masterthesis_venv2/lib/python3.11/site-packages/sklearn/linear_model/_logistic.py:1272: FutureWarning: 'multi_class' was deprecated in version 1.5 and will be removed in 1.8. From then on, it will always use 'multinomial'. Leave it to its default value to avoid this warning.
  warnings.warn(
[I 2026-01-17 15:08:46,406] Trial 6 finished with value: 0.8957136015325671 and parameters: {'C': 0.010809390923666368, 'max_iter': 291, 'solver': 'lbfgs'}. Best is trial 5 with value: 0.9195402298850575.
/home/sjoon/projects/brain_connectivity_classifier/masterthesis_venv2/lib/python3.11/site-packages/sklearn/linear_model/_logistic.py:1272: FutureWarning: 'multi_class' was deprecated in version 1.5 and will be removed in 1.8. From then on, it will always use 'multinomial'. Leave it to its default value to avoid this warning.
  warnings.warn(
[I 2026-01-17 15:09:03,818] Trial 7 finished with value: 0.9226532567049809 and parameters: {'C': 0.17856643681849566, 'max_iter': 129, 'solver': 'lbfgs'}. Best is trial 7 with value: 0.9226532567049809.
/home/sjoon/projects/brain_connectivity_classifier/masterthesis_venv2/lib/python3.11/site-packages/sklearn/linear_model/_logistic.py:1272: FutureWarning: 'multi_class' was deprecated in version 1.5 and will be removed in 1.8. From then on, it will always use 'multinomial'. Leave it to its default value to avoid this warning.
  warnings.warn(
[I 2026-01-17 15:09:18,398] Trial 8 finished with value: 0.8709291187739464 and parameters: {'C': 0.006482617122786845, 'max_iter': 208, 'solver': 'newton-cg'}. Best is trial 7 with value: 0.9226532567049809.
/home/sjoon/projects/brain_connectivity_classifier/masterthesis_venv2/lib/python3.11/site-packages/sklearn/linear_model/_logistic.py:1272: FutureWarning: 'multi_class' was deprecated in version 1.5 and will be removed in 1.8. From then on, it will always use 'multinomial'. Leave it to its default value to avoid this warning.
  warnings.warn(
[I 2026-01-17 15:09:37,488] Trial 9 finished with value: 0.8995450191570882 and parameters: {'C': 1.659849845334228, 'max_iter': 183, 'solver': 'lbfgs'}. Best is trial 7 with value: 0.9226532567049809.
/home/sjoon/projects/brain_connectivity_classifier/masterthesis_venv2/lib/python3.11/site-packages/sklearn/linear_model/_logistic.py:1272: FutureWarning: 'multi_class' was deprecated in version 1.5 and will be removed in 1.8. From then on, it will always use 'multinomial'. Leave it to its default value to avoid this warning.
  warnings.warn(
[I 2026-01-17 15:10:05,735] Trial 10 finished with value: 0.8200431034482759 and parameters: {'C': 0.0017881095717767353, 'max_iter': 161, 'solver': 'lbfgs'}. Best is trial 7 with value: 0.9226532567049809.
/home/sjoon/projects/brain_connectivity_classifier/masterthesis_venv2/lib/python3.11/site-packages/sklearn/linear_model/_logistic.py:1272: FutureWarning: 'multi_class' was deprecated in version 1.5 and will be removed in 1.8. From then on, it will always use 'multinomial'. Leave it to its default value to avoid this warning.
  warnings.warn(
[I 2026-01-17 15:10:22,945] Trial 11 finished with value: 0.912595785440613 and parameters: {'C': 0.22757039128829426, 'max_iter': 143, 'solver': 'newton-cg'}. Best is trial 7 with value: 0.9226532567049809.
/home/sjoon/projects/brain_connectivity_classifier/masterthesis_venv2/lib/python3.11/site-packages/sklearn/linear_model/_logistic.py:1272: FutureWarning: 'multi_class' was deprecated in version 1.5 and will be removed in 1.8. From then on, it will always use 'multinomial'. Leave it to its default value to avoid this warning.
  warnings.warn(
[I 2026-01-17 15:10:35,259] Trial 12 finished with value: 0.9057710727969349 and parameters: {'C': 0.29207131519085616, 'max_iter': 103, 'solver': 'newton-cg'}. Best is trial 7 with value: 0.9226532567049809.
/home/sjoon/projects/brain_connectivity_classifier/masterthesis_venv2/lib/python3.11/site-packages/sklearn/linear_model/_logistic.py:1272: FutureWarning: 'multi_class' was deprecated in version 1.5 and will be removed in 1.8. From then on, it will always use 'multinomial'. Leave it to its default value to avoid this warning.
  warnings.warn(
[I 2026-01-17 15:10:45,626] Trial 13 finished with value: 0.9191810344827587 and parameters: {'C': 0.6125347341607849, 'max_iter': 139, 'solver': 'newton-cg'}. Best is trial 7 with value: 0.9226532567049809.
/home/sjoon/projects/brain_connectivity_classifier/masterthesis_venv2/lib/python3.11/site-packages/sklearn/linear_model/_logistic.py:1272: FutureWarning: 'multi_class' was deprecated in version 1.5 and will be removed in 1.8. From then on, it will always use 'multinomial'. Leave it to its default value to avoid this warning.
  warnings.warn(
[I 2026-01-17 15:11:07,566] Trial 14 finished with value: 0.9107998084291188 and parameters: {'C': 0.7165634137598894, 'max_iter': 101, 'solver': 'lbfgs'}. Best is trial 7 with value: 0.9226532567049809.
/home/sjoon/projects/brain_connectivity_classifier/masterthesis_venv2/lib/python3.11/site-packages/sklearn/linear_model/_logistic.py:1272: FutureWarning: 'multi_class' was deprecated in version 1.5 and will be removed in 1.8. From then on, it will always use 'multinomial'. Leave it to its default value to avoid this warning.
  warnings.warn(
[I 2026-01-17 15:11:24,180] Trial 15 finished with value: 0.9158285440613027 and parameters: {'C': 0.08908483139796149, 'max_iter': 174, 'solver': 'newton-cg'}. Best is trial 7 with value: 0.9226532567049809.
/home/sjoon/projects/brain_connectivity_classifier/masterthesis_venv2/lib/python3.11/site-packages/sklearn/linear_model/_logistic.py:1272: FutureWarning: 'multi_class' was deprecated in version 1.5 and will be removed in 1.8. From then on, it will always use 'multinomial'. Leave it to its default value to avoid this warning.
  warnings.warn(
[I 2026-01-17 15:11:38,541] Trial 16 finished with value: 0.9012212643678161 and parameters: {'C': 9.116356780872863, 'max_iter': 226, 'solver': 'newton-cg'}. Best is trial 7 with value: 0.9226532567049809.
/home/sjoon/projects/brain_connectivity_classifier/masterthesis_venv2/lib/python3.11/site-packages/sklearn/linear_model/_logistic.py:1272: FutureWarning: 'multi_class' was deprecated in version 1.5 and will be removed in 1.8. From then on, it will always use 'multinomial'. Leave it to its default value to avoid this warning.
  warnings.warn(
[I 2026-01-17 15:12:13,580] Trial 17 finished with value: 0.9146312260536399 and parameters: {'C': 0.023277883008860606, 'max_iter': 134, 'solver': 'lbfgs'}. Best is trial 7 with value: 0.9226532567049809.
/home/sjoon/projects/brain_connectivity_classifier/masterthesis_venv2/lib/python3.11/site-packages/sklearn/linear_model/_logistic.py:1272: FutureWarning: 'multi_class' was deprecated in version 1.5 and will be removed in 1.8. From then on, it will always use 'multinomial'. Leave it to its default value to avoid this warning.
  warnings.warn(
[I 2026-01-17 15:12:33,642] Trial 18 finished with value: 0.9040948275862069 and parameters: {'C': 0.3038644937902105, 'max_iter': 206, 'solver': 'lbfgs'}. Best is trial 7 with value: 0.9226532567049809.
/home/sjoon/projects/brain_connectivity_classifier/masterthesis_venv2/lib/python3.11/site-packages/sklearn/linear_model/_logistic.py:1272: FutureWarning: 'multi_class' was deprecated in version 1.5 and will be removed in 1.8. From then on, it will always use 'multinomial'. Leave it to its default value to avoid this warning.
  warnings.warn(
[I 2026-01-17 15:12:46,557] Trial 19 finished with value: 0.9105603448275862 and parameters: {'C': 1.6815170413104197, 'max_iter': 417, 'solver': 'newton-cg'}. Best is trial 7 with value: 0.9226532567049809.
/home/sjoon/projects/brain_connectivity_classifier/masterthesis_venv2/lib/python3.11/site-packages/sklearn/linear_model/_logistic.py:1272: FutureWarning: 'multi_class' was deprecated in version 1.5 and will be removed in 1.8. From then on, it will always use 'multinomial'. Leave it to its default value to avoid this warning.
  warnings.warn(
[I 2026-01-17 15:13:00,877] Trial 20 finished with value: 0.9201388888888888 and parameters: {'C': 0.111571805158547, 'max_iter': 160, 'solver': 'newton-cg'}. Best is trial 7 with value: 0.9226532567049809.
/home/sjoon/projects/brain_connectivity_classifier/masterthesis_venv2/lib/python3.11/site-packages/sklearn/linear_model/_logistic.py:1272: FutureWarning: 'multi_class' was deprecated in version 1.5 and will be removed in 1.8. From then on, it will always use 'multinomial'. Leave it to its default value to avoid this warning.
  warnings.warn(
[I 2026-01-17 15:13:12,191] Trial 21 finished with value: 0.9273227969348659 and parameters: {'C': 0.142393927907295, 'max_iter': 156, 'solver': 'newton-cg'}. Best is trial 21 with value: 0.9273227969348659.
/home/sjoon/projects/brain_connectivity_classifier/masterthesis_venv2/lib/python3.11/site-packages/sklearn/linear_model/_logistic.py:1272: FutureWarning: 'multi_class' was deprecated in version 1.5 and will be removed in 1.8. From then on, it will always use 'multinomial'. Leave it to its default value to avoid this warning.
  warnings.warn(
[I 2026-01-17 15:13:26,539] Trial 22 finished with value: 0.9198994252873564 and parameters: {'C': 0.11162380084284368, 'max_iter': 162, 'solver': 'newton-cg'}. Best is trial 21 with value: 0.9273227969348659.
/home/sjoon/projects/brain_connectivity_classifier/masterthesis_venv2/lib/python3.11/site-packages/sklearn/linear_model/_logistic.py:1272: FutureWarning: 'multi_class' was deprecated in version 1.5 and will be removed in 1.8. From then on, it will always use 'multinomial'. Leave it to its default value to avoid this warning.
  warnings.warn(
[I 2026-01-17 15:13:40,958] Trial 23 finished with value: 0.9181034482758621 and parameters: {'C': 0.06434700792888491, 'max_iter': 148, 'solver': 'newton-cg'}. Best is trial 21 with value: 0.9273227969348659.
/home/sjoon/projects/brain_connectivity_classifier/masterthesis_venv2/lib/python3.11/site-packages/sklearn/linear_model/_logistic.py:1272: FutureWarning: 'multi_class' was deprecated in version 1.5 and will be removed in 1.8. From then on, it will always use 'multinomial'. Leave it to its default value to avoid this warning.
  warnings.warn(
[I 2026-01-17 15:13:52,139] Trial 24 finished with value: 0.9225335249042146 and parameters: {'C': 0.025677245448408784, 'max_iter': 193, 'solver': 'newton-cg'}. Best is trial 21 with value: 0.9273227969348659.
/home/sjoon/projects/brain_connectivity_classifier/masterthesis_venv2/lib/python3.11/site-packages/sklearn/linear_model/_logistic.py:1272: FutureWarning: 'multi_class' was deprecated in version 1.5 and will be removed in 1.8. From then on, it will always use 'multinomial'. Leave it to its default value to avoid this warning.
  warnings.warn(
[I 2026-01-17 15:14:05,558] Trial 25 finished with value: 0.8852969348659003 and parameters: {'C': 0.005039866517707325, 'max_iter': 240, 'solver': 'newton-cg'}. Best is trial 21 with value: 0.9273227969348659.
/home/sjoon/projects/brain_connectivity_classifier/masterthesis_venv2/lib/python3.11/site-packages/sklearn/linear_model/_logistic.py:1272: FutureWarning: 'multi_class' was deprecated in version 1.5 and will be removed in 1.8. From then on, it will always use 'multinomial'. Leave it to its default value to avoid this warning.
  warnings.warn(
[I 2026-01-17 15:14:37,267] Trial 26 finished with value: 0.9099616858237548 and parameters: {'C': 0.02226576371243045, 'max_iter': 194, 'solver': 'lbfgs'}. Best is trial 21 with value: 0.9273227969348659.
/home/sjoon/projects/brain_connectivity_classifier/masterthesis_venv2/lib/python3.11/site-packages/sklearn/linear_model/_logistic.py:1272: FutureWarning: 'multi_class' was deprecated in version 1.5 and will be removed in 1.8. From then on, it will always use 'multinomial'. Leave it to its default value to avoid this warning.
  warnings.warn(
