[I 2026-01-17 15:38:50,368] Trial 3 finished with value: 0.9111590038314177 and parameters: {'C': 0.05074569025512076, 'max_iter': 332, 'solver': 'lbfgs'}. Best is trial 2 with value: 0.9123563218390804.
/home/sjoon/projects/brain_connectivity_classifier/masterthesis_venv2/lib/python3.11/site-packages/sklearn/linear_model/_logistic.py:1272: FutureWarning: 'multi_class' was deprecated in version 1.5 and will be removed in 1.8. From then on, it will always use 'multinomial'. Leave it to its default value to avoid this warning.
  warnings.warn(
[I 2026-01-17 15:39:06,460] Trial 4 finished with value: 0.8424329501915708 and parameters: {'C': 0.002607939962442735, 'max_iter': 364, 'solver': 'newton-cg'}. Best is trial 2 with value: 0.9123563218390804.
/home/sjoon/projects/brain_connectivity_classifier/masterthesis_venv2/lib/python3.11/site-packages/sklearn/linear_model/_logistic.py:1272: FutureWarning: 'multi_class' was deprecated in version 1.5 and will be removed in 1.8. From then on, it will always use 'multinomial'. Leave it to its default value to avoid this warning.
  warnings.warn(
[I 2026-01-17 15:39:17,388] Trial 5 finished with value: 0.7965756704980843 and parameters: {'C': 0.001393009808491993, 'max_iter': 162, 'solver': 'newton-cg'}. Best is trial 2 with value: 0.9123563218390804.
/home/sjoon/projects/brain_connectivity_classifier/masterthesis_venv2/lib/python3.11/site-packages/sklearn/linear_model/_logistic.py:1272: FutureWarning: 'multi_class' was deprecated in version 1.5 and will be removed in 1.8. From then on, it will always use 'multinomial'. Leave it to its default value to avoid this warning.
  warnings.warn(
[I 2026-01-17 15:39:57,763] Trial 6 finished with value: 0.8930795019157088 and parameters: {'C': 0.011211424217817453, 'max_iter': 493, 'solver': 'lbfgs'}. Best is trial 2 with value: 0.9123563218390804.
/home/sjoon/projects/brain_connectivity_classifier/masterthesis_venv2/lib/python3.11/site-packages/sklearn/linear_model/_logistic.py:1272: FutureWarning: 'multi_class' was deprecated in version 1.5 and will be removed in 1.8. From then on, it will always use 'multinomial'. Leave it to its default value to avoid this warning.
  warnings.warn(
[I 2026-01-17 15:40:15,817] Trial 7 finished with value: 0.8866139846743295 and parameters: {'C': 0.007663100925476637, 'max_iter': 221, 'solver': 'newton-cg'}. Best is trial 2 with value: 0.9123563218390804.
/home/sjoon/projects/brain_connectivity_classifier/masterthesis_venv2/lib/python3.11/site-packages/sklearn/linear_model/_logistic.py:1272: FutureWarning: 'multi_class' was deprecated in version 1.5 and will be removed in 1.8. From then on, it will always use 'multinomial'. Leave it to its default value to avoid this warning.
  warnings.warn(
[I 2026-01-17 15:40:30,266] Trial 8 finished with value: 0.8948754789272031 and parameters: {'C': 0.00870565720849901, 'max_iter': 472, 'solver': 'newton-cg'}. Best is trial 2 with value: 0.9123563218390804.
/home/sjoon/projects/brain_connectivity_classifier/masterthesis_venv2/lib/python3.11/site-packages/sklearn/linear_model/_logistic.py:1272: FutureWarning: 'multi_class' was deprecated in version 1.5 and will be removed in 1.8. From then on, it will always use 'multinomial'. Leave it to its default value to avoid this warning.
  warnings.warn(
[I 2026-01-17 15:40:41,791] Trial 9 finished with value: 0.827705938697318 and parameters: {'C': 0.002292667236983871, 'max_iter': 127, 'solver': 'newton-cg'}. Best is trial 2 with value: 0.9123563218390804.
/home/sjoon/projects/brain_connectivity_classifier/masterthesis_venv2/lib/python3.11/site-packages/sklearn/linear_model/_logistic.py:1272: FutureWarning: 'multi_class' was deprecated in version 1.5 and will be removed in 1.8. From then on, it will always use 'multinomial'. Leave it to its default value to avoid this warning.
  warnings.warn(
[I 2026-01-17 15:41:01,402] Trial 10 finished with value: 0.9164272030651341 and parameters: {'C': 9.096792508078572, 'max_iter': 182, 'solver': 'lbfgs'}. Best is trial 10 with value: 0.9164272030651341.
/home/sjoon/projects/brain_connectivity_classifier/masterthesis_venv2/lib/python3.11/site-packages/sklearn/linear_model/_logistic.py:1272: FutureWarning: 'multi_class' was deprecated in version 1.5 and will be removed in 1.8. From then on, it will always use 'multinomial'. Leave it to its default value to avoid this warning.
  warnings.warn(
[I 2026-01-17 15:41:20,883] Trial 11 finished with value: 0.9121168582375478 and parameters: {'C': 6.7423866579257306, 'max_iter': 190, 'solver': 'lbfgs'}. Best is trial 10 with value: 0.9164272030651341.
/home/sjoon/projects/brain_connectivity_classifier/masterthesis_venv2/lib/python3.11/site-packages/sklearn/linear_model/_logistic.py:1272: FutureWarning: 'multi_class' was deprecated in version 1.5 and will be removed in 1.8. From then on, it will always use 'multinomial'. Leave it to its default value to avoid this warning.
  warnings.warn(
[I 2026-01-17 15:41:46,629] Trial 12 finished with value: 0.9103208812260536 and parameters: {'C': 0.84742439686303, 'max_iter': 102, 'solver': 'lbfgs'}. Best is trial 10 with value: 0.9164272030651341.
/home/sjoon/projects/brain_connectivity_classifier/masterthesis_venv2/lib/python3.11/site-packages/sklearn/linear_model/_logistic.py:1272: FutureWarning: 'multi_class' was deprecated in version 1.5 and will be removed in 1.8. From then on, it will always use 'multinomial'. Leave it to its default value to avoid this warning.
  warnings.warn(
[I 2026-01-17 15:42:03,078] Trial 13 finished with value: 0.9141522988505747 and parameters: {'C': 5.839634138867186, 'max_iter': 163, 'solver': 'lbfgs'}. Best is trial 10 with value: 0.9164272030651341.
/home/sjoon/projects/brain_connectivity_classifier/masterthesis_venv2/lib/python3.11/site-packages/sklearn/linear_model/_logistic.py:1272: FutureWarning: 'multi_class' was deprecated in version 1.5 and will be removed in 1.8. From then on, it will always use 'multinomial'. Leave it to its default value to avoid this warning.
  warnings.warn(
[I 2026-01-17 15:42:21,176] Trial 14 finished with value: 0.9185823754789272 and parameters: {'C': 0.46666802117864276, 'max_iter': 149, 'solver': 'lbfgs'}. Best is trial 14 with value: 0.9185823754789272.
/home/sjoon/projects/brain_connectivity_classifier/masterthesis_venv2/lib/python3.11/site-packages/sklearn/linear_model/_logistic.py:1272: FutureWarning: 'multi_class' was deprecated in version 1.5 and will be removed in 1.8. From then on, it will always use 'multinomial'. Leave it to its default value to avoid this warning.
  warnings.warn(
[I 2026-01-17 15:42:45,658] Trial 15 finished with value: 0.9220545977011494 and parameters: {'C': 0.24852884843036138, 'max_iter': 133, 'solver': 'lbfgs'}. Best is trial 15 with value: 0.9220545977011494.
/home/sjoon/projects/brain_connectivity_classifier/masterthesis_venv2/lib/python3.11/site-packages/sklearn/linear_model/_logistic.py:1272: FutureWarning: 'multi_class' was deprecated in version 1.5 and will be removed in 1.8. From then on, it will always use 'multinomial'. Leave it to its default value to avoid this warning.
  warnings.warn(
[I 2026-01-17 15:43:06,468] Trial 16 finished with value: 0.9210967432950191 and parameters: {'C': 0.21186719614720842, 'max_iter': 127, 'solver': 'lbfgs'}. Best is trial 15 with value: 0.9220545977011494.
/home/sjoon/projects/brain_connectivity_classifier/masterthesis_venv2/lib/python3.11/site-packages/sklearn/linear_model/_logistic.py:1272: FutureWarning: 'multi_class' was deprecated in version 1.5 and will be removed in 1.8. From then on, it will always use 'multinomial'. Leave it to its default value to avoid this warning.
  warnings.warn(
[I 2026-01-17 15:43:28,739] Trial 17 finished with value: 0.9169061302681992 and parameters: {'C': 0.1696928263747219, 'max_iter': 104, 'solver': 'lbfgs'}. Best is trial 15 with value: 0.9220545977011494.
/home/sjoon/projects/brain_connectivity_classifier/masterthesis_venv2/lib/python3.11/site-packages/sklearn/linear_model/_logistic.py:1272: FutureWarning: 'multi_class' was deprecated in version 1.5 and will be removed in 1.8. From then on, it will always use 'multinomial'. Leave it to its default value to avoid this warning.
  warnings.warn(
[I 2026-01-17 15:43:53,235] Trial 18 finished with value: 0.9037356321839081 and parameters: {'C': 0.15704385526983713, 'max_iter': 123, 'solver': 'lbfgs'}. Best is trial 15 with value: 0.9220545977011494.
/home/sjoon/projects/brain_connectivity_classifier/masterthesis_venv2/lib/python3.11/site-packages/sklearn/linear_model/_logistic.py:1272: FutureWarning: 'multi_class' was deprecated in version 1.5 and will be removed in 1.8. From then on, it will always use 'multinomial'. Leave it to its default value to avoid this warning.
  warnings.warn(
[I 2026-01-17 15:44:26,656] Trial 19 finished with value: 0.9163074712643678 and parameters: {'C': 0.05117297024093805, 'max_iter': 133, 'solver': 'lbfgs'}. Best is trial 15 with value: 0.9220545977011494.
/home/sjoon/projects/brain_connectivity_classifier/masterthesis_venv2/lib/python3.11/site-packages/sklearn/linear_model/_logistic.py:1272: FutureWarning: 'multi_class' was deprecated in version 1.5 and will be removed in 1.8. From then on, it will always use 'multinomial'. Leave it to its default value to avoid this warning.
  warnings.warn(
[I 2026-01-17 15:44:52,459] Trial 20 finished with value: 0.9124760536398467 and parameters: {'C': 0.4093314557124548, 'max_iter': 258, 'solver': 'lbfgs'}. Best is trial 15 with value: 0.9220545977011494.
/home/sjoon/projects/brain_connectivity_classifier/masterthesis_venv2/lib/python3.11/site-packages/sklearn/linear_model/_logistic.py:1272: FutureWarning: 'multi_class' was deprecated in version 1.5 and will be removed in 1.8. From then on, it will always use 'multinomial'. Leave it to its default value to avoid this warning.
  warnings.warn(
[I 2026-01-17 15:45:15,147] Trial 21 finished with value: 0.9193007662835249 and parameters: {'C': 0.4136028718408808, 'max_iter': 147, 'solver': 'lbfgs'}. Best is trial 15 with value: 0.9220545977011494.
/home/sjoon/projects/brain_connectivity_classifier/masterthesis_venv2/lib/python3.11/site-packages/sklearn/linear_model/_logistic.py:1272: FutureWarning: 'multi_class' was deprecated in version 1.5 and will be removed in 1.8. From then on, it will always use 'multinomial'. Leave it to its default value to avoid this warning.
  warnings.warn(
[I 2026-01-17 15:45:38,505] Trial 22 finished with value: 0.9043342911877394 and parameters: {'C': 1.9994511816370886, 'max_iter': 114, 'solver': 'lbfgs'}. Best is trial 15 with value: 0.9220545977011494.
/home/sjoon/projects/brain_connectivity_classifier/masterthesis_venv2/lib/python3.11/site-packages/sklearn/linear_model/_logistic.py:1272: FutureWarning: 'multi_class' was deprecated in version 1.5 and will be removed in 1.8. From then on, it will always use 'multinomial'. Leave it to its default value to avoid this warning.
  warnings.warn(
[I 2026-01-17 15:45:56,888] Trial 23 finished with value: 0.9100814176245211 and parameters: {'C': 0.2840970520067991, 'max_iter': 139, 'solver': 'lbfgs'}. Best is trial 15 with value: 0.9220545977011494.
/home/sjoon/projects/brain_connectivity_classifier/masterthesis_venv2/lib/python3.11/site-packages/sklearn/linear_model/_logistic.py:1272: FutureWarning: 'multi_class' was deprecated in version 1.5 and will be removed in 1.8. From then on, it will always use 'multinomial'. Leave it to its default value to avoid this warning.
  warnings.warn(
[I 2026-01-17 15:46:18,387] Trial 24 finished with value: 0.9124760536398467 and parameters: {'C': 0.10721794478962386, 'max_iter': 154, 'solver': 'lbfgs'}. Best is trial 15 with value: 0.9220545977011494.
/home/sjoon/projects/brain_connectivity_classifier/masterthesis_venv2/lib/python3.11/site-packages/sklearn/linear_model/_logistic.py:1272: FutureWarning: 'multi_class' was deprecated in version 1.5 and will be removed in 1.8. From then on, it will always use 'multinomial'. Leave it to its default value to avoid this warning.
  warnings.warn(
[I 2026-01-17 15:46:48,409] Trial 25 finished with value: 0.9184626436781609 and parameters: {'C': 0.034991519019655574, 'max_iter': 115, 'solver': 'lbfgs'}. Best is trial 15 with value: 0.9220545977011494.
/home/sjoon/projects/brain_connectivity_classifier/masterthesis_venv2/lib/python3.11/site-packages/sklearn/linear_model/_logistic.py:1272: FutureWarning: 'multi_class' was deprecated in version 1.5 and will be removed in 1.8. From then on, it will always use 'multinomial'. Leave it to its default value to avoid this warning.
  warnings.warn(
[I 2026-01-17 15:47:06,990] Trial 26 finished with value: 0.921455938697318 and parameters: {'C': 0.6605727770298478, 'max_iter': 177, 'solver': 'lbfgs'}. Best is trial 15 with value: 0.9220545977011494.
/home/sjoon/projects/brain_connectivity_classifier/masterthesis_venv2/lib/python3.11/site-packages/sklearn/linear_model/_logistic.py:1272: FutureWarning: 'multi_class' was deprecated in version 1.5 and will be removed in 1.8. From then on, it will always use 'multinomial'. Leave it to its default value to avoid this warning.
  warnings.warn(
[I 2026-01-17 15:47:26,102] Trial 27 finished with value: 0.9088840996168582 and parameters: {'C': 2.228222053814181, 'max_iter': 183, 'solver': 'lbfgs'}. Best is trial 15 with value: 0.9220545977011494.
/home/sjoon/projects/brain_connectivity_classifier/masterthesis_venv2/lib/python3.11/site-packages/sklearn/linear_model/_logistic.py:1272: FutureWarning: 'multi_class' was deprecated in version 1.5 and will be removed in 1.8. From then on, it will always use 'multinomial'. Leave it to its default value to avoid this warning.
  warnings.warn(
[I 2026-01-17 15:47:49,060] Trial 28 finished with value: 0.9056513409961686 and parameters: {'C': 0.7803422639186571, 'max_iter': 255, 'solver': 'lbfgs'}. Best is trial 15 with value: 0.9220545977011494.
/home/sjoon/projects/brain_connectivity_classifier/masterthesis_venv2/lib/python3.11/site-packages/sklearn/linear_model/_logistic.py:1272: FutureWarning: 'multi_class' was deprecated in version 1.5 and will be removed in 1.8. From then on, it will always use 'multinomial'. Leave it to its default value to avoid this warning.
  warnings.warn(
[I 2026-01-17 15:48:09,244] Trial 29 finished with value: 0.915948275862069 and parameters: {'C': 1.1176063713853193, 'max_iter': 172, 'solver': 'lbfgs'}. Best is trial 15 with value: 0.9220545977011494.
/home/sjoon/projects/brain_connectivity_classifier/masterthesis_venv2/lib/python3.11/site-packages/sklearn/linear_model/_logistic.py:1272: FutureWarning: 'multi_class' was deprecated in version 1.5 and will be removed in 1.8. From then on, it will always use 'multinomial'. Leave it to its default value to avoid this warning.
  warnings.warn(
[I 2026-01-17 15:48:26,679] Trial 30 finished with value: 0.9182231800766284 and parameters: {'C': 0.2166055755984475, 'max_iter': 201, 'solver': 'lbfgs'}. Best is trial 15 with value: 0.9220545977011494.
/home/sjoon/projects/brain_connectivity_classifier/masterthesis_venv2/lib/python3.11/site-packages/sklearn/linear_model/_logistic.py:1272: FutureWarning: 'multi_class' was deprecated in version 1.5 and will be removed in 1.8. From then on, it will always use 'multinomial'. Leave it to its default value to avoid this warning.
  warnings.warn(
[I 2026-01-17 15:48:49,272] Trial 31 finished with value: 0.9198994252873564 and parameters: {'C': 0.47043943404021693, 'max_iter': 143, 'solver': 'lbfgs'}. Best is trial 15 with value: 0.9220545977011494.
/home/sjoon/projects/brain_connectivity_classifier/masterthesis_venv2/lib/python3.11/site-packages/sklearn/linear_model/_logistic.py:1272: FutureWarning: 'multi_class' was deprecated in version 1.5 and will be removed in 1.8. From then on, it will always use 'multinomial'. Leave it to its default value to avoid this warning.
  warnings.warn(
[I 2026-01-17 15:49:09,423] Trial 32 finished with value: 0.9099616858237548 and parameters: {'C': 0.08823211755674261, 'max_iter': 141, 'solver': 'lbfgs'}. Best is trial 15 with value: 0.9220545977011494.
/home/sjoon/projects/brain_connectivity_classifier/masterthesis_venv2/lib/python3.11/site-packages/sklearn/linear_model/_logistic.py:1272: FutureWarning: 'multi_class' was deprecated in version 1.5 and will be removed in 1.8. From then on, it will always use 'multinomial'. Leave it to its default value to avoid this warning.
  warnings.warn(
[I 2026-01-17 15:49:27,756] Trial 33 finished with value: 0.9103208812260536 and parameters: {'C': 2.3911068718310973, 'max_iter': 112, 'solver': 'lbfgs'}. Best is trial 15 with value: 0.9220545977011494.
/home/sjoon/projects/brain_connectivity_classifier/masterthesis_venv2/lib/python3.11/site-packages/sklearn/linear_model/_logistic.py:1272: FutureWarning: 'multi_class' was deprecated in version 1.5 and will be removed in 1.8. From then on, it will always use 'multinomial'. Leave it to its default value to avoid this warning.
  warnings.warn(
[I 2026-01-17 15:49:51,067] Trial 34 finished with value: 0.9107998084291188 and parameters: {'C': 0.6398721147277115, 'max_iter': 124, 'solver': 'lbfgs'}. Best is trial 15 with value: 0.9220545977011494.
/home/sjoon/projects/brain_connectivity_classifier/masterthesis_venv2/lib/python3.11/site-packages/sklearn/linear_model/_logistic.py:1272: FutureWarning: 'multi_class' was deprecated in version 1.5 and will be removed in 1.8. From then on, it will always use 'multinomial'. Leave it to its default value to avoid this warning.
  warnings.warn(
[I 2026-01-17 15:50:01,480] Trial 35 finished with value: 0.9233716475095786 and parameters: {'C': 0.09984645745915338, 'max_iter': 165, 'solver': 'newton-cg'}. Best is trial 35 with value: 0.9233716475095786.
/home/sjoon/projects/brain_connectivity_classifier/masterthesis_venv2/lib/python3.11/site-packages/sklearn/linear_model/_logistic.py:1272: FutureWarning: 'multi_class' was deprecated in version 1.5 and will be removed in 1.8. From then on, it will always use 'multinomial'. Leave it to its default value to avoid this warning.
  warnings.warn(
[I 2026-01-17 15:50:16,612] Trial 36 finished with value: 0.9097222222222222 and parameters: {'C': 0.03328336208134901, 'max_iter': 227, 'solver': 'newton-cg'}. Best is trial 35 with value: 0.9233716475095786.
/home/sjoon/projects/brain_connectivity_classifier/masterthesis_venv2/lib/python3.11/site-packages/sklearn/linear_model/_logistic.py:1272: FutureWarning: 'multi_class' was deprecated in version 1.5 and will be removed in 1.8. From then on, it will always use 'multinomial'. Leave it to its default value to avoid this warning.
  warnings.warn(
[I 2026-01-17 15:50:33,775] Trial 37 finished with value: 0.9191810344827587 and parameters: {'C': 0.07782250550115603, 'max_iter': 400, 'solver': 'newton-cg'}. Best is trial 35 with value: 0.9233716475095786.
/home/sjoon/projects/brain_connectivity_classifier/masterthesis_venv2/lib/python3.11/site-packages/sklearn/linear_model/_logistic.py:1272: FutureWarning: 'multi_class' was deprecated in version 1.5 and will be removed in 1.8. From then on, it will always use 'multinomial'. Leave it to its default value to avoid this warning.
  warnings.warn(
[I 2026-01-17 15:50:46,347] Trial 38 finished with value: 0.913433908045977 and parameters: {'C': 0.24293826155170864, 'max_iter': 312, 'solver': 'newton-cg'}. Best is trial 35 with value: 0.9233716475095786.
/home/sjoon/projects/brain_connectivity_classifier/masterthesis_venv2/lib/python3.11/site-packages/sklearn/linear_model/_logistic.py:1272: FutureWarning: 'multi_class' was deprecated in version 1.5 and will be removed in 1.8. From then on, it will always use 'multinomial'. Leave it to its default value to avoid this warning.
  warnings.warn(
[I 2026-01-17 15:51:00,386] Trial 39 finished with value: 0.9013409961685823 and parameters: {'C': 0.015476380139962432, 'max_iter': 158, 'solver': 'newton-cg'}. Best is trial 35 with value: 0.9233716475095786.
/home/sjoon/projects/brain_connectivity_classifier/masterthesis_venv2/lib/python3.11/site-packages/sklearn/linear_model/_logistic.py:1272: FutureWarning: 'multi_class' was deprecated in version 1.5 and will be removed in 1.8. From then on, it will always use 'multinomial'. Leave it to its default value to avoid this warning.
  warnings.warn(
[I 2026-01-17 15:51:20,327] Trial 40 finished with value: 0.9189415708812261 and parameters: {'C': 0.11999386653638018, 'max_iter': 168, 'solver': 'newton-cg'}. Best is trial 35 with value: 0.9233716475095786.
/home/sjoon/projects/brain_connectivity_classifier/masterthesis_venv2/lib/python3.11/site-packages/sklearn/linear_model/_logistic.py:1272: FutureWarning: 'multi_class' was deprecated in version 1.5 and will be removed in 1.8. From then on, it will always use 'multinomial'. Leave it to its default value to avoid this warning.
  warnings.warn(
[I 2026-01-17 15:51:32,110] Trial 41 finished with value: 0.9110392720306514 and parameters: {'C': 1.3684943836754901, 'max_iter': 129, 'solver': 'newton-cg'}. Best is trial 35 with value: 0.9233716475095786.
/home/sjoon/projects/brain_connectivity_classifier/masterthesis_venv2/lib/python3.11/site-packages/sklearn/linear_model/_logistic.py:1272: FutureWarning: 'multi_class' was deprecated in version 1.5 and will be removed in 1.8. From then on, it will always use 'multinomial'. Leave it to its default value to avoid this warning.
  warnings.warn(
