[I 2025-12-14 02:38:45,380] A new study created in memory with name: no-name-41e0b8ea-cd62-4f93-b1ec-be651fc8ef8e
[I 2025-12-14 02:51:17,947] Trial 0 finished with value: 0.8128728112372523 and parameters: {'C': 0.03148911647956861, 'max_iter': 200, 'solver': 'lbfgs'}. Best is trial 0 with value: 0.8128728112372523.
[I 2025-12-14 02:54:36,799] Trial 1 finished with value: 0.6465268424090822 and parameters: {'C': 0.0017073967431528124, 'max_iter': 200, 'solver': 'saga'}. Best is trial 0 with value: 0.8128728112372523.
[I 2025-12-14 02:59:03,705] Trial 2 finished with value: 0.8482778526072734 and parameters: {'C': 2.1368329072358767, 'max_iter': 200, 'solver': 'saga'}. Best is trial 2 with value: 0.8482778526072734.
[I 2025-12-14 03:04:42,278] Trial 3 finished with value: 0.830190494516067 and parameters: {'C': 0.05342937261279776, 'max_iter': 500, 'solver': 'saga'}. Best is trial 2 with value: 0.8482778526072734.
[I 2025-12-14 03:17:51,114] Trial 4 finished with value: 0.8297094477583221 and parameters: {'C': 0.06672367170464207, 'max_iter': 200, 'solver': 'lbfgs'}. Best is trial 2 with value: 0.8482778526072734.
[I 2025-12-14 03:31:41,088] Trial 5 finished with value: 0.8490475274196652 and parameters: {'C': 0.26926469100861794, 'max_iter': 1000, 'solver': 'lbfgs'}. Best is trial 5 with value: 0.8490475274196652.
[I 2025-12-14 03:36:44,937] Trial 6 finished with value: 0.79064845102944 and parameters: {'C': 0.01653693718282442, 'max_iter': 500, 'solver': 'saga'}. Best is trial 5 with value: 0.8490475274196652.
[I 2025-12-14 03:40:07,630] Trial 7 finished with value: 0.630556090051953 and parameters: {'C': 0.0013726318898045872, 'max_iter': 200, 'solver': 'saga'}. Best is trial 5 with value: 0.8490475274196652.
[I 2025-12-14 03:54:12,357] Trial 8 finished with value: 0.8428901289205311 and parameters: {'C': 0.1537592023548176, 'max_iter': 500, 'solver': 'lbfgs'}. Best is trial 5 with value: 0.8490475274196652.
[I 2025-12-14 03:58:29,024] Trial 9 finished with value: 0.8521262266692322 and parameters: {'C': 0.24637685958997463, 'max_iter': 200, 'solver': 'saga'}. Best is trial 9 with value: 0.8521262266692322.
[I 2025-12-14 04:07:09,197] Trial 10 finished with value: 0.852992110833173 and parameters: {'C': 6.5142520981548735, 'max_iter': 1000, 'solver': 'saga'}. Best is trial 10 with value: 0.852992110833173.
[I 2025-12-14 04:15:22,040] Trial 11 finished with value: 0.8532807388878199 and parameters: {'C': 5.359957765771774, 'max_iter': 1000, 'solver': 'saga'}. Best is trial 11 with value: 0.8532807388878199.
[I 2025-12-14 04:24:23,273] Trial 12 finished with value: 0.8521262266692322 and parameters: {'C': 8.596232686158428, 'max_iter': 1000, 'solver': 'saga'}. Best is trial 11 with value: 0.8532807388878199.
[I 2025-12-14 04:31:48,505] Trial 13 finished with value: 0.8585722532230132 and parameters: {'C': 1.5773500431900689, 'max_iter': 1000, 'solver': 'saga'}. Best is trial 13 with value: 0.8585722532230132.
[I 2025-12-14 04:39:13,592] Trial 14 finished with value: 0.8587646719261112 and parameters: {'C': 1.5399704173328987, 'max_iter': 1000, 'solver': 'saga'}. Best is trial 14 with value: 0.8587646719261112.
[I 2025-12-14 04:46:32,820] Trial 15 finished with value: 0.859149509332307 and parameters: {'C': 1.0437258483189134, 'max_iter': 1000, 'solver': 'saga'}. Best is trial 15 with value: 0.859149509332307.
[I 2025-12-14 04:53:26,605] Trial 16 finished with value: 0.8589570906292091 and parameters: {'C': 0.9955180780510451, 'max_iter': 1000, 'solver': 'saga'}. Best is trial 15 with value: 0.859149509332307.
[I 2025-12-14 05:00:34,823] Trial 17 finished with value: 0.8574177410044256 and parameters: {'C': 0.5729891581071085, 'max_iter': 1000, 'solver': 'saga'}. Best is trial 15 with value: 0.859149509332307.
[I 2025-12-14 05:14:57,174] Trial 18 finished with value: 0.8566480661920338 and parameters: {'C': 0.6377498741418529, 'max_iter': 1000, 'solver': 'lbfgs'}. Best is trial 15 with value: 0.859149509332307.
[I 2025-12-14 05:19:28,359] Trial 19 finished with value: 0.755050990956321 and parameters: {'C': 0.00810132484211601, 'max_iter': 1000, 'solver': 'saga'}. Best is trial 15 with value: 0.859149509332307.
[I 2025-12-14 05:26:30,339] Trial 20 finished with value: 0.8589570906292091 and parameters: {'C': 0.8102137777629879, 'max_iter': 1000, 'solver': 'saga'}. Best is trial 15 with value: 0.859149509332307.
[I 2025-12-14 05:33:19,057] Trial 21 finished with value: 0.8586684625745622 and parameters: {'C': 0.6744937916825595, 'max_iter': 1000, 'solver': 'saga'}. Best is trial 15 with value: 0.859149509332307.
[I 2025-12-14 05:40:33,564] Trial 22 finished with value: 0.8569366942466807 and parameters: {'C': 2.649797385146213, 'max_iter': 1000, 'solver': 'saga'}. Best is trial 15 with value: 0.859149509332307.
[I 2025-12-14 05:47:20,949] Trial 23 finished with value: 0.859149509332307 and parameters: {'C': 0.7723920971341861, 'max_iter': 1000, 'solver': 'saga'}. Best is trial 15 with value: 0.859149509332307.
[I 2025-12-14 05:54:47,797] Trial 24 finished with value: 0.8552049259187993 and parameters: {'C': 3.6815392196986205, 'max_iter': 1000, 'solver': 'saga'}. Best is trial 15 with value: 0.859149509332307.
[I 2025-12-14 06:00:07,976] Trial 25 finished with value: 0.8540504137002116 and parameters: {'C': 0.30008250806600745, 'max_iter': 500, 'solver': 'saga'}. Best is trial 15 with value: 0.859149509332307.
[I 2025-12-14 06:14:28,834] Trial 26 finished with value: 0.8603040215508947 and parameters: {'C': 1.2409933450857489, 'max_iter': 1000, 'solver': 'lbfgs'}. Best is trial 26 with value: 0.8603040215508947.
[I 2025-12-14 06:28:02,400] Trial 27 finished with value: 0.8411583605926496 and parameters: {'C': 0.12807572466131747, 'max_iter': 1000, 'solver': 'lbfgs'}. Best is trial 26 with value: 0.8603040215508947.
[I 2025-12-14 06:42:09,672] Trial 28 finished with value: 0.8542428324033096 and parameters: {'C': 0.432931388555368, 'max_iter': 1000, 'solver': 'lbfgs'}. Best is trial 26 with value: 0.8603040215508947.
[I 2025-12-14 06:56:02,584] Trial 29 finished with value: 0.8620357898787763 and parameters: {'C': 1.5709224758814602, 'max_iter': 500, 'solver': 'lbfgs'}. Best is trial 29 with value: 0.8620357898787763.
[I 2025-12-14 07:08:32,579] Trial 30 finished with value: 0.8667500481046758 and parameters: {'C': 3.8337620108596893, 'max_iter': 500, 'solver': 'lbfgs'}. Best is trial 30 with value: 0.8667500481046758.
[I 2025-12-14 07:20:55,181] Trial 31 finished with value: 0.866269001346931 and parameters: {'C': 3.7768914310565522, 'max_iter': 500, 'solver': 'lbfgs'}. Best is trial 30 with value: 0.8667500481046758.
[I 2025-12-14 07:33:13,181] Trial 32 finished with value: 0.8665576294015779 and parameters: {'C': 3.947496833916507, 'max_iter': 500, 'solver': 'lbfgs'}. Best is trial 30 with value: 0.8667500481046758.
[I 2025-12-14 07:45:51,944] Trial 33 finished with value: 0.866172791995382 and parameters: {'C': 3.6528547892417316, 'max_iter': 500, 'solver': 'lbfgs'}. Best is trial 30 with value: 0.8667500481046758.
[I 2025-12-14 07:58:35,266] Trial 34 finished with value: 0.8654031171829902 and parameters: {'C': 3.59999811253773, 'max_iter': 500, 'solver': 'lbfgs'}. Best is trial 30 with value: 0.8667500481046758.
[I 2025-12-14 08:11:00,625] Trial 35 finished with value: 0.866172791995382 and parameters: {'C': 4.07970344156614, 'max_iter': 500, 'solver': 'lbfgs'}. Best is trial 30 with value: 0.8667500481046758.
[I 2025-12-14 08:21:54,615] Trial 36 finished with value: 0.8708870502212815 and parameters: {'C': 9.356730739490125, 'max_iter': 500, 'solver': 'lbfgs'}. Best is trial 36 with value: 0.8708870502212815.
[I 2025-12-14 08:32:43,275] Trial 37 finished with value: 0.8714643063305754 and parameters: {'C': 9.68209145976759, 'max_iter': 500, 'solver': 'lbfgs'}. Best is trial 37 with value: 0.8714643063305754.
[I 2025-12-14 08:43:41,371] Trial 38 finished with value: 0.8719453530883202 and parameters: {'C': 9.600341441672175, 'max_iter': 500, 'solver': 'lbfgs'}. Best is trial 38 with value: 0.8719453530883202.
[I 2025-12-14 08:54:34,843] Trial 39 finished with value: 0.8706946315181836 and parameters: {'C': 9.298709545475761, 'max_iter': 500, 'solver': 'lbfgs'}. Best is trial 38 with value: 0.8719453530883202.
[I 2025-12-14 09:06:05,425] Trial 40 finished with value: 0.869251491244949 and parameters: {'C': 6.592318760277425, 'max_iter': 500, 'solver': 'lbfgs'}. Best is trial 38 with value: 0.8719453530883202.
[I 2025-12-14 09:17:12,241] Trial 41 finished with value: 0.8705984221666346 and parameters: {'C': 7.252317567703164, 'max_iter': 500, 'solver': 'lbfgs'}. Best is trial 38 with value: 0.8719453530883202.
[I 2025-12-14 09:27:56,940] Trial 42 finished with value: 0.8705984221666346 and parameters: {'C': 9.215388456012844, 'max_iter': 500, 'solver': 'lbfgs'}. Best is trial 38 with value: 0.8719453530883202.
[I 2025-12-14 09:38:41,613] Trial 43 finished with value: 0.8704060034635367 and parameters: {'C': 9.231467609346668, 'max_iter': 500, 'solver': 'lbfgs'}. Best is trial 38 with value: 0.8719453530883202.
[I 2025-12-14 09:52:07,846] Trial 44 finished with value: 0.8632865114489129 and parameters: {'C': 2.2041052379885615, 'max_iter': 500, 'solver': 'lbfgs'}. Best is trial 38 with value: 0.8719453530883202.
[I 2025-12-14 10:03:40,866] Trial 45 finished with value: 0.869540119299596 and parameters: {'C': 6.3653049614048, 'max_iter': 200, 'solver': 'lbfgs'}. Best is trial 38 with value: 0.8719453530883202.
[I 2025-12-14 10:14:41,327] Trial 46 finished with value: 0.7136809697902636 and parameters: {'C': 0.004334873830542053, 'max_iter': 500, 'solver': 'lbfgs'}. Best is trial 38 with value: 0.8719453530883202.
[I 2025-12-14 10:25:23,865] Trial 47 finished with value: 0.8714643063305754 and parameters: {'C': 9.628024003981503, 'max_iter': 500, 'solver': 'lbfgs'}. Best is trial 38 with value: 0.8719453530883202.
[I 2025-12-14 10:38:43,905] Trial 48 finished with value: 0.8322108908985953 and parameters: {'C': 0.07272738925806131, 'max_iter': 500, 'solver': 'lbfgs'}. Best is trial 38 with value: 0.8719453530883202.
[I 2025-12-14 10:51:17,643] Trial 49 finished with value: 0.8173946507600539 and parameters: {'C': 0.03677233630184411, 'max_iter': 200, 'solver': 'lbfgs'}. Best is trial 38 with value: 0.8719453530883202.
