[I 2026-01-24 21:51:35,957] Trial 24 finished with value: 0.7581417624521073 and parameters: {'C': 0.01757391708220502, 'solver': 'saga', 'max_iter': 563, 'tol': 0.06475158473776357}. Best is trial 20 with value: 0.7613745210727969.
[I 2026-01-24 21:54:42,609] Trial 25 finished with value: 0.758860153256705 and parameters: {'C': 0.011773454081557475, 'solver': 'saga', 'max_iter': 862, 'tol': 0.016784023110804104}. Best is trial 20 with value: 0.7613745210727969.
[I 2026-01-24 21:56:38,866] Trial 26 finished with value: 0.7655651340996169 and parameters: {'C': 0.015787691101924656, 'solver': 'saga', 'max_iter': 621, 'tol': 0.047111073004278234}. Best is trial 26 with value: 0.7655651340996169.
[I 2026-01-24 21:58:30,281] Trial 27 finished with value: 0.7528735632183908 and parameters: {'C': 0.018878508311609858, 'solver': 'saga', 'max_iter': 946, 'tol': 0.05419850922789434}. Best is trial 26 with value: 0.7655651340996169.
[I 2026-01-24 22:00:49,185] Trial 28 finished with value: 0.7570641762452107 and parameters: {'C': 0.04372778020703778, 'solver': 'saga', 'max_iter': 534, 'tol': 0.04305527285848266}. Best is trial 26 with value: 0.7655651340996169.
[I 2026-01-24 22:03:00,895] Trial 29 finished with value: 0.766044061302682 and parameters: {'C': 0.013878345621243083, 'solver': 'saga', 'max_iter': 242, 'tol': 0.03514701145259573}. Best is trial 29 with value: 0.766044061302682.
[I 2026-01-24 22:06:20,856] Trial 30 finished with value: 0.7665229885057471 and parameters: {'C': 0.023464850926655283, 'solver': 'saga', 'max_iter': 245, 'tol': 0.020052299351157873}. Best is trial 30 with value: 0.7665229885057471.
[I 2026-01-24 22:09:30,093] Trial 31 finished with value: 0.7575431034482759 and parameters: {'C': 0.02524220130277903, 'solver': 'saga', 'max_iter': 250, 'tol': 0.022053038040498574}. Best is trial 30 with value: 0.7665229885057471.
[I 2026-01-24 22:11:48,473] Trial 32 finished with value: 0.7659243295019157 and parameters: {'C': 0.012901205431057605, 'solver': 'saga', 'max_iter': 225, 'tol': 0.0316996495791388}. Best is trial 30 with value: 0.7665229885057471.
[I 2026-01-24 22:13:56,579] Trial 33 finished with value: 0.7701149425287356 and parameters: {'C': 0.013473042977285897, 'solver': 'saga', 'max_iter': 424, 'tol': 0.03725226561755071}. Best is trial 33 with value: 0.7701149425287356.
[I 2026-01-24 22:19:09,238] Trial 34 finished with value: 0.7613745210727969 and parameters: {'C': 0.021598601583812233, 'solver': 'saga', 'max_iter': 248, 'tol': 0.00854696978492419}. Best is trial 33 with value: 0.7701149425287356.
[I 2026-01-24 22:20:37,034] Trial 35 finished with value: 0.7620929118773946 and parameters: {'C': 0.034995448264671, 'solver': 'saga', 'max_iter': 424, 'tol': 0.09255019521384696}. Best is trial 33 with value: 0.7701149425287356.
[I 2026-01-24 22:23:55,246] Trial 36 finished with value: 0.7430555555555556 and parameters: {'C': 0.012932087684106716, 'solver': 'saga', 'max_iter': 234, 'tol': 0.016147936395283245}. Best is trial 33 with value: 0.7701149425287356.
[I 2026-01-24 22:25:48,636] Trial 37 finished with value: 0.7562260536398467 and parameters: {'C': 0.0071326289824640635, 'solver': 'saga', 'max_iter': 477, 'tol': 0.03697553068700486}. Best is trial 33 with value: 0.7701149425287356.
[I 2026-01-24 22:29:01,807] Trial 38 finished with value: 0.764367816091954 and parameters: {'C': 0.027727216396539633, 'solver': 'saga', 'max_iter': 360, 'tol': 0.021282120115451938}. Best is trial 33 with value: 0.7701149425287356.
[I 2026-01-24 22:33:31,134] Trial 39 finished with value: 0.7473659003831418 and parameters: {'C': 0.037441138748113854, 'solver': 'sag', 'max_iter': 209, 'tol': 0.005640009182194726}. Best is trial 33 with value: 0.7701149425287356.
