[I 2026-01-23 17:13:32,045] A new study created in memory with name: no-name-1b5df474-a578-4504-b600-a20811e040d8
[I 2026-01-23 17:25:24,613] Trial 0 finished with value: 0.7460488505747126 and parameters: {'C': 0.004328450221293881, 'solver': 'sag', 'max_iter': 1238, 'tol': 0.00029380279387035364}. Best is trial 0 with value: 0.7460488505747126.
[I 2026-01-23 17:28:09,125] Trial 1 finished with value: 0.7232998084291188 and parameters: {'C': 0.0018408992080552514, 'solver': 'saga', 'max_iter': 1242, 'tol': 0.013311216080736894}. Best is trial 0 with value: 0.7460488505747126.
[I 2026-01-23 17:35:46,624] Trial 2 finished with value: 0.6612787356321839 and parameters: {'C': 0.0010838581269344747, 'solver': 'sag', 'max_iter': 503, 'tol': 0.0003511356313970409}. Best is trial 0 with value: 0.7460488505747126.
[I 2026-01-23 17:47:39,245] Trial 3 finished with value: 0.719588122605364 and parameters: {'C': 0.002049268011541736, 'solver': 'saga', 'max_iter': 921, 'tol': 0.0007476312062252305}. Best is trial 0 with value: 0.7460488505747126.
[I 2026-01-23 17:56:27,030] Trial 4 finished with value: 0.7646072796934866 and parameters: {'C': 0.010952662748632562, 'solver': 'saga', 'max_iter': 796, 'tol': 0.0023345864076016252}. Best is trial 4 with value: 0.7646072796934866.
[I 2026-01-23 18:38:48,587] Trial 5 finished with value: 0.7602969348659003 and parameters: {'C': 0.02157696745589683, 'solver': 'saga', 'max_iter': 1226, 'tol': 0.000137832374550072}. Best is trial 4 with value: 0.7646072796934866.
[I 2026-01-23 18:40:06,113] Trial 6 finished with value: 0.7271312260536399 and parameters: {'C': 0.010769622478263132, 'solver': 'sag', 'max_iter': 1903, 'tol': 0.07886714129990492}. Best is trial 4 with value: 0.7646072796934866.
[I 2026-01-23 18:47:10,524] Trial 7 finished with value: 0.7567049808429118 and parameters: {'C': 0.02362886418423641, 'solver': 'sag', 'max_iter': 1400, 'tol': 0.0020914981329035616}. Best is trial 4 with value: 0.7646072796934866.
[I 2026-01-23 18:55:30,009] Trial 8 finished with value: 0.6799568965517241 and parameters: {'C': 0.001611904472760919, 'solver': 'sag', 'max_iter': 1828, 'tol': 0.0005975027999960298}. Best is trial 4 with value: 0.7646072796934866.
[I 2026-01-23 19:20:38,670] Trial 9 finished with value: 0.7550287356321839 and parameters: {'C': 0.01335381908879058, 'solver': 'saga', 'max_iter': 1139, 'tol': 0.00035856126103454}. Best is trial 4 with value: 0.7646072796934866.
[I 2026-01-23 19:26:55,780] Trial 10 finished with value: 0.7510775862068966 and parameters: {'C': 0.04204215880135205, 'solver': 'saga', 'max_iter': 114, 'tol': 0.008306050731972225}. Best is trial 4 with value: 0.7646072796934866.
[I 2026-01-23 19:56:43,121] Trial 11 finished with value: 0.7420977011494253 and parameters: {'C': 0.005398496234634164, 'solver': 'saga', 'max_iter': 776, 'tol': 0.00011969841803398473}. Best is trial 4 with value: 0.7646072796934866.
[I 2026-01-23 20:05:47,228] Trial 12 finished with value: 0.7647270114942529 and parameters: {'C': 0.02144683550679634, 'solver': 'saga', 'max_iter': 633, 'tol': 0.0029129558941600165}. Best is trial 12 with value: 0.7647270114942529.
[I 2026-01-23 20:12:54,436] Trial 13 finished with value: 0.7654454022988506 and parameters: {'C': 0.009904377958627296, 'solver': 'saga', 'max_iter': 597, 'tol': 0.0032521661270186793}. Best is trial 13 with value: 0.7654454022988506.
[I 2026-01-23 20:19:19,278] Trial 14 finished with value: 0.7533524904214559 and parameters: {'C': 0.04416360294101455, 'solver': 'saga', 'max_iter': 420, 'tol': 0.008381043221879717}. Best is trial 13 with value: 0.7654454022988506.
[I 2026-01-23 20:22:15,627] Trial 15 finished with value: 0.7686781609195402 and parameters: {'C': 0.02112998742701668, 'solver': 'saga', 'max_iter': 532, 'tol': 0.023357760386764348}. Best is trial 15 with value: 0.7686781609195402.
[I 2026-01-23 20:23:38,512] Trial 16 finished with value: 0.7450909961685823 and parameters: {'C': 0.003723836554293249, 'solver': 'saga', 'max_iter': 221, 'tol': 0.056001236995109484}. Best is trial 15 with value: 0.7686781609195402.
[I 2026-01-23 20:25:47,172] Trial 17 finished with value: 0.7459291187739464 and parameters: {'C': 0.007586633701800845, 'solver': 'saga', 'max_iter': 341, 'tol': 0.02862846611871128}. Best is trial 15 with value: 0.7686781609195402.
[I 2026-01-23 20:28:37,025] Trial 18 finished with value: 0.7637691570881227 and parameters: {'C': 0.015146439742268713, 'solver': 'saga', 'max_iter': 630, 'tol': 0.02269893463197247}. Best is trial 15 with value: 0.7686781609195402.
[I 2026-01-23 20:36:16,281] Trial 19 finished with value: 0.7614942528735632 and parameters: {'C': 0.030803514310623666, 'solver': 'saga', 'max_iter': 1583, 'tol': 0.0049508546337756094}. Best is trial 15 with value: 0.7686781609195402.
[I 2026-01-23 20:47:38,025] Trial 20 finished with value: 0.7525143678160919 and parameters: {'C': 0.007176568441252059, 'solver': 'saga', 'max_iter': 974, 'tol': 0.001367385566685505}. Best is trial 15 with value: 0.7686781609195402.
[I 2026-01-23 20:54:37,519] Trial 21 finished with value: 0.7640086206896551 and parameters: {'C': 0.01932828964719441, 'solver': 'saga', 'max_iter': 611, 'tol': 0.004378672601283649}. Best is trial 15 with value: 0.7686781609195402.
[I 2026-01-23 21:10:14,380] Trial 22 finished with value: 0.7641283524904214 and parameters: {'C': 0.02508261844392519, 'solver': 'saga', 'max_iter': 690, 'tol': 0.001167458325774061}. Best is trial 15 with value: 0.7686781609195402.
[I 2026-01-23 21:12:37,544] Trial 23 finished with value: 0.7545498084291188 and parameters: {'C': 0.015871950962040395, 'solver': 'saga', 'max_iter': 491, 'tol': 0.030434192157839733}. Best is trial 15 with value: 0.7686781609195402.
[I 2026-01-23 21:21:58,833] Trial 24 finished with value: 0.7562260536398467 and parameters: {'C': 0.03330202308122628, 'solver': 'saga', 'max_iter': 292, 'tol': 0.003532530465853953}. Best is trial 15 with value: 0.7686781609195402.
[I 2026-01-23 21:26:11,437] Trial 25 finished with value: 0.7547892720306514 and parameters: {'C': 0.009732541913408346, 'solver': 'saga', 'max_iter': 813, 'tol': 0.008592234375950315}. Best is trial 15 with value: 0.7686781609195402.
[I 2026-01-23 21:29:08,900] Trial 26 finished with value: 0.7367097701149425 and parameters: {'C': 0.030141916255959515, 'solver': 'sag', 'max_iter': 542, 'tol': 0.01606384862434723}. Best is trial 15 with value: 0.7686781609195402.
[I 2026-01-23 21:35:08,788] Trial 27 finished with value: 0.7644875478927203 and parameters: {'C': 0.017570072902835368, 'solver': 'saga', 'max_iter': 951, 'tol': 0.005869651947652399}. Best is trial 15 with value: 0.7686781609195402.
[I 2026-01-23 21:36:54,750] Trial 28 finished with value: 0.7619731800766284 and parameters: {'C': 0.008847032080033889, 'solver': 'saga', 'max_iter': 332, 'tol': 0.05104714365601557}. Best is trial 15 with value: 0.7686781609195402.
[I 2026-01-23 21:44:30,171] Trial 29 finished with value: 0.7358716475095786 and parameters: {'C': 0.004685719413761401, 'solver': 'sag', 'max_iter': 121, 'tol': 0.001959809524985466}. Best is trial 15 with value: 0.7686781609195402.
[I 2026-01-23 22:00:07,631] Trial 30 finished with value: 0.7482040229885057 and parameters: {'C': 0.012677070348917047, 'solver': 'saga', 'max_iter': 708, 'tol': 0.0009148848328054144}. Best is trial 15 with value: 0.7686781609195402.
[I 2026-01-23 22:07:27,025] Trial 31 finished with value: 0.7521551724137931 and parameters: {'C': 0.011877642232740362, 'solver': 'saga', 'max_iter': 823, 'tol': 0.0032850285126294794}. Best is trial 15 with value: 0.7686781609195402.
[I 2026-01-23 22:16:39,668] Trial 32 finished with value: 0.7431752873563219 and parameters: {'C': 0.00589869094467403, 'solver': 'saga', 'max_iter': 1049, 'tol': 0.0018093091282793}. Best is trial 15 with value: 0.7686781609195402.
[I 2026-01-23 22:23:30,812] Trial 33 finished with value: 0.7420977011494253 and parameters: {'C': 0.0035828266366208913, 'solver': 'saga', 'max_iter': 557, 'tol': 0.002373427164204023}. Best is trial 15 with value: 0.7686781609195402.
[I 2026-01-23 22:26:52,950] Trial 34 finished with value: 0.7671216475095786 and parameters: {'C': 0.008952725153560945, 'solver': 'saga', 'max_iter': 437, 'tol': 0.01312605221731625}. Best is trial 15 with value: 0.7686781609195402.
[I 2026-01-23 22:29:20,339] Trial 35 finished with value: 0.7484434865900383 and parameters: {'C': 0.002859462571229446, 'solver': 'saga', 'max_iter': 458, 'tol': 0.01467779587925436}. Best is trial 15 with value: 0.7686781609195402.
[I 2026-01-23 22:32:49,553] Trial 36 finished with value: 0.7485632183908046 and parameters: {'C': 0.008648579425349152, 'solver': 'saga', 'max_iter': 405, 'tol': 0.011188219163737398}. Best is trial 15 with value: 0.7686781609195402.
[I 2026-01-23 22:35:00,437] Trial 37 finished with value: 0.7165948275862069 and parameters: {'C': 0.006347598695881996, 'solver': 'sag', 'max_iter': 239, 'tol': 0.01962492072473377}. Best is trial 15 with value: 0.7686781609195402.
[I 2026-01-23 22:36:26,678] Trial 38 finished with value: 0.7587404214559387 and parameters: {'C': 0.019539106259613928, 'solver': 'saga', 'max_iter': 666, 'tol': 0.09826740452177561}. Best is trial 15 with value: 0.7686781609195402.
[I 2026-01-23 22:38:20,640] Trial 39 finished with value: 0.7450909961685823 and parameters: {'C': 0.024864597293190537, 'solver': 'sag', 'max_iter': 883, 'tol': 0.04352253864913436}. Best is trial 15 with value: 0.7686781609195402.
[I 2026-01-23 22:41:54,739] A new study created in memory with name: no-name-e9b2886c-f6dd-4a9b-9422-08d008c34e6a
[I 2026-01-23 23:00:05,953] Trial 0 finished with value: 0.7328783524904214 and parameters: {'C': 0.010427238115234532, 'solver': 'saga', 'max_iter': 254, 'tol': 0.0006299533892479956}. Best is trial 0 with value: 0.7328783524904214.
[I 2026-01-23 23:15:16,754] Trial 1 finished with value: 0.7476053639846744 and parameters: {'C': 0.017696423347480762, 'solver': 'sag', 'max_iter': 1265, 'tol': 0.00024022348029712772}. Best is trial 1 with value: 0.7476053639846744.
[I 2026-01-23 23:33:22,869] Trial 2 finished with value: 0.7599377394636015 and parameters: {'C': 0.011084473764197656, 'solver': 'sag', 'max_iter': 164, 'tol': 0.00012883516724356779}. Best is trial 2 with value: 0.7599377394636015.
[I 2026-01-23 23:40:44,075] Trial 3 finished with value: 0.7423371647509579 and parameters: {'C': 0.003526097523788043, 'solver': 'saga', 'max_iter': 1818, 'tol': 0.002132926831077092}. Best is trial 2 with value: 0.7599377394636015.
[I 2026-01-23 23:44:15,730] Trial 4 finished with value: 0.7529932950191571 and parameters: {'C': 0.012910720260046808, 'solver': 'saga', 'max_iter': 391, 'tol': 0.013369345708188866}. Best is trial 2 with value: 0.7599377394636015.
[I 2026-01-23 23:45:47,859] Trial 5 finished with value: 0.7349137931034483 and parameters: {'C': 0.020304103953217918, 'solver': 'sag', 'max_iter': 424, 'tol': 0.059519380523387365}. Best is trial 2 with value: 0.7599377394636015.
[I 2026-01-24 00:10:43,312] Trial 6 finished with value: 0.7371886973180076 and parameters: {'C': 0.0070646245039684905, 'solver': 'saga', 'max_iter': 1342, 'tol': 0.00026228902190528555}. Best is trial 2 with value: 0.7599377394636015.
[I 2026-01-24 00:16:51,939] Trial 7 finished with value: 0.6623563218390804 and parameters: {'C': 0.0013013494708858312, 'solver': 'sag', 'max_iter': 632, 'tol': 0.002339212471021593}. Best is trial 2 with value: 0.7599377394636015.
[I 2026-01-24 00:26:52,719] Trial 8 finished with value: 0.7561063218390804 and parameters: {'C': 0.04803737170725476, 'solver': 'saga', 'max_iter': 518, 'tol': 0.003294473561312127}. Best is trial 2 with value: 0.7599377394636015.
[I 2026-01-24 00:29:55,942] Trial 9 finished with value: 0.7264128352490421 and parameters: {'C': 0.0021440367142938595, 'solver': 'saga', 'max_iter': 1362, 'tol': 0.008809962034463806}. Best is trial 2 with value: 0.7599377394636015.
[I 2026-01-24 00:44:13,049] Trial 10 finished with value: 0.735632183908046 and parameters: {'C': 0.004959633082105794, 'solver': 'sag', 'max_iter': 860, 'tol': 0.00010447601010676575}. Best is trial 2 with value: 0.7599377394636015.
[I 2026-01-24 00:52:29,294] Trial 11 finished with value: 0.7312021072796935 and parameters: {'C': 0.0489225125074638, 'solver': 'sag', 'max_iter': 109, 'tol': 0.0012711348345542453}. Best is trial 2 with value: 0.7599377394636015.
[I 2026-01-24 00:59:17,699] Trial 12 finished with value: 0.7628113026819924 and parameters: {'C': 0.04612651108762214, 'solver': 'saga', 'max_iter': 717, 'tol': 0.007439657945534602}. Best is trial 12 with value: 0.7628113026819924.
[I 2026-01-24 01:01:37,121] Trial 13 finished with value: 0.7232998084291188 and parameters: {'C': 0.028651671111150478, 'solver': 'sag', 'max_iter': 909, 'tol': 0.027136848405028762}. Best is trial 12 with value: 0.7628113026819924.
[I 2026-01-24 01:07:31,565] Trial 14 finished with value: 0.7601772030651341 and parameters: {'C': 0.02854458789429932, 'solver': 'saga', 'max_iter': 707, 'tol': 0.007148365955777134}. Best is trial 12 with value: 0.7628113026819924.
[I 2026-01-24 01:14:01,847] Trial 15 finished with value: 0.7534722222222222 and parameters: {'C': 0.029595780258085007, 'solver': 'saga', 'max_iter': 728, 'tol': 0.0063397198259659525}. Best is trial 12 with value: 0.7628113026819924.
[I 2026-01-24 01:16:59,217] Trial 16 finished with value: 0.7625718390804598 and parameters: {'C': 0.030289658598558308, 'solver': 'saga', 'max_iter': 1093, 'tol': 0.024308671043611008}. Best is trial 12 with value: 0.7628113026819924.
[I 2026-01-24 01:18:34,074] Trial 17 finished with value: 0.7634099616858238 and parameters: {'C': 0.04900374155287022, 'solver': 'saga', 'max_iter': 1119, 'tol': 0.08116233177318297}. Best is trial 17 with value: 0.7634099616858238.
[I 2026-01-24 01:19:58,101] Trial 18 finished with value: 0.7545498084291188 and parameters: {'C': 0.019331343209092557, 'solver': 'saga', 'max_iter': 1669, 'tol': 0.09742438228016675}. Best is trial 17 with value: 0.7634099616858238.
[I 2026-01-24 01:22:23,782] Trial 19 finished with value: 0.7641283524904214 and parameters: {'C': 0.04753192803057754, 'solver': 'saga', 'max_iter': 1132, 'tol': 0.03910777184574361}. Best is trial 19 with value: 0.7641283524904214.
[I 2026-01-24 01:24:11,474] Trial 20 finished with value: 0.7458093869731801 and parameters: {'C': 0.006796657401637827, 'solver': 'saga', 'max_iter': 1151, 'tol': 0.037877230810205074}. Best is trial 19 with value: 0.7641283524904214.
[I 2026-01-24 01:25:40,636] Trial 21 finished with value: 0.7575431034482759 and parameters: {'C': 0.04245725051256515, 'solver': 'saga', 'max_iter': 967, 'tol': 0.09007627429433132}. Best is trial 19 with value: 0.7641283524904214.
[I 2026-01-24 01:29:36,784] Trial 22 finished with value: 0.7543103448275862 and parameters: {'C': 0.036640990566794214, 'solver': 'saga', 'max_iter': 1167, 'tol': 0.01680136900354486}. Best is trial 19 with value: 0.7641283524904214.
[I 2026-01-24 01:31:33,994] Trial 23 finished with value: 0.7617337164750958 and parameters: {'C': 0.02045159037783925, 'solver': 'saga', 'max_iter': 1512, 'tol': 0.046779876668836}. Best is trial 19 with value: 0.7641283524904214.
[I 2026-01-24 01:35:34,104] Trial 24 finished with value: 0.7576628352490421 and parameters: {'C': 0.034079637651363154, 'solver': 'saga', 'max_iter': 1490, 'tol': 0.016160401491312138}. Best is trial 19 with value: 0.7641283524904214.
[I 2026-01-24 01:37:43,962] Trial 25 finished with value: 0.7685584291187739 and parameters: {'C': 0.0492958401361325, 'solver': 'saga', 'max_iter': 832, 'tol': 0.04758541135351074}. Best is trial 25 with value: 0.7685584291187739.
[I 2026-01-24 01:39:26,756] Trial 26 finished with value: 0.7570641762452107 and parameters: {'C': 0.022982574754545345, 'solver': 'saga', 'max_iter': 932, 'tol': 0.06222457789698369}. Best is trial 25 with value: 0.7685584291187739.
[I 2026-01-24 01:41:43,770] Trial 27 finished with value: 0.7673611111111112 and parameters: {'C': 0.014370471315088661, 'solver': 'saga', 'max_iter': 1044, 'tol': 0.0324351886619984}. Best is trial 25 with value: 0.7685584291187739.
[I 2026-01-24 01:44:01,108] Trial 28 finished with value: 0.7624521072796935 and parameters: {'C': 0.013926592903754031, 'solver': 'saga', 'max_iter': 1961, 'tol': 0.030751365361965672}. Best is trial 25 with value: 0.7685584291187739.
[I 2026-01-24 01:46:10,743] Trial 29 finished with value: 0.7452107279693486 and parameters: {'C': 0.00361439712553096, 'solver': 'saga', 'max_iter': 823, 'tol': 0.019584451428942835}. Best is trial 25 with value: 0.7685584291187739.
[I 2026-01-24 01:49:40,025] Trial 30 finished with value: 0.76352969348659 and parameters: {'C': 0.009027400103240069, 'solver': 'saga', 'max_iter': 1021, 'tol': 0.010967549679033482}. Best is trial 25 with value: 0.7685584291187739.
[I 2026-01-24 01:51:28,510] Trial 31 finished with value: 0.7667624521072797 and parameters: {'C': 0.008953473272614958, 'solver': 'saga', 'max_iter': 985, 'tol': 0.04221286818062549}. Best is trial 25 with value: 0.7685584291187739.
[I 2026-01-24 01:53:21,704] Trial 32 finished with value: 0.7540708812260536 and parameters: {'C': 0.009120085762576289, 'solver': 'saga', 'max_iter': 1308, 'tol': 0.04136161953860451}. Best is trial 25 with value: 0.7685584291187739.
[I 2026-01-24 01:55:06,000] Trial 33 finished with value: 0.7543103448275862 and parameters: {'C': 0.014189074684808105, 'solver': 'saga', 'max_iter': 1244, 'tol': 0.05383310770464729}. Best is trial 25 with value: 0.7685584291187739.
[I 2026-01-24 01:56:49,358] Trial 34 finished with value: 0.7540708812260536 and parameters: {'C': 0.005793980095187861, 'solver': 'saga', 'max_iter': 1028, 'tol': 0.034513251813713904}. Best is trial 25 with value: 0.7685584291187739.
[I 2026-01-24 02:03:13,672] Trial 35 finished with value: 0.7514367816091954 and parameters: {'C': 0.0159064350085644, 'solver': 'saga', 'max_iter': 573, 'tol': 0.004653535617085812}. Best is trial 25 with value: 0.7685584291187739.
[I 2026-01-24 02:17:07,125] Trial 36 finished with value: 0.741977969348659 and parameters: {'C': 0.010145195776085875, 'solver': 'saga', 'max_iter': 808, 'tol': 0.001042536946117573}. Best is trial 25 with value: 0.7685584291187739.
[I 2026-01-24 02:18:31,748] Trial 37 finished with value: 0.7486829501915708 and parameters: {'C': 0.023190889643394778, 'solver': 'sag', 'max_iter': 1422, 'tol': 0.0658152989526391}. Best is trial 25 with value: 0.7685584291187739.
[I 2026-01-24 02:20:35,779] Trial 38 finished with value: 0.7590996168582376 and parameters: {'C': 0.0037447335606591164, 'solver': 'saga', 'max_iter': 339, 'tol': 0.02283056592218663}. Best is trial 25 with value: 0.7685584291187739.
[I 2026-01-24 02:47:22,491] Trial 39 finished with value: 0.7490421455938697 and parameters: {'C': 0.011091595843198913, 'solver': 'saga', 'max_iter': 1256, 'tol': 0.0002902954194273415}. Best is trial 25 with value: 0.7685584291187739.
[I 2026-01-24 02:49:57,434] A new study created in memory with name: no-name-55d6cdc6-b192-4c77-8386-2b73d1e2c3e1
[I 2026-01-24 02:51:12,767] Trial 0 finished with value: 0.5908764367816092 and parameters: {'C': 0.0010676837369106224, 'solver': 'sag', 'max_iter': 814, 'tol': 0.04862349385836231}. Best is trial 0 with value: 0.5908764367816092.
[I 2026-01-24 02:52:49,949] Trial 1 finished with value: 0.7595785440613027 and parameters: {'C': 0.007471370937701503, 'solver': 'saga', 'max_iter': 290, 'tol': 0.056265291942498734}. Best is trial 1 with value: 0.7595785440613027.
[I 2026-01-24 03:04:31,140] Trial 2 finished with value: 0.743654214559387 and parameters: {'C': 0.0066073300671606085, 'solver': 'saga', 'max_iter': 370, 'tol': 0.0012496847475103156}. Best is trial 1 with value: 0.7595785440613027.
[I 2026-01-24 03:06:53,678] Trial 3 finished with value: 0.7369492337164751 and parameters: {'C': 0.04175688152336643, 'solver': 'sag', 'max_iter': 544, 'tol': 0.026645984516151213}. Best is trial 1 with value: 0.7595785440613027.
[I 2026-01-24 03:15:30,881] Trial 4 finished with value: 0.6754070881226054 and parameters: {'C': 0.0011362695611279797, 'solver': 'sag', 'max_iter': 1983, 'tol': 0.00018631701727205352}. Best is trial 1 with value: 0.7595785440613027.
[I 2026-01-24 03:18:40,710] Trial 5 finished with value: 0.7294061302681992 and parameters: {'C': 0.011947304966976742, 'solver': 'sag', 'max_iter': 1212, 'tol': 0.00912076426178462}. Best is trial 1 with value: 0.7595785440613027.
[I 2026-01-24 03:27:43,225] Trial 6 finished with value: 0.6872605363984674 and parameters: {'C': 0.0014720815423974929, 'solver': 'sag', 'max_iter': 1553, 'tol': 0.0002787781657488998}. Best is trial 1 with value: 0.7595785440613027.
[I 2026-01-24 03:43:46,817] Trial 7 finished with value: 0.7658045977011494 and parameters: {'C': 0.012523510761351952, 'solver': 'saga', 'max_iter': 1296, 'tol': 0.0008615708780737956}. Best is trial 7 with value: 0.7658045977011494.
[I 2026-01-24 03:54:57,472] Trial 8 finished with value: 0.7557471264367817 and parameters: {'C': 0.019549559702332953, 'solver': 'saga', 'max_iter': 688, 'tol': 0.0018626931684202134}. Best is trial 7 with value: 0.7658045977011494.
[I 2026-01-24 03:56:51,434] Trial 9 finished with value: 0.7353927203065134 and parameters: {'C': 0.012937900565867418, 'solver': 'sag', 'max_iter': 1798, 'tol': 0.03934013632694226}. Best is trial 7 with value: 0.7658045977011494.
[I 2026-01-24 04:10:29,251] Trial 10 finished with value: 0.7244971264367817 and parameters: {'C': 0.003230932335202196, 'solver': 'saga', 'max_iter': 1257, 'tol': 0.0006784784486233014}. Best is trial 7 with value: 0.7658045977011494.
[I 2026-01-24 04:14:31,880] Trial 11 finished with value: 0.751676245210728 and parameters: {'C': 0.00500120992611103, 'solver': 'saga', 'max_iter': 166, 'tol': 0.006014467230032082}. Best is trial 7 with value: 0.7658045977011494.
