[I 2026-01-24 04:19:20,074] Trial 12 finished with value: 0.7577825670498084 and parameters: {'C': 0.026105260208050384, 'solver': 'saga', 'max_iter': 984, 'tol': 0.010735411110463857}. Best is trial 7 with value: 0.7658045977011494.
[I 2026-01-24 04:32:49,007] Trial 13 finished with value: 0.7253352490421456 and parameters: {'C': 0.002727092236459336, 'solver': 'saga', 'max_iter': 1512, 'tol': 0.0006306677476555148}. Best is trial 7 with value: 0.7658045977011494.
[I 2026-01-24 04:34:18,576] Trial 14 finished with value: 0.7608955938697318 and parameters: {'C': 0.012259318496239178, 'solver': 'saga', 'max_iter': 105, 'tol': 0.08279168540517966}. Best is trial 7 with value: 0.7658045977011494.
[I 2026-01-24 05:15:25,869] Trial 15 finished with value: 0.7637691570881227 and parameters: {'C': 0.012624757040659336, 'solver': 'saga', 'max_iter': 1035, 'tol': 0.00010380438819801654}. Best is trial 7 with value: 0.7658045977011494.
[I 2026-01-24 06:02:29,526] Trial 16 finished with value: 0.7456896551724138 and parameters: {'C': 0.023209302722432826, 'solver': 'saga', 'max_iter': 1079, 'tol': 0.00010605844749523074}. Best is trial 7 with value: 0.7658045977011494.
[I 2026-01-24 06:34:23,259] Trial 17 finished with value: 0.7626915708812261 and parameters: {'C': 0.03510953312849461, 'solver': 'saga', 'max_iter': 1417, 'tol': 0.0003608880004923569}. Best is trial 7 with value: 0.7658045977011494.
[I 2026-01-24 06:41:41,107] Trial 18 finished with value: 0.7553879310344828 and parameters: {'C': 0.008719120485586828, 'solver': 'saga', 'max_iter': 905, 'tol': 0.0029906586025689845}. Best is trial 7 with value: 0.7658045977011494.
[I 2026-01-24 07:23:37,057] Trial 19 finished with value: 0.7582614942528736 and parameters: {'C': 0.016398205861843408, 'solver': 'saga', 'max_iter': 1273, 'tol': 0.00011401461293608779}. Best is trial 7 with value: 0.7658045977011494.
[I 2026-01-24 07:38:06,205] Trial 20 finished with value: 0.7557471264367817 and parameters: {'C': 0.005481265391156678, 'solver': 'saga', 'max_iter': 1704, 'tol': 0.0007805405633228041}. Best is trial 7 with value: 0.7658045977011494.
[I 2026-01-24 08:17:22,550] Trial 21 finished with value: 0.7531130268199234 and parameters: {'C': 0.04860971006791453, 'solver': 'saga', 'max_iter': 1442, 'tol': 0.00030630607432931425}. Best is trial 7 with value: 0.7658045977011494.
[I 2026-01-24 08:49:51,493] Trial 22 finished with value: 0.7546695402298851 and parameters: {'C': 0.03211697067795011, 'solver': 'saga', 'max_iter': 1116, 'tol': 0.000342390302239471}. Best is trial 7 with value: 0.7658045977011494.
[I 2026-01-24 09:16:32,895] Trial 23 finished with value: 0.7498802681992337 and parameters: {'C': 0.03242207562679432, 'solver': 'saga', 'max_iter': 1381, 'tol': 0.00046659193777534087}. Best is trial 7 with value: 0.7658045977011494.
[I 2026-01-24 09:53:01,277] Trial 24 finished with value: 0.7631704980842912 and parameters: {'C': 0.01621417795496358, 'solver': 'saga', 'max_iter': 1665, 'tol': 0.00016172709562979956}. Best is trial 7 with value: 0.7658045977011494.
[I 2026-01-24 10:28:10,520] Trial 25 finished with value: 0.7515565134099617 and parameters: {'C': 0.01537455722665991, 'solver': 'saga', 'max_iter': 1681, 'tol': 0.0001764197344350417}. Best is trial 7 with value: 0.7658045977011494.
[I 2026-01-24 10:40:23,019] Trial 26 finished with value: 0.7425766283524904 and parameters: {'C': 0.009485666104571007, 'solver': 'saga', 'max_iter': 1941, 'tol': 0.0013256935715347772}. Best is trial 7 with value: 0.7658045977011494.
[I 2026-01-24 11:19:04,105] Trial 27 finished with value: 0.7585009578544061 and parameters: {'C': 0.02274536050054103, 'solver': 'saga', 'max_iter': 1622, 'tol': 0.00017976301126496275}. Best is trial 7 with value: 0.7658045977011494.
[I 2026-01-24 11:43:17,821] Trial 28 finished with value: 0.7471264367816092 and parameters: {'C': 0.0038876051002615956, 'solver': 'saga', 'max_iter': 1853, 'tol': 0.00017129952890938526}. Best is trial 7 with value: 0.7658045977011494.
[I 2026-01-24 11:48:32,485] Trial 29 finished with value: 0.7359913793103449 and parameters: {'C': 0.00975059202372711, 'solver': 'sag', 'max_iter': 827, 'tol': 0.0032365278856639913}. Best is trial 7 with value: 0.7658045977011494.
[I 2026-01-24 12:31:54,161] Trial 30 finished with value: 0.7526340996168582 and parameters: {'C': 0.01718010160086938, 'solver': 'saga', 'max_iter': 712, 'tol': 0.00010424606032600909}. Best is trial 7 with value: 0.7658045977011494.
[I 2026-01-24 12:59:06,553] Trial 31 finished with value: 0.7605363984674329 and parameters: {'C': 0.03192041434458835, 'solver': 'saga', 'max_iter': 1406, 'tol': 0.00047049644572491373}. Best is trial 7 with value: 0.7658045977011494.
[I 2026-01-24 13:28:59,113] Trial 32 finished with value: 0.756345785440613 and parameters: {'C': 0.014751502351208489, 'solver': 'saga', 'max_iter': 1188, 'tol': 0.00025800556347255454}. Best is trial 7 with value: 0.7658045977011494.
[I 2026-01-24 13:41:18,852] Trial 33 finished with value: 0.7546695402298851 and parameters: {'C': 0.007125404222595649, 'solver': 'saga', 'max_iter': 1337, 'tol': 0.00116546213203337}. Best is trial 7 with value: 0.7658045977011494.
[I 2026-01-24 14:03:12,848] Trial 34 finished with value: 0.7561063218390804 and parameters: {'C': 0.01044479011204666, 'solver': 'saga', 'max_iter': 984, 'tol': 0.0004592446931636341}. Best is trial 7 with value: 0.7658045977011494.
[I 2026-01-24 14:44:02,642] Trial 35 finished with value: 0.7543103448275862 and parameters: {'C': 0.021019216639317342, 'solver': 'saga', 'max_iter': 1523, 'tol': 0.00014485871762773863}. Best is trial 7 with value: 0.7658045977011494.
[I 2026-01-24 14:58:39,233] Trial 36 finished with value: 0.7423371647509579 and parameters: {'C': 0.039000569755835504, 'solver': 'sag', 'max_iter': 1774, 'tol': 0.000242457741092111}. Best is trial 7 with value: 0.7658045977011494.
[I 2026-01-24 15:17:15,767] Trial 37 finished with value: 0.7594588122605364 and parameters: {'C': 0.029493756899303683, 'solver': 'saga', 'max_iter': 481, 'tol': 0.0009241175485023834}. Best is trial 7 with value: 0.7658045977011494.
[I 2026-01-24 15:24:31,329] Trial 38 finished with value: 0.7374281609195402 and parameters: {'C': 0.007872656853594142, 'solver': 'sag', 'max_iter': 1173, 'tol': 0.002067821397798785}. Best is trial 7 with value: 0.7658045977011494.
[I 2026-01-24 15:45:20,050] Trial 39 finished with value: 0.7544300766283525 and parameters: {'C': 0.006153234411558199, 'solver': 'saga', 'max_iter': 1599, 'tol': 0.0003803899811432634}. Best is trial 7 with value: 0.7658045977011494.
[I 2026-01-24 16:04:20,156] A new study created in memory with name: no-name-0b0fc365-ba6c-4988-b456-86340dc7d882
[I 2026-01-24 16:17:32,334] Trial 0 finished with value: 0.7340756704980843 and parameters: {'C': 0.023111893373509135, 'solver': 'sag', 'max_iter': 492, 'tol': 0.00078709960415946}. Best is trial 0 with value: 0.7340756704980843.
[I 2026-01-24 16:19:26,063] Trial 1 finished with value: 0.5894396551724138 and parameters: {'C': 0.0010703870437872285, 'solver': 'sag', 'max_iter': 1807, 'tol': 0.02639724485125726}. Best is trial 0 with value: 0.7340756704980843.
[I 2026-01-24 16:25:27,529] Trial 2 finished with value: 0.7201867816091954 and parameters: {'C': 0.0033014896874695313, 'solver': 'sag', 'max_iter': 1118, 'tol': 0.002872940620429812}. Best is trial 0 with value: 0.7340756704980843.
[I 2026-01-24 16:29:46,775] Trial 3 finished with value: 0.7073754789272031 and parameters: {'C': 0.0037946192701887606, 'solver': 'sag', 'max_iter': 523, 'tol': 0.00719557826833239}. Best is trial 0 with value: 0.7340756704980843.
[I 2026-01-24 16:51:01,891] Trial 4 finished with value: 0.7108477011494253 and parameters: {'C': 0.002281390957241194, 'solver': 'saga', 'max_iter': 395, 'tol': 0.0001567283282245233}. Best is trial 0 with value: 0.7340756704980843.
[I 2026-01-24 16:53:55,856] Trial 5 finished with value: 0.6791187739463601 and parameters: {'C': 0.0018185302361141264, 'solver': 'sag', 'max_iter': 772, 'tol': 0.013860199307248498}. Best is trial 0 with value: 0.7340756704980843.
[I 2026-01-24 17:12:33,210] Trial 6 finished with value: 0.7393438697318008 and parameters: {'C': 0.019512637954029962, 'solver': 'sag', 'max_iter': 707, 'tol': 0.00013374465864153442}. Best is trial 6 with value: 0.7393438697318008.
[I 2026-01-24 17:17:19,932] Trial 7 finished with value: 0.750838122605364 and parameters: {'C': 0.035330167290587064, 'solver': 'sag', 'max_iter': 660, 'tol': 0.0043357009234606}. Best is trial 7 with value: 0.750838122605364.
[I 2026-01-24 17:25:08,473] Trial 8 finished with value: 0.7594588122605364 and parameters: {'C': 0.026218062480075344, 'solver': 'saga', 'max_iter': 1724, 'tol': 0.004348247130348103}. Best is trial 8 with value: 0.7594588122605364.
[I 2026-01-24 17:32:09,781] Trial 9 finished with value: 0.695522030651341 and parameters: {'C': 0.0015771139418010347, 'solver': 'saga', 'max_iter': 594, 'tol': 0.001973747455406206}. Best is trial 8 with value: 0.7594588122605364.
[I 2026-01-24 17:34:10,473] Trial 10 finished with value: 0.7636494252873564 and parameters: {'C': 0.009241126801621225, 'solver': 'saga', 'max_iter': 1987, 'tol': 0.039088533319069405}. Best is trial 10 with value: 0.7636494252873564.
[I 2026-01-24 17:35:35,874] Trial 11 finished with value: 0.7606561302681992 and parameters: {'C': 0.010020879427133474, 'solver': 'saga', 'max_iter': 1983, 'tol': 0.09527784235705314}. Best is trial 10 with value: 0.7636494252873564.
[I 2026-01-24 17:37:11,397] Trial 12 finished with value: 0.7551484674329502 and parameters: {'C': 0.01023656397810209, 'solver': 'saga', 'max_iter': 1999, 'tol': 0.06721740211426334}. Best is trial 10 with value: 0.7636494252873564.
[I 2026-01-24 17:38:33,840] Trial 13 finished with value: 0.7522749042145593 and parameters: {'C': 0.007832436498952893, 'solver': 'saga', 'max_iter': 1425, 'tol': 0.08264272355949674}. Best is trial 10 with value: 0.7636494252873564.
[I 2026-01-24 17:40:42,333] Trial 14 finished with value: 0.7699952107279694 and parameters: {'C': 0.012856216287590129, 'solver': 'saga', 'max_iter': 1418, 'tol': 0.03626183467716541}. Best is trial 14 with value: 0.7699952107279694.
[I 2026-01-24 17:42:58,446] Trial 15 finished with value: 0.757183908045977 and parameters: {'C': 0.014607202895490508, 'solver': 'saga', 'max_iter': 1417, 'tol': 0.034133504211487545}. Best is trial 14 with value: 0.7699952107279694.
[I 2026-01-24 17:45:15,478] Trial 16 finished with value: 0.7441331417624522 and parameters: {'C': 0.005328642196689586, 'solver': 'saga', 'max_iter': 1449, 'tol': 0.018833533575304522}. Best is trial 14 with value: 0.7699952107279694.
[I 2026-01-24 18:02:41,580] Trial 17 finished with value: 0.7581417624521073 and parameters: {'C': 0.01310388111979804, 'solver': 'saga', 'max_iter': 1119, 'tol': 0.0007502930376275283}. Best is trial 14 with value: 0.7699952107279694.
[I 2026-01-24 18:08:23,545] Trial 18 finished with value: 0.7771791187739464 and parameters: {'C': 0.04439364235161713, 'solver': 'saga', 'max_iter': 1641, 'tol': 0.010333828633562555}. Best is trial 18 with value: 0.7771791187739464.
[I 2026-01-24 18:13:31,129] Trial 19 finished with value: 0.7574233716475096 and parameters: {'C': 0.041217731996098156, 'solver': 'saga', 'max_iter': 106, 'tol': 0.011905986971593679}. Best is trial 18 with value: 0.7771791187739464.
[I 2026-01-24 18:19:17,395] Trial 20 finished with value: 0.7559865900383141 and parameters: {'C': 0.03602564681439204, 'solver': 'saga', 'max_iter': 1627, 'tol': 0.008947297094009222}. Best is trial 18 with value: 0.7771791187739464.
[I 2026-01-24 18:21:03,717] Trial 21 finished with value: 0.7579022988505747 and parameters: {'C': 0.006432518256972305, 'solver': 'saga', 'max_iter': 1569, 'tol': 0.0405151784222919}. Best is trial 18 with value: 0.7771791187739464.
[I 2026-01-24 18:23:02,947] Trial 22 finished with value: 0.7623323754789272 and parameters: {'C': 0.0177581200681896, 'solver': 'saga', 'max_iter': 1260, 'tol': 0.045671006919024586}. Best is trial 18 with value: 0.7771791187739464.
[I 2026-01-24 18:25:13,315] Trial 23 finished with value: 0.759698275862069 and parameters: {'C': 0.005310240408712755, 'solver': 'saga', 'max_iter': 1856, 'tol': 0.020634617019844134}. Best is trial 18 with value: 0.7771791187739464.
[I 2026-01-24 18:30:54,316] Trial 24 finished with value: 0.758860153256705 and parameters: {'C': 0.027698402455221205, 'solver': 'saga', 'max_iter': 958, 'tol': 0.008322626657530878}. Best is trial 18 with value: 0.7771791187739464.
[I 2026-01-24 18:32:41,737] Trial 25 finished with value: 0.7662835249042146 and parameters: {'C': 0.01006615939088569, 'solver': 'saga', 'max_iter': 1608, 'tol': 0.0514712165181645}. Best is trial 18 with value: 0.7771791187739464.
[I 2026-01-24 18:34:30,889] Trial 26 finished with value: 0.7585009578544061 and parameters: {'C': 0.045504867152661256, 'solver': 'saga', 'max_iter': 1266, 'tol': 0.06344178579395596}. Best is trial 18 with value: 0.7771791187739464.
[I 2026-01-24 18:37:19,323] Trial 27 finished with value: 0.7632902298850575 and parameters: {'C': 0.012412283097731956, 'solver': 'saga', 'max_iter': 1574, 'tol': 0.020913124688551204}. Best is trial 18 with value: 0.7771791187739464.
[I 2026-01-24 18:43:19,899] Trial 28 finished with value: 0.7557471264367817 and parameters: {'C': 0.018026929176286156, 'solver': 'saga', 'max_iter': 1264, 'tol': 0.005834927193194961}. Best is trial 18 with value: 0.7771791187739464.
[I 2026-01-24 18:54:55,077] Trial 29 finished with value: 0.7574233716475096 and parameters: {'C': 0.023960446358543178, 'solver': 'saga', 'max_iter': 1691, 'tol': 0.001950888172409774}. Best is trial 18 with value: 0.7771791187739464.
[I 2026-01-24 18:57:27,528] Trial 30 finished with value: 0.7337164750957854 and parameters: {'C': 0.0043022753424207145, 'solver': 'saga', 'max_iter': 960, 'tol': 0.013449733949321488}. Best is trial 18 with value: 0.7771791187739464.
[I 2026-01-24 18:59:16,414] Trial 31 finished with value: 0.7625718390804598 and parameters: {'C': 0.009481173811872372, 'solver': 'saga', 'max_iter': 1856, 'tol': 0.04836890753204978}. Best is trial 18 with value: 0.7771791187739464.
[I 2026-01-24 19:01:28,354] Trial 32 finished with value: 0.7605363984674329 and parameters: {'C': 0.007408504284316214, 'solver': 'saga', 'max_iter': 1761, 'tol': 0.02649645537532473}. Best is trial 18 with value: 0.7771791187739464.
[I 2026-01-24 19:03:14,495] Trial 33 finished with value: 0.7472461685823755 and parameters: {'C': 0.0029266354424381945, 'solver': 'saga', 'max_iter': 1495, 'tol': 0.03723498609688802}. Best is trial 18 with value: 0.7771791187739464.
[I 2026-01-24 19:05:25,065] Trial 34 finished with value: 0.7294061302681992 and parameters: {'C': 0.015320855922058505, 'solver': 'sag', 'max_iter': 1875, 'tol': 0.027881886745080787}. Best is trial 18 with value: 0.7771791187739464.
[I 2026-01-24 19:07:08,568] Trial 35 finished with value: 0.7590996168582376 and parameters: {'C': 0.011310127714633815, 'solver': 'saga', 'max_iter': 1343, 'tol': 0.055559620048173185}. Best is trial 18 with value: 0.7771791187739464.
[I 2026-01-24 19:18:01,319] Trial 36 finished with value: 0.7454501915708812 and parameters: {'C': 0.008112661756345754, 'solver': 'sag', 'max_iter': 1672, 'tol': 0.0006110827670509596}. Best is trial 18 with value: 0.7771791187739464.
[I 2026-01-24 19:20:29,740] Trial 37 finished with value: 0.7582614942528736 and parameters: {'C': 0.006320758622844133, 'solver': 'saga', 'max_iter': 1128, 'tol': 0.015615024496716957}. Best is trial 18 with value: 0.7771791187739464.
[I 2026-01-24 19:23:46,232] Trial 38 finished with value: 0.7355124521072797 and parameters: {'C': 0.029946466210507512, 'solver': 'sag', 'max_iter': 1533, 'tol': 0.010672268942555503}. Best is trial 18 with value: 0.7771791187739464.
[I 2026-01-24 19:25:35,246] Trial 39 finished with value: 0.7549090038314177 and parameters: {'C': 0.004527240761317964, 'solver': 'saga', 'max_iter': 1932, 'tol': 0.02882940345893969}. Best is trial 18 with value: 0.7771791187739464.
[I 2026-01-24 19:32:34,601] A new study created in memory with name: no-name-42fe0e52-aa43-4114-9e10-a2215a94f5e1
[I 2026-01-24 19:34:47,558] Trial 0 finished with value: 0.7497605363984674 and parameters: {'C': 0.02644679726318295, 'solver': 'sag', 'max_iter': 462, 'tol': 0.034646331336293336}. Best is trial 0 with value: 0.7497605363984674.
[I 2026-01-24 19:43:47,344] Trial 1 finished with value: 0.7529932950191571 and parameters: {'C': 0.01177260370499059, 'solver': 'sag', 'max_iter': 829, 'tol': 0.0011691624028812827}. Best is trial 1 with value: 0.7529932950191571.
[I 2026-01-24 19:45:42,418] Trial 2 finished with value: 0.7517959770114943 and parameters: {'C': 0.005594486465904594, 'solver': 'saga', 'max_iter': 310, 'tol': 0.027390505542338996}. Best is trial 1 with value: 0.7529932950191571.
[I 2026-01-24 20:01:22,683] Trial 3 finished with value: 0.7450909961685823 and parameters: {'C': 0.006599043735652599, 'solver': 'sag', 'max_iter': 471, 'tol': 0.00016269318070469767}. Best is trial 1 with value: 0.7529932950191571.
[I 2026-01-24 20:08:48,672] Trial 4 finished with value: 0.7533524904214559 and parameters: {'C': 0.03191220492573215, 'solver': 'sag', 'max_iter': 1246, 'tol': 0.0018126022717768388}. Best is trial 4 with value: 0.7533524904214559.
[I 2026-01-24 20:12:40,870] Trial 5 finished with value: 0.7370689655172413 and parameters: {'C': 0.00811366773272938, 'solver': 'sag', 'max_iter': 876, 'tol': 0.005202017917134417}. Best is trial 4 with value: 0.7533524904214559.
[I 2026-01-24 20:25:44,405] Trial 6 finished with value: 0.7498802681992337 and parameters: {'C': 0.03066632448578329, 'solver': 'saga', 'max_iter': 104, 'tol': 0.0018354405494688279}. Best is trial 4 with value: 0.7533524904214559.
[I 2026-01-24 20:27:43,482] Trial 7 finished with value: 0.7565852490421456 and parameters: {'C': 0.004453974908159252, 'solver': 'saga', 'max_iter': 399, 'tol': 0.022427527585940615}. Best is trial 7 with value: 0.7565852490421456.
[I 2026-01-24 20:39:54,439] Trial 8 finished with value: 0.7444923371647509 and parameters: {'C': 0.04719460015113497, 'solver': 'sag', 'max_iter': 302, 'tol': 0.0007584787102796167}. Best is trial 7 with value: 0.7565852490421456.
[I 2026-01-24 20:42:39,200] Trial 9 finished with value: 0.7332375478927203 and parameters: {'C': 0.0129125456492453, 'solver': 'sag', 'max_iter': 355, 'tol': 0.014711518654835934}. Best is trial 7 with value: 0.7565852490421456.
[I 2026-01-24 20:43:47,836] Trial 10 finished with value: 0.7370689655172413 and parameters: {'C': 0.0016171261095073864, 'solver': 'saga', 'max_iter': 1975, 'tol': 0.099634822824789}. Best is trial 7 with value: 0.7565852490421456.
[I 2026-01-24 20:47:23,030] Trial 11 finished with value: 0.7377873563218391 and parameters: {'C': 0.0027792888479463767, 'solver': 'saga', 'max_iter': 1423, 'tol': 0.006219091745895595}. Best is trial 7 with value: 0.7565852490421456.
[I 2026-01-24 21:05:42,595] Trial 12 finished with value: 0.7386254789272031 and parameters: {'C': 0.0034371036630789285, 'solver': 'saga', 'max_iter': 1297, 'tol': 0.0003745679404328386}. Best is trial 7 with value: 0.7565852490421456.
[I 2026-01-24 21:10:19,091] Trial 13 finished with value: 0.6950431034482759 and parameters: {'C': 0.0012739011477871508, 'solver': 'saga', 'max_iter': 1538, 'tol': 0.003882867959886221}. Best is trial 7 with value: 0.7565852490421456.
[I 2026-01-24 21:13:20,856] Trial 14 finished with value: 0.7306034482758621 and parameters: {'C': 0.016740893173064642, 'solver': 'sag', 'max_iter': 1111, 'tol': 0.011550216731683747}. Best is trial 7 with value: 0.7565852490421456.
[I 2026-01-24 21:14:34,571] Trial 15 finished with value: 0.7458093869731801 and parameters: {'C': 0.003556773120303701, 'solver': 'saga', 'max_iter': 1751, 'tol': 0.07654818321359323}. Best is trial 7 with value: 0.7565852490421456.
[I 2026-01-24 21:21:27,023] Trial 16 finished with value: 0.7092911877394636 and parameters: {'C': 0.002257154973112378, 'solver': 'saga', 'max_iter': 733, 'tol': 0.0023436131495911676}. Best is trial 7 with value: 0.7565852490421456.
[I 2026-01-24 21:32:51,950] Trial 17 finished with value: 0.7465277777777778 and parameters: {'C': 0.004947825404654903, 'solver': 'sag', 'max_iter': 1119, 'tol': 0.0003655169885268063}. Best is trial 7 with value: 0.7565852490421456.
[I 2026-01-24 21:37:57,139] Trial 18 finished with value: 0.7555076628352491 and parameters: {'C': 0.022215559408047116, 'solver': 'saga', 'max_iter': 639, 'tol': 0.009247668849351812}. Best is trial 7 with value: 0.7565852490421456.
[I 2026-01-24 21:41:43,423] Trial 19 finished with value: 0.7589798850574713 and parameters: {'C': 0.009567378948941526, 'solver': 'saga', 'max_iter': 653, 'tol': 0.011138692292129002}. Best is trial 19 with value: 0.7589798850574713.
[I 2026-01-24 21:44:01,609] Trial 20 finished with value: 0.7613745210727969 and parameters: {'C': 0.009072411475249221, 'solver': 'saga', 'max_iter': 139, 'tol': 0.02854984580701084}. Best is trial 20 with value: 0.7613745210727969.
[I 2026-01-24 21:46:17,486] Trial 21 finished with value: 0.7577825670498084 and parameters: {'C': 0.00858228834442926, 'solver': 'saga', 'max_iter': 150, 'tol': 0.028111835695170936}. Best is trial 20 with value: 0.7613745210727969.
[I 2026-01-24 21:48:07,698] Trial 22 finished with value: 0.7567049808429118 and parameters: {'C': 0.009342841045524982, 'solver': 'saga', 'max_iter': 102, 'tol': 0.04406579566419416}. Best is trial 20 with value: 0.7613745210727969.
[I 2026-01-24 21:49:57,331] Trial 23 finished with value: 0.7590996168582376 and parameters: {'C': 0.015304792646263516, 'solver': 'saga', 'max_iter': 571, 'tol': 0.0507572072019723}. Best is trial 20 with value: 0.7613745210727969.
