[I 2026-01-17 15:17:16,740] Trial 32 finished with value: 0.914272030651341 and parameters: {'C': 0.1445244886386583, 'max_iter': 130, 'solver': 'lbfgs'}. Best is trial 29 with value: 0.9260057471264368.
/home/sjoon/projects/brain_connectivity_classifier/masterthesis_venv2/lib/python3.11/site-packages/sklearn/linear_model/_logistic.py:1272: FutureWarning: 'multi_class' was deprecated in version 1.5 and will be removed in 1.8. From then on, it will always use 'multinomial'. Leave it to its default value to avoid this warning.
  warnings.warn(
[I 2026-01-17 15:17:31,104] Trial 33 finished with value: 0.9090038314176245 and parameters: {'C': 0.051521096281620646, 'max_iter': 148, 'solver': 'lbfgs'}. Best is trial 29 with value: 0.9260057471264368.
/home/sjoon/projects/brain_connectivity_classifier/masterthesis_venv2/lib/python3.11/site-packages/sklearn/linear_model/_logistic.py:1272: FutureWarning: 'multi_class' was deprecated in version 1.5 and will be removed in 1.8. From then on, it will always use 'multinomial'. Leave it to its default value to avoid this warning.
  warnings.warn(
[I 2026-01-17 15:17:41,220] Trial 34 finished with value: 0.9123563218390804 and parameters: {'C': 0.37363938358946913, 'max_iter': 112, 'solver': 'lbfgs'}. Best is trial 29 with value: 0.9260057471264368.
/home/sjoon/projects/brain_connectivity_classifier/masterthesis_venv2/lib/python3.11/site-packages/sklearn/linear_model/_logistic.py:1272: FutureWarning: 'multi_class' was deprecated in version 1.5 and will be removed in 1.8. From then on, it will always use 'multinomial'. Leave it to its default value to avoid this warning.
  warnings.warn(
[I 2026-01-17 15:17:54,740] Trial 35 finished with value: 0.9027777777777778 and parameters: {'C': 0.03814386879749297, 'max_iter': 162, 'solver': 'lbfgs'}. Best is trial 29 with value: 0.9260057471264368.
/home/sjoon/projects/brain_connectivity_classifier/masterthesis_venv2/lib/python3.11/site-packages/sklearn/linear_model/_logistic.py:1272: FutureWarning: 'multi_class' was deprecated in version 1.5 and will be removed in 1.8. From then on, it will always use 'multinomial'. Leave it to its default value to avoid this warning.
  warnings.warn(
[I 2026-01-17 15:18:10,724] Trial 36 finished with value: 0.8946360153256705 and parameters: {'C': 0.00962391401927593, 'max_iter': 147, 'solver': 'lbfgs'}. Best is trial 29 with value: 0.9260057471264368.
/home/sjoon/projects/brain_connectivity_classifier/masterthesis_venv2/lib/python3.11/site-packages/sklearn/linear_model/_logistic.py:1272: FutureWarning: 'multi_class' was deprecated in version 1.5 and will be removed in 1.8. From then on, it will always use 'multinomial'. Leave it to its default value to avoid this warning.
  warnings.warn(
[I 2026-01-17 15:18:28,548] Trial 37 finished with value: 0.9058908045977011 and parameters: {'C': 0.01791733771733017, 'max_iter': 126, 'solver': 'lbfgs'}. Best is trial 29 with value: 0.9260057471264368.
/home/sjoon/projects/brain_connectivity_classifier/masterthesis_venv2/lib/python3.11/site-packages/sklearn/linear_model/_logistic.py:1272: FutureWarning: 'multi_class' was deprecated in version 1.5 and will be removed in 1.8. From then on, it will always use 'multinomial'. Leave it to its default value to avoid this warning.
  warnings.warn(
[I 2026-01-17 15:18:30,265] Trial 38 finished with value: 0.8840996168582376 and parameters: {'C': 0.006480882006290881, 'max_iter': 111, 'solver': 'newton-cg'}. Best is trial 29 with value: 0.9260057471264368.
/home/sjoon/projects/brain_connectivity_classifier/masterthesis_venv2/lib/python3.11/site-packages/sklearn/linear_model/_logistic.py:1272: FutureWarning: 'multi_class' was deprecated in version 1.5 and will be removed in 1.8. From then on, it will always use 'multinomial'. Leave it to its default value to avoid this warning.
  warnings.warn(
[I 2026-01-17 15:18:43,200] Trial 39 finished with value: 0.9149904214559387 and parameters: {'C': 0.07137820743254737, 'max_iter': 100, 'solver': 'lbfgs'}. Best is trial 29 with value: 0.9260057471264368.
/home/sjoon/projects/brain_connectivity_classifier/masterthesis_venv2/lib/python3.11/site-packages/sklearn/linear_model/_logistic.py:1272: FutureWarning: 'multi_class' was deprecated in version 1.5 and will be removed in 1.8. From then on, it will always use 'multinomial'. Leave it to its default value to avoid this warning.
  warnings.warn(
[I 2026-01-17 15:18:45,885] Trial 40 finished with value: 0.9015804597701149 and parameters: {'C': 0.5233908175129802, 'max_iter': 137, 'solver': 'newton-cg'}. Best is trial 29 with value: 0.9260057471264368.
/home/sjoon/projects/brain_connectivity_classifier/masterthesis_venv2/lib/python3.11/site-packages/sklearn/linear_model/_logistic.py:1272: FutureWarning: 'multi_class' was deprecated in version 1.5 and will be removed in 1.8. From then on, it will always use 'multinomial'. Leave it to its default value to avoid this warning.
  warnings.warn(
[I 2026-01-17 15:18:47,202] Trial 41 finished with value: 0.9166666666666666 and parameters: {'C': 0.07685999978585421, 'max_iter': 366, 'solver': 'newton-cg'}. Best is trial 29 with value: 0.9260057471264368.
/home/sjoon/projects/brain_connectivity_classifier/masterthesis_venv2/lib/python3.11/site-packages/sklearn/linear_model/_logistic.py:1272: FutureWarning: 'multi_class' was deprecated in version 1.5 and will be removed in 1.8. From then on, it will always use 'multinomial'. Leave it to its default value to avoid this warning.
  warnings.warn(
[I 2026-01-17 15:18:48,416] Trial 42 finished with value: 0.9257662835249042 and parameters: {'C': 0.1981624978423898, 'max_iter': 246, 'solver': 'newton-cg'}. Best is trial 29 with value: 0.9260057471264368.
/home/sjoon/projects/brain_connectivity_classifier/masterthesis_venv2/lib/python3.11/site-packages/sklearn/linear_model/_logistic.py:1272: FutureWarning: 'multi_class' was deprecated in version 1.5 and will be removed in 1.8. From then on, it will always use 'multinomial'. Leave it to its default value to avoid this warning.
  warnings.warn(
[I 2026-01-17 15:18:49,691] Trial 43 finished with value: 0.9025383141762452 and parameters: {'C': 0.14633730549631946, 'max_iter': 239, 'solver': 'newton-cg'}. Best is trial 29 with value: 0.9260057471264368.
/home/sjoon/projects/brain_connectivity_classifier/masterthesis_venv2/lib/python3.11/site-packages/sklearn/linear_model/_logistic.py:1272: FutureWarning: 'multi_class' was deprecated in version 1.5 and will be removed in 1.8. From then on, it will always use 'multinomial'. Leave it to its default value to avoid this warning.
  warnings.warn(
[I 2026-01-17 15:18:50,843] Trial 44 finished with value: 0.9078065134099617 and parameters: {'C': 0.859285581360191, 'max_iter': 272, 'solver': 'newton-cg'}. Best is trial 29 with value: 0.9260057471264368.
/home/sjoon/projects/brain_connectivity_classifier/masterthesis_venv2/lib/python3.11/site-packages/sklearn/linear_model/_logistic.py:1272: FutureWarning: 'multi_class' was deprecated in version 1.5 and will be removed in 1.8. From then on, it will always use 'multinomial'. Leave it to its default value to avoid this warning.
  warnings.warn(
[I 2026-01-17 15:18:52,035] Trial 45 finished with value: 0.9025383141762452 and parameters: {'C': 0.2637253792005264, 'max_iter': 339, 'solver': 'newton-cg'}. Best is trial 29 with value: 0.9260057471264368.
/home/sjoon/projects/brain_connectivity_classifier/masterthesis_venv2/lib/python3.11/site-packages/sklearn/linear_model/_logistic.py:1272: FutureWarning: 'multi_class' was deprecated in version 1.5 and will be removed in 1.8. From then on, it will always use 'multinomial'. Leave it to its default value to avoid this warning.
  warnings.warn(
[I 2026-01-17 15:18:53,524] Trial 46 finished with value: 0.9097222222222222 and parameters: {'C': 0.03485848476550824, 'max_iter': 240, 'solver': 'newton-cg'}. Best is trial 29 with value: 0.9260057471264368.
/home/sjoon/projects/brain_connectivity_classifier/masterthesis_venv2/lib/python3.11/site-packages/sklearn/linear_model/_logistic.py:1272: FutureWarning: 'multi_class' was deprecated in version 1.5 and will be removed in 1.8. From then on, it will always use 'multinomial'. Leave it to its default value to avoid this warning.
  warnings.warn(
[I 2026-01-17 15:18:55,155] Trial 47 finished with value: 0.9267241379310345 and parameters: {'C': 0.10743167235072079, 'max_iter': 479, 'solver': 'newton-cg'}. Best is trial 47 with value: 0.9267241379310345.
/home/sjoon/projects/brain_connectivity_classifier/masterthesis_venv2/lib/python3.11/site-packages/sklearn/linear_model/_logistic.py:1272: FutureWarning: 'multi_class' was deprecated in version 1.5 and will be removed in 1.8. From then on, it will always use 'multinomial'. Leave it to its default value to avoid this warning.
  warnings.warn(
[I 2026-01-17 15:19:05,272] Trial 48 finished with value: 0.9204980842911877 and parameters: {'C': 0.14342800159684638, 'max_iter': 471, 'solver': 'lbfgs'}. Best is trial 47 with value: 0.9267241379310345.
/home/sjoon/projects/brain_connectivity_classifier/masterthesis_venv2/lib/python3.11/site-packages/sklearn/linear_model/_logistic.py:1272: FutureWarning: 'multi_class' was deprecated in version 1.5 and will be removed in 1.8. From then on, it will always use 'multinomial'. Leave it to its default value to avoid this warning.
  warnings.warn(
