[I 2026-01-17 15:42:13,856] Trial 29 finished with value: 0.8888888888888888 and parameters: {'C': 2.010074998264837, 'max_iter': 106, 'solver': 'lbfgs'}. Best is trial 7 with value: 0.9188218390804598.
/home/sjoon/projects/brain_connectivity_classifier/masterthesis_venv2/lib/python3.11/site-packages/sklearn/linear_model/_logistic.py:1272: FutureWarning: 'multi_class' was deprecated in version 1.5 and will be removed in 1.8. From then on, it will always use 'multinomial'. Leave it to its default value to avoid this warning.
  warnings.warn(
[I 2026-01-17 15:42:23,628] Trial 30 finished with value: 0.9006226053639846 and parameters: {'C': 0.5014754777867636, 'max_iter': 178, 'solver': 'lbfgs'}. Best is trial 7 with value: 0.9188218390804598.
/home/sjoon/projects/brain_connectivity_classifier/masterthesis_venv2/lib/python3.11/site-packages/sklearn/linear_model/_logistic.py:1272: FutureWarning: 'multi_class' was deprecated in version 1.5 and will be removed in 1.8. From then on, it will always use 'multinomial'. Leave it to its default value to avoid this warning.
  warnings.warn(
[I 2026-01-17 15:42:35,536] Trial 31 finished with value: 0.9092432950191571 and parameters: {'C': 0.06479927979647172, 'max_iter': 438, 'solver': 'lbfgs'}. Best is trial 7 with value: 0.9188218390804598.
/home/sjoon/projects/brain_connectivity_classifier/masterthesis_venv2/lib/python3.11/site-packages/sklearn/linear_model/_logistic.py:1272: FutureWarning: 'multi_class' was deprecated in version 1.5 and will be removed in 1.8. From then on, it will always use 'multinomial'. Leave it to its default value to avoid this warning.
  warnings.warn(
[I 2026-01-17 15:42:48,904] Trial 32 finished with value: 0.8970306513409961 and parameters: {'C': 0.027497966457021485, 'max_iter': 277, 'solver': 'lbfgs'}. Best is trial 7 with value: 0.9188218390804598.
/home/sjoon/projects/brain_connectivity_classifier/masterthesis_venv2/lib/python3.11/site-packages/sklearn/linear_model/_logistic.py:1272: FutureWarning: 'multi_class' was deprecated in version 1.5 and will be removed in 1.8. From then on, it will always use 'multinomial'. Leave it to its default value to avoid this warning.
  warnings.warn(
[I 2026-01-17 15:42:59,680] Trial 33 finished with value: 0.9178639846743295 and parameters: {'C': 0.10800735104467375, 'max_iter': 167, 'solver': 'lbfgs'}. Best is trial 7 with value: 0.9188218390804598.
/home/sjoon/projects/brain_connectivity_classifier/masterthesis_venv2/lib/python3.11/site-packages/sklearn/linear_model/_logistic.py:1272: FutureWarning: 'multi_class' was deprecated in version 1.5 and will be removed in 1.8. From then on, it will always use 'multinomial'. Leave it to its default value to avoid this warning.
  warnings.warn(
[I 2026-01-17 15:43:01,029] Trial 34 finished with value: 0.9018199233716475 and parameters: {'C': 1.1775257996270847, 'max_iter': 161, 'solver': 'newton-cg'}. Best is trial 7 with value: 0.9188218390804598.
/home/sjoon/projects/brain_connectivity_classifier/masterthesis_venv2/lib/python3.11/site-packages/sklearn/linear_model/_logistic.py:1272: FutureWarning: 'multi_class' was deprecated in version 1.5 and will be removed in 1.8. From then on, it will always use 'multinomial'. Leave it to its default value to avoid this warning.
  warnings.warn(
[I 2026-01-17 15:43:13,184] Trial 35 finished with value: 0.8857758620689655 and parameters: {'C': 0.028631921244252952, 'max_iter': 129, 'solver': 'lbfgs'}. Best is trial 7 with value: 0.9188218390804598.
/home/sjoon/projects/brain_connectivity_classifier/masterthesis_venv2/lib/python3.11/site-packages/sklearn/linear_model/_logistic.py:1272: FutureWarning: 'multi_class' was deprecated in version 1.5 and will be removed in 1.8. From then on, it will always use 'multinomial'. Leave it to its default value to avoid this warning.
  warnings.warn(
[I 2026-01-17 15:43:24,068] Trial 36 finished with value: 0.8994252873563219 and parameters: {'C': 0.3142925254401171, 'max_iter': 110, 'solver': 'lbfgs'}. Best is trial 7 with value: 0.9188218390804598.
/home/sjoon/projects/brain_connectivity_classifier/masterthesis_venv2/lib/python3.11/site-packages/sklearn/linear_model/_logistic.py:1272: FutureWarning: 'multi_class' was deprecated in version 1.5 and will be removed in 1.8. From then on, it will always use 'multinomial'. Leave it to its default value to avoid this warning.
  warnings.warn(
[I 2026-01-17 15:43:25,665] Trial 37 finished with value: 0.9034961685823755 and parameters: {'C': 0.16050707973933925, 'max_iter': 202, 'solver': 'newton-cg'}. Best is trial 7 with value: 0.9188218390804598.
/home/sjoon/projects/brain_connectivity_classifier/masterthesis_venv2/lib/python3.11/site-packages/sklearn/linear_model/_logistic.py:1272: FutureWarning: 'multi_class' was deprecated in version 1.5 and will be removed in 1.8. From then on, it will always use 'multinomial'. Leave it to its default value to avoid this warning.
  warnings.warn(
[I 2026-01-17 15:43:37,348] Trial 38 finished with value: 0.9097222222222222 and parameters: {'C': 0.07395996390054366, 'max_iter': 233, 'solver': 'lbfgs'}. Best is trial 7 with value: 0.9188218390804598.
/home/sjoon/projects/brain_connectivity_classifier/masterthesis_venv2/lib/python3.11/site-packages/sklearn/linear_model/_logistic.py:1272: FutureWarning: 'multi_class' was deprecated in version 1.5 and will be removed in 1.8. From then on, it will always use 'multinomial'. Leave it to its default value to avoid this warning.
  warnings.warn(
[I 2026-01-17 15:43:48,596] Trial 39 finished with value: 0.9003831417624522 and parameters: {'C': 3.407098822655385, 'max_iter': 140, 'solver': 'lbfgs'}. Best is trial 7 with value: 0.9188218390804598.
/home/sjoon/projects/brain_connectivity_classifier/masterthesis_venv2/lib/python3.11/site-packages/sklearn/linear_model/_logistic.py:1272: FutureWarning: 'multi_class' was deprecated in version 1.5 and will be removed in 1.8. From then on, it will always use 'multinomial'. Leave it to its default value to avoid this warning.
  warnings.warn(
[I 2026-01-17 15:43:50,408] Trial 40 finished with value: 0.9224137931034483 and parameters: {'C': 0.5666524808889193, 'max_iter': 169, 'solver': 'newton-cg'}. Best is trial 40 with value: 0.9224137931034483.
/home/sjoon/projects/brain_connectivity_classifier/masterthesis_venv2/lib/python3.11/site-packages/sklearn/linear_model/_logistic.py:1272: FutureWarning: 'multi_class' was deprecated in version 1.5 and will be removed in 1.8. From then on, it will always use 'multinomial'. Leave it to its default value to avoid this warning.
  warnings.warn(
[I 2026-01-17 15:43:52,370] Trial 41 finished with value: 0.9082854406130269 and parameters: {'C': 1.3143475881576665, 'max_iter': 160, 'solver': 'newton-cg'}. Best is trial 40 with value: 0.9224137931034483.
/home/sjoon/projects/brain_connectivity_classifier/masterthesis_venv2/lib/python3.11/site-packages/sklearn/linear_model/_logistic.py:1272: FutureWarning: 'multi_class' was deprecated in version 1.5 and will be removed in 1.8. From then on, it will always use 'multinomial'. Leave it to its default value to avoid this warning.
  warnings.warn(
[I 2026-01-17 15:43:53,961] Trial 42 finished with value: 0.8975095785440613 and parameters: {'C': 0.5172642160070474, 'max_iter': 195, 'solver': 'newton-cg'}. Best is trial 40 with value: 0.9224137931034483.
/home/sjoon/projects/brain_connectivity_classifier/masterthesis_venv2/lib/python3.11/site-packages/sklearn/linear_model/_logistic.py:1272: FutureWarning: 'multi_class' was deprecated in version 1.5 and will be removed in 1.8. From then on, it will always use 'multinomial'. Leave it to its default value to avoid this warning.
  warnings.warn(
[I 2026-01-17 15:43:55,350] Trial 43 finished with value: 0.9075670498084292 and parameters: {'C': 0.29236600458874124, 'max_iter': 170, 'solver': 'newton-cg'}. Best is trial 40 with value: 0.9224137931034483.
/home/sjoon/projects/brain_connectivity_classifier/masterthesis_venv2/lib/python3.11/site-packages/sklearn/linear_model/_logistic.py:1272: FutureWarning: 'multi_class' was deprecated in version 1.5 and will be removed in 1.8. From then on, it will always use 'multinomial'. Leave it to its default value to avoid this warning.
  warnings.warn(
[I 2026-01-17 15:43:56,986] Trial 44 finished with value: 0.9145114942528736 and parameters: {'C': 0.15811286395967095, 'max_iter': 118, 'solver': 'newton-cg'}. Best is trial 40 with value: 0.9224137931034483.
/home/sjoon/projects/brain_connectivity_classifier/masterthesis_venv2/lib/python3.11/site-packages/sklearn/linear_model/_logistic.py:1272: FutureWarning: 'multi_class' was deprecated in version 1.5 and will be removed in 1.8. From then on, it will always use 'multinomial'. Leave it to its default value to avoid this warning.
  warnings.warn(
[I 2026-01-17 15:43:58,654] Trial 45 finished with value: 0.9001436781609196 and parameters: {'C': 0.03916210770053369, 'max_iter': 172, 'solver': 'newton-cg'}. Best is trial 40 with value: 0.9224137931034483.
/home/sjoon/projects/brain_connectivity_classifier/masterthesis_venv2/lib/python3.11/site-packages/sklearn/linear_model/_logistic.py:1272: FutureWarning: 'multi_class' was deprecated in version 1.5 and will be removed in 1.8. From then on, it will always use 'multinomial'. Leave it to its default value to avoid this warning.
  warnings.warn(
[I 2026-01-17 15:44:11,788] Trial 46 finished with value: 0.9025383141762452 and parameters: {'C': 0.08433206813517964, 'max_iter': 132, 'solver': 'lbfgs'}. Best is trial 40 with value: 0.9224137931034483.
/home/sjoon/projects/brain_connectivity_classifier/masterthesis_venv2/lib/python3.11/site-packages/sklearn/linear_model/_logistic.py:1272: FutureWarning: 'multi_class' was deprecated in version 1.5 and will be removed in 1.8. From then on, it will always use 'multinomial'. Leave it to its default value to avoid this warning.
  warnings.warn(
[I 2026-01-17 15:44:21,080] Trial 47 finished with value: 0.8975095785440613 and parameters: {'C': 0.3809310259805257, 'max_iter': 152, 'solver': 'lbfgs'}. Best is trial 40 with value: 0.9224137931034483.
/home/sjoon/projects/brain_connectivity_classifier/masterthesis_venv2/lib/python3.11/site-packages/sklearn/linear_model/_logistic.py:1272: FutureWarning: 'multi_class' was deprecated in version 1.5 and will be removed in 1.8. From then on, it will always use 'multinomial'. Leave it to its default value to avoid this warning.
  warnings.warn(
[I 2026-01-17 15:44:22,605] Trial 48 finished with value: 0.8896072796934866 and parameters: {'C': 0.012509862277863524, 'max_iter': 220, 'solver': 'newton-cg'}. Best is trial 40 with value: 0.9224137931034483.
/home/sjoon/projects/brain_connectivity_classifier/masterthesis_venv2/lib/python3.11/site-packages/sklearn/linear_model/_logistic.py:1272: FutureWarning: 'multi_class' was deprecated in version 1.5 and will be removed in 1.8. From then on, it will always use 'multinomial'. Leave it to its default value to avoid this warning.
  warnings.warn(
[I 2026-01-17 15:44:33,584] Trial 49 finished with value: 0.9068486590038314 and parameters: {'C': 0.7012362542400266, 'max_iter': 189, 'solver': 'lbfgs'}. Best is trial 40 with value: 0.9224137931034483.
/home/sjoon/projects/brain_connectivity_classifier/masterthesis_venv2/lib/python3.11/site-packages/sklearn/linear_model/_logistic.py:1272: FutureWarning: 'multi_class' was deprecated in version 1.5 and will be removed in 1.8. From then on, it will always use 'multinomial'. Leave it to its default value to avoid this warning.
  warnings.warn(
[Parallel(n_jobs=-1)]: Using backend LokyBackend with 16 concurrent workers.
[I 2026-01-17 15:44:37,216] A new study created in memory with name: no-name-32c848a5-7f68-41ce-aa53-678245013eb1
/home/sjoon/projects/brain_connectivity_classifier/masterthesis_venv2/lib/python3.11/site-packages/sklearn/linear_model/_logistic.py:1272: FutureWarning: 'multi_class' was deprecated in version 1.5 and will be removed in 1.8. From then on, it will always use 'multinomial'. Leave it to its default value to avoid this warning.
  warnings.warn(
[I 2026-01-17 15:44:54,888] Trial 0 finished with value: 0.8857758620689655 and parameters: {'C': 9.037453045307826, 'max_iter': 242, 'solver': 'lbfgs'}. Best is trial 0 with value: 0.8857758620689655.
/home/sjoon/projects/brain_connectivity_classifier/masterthesis_venv2/lib/python3.11/site-packages/sklearn/linear_model/_logistic.py:1272: FutureWarning: 'multi_class' was deprecated in version 1.5 and will be removed in 1.8. From then on, it will always use 'multinomial'. Leave it to its default value to avoid this warning.
  warnings.warn(
[I 2026-01-17 15:44:57,508] Trial 1 finished with value: 0.9130747126436781 and parameters: {'C': 0.0599622587133535, 'max_iter': 214, 'solver': 'newton-cg'}. Best is trial 1 with value: 0.9130747126436781.
/home/sjoon/projects/brain_connectivity_classifier/masterthesis_venv2/lib/python3.11/site-packages/sklearn/linear_model/_logistic.py:1272: FutureWarning: 'multi_class' was deprecated in version 1.5 and will be removed in 1.8. From then on, it will always use 'multinomial'. Leave it to its default value to avoid this warning.
  warnings.warn(
[I 2026-01-17 15:45:13,404] Trial 2 finished with value: 0.8388409961685823 and parameters: {'C': 0.002909396057508643, 'max_iter': 274, 'solver': 'lbfgs'}. Best is trial 1 with value: 0.9130747126436781.
/home/sjoon/projects/brain_connectivity_classifier/masterthesis_venv2/lib/python3.11/site-packages/sklearn/linear_model/_logistic.py:1272: FutureWarning: 'multi_class' was deprecated in version 1.5 and will be removed in 1.8. From then on, it will always use 'multinomial'. Leave it to its default value to avoid this warning.
  warnings.warn(
[I 2026-01-17 15:45:29,476] Trial 3 finished with value: 0.8819444444444444 and parameters: {'C': 9.180931329804336, 'max_iter': 213, 'solver': 'lbfgs'}. Best is trial 1 with value: 0.9130747126436781.
/home/sjoon/projects/brain_connectivity_classifier/masterthesis_venv2/lib/python3.11/site-packages/sklearn/linear_model/_logistic.py:1272: FutureWarning: 'multi_class' was deprecated in version 1.5 and will be removed in 1.8. From then on, it will always use 'multinomial'. Leave it to its default value to avoid this warning.
  warnings.warn(
[I 2026-01-17 15:45:45,744] Trial 4 finished with value: 0.8931992337164751 and parameters: {'C': 8.017025468558087, 'max_iter': 295, 'solver': 'lbfgs'}. Best is trial 1 with value: 0.9130747126436781.
/home/sjoon/projects/brain_connectivity_classifier/masterthesis_venv2/lib/python3.11/site-packages/sklearn/linear_model/_logistic.py:1272: FutureWarning: 'multi_class' was deprecated in version 1.5 and will be removed in 1.8. From then on, it will always use 'multinomial'. Leave it to its default value to avoid this warning.
  warnings.warn(
[I 2026-01-17 15:45:47,690] Trial 5 finished with value: 0.9102011494252874 and parameters: {'C': 0.10934495147517145, 'max_iter': 119, 'solver': 'newton-cg'}. Best is trial 1 with value: 0.9130747126436781.
/home/sjoon/projects/brain_connectivity_classifier/masterthesis_venv2/lib/python3.11/site-packages/sklearn/linear_model/_logistic.py:1272: FutureWarning: 'multi_class' was deprecated in version 1.5 and will be removed in 1.8. From then on, it will always use 'multinomial'. Leave it to its default value to avoid this warning.
  warnings.warn(
[I 2026-01-17 15:46:07,396] Trial 6 finished with value: 0.875 and parameters: {'C': 0.009354759507486167, 'max_iter': 186, 'solver': 'lbfgs'}. Best is trial 1 with value: 0.9130747126436781.
/home/sjoon/projects/brain_connectivity_classifier/masterthesis_venv2/lib/python3.11/site-packages/sklearn/linear_model/_logistic.py:1272: FutureWarning: 'multi_class' was deprecated in version 1.5 and will be removed in 1.8. From then on, it will always use 'multinomial'. Leave it to its default value to avoid this warning.
  warnings.warn(
[I 2026-01-17 15:46:21,860] Trial 7 finished with value: 0.8860153256704981 and parameters: {'C': 4.927176912697252, 'max_iter': 143, 'solver': 'lbfgs'}. Best is trial 1 with value: 0.9130747126436781.
/home/sjoon/projects/brain_connectivity_classifier/masterthesis_venv2/lib/python3.11/site-packages/sklearn/linear_model/_logistic.py:1272: FutureWarning: 'multi_class' was deprecated in version 1.5 and will be removed in 1.8. From then on, it will always use 'multinomial'. Leave it to its default value to avoid this warning.
  warnings.warn(
[I 2026-01-17 15:46:33,140] Trial 8 finished with value: 0.9078065134099617 and parameters: {'C': 0.25352249141085603, 'max_iter': 192, 'solver': 'lbfgs'}. Best is trial 1 with value: 0.9130747126436781.
/home/sjoon/projects/brain_connectivity_classifier/masterthesis_venv2/lib/python3.11/site-packages/sklearn/linear_model/_logistic.py:1272: FutureWarning: 'multi_class' was deprecated in version 1.5 and will be removed in 1.8. From then on, it will always use 'multinomial'. Leave it to its default value to avoid this warning.
  warnings.warn(
[I 2026-01-17 15:46:49,068] Trial 9 finished with value: 0.9020593869731801 and parameters: {'C': 0.06775665627513389, 'max_iter': 245, 'solver': 'lbfgs'}. Best is trial 1 with value: 0.9130747126436781.
/home/sjoon/projects/brain_connectivity_classifier/masterthesis_venv2/lib/python3.11/site-packages/sklearn/linear_model/_logistic.py:1272: FutureWarning: 'multi_class' was deprecated in version 1.5 and will be removed in 1.8. From then on, it will always use 'multinomial'. Leave it to its default value to avoid this warning.
  warnings.warn(
[I 2026-01-17 15:46:51,850] Trial 10 finished with value: 0.8989463601532567 and parameters: {'C': 0.7535815926355863, 'max_iter': 478, 'solver': 'newton-cg'}. Best is trial 1 with value: 0.9130747126436781.
/home/sjoon/projects/brain_connectivity_classifier/masterthesis_venv2/lib/python3.11/site-packages/sklearn/linear_model/_logistic.py:1272: FutureWarning: 'multi_class' was deprecated in version 1.5 and will be removed in 1.8. From then on, it will always use 'multinomial'. Leave it to its default value to avoid this warning.
  warnings.warn(
[I 2026-01-17 15:46:53,165] Trial 11 finished with value: 0.9013409961685823 and parameters: {'C': 0.0358497315752199, 'max_iter': 102, 'solver': 'newton-cg'}. Best is trial 1 with value: 0.9130747126436781.
/home/sjoon/projects/brain_connectivity_classifier/masterthesis_venv2/lib/python3.11/site-packages/sklearn/linear_model/_logistic.py:1272: FutureWarning: 'multi_class' was deprecated in version 1.5 and will be removed in 1.8. From then on, it will always use 'multinomial'. Leave it to its default value to avoid this warning.
  warnings.warn(
[I 2026-01-17 15:46:54,408] Trial 12 finished with value: 0.896551724137931 and parameters: {'C': 0.44736475527213354, 'max_iter': 101, 'solver': 'newton-cg'}. Best is trial 1 with value: 0.9130747126436781.
/home/sjoon/projects/brain_connectivity_classifier/masterthesis_venv2/lib/python3.11/site-packages/sklearn/linear_model/_logistic.py:1272: FutureWarning: 'multi_class' was deprecated in version 1.5 and will be removed in 1.8. From then on, it will always use 'multinomial'. Leave it to its default value to avoid this warning.
  warnings.warn(
[I 2026-01-17 15:46:55,922] Trial 13 finished with value: 0.8900862068965517 and parameters: {'C': 0.016691123385296113, 'max_iter': 137, 'solver': 'newton-cg'}. Best is trial 1 with value: 0.9130747126436781.
/home/sjoon/projects/brain_connectivity_classifier/masterthesis_venv2/lib/python3.11/site-packages/sklearn/linear_model/_logistic.py:1272: FutureWarning: 'multi_class' was deprecated in version 1.5 and will be removed in 1.8. From then on, it will always use 'multinomial'. Leave it to its default value to avoid this warning.
  warnings.warn(
[I 2026-01-17 15:46:57,376] Trial 14 finished with value: 0.9149904214559387 and parameters: {'C': 0.1539338559030977, 'max_iter': 348, 'solver': 'newton-cg'}. Best is trial 14 with value: 0.9149904214559387.
/home/sjoon/projects/brain_connectivity_classifier/masterthesis_venv2/lib/python3.11/site-packages/sklearn/linear_model/_logistic.py:1272: FutureWarning: 'multi_class' was deprecated in version 1.5 and will be removed in 1.8. From then on, it will always use 'multinomial'. Leave it to its default value to avoid this warning.
  warnings.warn(
[I 2026-01-17 15:46:58,570] Trial 15 finished with value: 0.7883141762452107 and parameters: {'C': 0.0012303483522539905, 'max_iter': 367, 'solver': 'newton-cg'}. Best is trial 14 with value: 0.9149904214559387.
/home/sjoon/projects/brain_connectivity_classifier/masterthesis_venv2/lib/python3.11/site-packages/sklearn/linear_model/_logistic.py:1272: FutureWarning: 'multi_class' was deprecated in version 1.5 and will be removed in 1.8. From then on, it will always use 'multinomial'. Leave it to its default value to avoid this warning.
  warnings.warn(
[I 2026-01-17 15:47:00,282] Trial 16 finished with value: 0.9080459770114943 and parameters: {'C': 1.4565037605783118, 'max_iter': 347, 'solver': 'newton-cg'}. Best is trial 14 with value: 0.9149904214559387.
/home/sjoon/projects/brain_connectivity_classifier/masterthesis_venv2/lib/python3.11/site-packages/sklearn/linear_model/_logistic.py:1272: FutureWarning: 'multi_class' was deprecated in version 1.5 and will be removed in 1.8. From then on, it will always use 'multinomial'. Leave it to its default value to avoid this warning.
  warnings.warn(
[I 2026-01-17 15:47:01,799] Trial 17 finished with value: 0.9137931034482759 and parameters: {'C': 0.17600677357969377, 'max_iter': 430, 'solver': 'newton-cg'}. Best is trial 14 with value: 0.9149904214559387.
/home/sjoon/projects/brain_connectivity_classifier/masterthesis_venv2/lib/python3.11/site-packages/sklearn/linear_model/_logistic.py:1272: FutureWarning: 'multi_class' was deprecated in version 1.5 and will be removed in 1.8. From then on, it will always use 'multinomial'. Leave it to its default value to avoid this warning.
  warnings.warn(
