[I 2026-01-17 15:55:17,140] Trial 46 finished with value: 0.9145114942528736 and parameters: {'C': 0.1771369398789177, 'max_iter': 337, 'solver': 'newton-cg'}. Best is trial 10 with value: 0.923132183908046.
/home/sjoon/projects/brain_connectivity_classifier/masterthesis_venv2/lib/python3.11/site-packages/sklearn/linear_model/_logistic.py:1272: FutureWarning: 'multi_class' was deprecated in version 1.5 and will be removed in 1.8. From then on, it will always use 'multinomial'. Leave it to its default value to avoid this warning.
  warnings.warn(
[I 2026-01-17 15:55:18,867] Trial 47 finished with value: 0.8915229885057471 and parameters: {'C': 0.44925358234371554, 'max_iter': 338, 'solver': 'newton-cg'}. Best is trial 10 with value: 0.923132183908046.
/home/sjoon/projects/brain_connectivity_classifier/masterthesis_venv2/lib/python3.11/site-packages/sklearn/linear_model/_logistic.py:1272: FutureWarning: 'multi_class' was deprecated in version 1.5 and will be removed in 1.8. From then on, it will always use 'multinomial'. Leave it to its default value to avoid this warning.
  warnings.warn(
[I 2026-01-17 15:55:20,485] Trial 48 finished with value: 0.8898467432950191 and parameters: {'C': 1.174147641374347, 'max_iter': 463, 'solver': 'newton-cg'}. Best is trial 10 with value: 0.923132183908046.
/home/sjoon/projects/brain_connectivity_classifier/masterthesis_venv2/lib/python3.11/site-packages/sklearn/linear_model/_logistic.py:1272: FutureWarning: 'multi_class' was deprecated in version 1.5 and will be removed in 1.8. From then on, it will always use 'multinomial'. Leave it to its default value to avoid this warning.
  warnings.warn(
[I 2026-01-17 15:55:22,126] Trial 49 finished with value: 0.9032567049808429 and parameters: {'C': 0.02237071464108733, 'max_iter': 152, 'solver': 'newton-cg'}. Best is trial 10 with value: 0.923132183908046.
/home/sjoon/projects/brain_connectivity_classifier/masterthesis_venv2/lib/python3.11/site-packages/sklearn/linear_model/_logistic.py:1272: FutureWarning: 'multi_class' was deprecated in version 1.5 and will be removed in 1.8. From then on, it will always use 'multinomial'. Leave it to its default value to avoid this warning.
  warnings.warn(
[Parallel(n_jobs=-1)]: Using backend LokyBackend with 16 concurrent workers.
[I 2026-01-17 15:55:32,520] A new study created in memory with name: no-name-38bddd26-417d-4c04-b2bd-6412ecd2860a
/home/sjoon/projects/brain_connectivity_classifier/masterthesis_venv2/lib/python3.11/site-packages/sklearn/linear_model/_logistic.py:1272: FutureWarning: 'multi_class' was deprecated in version 1.5 and will be removed in 1.8. From then on, it will always use 'multinomial'. Leave it to its default value to avoid this warning.
  warnings.warn(
[I 2026-01-17 15:55:43,496] Trial 0 finished with value: 0.8278256704980843 and parameters: {'C': 0.0028441591049060163, 'max_iter': 480, 'solver': 'lbfgs'}. Best is trial 0 with value: 0.8278256704980843.
/home/sjoon/projects/brain_connectivity_classifier/masterthesis_venv2/lib/python3.11/site-packages/sklearn/linear_model/_logistic.py:1272: FutureWarning: 'multi_class' was deprecated in version 1.5 and will be removed in 1.8. From then on, it will always use 'multinomial'. Leave it to its default value to avoid this warning.
  warnings.warn(
[I 2026-01-17 15:55:52,584] Trial 1 finished with value: 0.9013409961685823 and parameters: {'C': 0.676737983619307, 'max_iter': 362, 'solver': 'lbfgs'}. Best is trial 1 with value: 0.9013409961685823.
/home/sjoon/projects/brain_connectivity_classifier/masterthesis_venv2/lib/python3.11/site-packages/sklearn/linear_model/_logistic.py:1272: FutureWarning: 'multi_class' was deprecated in version 1.5 and will be removed in 1.8. From then on, it will always use 'multinomial'. Leave it to its default value to avoid this warning.
  warnings.warn(
[I 2026-01-17 15:56:02,420] Trial 2 finished with value: 0.9049329501915708 and parameters: {'C': 0.6669972526855809, 'max_iter': 148, 'solver': 'lbfgs'}. Best is trial 2 with value: 0.9049329501915708.
/home/sjoon/projects/brain_connectivity_classifier/masterthesis_venv2/lib/python3.11/site-packages/sklearn/linear_model/_logistic.py:1272: FutureWarning: 'multi_class' was deprecated in version 1.5 and will be removed in 1.8. From then on, it will always use 'multinomial'. Leave it to its default value to avoid this warning.
  warnings.warn(
[I 2026-01-17 15:56:12,908] Trial 3 finished with value: 0.8338122605363985 and parameters: {'C': 0.002482583241528884, 'max_iter': 162, 'solver': 'lbfgs'}. Best is trial 2 with value: 0.9049329501915708.
/home/sjoon/projects/brain_connectivity_classifier/masterthesis_venv2/lib/python3.11/site-packages/sklearn/linear_model/_logistic.py:1272: FutureWarning: 'multi_class' was deprecated in version 1.5 and will be removed in 1.8. From then on, it will always use 'multinomial'. Leave it to its default value to avoid this warning.
  warnings.warn(
[I 2026-01-17 15:56:14,628] Trial 4 finished with value: 0.8692528735632183 and parameters: {'C': 0.005520476332498233, 'max_iter': 438, 'solver': 'newton-cg'}. Best is trial 2 with value: 0.9049329501915708.
/home/sjoon/projects/brain_connectivity_classifier/masterthesis_venv2/lib/python3.11/site-packages/sklearn/linear_model/_logistic.py:1272: FutureWarning: 'multi_class' was deprecated in version 1.5 and will be removed in 1.8. From then on, it will always use 'multinomial'. Leave it to its default value to avoid this warning.
  warnings.warn(
[I 2026-01-17 15:56:25,956] Trial 5 finished with value: 0.8970306513409961 and parameters: {'C': 6.5712914521521935, 'max_iter': 122, 'solver': 'lbfgs'}. Best is trial 2 with value: 0.9049329501915708.
/home/sjoon/projects/brain_connectivity_classifier/masterthesis_venv2/lib/python3.11/site-packages/sklearn/linear_model/_logistic.py:1272: FutureWarning: 'multi_class' was deprecated in version 1.5 and will be removed in 1.8. From then on, it will always use 'multinomial'. Leave it to its default value to avoid this warning.
  warnings.warn(
[I 2026-01-17 15:56:27,664] Trial 6 finished with value: 0.9025383141762452 and parameters: {'C': 2.674006332791668, 'max_iter': 306, 'solver': 'newton-cg'}. Best is trial 2 with value: 0.9049329501915708.
/home/sjoon/projects/brain_connectivity_classifier/masterthesis_venv2/lib/python3.11/site-packages/sklearn/linear_model/_logistic.py:1272: FutureWarning: 'multi_class' was deprecated in version 1.5 and will be removed in 1.8. From then on, it will always use 'multinomial'. Leave it to its default value to avoid this warning.
  warnings.warn(
[I 2026-01-17 15:56:38,640] Trial 7 finished with value: 0.9109195402298851 and parameters: {'C': 0.11232957583917665, 'max_iter': 133, 'solver': 'lbfgs'}. Best is trial 7 with value: 0.9109195402298851.
/home/sjoon/projects/brain_connectivity_classifier/masterthesis_venv2/lib/python3.11/site-packages/sklearn/linear_model/_logistic.py:1272: FutureWarning: 'multi_class' was deprecated in version 1.5 and will be removed in 1.8. From then on, it will always use 'multinomial'. Leave it to its default value to avoid this warning.
  warnings.warn(
[I 2026-01-17 15:56:39,688] Trial 8 finished with value: 0.7478448275862069 and parameters: {'C': 0.0011025751793016115, 'max_iter': 415, 'solver': 'newton-cg'}. Best is trial 7 with value: 0.9109195402298851.
/home/sjoon/projects/brain_connectivity_classifier/masterthesis_venv2/lib/python3.11/site-packages/sklearn/linear_model/_logistic.py:1272: FutureWarning: 'multi_class' was deprecated in version 1.5 and will be removed in 1.8. From then on, it will always use 'multinomial'. Leave it to its default value to avoid this warning.
  warnings.warn(
[I 2026-01-17 15:56:41,194] Trial 9 finished with value: 0.8977490421455939 and parameters: {'C': 0.9545115569638085, 'max_iter': 153, 'solver': 'newton-cg'}. Best is trial 7 with value: 0.9109195402298851.
/home/sjoon/projects/brain_connectivity_classifier/masterthesis_venv2/lib/python3.11/site-packages/sklearn/linear_model/_logistic.py:1272: FutureWarning: 'multi_class' was deprecated in version 1.5 and will be removed in 1.8. From then on, it will always use 'multinomial'. Leave it to its default value to avoid this warning.
  warnings.warn(
[I 2026-01-17 15:56:52,236] Trial 10 finished with value: 0.9056513409961686 and parameters: {'C': 0.04204561005028862, 'max_iter': 225, 'solver': 'lbfgs'}. Best is trial 7 with value: 0.9109195402298851.
/home/sjoon/projects/brain_connectivity_classifier/masterthesis_venv2/lib/python3.11/site-packages/sklearn/linear_model/_logistic.py:1272: FutureWarning: 'multi_class' was deprecated in version 1.5 and will be removed in 1.8. From then on, it will always use 'multinomial'. Leave it to its default value to avoid this warning.
  warnings.warn(
[I 2026-01-17 15:57:05,740] Trial 11 finished with value: 0.9233716475095786 and parameters: {'C': 0.03997785541283189, 'max_iter': 229, 'solver': 'lbfgs'}. Best is trial 11 with value: 0.9233716475095786.
/home/sjoon/projects/brain_connectivity_classifier/masterthesis_venv2/lib/python3.11/site-packages/sklearn/linear_model/_logistic.py:1272: FutureWarning: 'multi_class' was deprecated in version 1.5 and will be removed in 1.8. From then on, it will always use 'multinomial'. Leave it to its default value to avoid this warning.
  warnings.warn(
[I 2026-01-17 15:57:18,028] Trial 12 finished with value: 0.9169061302681992 and parameters: {'C': 0.055832415964154246, 'max_iter': 204, 'solver': 'lbfgs'}. Best is trial 11 with value: 0.9233716475095786.
/home/sjoon/projects/brain_connectivity_classifier/masterthesis_venv2/lib/python3.11/site-packages/sklearn/linear_model/_logistic.py:1272: FutureWarning: 'multi_class' was deprecated in version 1.5 and will be removed in 1.8. From then on, it will always use 'multinomial'. Leave it to its default value to avoid this warning.
  warnings.warn(
[I 2026-01-17 15:57:31,592] Trial 13 finished with value: 0.9006226053639846 and parameters: {'C': 0.02603472980014387, 'max_iter': 222, 'solver': 'lbfgs'}. Best is trial 11 with value: 0.9233716475095786.
/home/sjoon/projects/brain_connectivity_classifier/masterthesis_venv2/lib/python3.11/site-packages/sklearn/linear_model/_logistic.py:1272: FutureWarning: 'multi_class' was deprecated in version 1.5 and will be removed in 1.8. From then on, it will always use 'multinomial'. Leave it to its default value to avoid this warning.
  warnings.warn(
[I 2026-01-17 15:57:42,364] Trial 14 finished with value: 0.9181034482758621 and parameters: {'C': 0.13559447707543248, 'max_iter': 216, 'solver': 'lbfgs'}. Best is trial 11 with value: 0.9233716475095786.
/home/sjoon/projects/brain_connectivity_classifier/masterthesis_venv2/lib/python3.11/site-packages/sklearn/linear_model/_logistic.py:1272: FutureWarning: 'multi_class' was deprecated in version 1.5 and will be removed in 1.8. From then on, it will always use 'multinomial'. Leave it to its default value to avoid this warning.
  warnings.warn(
[I 2026-01-17 15:57:51,512] Trial 15 finished with value: 0.9085249042145593 and parameters: {'C': 0.16823079841650115, 'max_iter': 287, 'solver': 'lbfgs'}. Best is trial 11 with value: 0.9233716475095786.
/home/sjoon/projects/brain_connectivity_classifier/masterthesis_venv2/lib/python3.11/site-packages/sklearn/linear_model/_logistic.py:1272: FutureWarning: 'multi_class' was deprecated in version 1.5 and will be removed in 1.8. From then on, it will always use 'multinomial'. Leave it to its default value to avoid this warning.
  warnings.warn(
[I 2026-01-17 15:58:03,888] Trial 16 finished with value: 0.89272030651341 and parameters: {'C': 0.011790154969838158, 'max_iter': 183, 'solver': 'lbfgs'}. Best is trial 11 with value: 0.9233716475095786.
/home/sjoon/projects/brain_connectivity_classifier/masterthesis_venv2/lib/python3.11/site-packages/sklearn/linear_model/_logistic.py:1272: FutureWarning: 'multi_class' was deprecated in version 1.5 and will be removed in 1.8. From then on, it will always use 'multinomial'. Leave it to its default value to avoid this warning.
  warnings.warn(
[I 2026-01-17 15:58:13,260] Trial 17 finished with value: 0.9078065134099617 and parameters: {'C': 0.20200173834689766, 'max_iter': 268, 'solver': 'lbfgs'}. Best is trial 11 with value: 0.9233716475095786.
/home/sjoon/projects/brain_connectivity_classifier/masterthesis_venv2/lib/python3.11/site-packages/sklearn/linear_model/_logistic.py:1272: FutureWarning: 'multi_class' was deprecated in version 1.5 and will be removed in 1.8. From then on, it will always use 'multinomial'. Leave it to its default value to avoid this warning.
  warnings.warn(
[I 2026-01-17 15:58:14,789] Trial 18 finished with value: 0.8963122605363985 and parameters: {'C': 0.016169767660276144, 'max_iter': 105, 'solver': 'newton-cg'}. Best is trial 11 with value: 0.9233716475095786.
/home/sjoon/projects/brain_connectivity_classifier/masterthesis_venv2/lib/python3.11/site-packages/sklearn/linear_model/_logistic.py:1272: FutureWarning: 'multi_class' was deprecated in version 1.5 and will be removed in 1.8. From then on, it will always use 'multinomial'. Leave it to its default value to avoid this warning.
  warnings.warn(
[I 2026-01-17 15:58:23,352] Trial 19 finished with value: 0.9044540229885057 and parameters: {'C': 0.3358294682352954, 'max_iter': 261, 'solver': 'lbfgs'}. Best is trial 11 with value: 0.9233716475095786.
/home/sjoon/projects/brain_connectivity_classifier/masterthesis_venv2/lib/python3.11/site-packages/sklearn/linear_model/_logistic.py:1272: FutureWarning: 'multi_class' was deprecated in version 1.5 and will be removed in 1.8. From then on, it will always use 'multinomial'. Leave it to its default value to avoid this warning.
  warnings.warn(
[I 2026-01-17 15:58:34,707] Trial 20 finished with value: 0.9243295019157088 and parameters: {'C': 0.08714696531364584, 'max_iter': 331, 'solver': 'lbfgs'}. Best is trial 20 with value: 0.9243295019157088.
/home/sjoon/projects/brain_connectivity_classifier/masterthesis_venv2/lib/python3.11/site-packages/sklearn/linear_model/_logistic.py:1272: FutureWarning: 'multi_class' was deprecated in version 1.5 and will be removed in 1.8. From then on, it will always use 'multinomial'. Leave it to its default value to avoid this warning.
  warnings.warn(
[I 2026-01-17 15:58:46,696] Trial 21 finished with value: 0.9034961685823755 and parameters: {'C': 0.06927232290867875, 'max_iter': 338, 'solver': 'lbfgs'}. Best is trial 20 with value: 0.9243295019157088.
/home/sjoon/projects/brain_connectivity_classifier/masterthesis_venv2/lib/python3.11/site-packages/sklearn/linear_model/_logistic.py:1272: FutureWarning: 'multi_class' was deprecated in version 1.5 and will be removed in 1.8. From then on, it will always use 'multinomial'. Leave it to its default value to avoid this warning.
  warnings.warn(
[I 2026-01-17 15:58:56,068] Trial 22 finished with value: 0.9039750957854407 and parameters: {'C': 0.29947434348458185, 'max_iter': 238, 'solver': 'lbfgs'}. Best is trial 20 with value: 0.9243295019157088.
/home/sjoon/projects/brain_connectivity_classifier/masterthesis_venv2/lib/python3.11/site-packages/sklearn/linear_model/_logistic.py:1272: FutureWarning: 'multi_class' was deprecated in version 1.5 and will be removed in 1.8. From then on, it will always use 'multinomial'. Leave it to its default value to avoid this warning.
  warnings.warn(
[I 2026-01-17 15:59:08,284] Trial 23 finished with value: 0.8929597701149425 and parameters: {'C': 0.021126342756391636, 'max_iter': 186, 'solver': 'lbfgs'}. Best is trial 20 with value: 0.9243295019157088.
/home/sjoon/projects/brain_connectivity_classifier/masterthesis_venv2/lib/python3.11/site-packages/sklearn/linear_model/_logistic.py:1272: FutureWarning: 'multi_class' was deprecated in version 1.5 and will be removed in 1.8. From then on, it will always use 'multinomial'. Leave it to its default value to avoid this warning.
  warnings.warn(
[I 2026-01-17 15:59:20,132] Trial 24 finished with value: 0.9039750957854407 and parameters: {'C': 0.08506766505346873, 'max_iter': 344, 'solver': 'lbfgs'}. Best is trial 20 with value: 0.9243295019157088.
/home/sjoon/projects/brain_connectivity_classifier/masterthesis_venv2/lib/python3.11/site-packages/sklearn/linear_model/_logistic.py:1272: FutureWarning: 'multi_class' was deprecated in version 1.5 and will be removed in 1.8. From then on, it will always use 'multinomial'. Leave it to its default value to avoid this warning.
  warnings.warn(
[I 2026-01-17 15:59:32,048] Trial 25 finished with value: 0.883860153256705 and parameters: {'C': 0.007531749656203795, 'max_iter': 191, 'solver': 'lbfgs'}. Best is trial 20 with value: 0.9243295019157088.
/home/sjoon/projects/brain_connectivity_classifier/masterthesis_venv2/lib/python3.11/site-packages/sklearn/linear_model/_logistic.py:1272: FutureWarning: 'multi_class' was deprecated in version 1.5 and will be removed in 1.8. From then on, it will always use 'multinomial'. Leave it to its default value to avoid this warning.
  warnings.warn(
[I 2026-01-17 15:59:33,810] Trial 26 finished with value: 0.8953544061302682 and parameters: {'C': 1.4134101026177435, 'max_iter': 244, 'solver': 'newton-cg'}. Best is trial 20 with value: 0.9243295019157088.
/home/sjoon/projects/brain_connectivity_classifier/masterthesis_venv2/lib/python3.11/site-packages/sklearn/linear_model/_logistic.py:1272: FutureWarning: 'multi_class' was deprecated in version 1.5 and will be removed in 1.8. From then on, it will always use 'multinomial'. Leave it to its default value to avoid this warning.
  warnings.warn(
[I 2026-01-17 15:59:45,472] Trial 27 finished with value: 0.8991858237547893 and parameters: {'C': 0.03564724302452583, 'max_iter': 321, 'solver': 'lbfgs'}. Best is trial 20 with value: 0.9243295019157088.
/home/sjoon/projects/brain_connectivity_classifier/masterthesis_venv2/lib/python3.11/site-packages/sklearn/linear_model/_logistic.py:1272: FutureWarning: 'multi_class' was deprecated in version 1.5 and will be removed in 1.8. From then on, it will always use 'multinomial'. Leave it to its default value to avoid this warning.
  warnings.warn(
[I 2026-01-17 15:59:57,252] Trial 28 finished with value: 0.9238505747126436 and parameters: {'C': 0.12774356480821045, 'max_iter': 386, 'solver': 'lbfgs'}. Best is trial 20 with value: 0.9243295019157088.
/home/sjoon/projects/brain_connectivity_classifier/masterthesis_venv2/lib/python3.11/site-packages/sklearn/linear_model/_logistic.py:1272: FutureWarning: 'multi_class' was deprecated in version 1.5 and will be removed in 1.8. From then on, it will always use 'multinomial'. Leave it to its default value to avoid this warning.
  warnings.warn(
[I 2026-01-17 16:00:06,320] Trial 29 finished with value: 0.9193007662835249 and parameters: {'C': 0.39910232760788833, 'max_iter': 474, 'solver': 'lbfgs'}. Best is trial 20 with value: 0.9243295019157088.
/home/sjoon/projects/brain_connectivity_classifier/masterthesis_venv2/lib/python3.11/site-packages/sklearn/linear_model/_logistic.py:1272: FutureWarning: 'multi_class' was deprecated in version 1.5 and will be removed in 1.8. From then on, it will always use 'multinomial'. Leave it to its default value to avoid this warning.
  warnings.warn(
[I 2026-01-17 16:00:18,640] Trial 30 finished with value: 0.8541666666666666 and parameters: {'C': 0.004230798582417213, 'max_iter': 409, 'solver': 'lbfgs'}. Best is trial 20 with value: 0.9243295019157088.
/home/sjoon/projects/brain_connectivity_classifier/masterthesis_venv2/lib/python3.11/site-packages/sklearn/linear_model/_logistic.py:1272: FutureWarning: 'multi_class' was deprecated in version 1.5 and will be removed in 1.8. From then on, it will always use 'multinomial'. Leave it to its default value to avoid this warning.
  warnings.warn(
[I 2026-01-17 16:00:27,492] Trial 31 finished with value: 0.9049329501915708 and parameters: {'C': 0.38154700561614696, 'max_iter': 496, 'solver': 'lbfgs'}. Best is trial 20 with value: 0.9243295019157088.
/home/sjoon/projects/brain_connectivity_classifier/masterthesis_venv2/lib/python3.11/site-packages/sklearn/linear_model/_logistic.py:1272: FutureWarning: 'multi_class' was deprecated in version 1.5 and will be removed in 1.8. From then on, it will always use 'multinomial'. Leave it to its default value to avoid this warning.
  warnings.warn(
[I 2026-01-17 16:00:39,568] Trial 32 finished with value: 0.9147509578544061 and parameters: {'C': 0.08838211594956322, 'max_iter': 379, 'solver': 'lbfgs'}. Best is trial 20 with value: 0.9243295019157088.
/home/sjoon/projects/brain_connectivity_classifier/masterthesis_venv2/lib/python3.11/site-packages/sklearn/linear_model/_logistic.py:1272: FutureWarning: 'multi_class' was deprecated in version 1.5 and will be removed in 1.8. From then on, it will always use 'multinomial'. Leave it to its default value to avoid this warning.
  warnings.warn(
[I 2026-01-17 16:00:49,880] Trial 33 finished with value: 0.9080459770114943 and parameters: {'C': 0.4971480480454988, 'max_iter': 450, 'solver': 'lbfgs'}. Best is trial 20 with value: 0.9243295019157088.
/home/sjoon/projects/brain_connectivity_classifier/masterthesis_venv2/lib/python3.11/site-packages/sklearn/linear_model/_logistic.py:1272: FutureWarning: 'multi_class' was deprecated in version 1.5 and will be removed in 1.8. From then on, it will always use 'multinomial'. Leave it to its default value to avoid this warning.
  warnings.warn(
[I 2026-01-17 16:00:58,428] Trial 34 finished with value: 0.9099616858237548 and parameters: {'C': 0.2170070753680049, 'max_iter': 386, 'solver': 'lbfgs'}. Best is trial 20 with value: 0.9243295019157088.
/home/sjoon/projects/brain_connectivity_classifier/masterthesis_venv2/lib/python3.11/site-packages/sklearn/linear_model/_logistic.py:1272: FutureWarning: 'multi_class' was deprecated in version 1.5 and will be removed in 1.8. From then on, it will always use 'multinomial'. Leave it to its default value to avoid this warning.
  warnings.warn(
