[I 2026-01-17 15:13:32,424] Trial 44 finished with value: 0.9178639846743295 and parameters: {'C': 0.18739364823107027, 'max_iter': 403, 'solver': 'lbfgs'}. Best is trial 10 with value: 0.9243295019157088.
/home/sjoon/projects/brain_connectivity_classifier/masterthesis_venv2/lib/python3.11/site-packages/sklearn/linear_model/_logistic.py:1272: FutureWarning: 'multi_class' was deprecated in version 1.5 and will be removed in 1.8. From then on, it will always use 'multinomial'. Leave it to its default value to avoid this warning.
  warnings.warn(
[I 2026-01-17 15:13:44,120] Trial 45 finished with value: 0.9152298850574713 and parameters: {'C': 0.3103284107752913, 'max_iter': 439, 'solver': 'lbfgs'}. Best is trial 10 with value: 0.9243295019157088.
/home/sjoon/projects/brain_connectivity_classifier/masterthesis_venv2/lib/python3.11/site-packages/sklearn/linear_model/_logistic.py:1272: FutureWarning: 'multi_class' was deprecated in version 1.5 and will be removed in 1.8. From then on, it will always use 'multinomial'. Leave it to its default value to avoid this warning.
  warnings.warn(
[I 2026-01-17 15:13:45,766] Trial 46 finished with value: 0.9087643678160919 and parameters: {'C': 0.19230646104360305, 'max_iter': 400, 'solver': 'newton-cg'}. Best is trial 10 with value: 0.9243295019157088.
/home/sjoon/projects/brain_connectivity_classifier/masterthesis_venv2/lib/python3.11/site-packages/sklearn/linear_model/_logistic.py:1272: FutureWarning: 'multi_class' was deprecated in version 1.5 and will be removed in 1.8. From then on, it will always use 'multinomial'. Leave it to its default value to avoid this warning.
  warnings.warn(
[I 2026-01-17 15:13:55,720] Trial 47 finished with value: 0.9099616858237548 and parameters: {'C': 0.44925358234371554, 'max_iter': 474, 'solver': 'lbfgs'}. Best is trial 10 with value: 0.9243295019157088.
/home/sjoon/projects/brain_connectivity_classifier/masterthesis_venv2/lib/python3.11/site-packages/sklearn/linear_model/_logistic.py:1272: FutureWarning: 'multi_class' was deprecated in version 1.5 and will be removed in 1.8. From then on, it will always use 'multinomial'. Leave it to its default value to avoid this warning.
  warnings.warn(
[I 2026-01-17 15:14:07,484] Trial 48 finished with value: 0.8869731800766284 and parameters: {'C': 1.6537844733707296, 'max_iter': 497, 'solver': 'lbfgs'}. Best is trial 10 with value: 0.9243295019157088.
/home/sjoon/projects/brain_connectivity_classifier/masterthesis_venv2/lib/python3.11/site-packages/sklearn/linear_model/_logistic.py:1272: FutureWarning: 'multi_class' was deprecated in version 1.5 and will be removed in 1.8. From then on, it will always use 'multinomial'. Leave it to its default value to avoid this warning.
  warnings.warn(
[I 2026-01-17 15:14:21,404] Trial 49 finished with value: 0.9164272030651341 and parameters: {'C': 0.07355854315185563, 'max_iter': 385, 'solver': 'lbfgs'}. Best is trial 10 with value: 0.9243295019157088.
/home/sjoon/projects/brain_connectivity_classifier/masterthesis_venv2/lib/python3.11/site-packages/sklearn/linear_model/_logistic.py:1272: FutureWarning: 'multi_class' was deprecated in version 1.5 and will be removed in 1.8. From then on, it will always use 'multinomial'. Leave it to its default value to avoid this warning.
  warnings.warn(
[Parallel(n_jobs=-1)]: Using backend LokyBackend with 16 concurrent workers.
[I 2026-01-17 15:14:32,796] A new study created in memory with name: no-name-167dd585-b150-4f12-9639-50819f45ec60
/home/sjoon/projects/brain_connectivity_classifier/masterthesis_venv2/lib/python3.11/site-packages/sklearn/linear_model/_logistic.py:1272: FutureWarning: 'multi_class' was deprecated in version 1.5 and will be removed in 1.8. From then on, it will always use 'multinomial'. Leave it to its default value to avoid this warning.
  warnings.warn(
[I 2026-01-17 15:14:45,780] Trial 0 finished with value: 0.8426724137931034 and parameters: {'C': 0.0028441591049060163, 'max_iter': 480, 'solver': 'lbfgs'}. Best is trial 0 with value: 0.8426724137931034.
/home/sjoon/projects/brain_connectivity_classifier/masterthesis_venv2/lib/python3.11/site-packages/sklearn/linear_model/_logistic.py:1272: FutureWarning: 'multi_class' was deprecated in version 1.5 and will be removed in 1.8. From then on, it will always use 'multinomial'. Leave it to its default value to avoid this warning.
  warnings.warn(
[I 2026-01-17 15:14:57,432] Trial 1 finished with value: 0.9011015325670498 and parameters: {'C': 0.676737983619307, 'max_iter': 362, 'solver': 'lbfgs'}. Best is trial 1 with value: 0.9011015325670498.
/home/sjoon/projects/brain_connectivity_classifier/masterthesis_venv2/lib/python3.11/site-packages/sklearn/linear_model/_logistic.py:1272: FutureWarning: 'multi_class' was deprecated in version 1.5 and will be removed in 1.8. From then on, it will always use 'multinomial'. Leave it to its default value to avoid this warning.
  warnings.warn(
[I 2026-01-17 15:15:08,912] Trial 2 finished with value: 0.9087643678160919 and parameters: {'C': 0.6669972526855809, 'max_iter': 148, 'solver': 'lbfgs'}. Best is trial 2 with value: 0.9087643678160919.
/home/sjoon/projects/brain_connectivity_classifier/masterthesis_venv2/lib/python3.11/site-packages/sklearn/linear_model/_logistic.py:1272: FutureWarning: 'multi_class' was deprecated in version 1.5 and will be removed in 1.8. From then on, it will always use 'multinomial'. Leave it to its default value to avoid this warning.
  warnings.warn(
[I 2026-01-17 15:15:22,656] Trial 3 finished with value: 0.8369252873563219 and parameters: {'C': 0.002482583241528884, 'max_iter': 162, 'solver': 'lbfgs'}. Best is trial 2 with value: 0.9087643678160919.
/home/sjoon/projects/brain_connectivity_classifier/masterthesis_venv2/lib/python3.11/site-packages/sklearn/linear_model/_logistic.py:1272: FutureWarning: 'multi_class' was deprecated in version 1.5 and will be removed in 1.8. From then on, it will always use 'multinomial'. Leave it to its default value to avoid this warning.
  warnings.warn(
[I 2026-01-17 15:15:24,783] Trial 4 finished with value: 0.8797892720306514 and parameters: {'C': 0.005520476332498233, 'max_iter': 438, 'solver': 'newton-cg'}. Best is trial 2 with value: 0.9087643678160919.
/home/sjoon/projects/brain_connectivity_classifier/masterthesis_venv2/lib/python3.11/site-packages/sklearn/linear_model/_logistic.py:1272: FutureWarning: 'multi_class' was deprecated in version 1.5 and will be removed in 1.8. From then on, it will always use 'multinomial'. Leave it to its default value to avoid this warning.
  warnings.warn(
[I 2026-01-17 15:15:35,524] Trial 5 finished with value: 0.9022988505747126 and parameters: {'C': 6.5712914521521935, 'max_iter': 122, 'solver': 'lbfgs'}. Best is trial 2 with value: 0.9087643678160919.
/home/sjoon/projects/brain_connectivity_classifier/masterthesis_venv2/lib/python3.11/site-packages/sklearn/linear_model/_logistic.py:1272: FutureWarning: 'multi_class' was deprecated in version 1.5 and will be removed in 1.8. From then on, it will always use 'multinomial'. Leave it to its default value to avoid this warning.
  warnings.warn(
[I 2026-01-17 15:15:37,898] Trial 6 finished with value: 0.9001436781609196 and parameters: {'C': 2.674006332791668, 'max_iter': 306, 'solver': 'newton-cg'}. Best is trial 2 with value: 0.9087643678160919.
/home/sjoon/projects/brain_connectivity_classifier/masterthesis_venv2/lib/python3.11/site-packages/sklearn/linear_model/_logistic.py:1272: FutureWarning: 'multi_class' was deprecated in version 1.5 and will be removed in 1.8. From then on, it will always use 'multinomial'. Leave it to its default value to avoid this warning.
  warnings.warn(
[I 2026-01-17 15:15:48,904] Trial 7 finished with value: 0.9106800766283525 and parameters: {'C': 0.11232957583917665, 'max_iter': 133, 'solver': 'lbfgs'}. Best is trial 7 with value: 0.9106800766283525.
/home/sjoon/projects/brain_connectivity_classifier/masterthesis_venv2/lib/python3.11/site-packages/sklearn/linear_model/_logistic.py:1272: FutureWarning: 'multi_class' was deprecated in version 1.5 and will be removed in 1.8. From then on, it will always use 'multinomial'. Leave it to its default value to avoid this warning.
  warnings.warn(
[I 2026-01-17 15:15:51,040] Trial 8 finished with value: 0.7567049808429118 and parameters: {'C': 0.0011025751793016115, 'max_iter': 415, 'solver': 'newton-cg'}. Best is trial 7 with value: 0.9106800766283525.
/home/sjoon/projects/brain_connectivity_classifier/masterthesis_venv2/lib/python3.11/site-packages/sklearn/linear_model/_logistic.py:1272: FutureWarning: 'multi_class' was deprecated in version 1.5 and will be removed in 1.8. From then on, it will always use 'multinomial'. Leave it to its default value to avoid this warning.
  warnings.warn(
[I 2026-01-17 15:15:52,267] Trial 9 finished with value: 0.9113984674329502 and parameters: {'C': 0.9545115569638085, 'max_iter': 153, 'solver': 'newton-cg'}. Best is trial 9 with value: 0.9113984674329502.
/home/sjoon/projects/brain_connectivity_classifier/masterthesis_venv2/lib/python3.11/site-packages/sklearn/linear_model/_logistic.py:1272: FutureWarning: 'multi_class' was deprecated in version 1.5 and will be removed in 1.8. From then on, it will always use 'multinomial'. Leave it to its default value to avoid this warning.
  warnings.warn(
[I 2026-01-17 15:15:53,678] Trial 10 finished with value: 0.9068486590038314 and parameters: {'C': 0.029381398074314703, 'max_iter': 217, 'solver': 'newton-cg'}. Best is trial 9 with value: 0.9113984674329502.
/home/sjoon/projects/brain_connectivity_classifier/masterthesis_venv2/lib/python3.11/site-packages/sklearn/linear_model/_logistic.py:1272: FutureWarning: 'multi_class' was deprecated in version 1.5 and will be removed in 1.8. From then on, it will always use 'multinomial'. Leave it to its default value to avoid this warning.
  warnings.warn(
[I 2026-01-17 15:15:54,933] Trial 11 finished with value: 0.9185823754789272 and parameters: {'C': 0.08595484384746106, 'max_iter': 102, 'solver': 'newton-cg'}. Best is trial 11 with value: 0.9185823754789272.
/home/sjoon/projects/brain_connectivity_classifier/masterthesis_venv2/lib/python3.11/site-packages/sklearn/linear_model/_logistic.py:1272: FutureWarning: 'multi_class' was deprecated in version 1.5 and will be removed in 1.8. From then on, it will always use 'multinomial'. Leave it to its default value to avoid this warning.
  warnings.warn(
[I 2026-01-17 15:15:56,027] Trial 12 finished with value: 0.9171455938697318 and parameters: {'C': 0.10748564369186675, 'max_iter': 104, 'solver': 'newton-cg'}. Best is trial 11 with value: 0.9185823754789272.
/home/sjoon/projects/brain_connectivity_classifier/masterthesis_venv2/lib/python3.11/site-packages/sklearn/linear_model/_logistic.py:1272: FutureWarning: 'multi_class' was deprecated in version 1.5 and will be removed in 1.8. From then on, it will always use 'multinomial'. Leave it to its default value to avoid this warning.
  warnings.warn(
[I 2026-01-17 15:15:57,374] Trial 13 finished with value: 0.9185823754789272 and parameters: {'C': 0.07524841741478018, 'max_iter': 206, 'solver': 'newton-cg'}. Best is trial 11 with value: 0.9185823754789272.
/home/sjoon/projects/brain_connectivity_classifier/masterthesis_venv2/lib/python3.11/site-packages/sklearn/linear_model/_logistic.py:1272: FutureWarning: 'multi_class' was deprecated in version 1.5 and will be removed in 1.8. From then on, it will always use 'multinomial'. Leave it to its default value to avoid this warning.
  warnings.warn(
[I 2026-01-17 15:15:59,052] Trial 14 finished with value: 0.9068486590038314 and parameters: {'C': 0.02442740652544532, 'max_iter': 225, 'solver': 'newton-cg'}. Best is trial 11 with value: 0.9185823754789272.
/home/sjoon/projects/brain_connectivity_classifier/masterthesis_venv2/lib/python3.11/site-packages/sklearn/linear_model/_logistic.py:1272: FutureWarning: 'multi_class' was deprecated in version 1.5 and will be removed in 1.8. From then on, it will always use 'multinomial'. Leave it to its default value to avoid this warning.
  warnings.warn(
[I 2026-01-17 15:16:00,482] Trial 15 finished with value: 0.8975095785440613 and parameters: {'C': 0.024709733135364412, 'max_iter': 203, 'solver': 'newton-cg'}. Best is trial 11 with value: 0.9185823754789272.
/home/sjoon/projects/brain_connectivity_classifier/masterthesis_venv2/lib/python3.11/site-packages/sklearn/linear_model/_logistic.py:1272: FutureWarning: 'multi_class' was deprecated in version 1.5 and will be removed in 1.8. From then on, it will always use 'multinomial'. Leave it to its default value to avoid this warning.
  warnings.warn(
[I 2026-01-17 15:16:01,835] Trial 16 finished with value: 0.9128352490421456 and parameters: {'C': 0.1911630781649312, 'max_iter': 274, 'solver': 'newton-cg'}. Best is trial 11 with value: 0.9185823754789272.
/home/sjoon/projects/brain_connectivity_classifier/masterthesis_venv2/lib/python3.11/site-packages/sklearn/linear_model/_logistic.py:1272: FutureWarning: 'multi_class' was deprecated in version 1.5 and will be removed in 1.8. From then on, it will always use 'multinomial'. Leave it to its default value to avoid this warning.
  warnings.warn(
[I 2026-01-17 15:16:03,368] Trial 17 finished with value: 0.8881704980842912 and parameters: {'C': 0.011765569080053809, 'max_iter': 188, 'solver': 'newton-cg'}. Best is trial 11 with value: 0.9185823754789272.
/home/sjoon/projects/brain_connectivity_classifier/masterthesis_venv2/lib/python3.11/site-packages/sklearn/linear_model/_logistic.py:1272: FutureWarning: 'multi_class' was deprecated in version 1.5 and will be removed in 1.8. From then on, it will always use 'multinomial'. Leave it to its default value to avoid this warning.
  warnings.warn(
[I 2026-01-17 15:16:04,704] Trial 18 finished with value: 0.9111590038314177 and parameters: {'C': 0.20082669625492605, 'max_iter': 103, 'solver': 'newton-cg'}. Best is trial 11 with value: 0.9185823754789272.
/home/sjoon/projects/brain_connectivity_classifier/masterthesis_venv2/lib/python3.11/site-packages/sklearn/linear_model/_logistic.py:1272: FutureWarning: 'multi_class' was deprecated in version 1.5 and will be removed in 1.8. From then on, it will always use 'multinomial'. Leave it to its default value to avoid this warning.
  warnings.warn(
[I 2026-01-17 15:16:06,147] Trial 19 finished with value: 0.9152298850574713 and parameters: {'C': 0.0475654777829324, 'max_iter': 276, 'solver': 'newton-cg'}. Best is trial 11 with value: 0.9185823754789272.
/home/sjoon/projects/brain_connectivity_classifier/masterthesis_venv2/lib/python3.11/site-packages/sklearn/linear_model/_logistic.py:1272: FutureWarning: 'multi_class' was deprecated in version 1.5 and will be removed in 1.8. From then on, it will always use 'multinomial'. Leave it to its default value to avoid this warning.
  warnings.warn(
[I 2026-01-17 15:16:07,460] Trial 20 finished with value: 0.912595785440613 and parameters: {'C': 0.272250991349576, 'max_iter': 178, 'solver': 'newton-cg'}. Best is trial 11 with value: 0.9185823754789272.
/home/sjoon/projects/brain_connectivity_classifier/masterthesis_venv2/lib/python3.11/site-packages/sklearn/linear_model/_logistic.py:1272: FutureWarning: 'multi_class' was deprecated in version 1.5 and will be removed in 1.8. From then on, it will always use 'multinomial'. Leave it to its default value to avoid this warning.
  warnings.warn(
[I 2026-01-17 15:16:09,141] Trial 21 finished with value: 0.9137931034482759 and parameters: {'C': 0.060229940479643855, 'max_iter': 100, 'solver': 'newton-cg'}. Best is trial 11 with value: 0.9185823754789272.
/home/sjoon/projects/brain_connectivity_classifier/masterthesis_venv2/lib/python3.11/site-packages/sklearn/linear_model/_logistic.py:1272: FutureWarning: 'multi_class' was deprecated in version 1.5 and will be removed in 1.8. From then on, it will always use 'multinomial'. Leave it to its default value to avoid this warning.
  warnings.warn(
[I 2026-01-17 15:16:10,394] Trial 22 finished with value: 0.907088122605364 and parameters: {'C': 0.09912171651310286, 'max_iter': 120, 'solver': 'newton-cg'}. Best is trial 11 with value: 0.9185823754789272.
/home/sjoon/projects/brain_connectivity_classifier/masterthesis_venv2/lib/python3.11/site-packages/sklearn/linear_model/_logistic.py:1272: FutureWarning: 'multi_class' was deprecated in version 1.5 and will be removed in 1.8. From then on, it will always use 'multinomial'. Leave it to its default value to avoid this warning.
  warnings.warn(
[I 2026-01-17 15:16:11,766] Trial 23 finished with value: 0.8929597701149425 and parameters: {'C': 0.01264582931356363, 'max_iter': 123, 'solver': 'newton-cg'}. Best is trial 11 with value: 0.9185823754789272.
/home/sjoon/projects/brain_connectivity_classifier/masterthesis_venv2/lib/python3.11/site-packages/sklearn/linear_model/_logistic.py:1272: FutureWarning: 'multi_class' was deprecated in version 1.5 and will be removed in 1.8. From then on, it will always use 'multinomial'. Leave it to its default value to avoid this warning.
  warnings.warn(
[I 2026-01-17 15:16:13,347] Trial 24 finished with value: 0.9018199233716475 and parameters: {'C': 0.40868227032050136, 'max_iter': 110, 'solver': 'newton-cg'}. Best is trial 11 with value: 0.9185823754789272.
/home/sjoon/projects/brain_connectivity_classifier/masterthesis_venv2/lib/python3.11/site-packages/sklearn/linear_model/_logistic.py:1272: FutureWarning: 'multi_class' was deprecated in version 1.5 and will be removed in 1.8. From then on, it will always use 'multinomial'. Leave it to its default value to avoid this warning.
  warnings.warn(
[I 2026-01-17 15:16:14,791] Trial 25 finished with value: 0.921455938697318 and parameters: {'C': 0.0869502906664159, 'max_iter': 139, 'solver': 'newton-cg'}. Best is trial 25 with value: 0.921455938697318.
/home/sjoon/projects/brain_connectivity_classifier/masterthesis_venv2/lib/python3.11/site-packages/sklearn/linear_model/_logistic.py:1272: FutureWarning: 'multi_class' was deprecated in version 1.5 and will be removed in 1.8. From then on, it will always use 'multinomial'. Leave it to its default value to avoid this warning.
  warnings.warn(
[I 2026-01-17 15:16:16,444] Trial 26 finished with value: 0.9008620689655172 and parameters: {'C': 1.4642019330148874, 'max_iter': 139, 'solver': 'newton-cg'}. Best is trial 25 with value: 0.921455938697318.
/home/sjoon/projects/brain_connectivity_classifier/masterthesis_venv2/lib/python3.11/site-packages/sklearn/linear_model/_logistic.py:1272: FutureWarning: 'multi_class' was deprecated in version 1.5 and will be removed in 1.8. From then on, it will always use 'multinomial'. Leave it to its default value to avoid this warning.
  warnings.warn(
[I 2026-01-17 15:16:18,075] Trial 27 finished with value: 0.8994252873563219 and parameters: {'C': 0.012134776039669191, 'max_iter': 169, 'solver': 'newton-cg'}. Best is trial 25 with value: 0.921455938697318.
/home/sjoon/projects/brain_connectivity_classifier/masterthesis_venv2/lib/python3.11/site-packages/sklearn/linear_model/_logistic.py:1272: FutureWarning: 'multi_class' was deprecated in version 1.5 and will be removed in 1.8. From then on, it will always use 'multinomial'. Leave it to its default value to avoid this warning.
  warnings.warn(
[I 2026-01-17 15:16:19,487] Trial 28 finished with value: 0.9228927203065134 and parameters: {'C': 0.06054798613309399, 'max_iter': 130, 'solver': 'newton-cg'}. Best is trial 28 with value: 0.9228927203065134.
/home/sjoon/projects/brain_connectivity_classifier/masterthesis_venv2/lib/python3.11/site-packages/sklearn/linear_model/_logistic.py:1272: FutureWarning: 'multi_class' was deprecated in version 1.5 and will be removed in 1.8. From then on, it will always use 'multinomial'. Leave it to its default value to avoid this warning.
  warnings.warn(
[I 2026-01-17 15:16:33,464] Trial 29 finished with value: 0.9260057471264368 and parameters: {'C': 0.037796938629745425, 'max_iter': 115, 'solver': 'lbfgs'}. Best is trial 29 with value: 0.9260057471264368.
/home/sjoon/projects/brain_connectivity_classifier/masterthesis_venv2/lib/python3.11/site-packages/sklearn/linear_model/_logistic.py:1272: FutureWarning: 'multi_class' was deprecated in version 1.5 and will be removed in 1.8. From then on, it will always use 'multinomial'. Leave it to its default value to avoid this warning.
  warnings.warn(
[I 2026-01-17 15:16:50,720] Trial 30 finished with value: 0.8644636015325671 and parameters: {'C': 0.004544094094295799, 'max_iter': 137, 'solver': 'lbfgs'}. Best is trial 29 with value: 0.9260057471264368.
/home/sjoon/projects/brain_connectivity_classifier/masterthesis_venv2/lib/python3.11/site-packages/sklearn/linear_model/_logistic.py:1272: FutureWarning: 'multi_class' was deprecated in version 1.5 and will be removed in 1.8. From then on, it will always use 'multinomial'. Leave it to its default value to avoid this warning.
  warnings.warn(
[I 2026-01-17 15:17:06,752] Trial 31 finished with value: 0.8979885057471264 and parameters: {'C': 0.028607083100250938, 'max_iter': 115, 'solver': 'lbfgs'}. Best is trial 29 with value: 0.9260057471264368.
/home/sjoon/projects/brain_connectivity_classifier/masterthesis_venv2/lib/python3.11/site-packages/sklearn/linear_model/_logistic.py:1272: FutureWarning: 'multi_class' was deprecated in version 1.5 and will be removed in 1.8. From then on, it will always use 'multinomial'. Leave it to its default value to avoid this warning.
  warnings.warn(
