[I 2026-01-17 14:54:28,716] Trial 39 finished with value: 0.9178639846743295 and parameters: {'C': 0.04721577323386001, 'max_iter': 242, 'solver': 'lbfgs'}. Best is trial 37 with value: 0.9255268199233716.
/home/sjoon/projects/brain_connectivity_classifier/masterthesis_venv2/lib/python3.11/site-packages/sklearn/linear_model/_logistic.py:1272: FutureWarning: 'multi_class' was deprecated in version 1.5 and will be removed in 1.8. From then on, it will always use 'multinomial'. Leave it to its default value to avoid this warning.
  warnings.warn(
[I 2026-01-17 14:54:30,262] Trial 40 finished with value: 0.89272030651341 and parameters: {'C': 0.014550378183023259, 'max_iter': 215, 'solver': 'newton-cg'}. Best is trial 37 with value: 0.9255268199233716.
/home/sjoon/projects/brain_connectivity_classifier/masterthesis_venv2/lib/python3.11/site-packages/sklearn/linear_model/_logistic.py:1272: FutureWarning: 'multi_class' was deprecated in version 1.5 and will be removed in 1.8. From then on, it will always use 'multinomial'. Leave it to its default value to avoid this warning.
  warnings.warn(
[I 2026-01-17 14:54:40,024] Trial 41 finished with value: 0.8987068965517241 and parameters: {'C': 0.10046064872841941, 'max_iter': 320, 'solver': 'lbfgs'}. Best is trial 37 with value: 0.9255268199233716.
/home/sjoon/projects/brain_connectivity_classifier/masterthesis_venv2/lib/python3.11/site-packages/sklearn/linear_model/_logistic.py:1272: FutureWarning: 'multi_class' was deprecated in version 1.5 and will be removed in 1.8. From then on, it will always use 'multinomial'. Leave it to its default value to avoid this warning.
  warnings.warn(
[I 2026-01-17 14:54:52,468] Trial 42 finished with value: 0.9087643678160919 and parameters: {'C': 0.051463288220396294, 'max_iter': 273, 'solver': 'lbfgs'}. Best is trial 37 with value: 0.9255268199233716.
/home/sjoon/projects/brain_connectivity_classifier/masterthesis_venv2/lib/python3.11/site-packages/sklearn/linear_model/_logistic.py:1272: FutureWarning: 'multi_class' was deprecated in version 1.5 and will be removed in 1.8. From then on, it will always use 'multinomial'. Leave it to its default value to avoid this warning.
  warnings.warn(
[I 2026-01-17 14:55:00,596] Trial 43 finished with value: 0.9046934865900383 and parameters: {'C': 0.14843814703693933, 'max_iter': 180, 'solver': 'lbfgs'}. Best is trial 37 with value: 0.9255268199233716.
/home/sjoon/projects/brain_connectivity_classifier/masterthesis_venv2/lib/python3.11/site-packages/sklearn/linear_model/_logistic.py:1272: FutureWarning: 'multi_class' was deprecated in version 1.5 and will be removed in 1.8. From then on, it will always use 'multinomial'. Leave it to its default value to avoid this warning.
  warnings.warn(
[I 2026-01-17 14:55:13,992] Trial 44 finished with value: 0.9044540229885057 and parameters: {'C': 0.03302365259642785, 'max_iter': 212, 'solver': 'lbfgs'}. Best is trial 37 with value: 0.9255268199233716.
/home/sjoon/projects/brain_connectivity_classifier/masterthesis_venv2/lib/python3.11/site-packages/sklearn/linear_model/_logistic.py:1272: FutureWarning: 'multi_class' was deprecated in version 1.5 and will be removed in 1.8. From then on, it will always use 'multinomial'. Leave it to its default value to avoid this warning.
  warnings.warn(
[I 2026-01-17 14:55:27,176] Trial 45 finished with value: 0.8920019157088123 and parameters: {'C': 0.010589431419615433, 'max_iter': 253, 'solver': 'lbfgs'}. Best is trial 37 with value: 0.9255268199233716.
/home/sjoon/projects/brain_connectivity_classifier/masterthesis_venv2/lib/python3.11/site-packages/sklearn/linear_model/_logistic.py:1272: FutureWarning: 'multi_class' was deprecated in version 1.5 and will be removed in 1.8. From then on, it will always use 'multinomial'. Leave it to its default value to avoid this warning.
  warnings.warn(
[I 2026-01-17 14:55:29,061] Trial 46 finished with value: 0.9066091954022989 and parameters: {'C': 0.4090255902651356, 'max_iter': 357, 'solver': 'newton-cg'}. Best is trial 37 with value: 0.9255268199233716.
/home/sjoon/projects/brain_connectivity_classifier/masterthesis_venv2/lib/python3.11/site-packages/sklearn/linear_model/_logistic.py:1272: FutureWarning: 'multi_class' was deprecated in version 1.5 and will be removed in 1.8. From then on, it will always use 'multinomial'. Leave it to its default value to avoid this warning.
  warnings.warn(
[I 2026-01-17 14:55:40,612] Trial 47 finished with value: 0.9183429118773946 and parameters: {'C': 0.08277139239680853, 'max_iter': 240, 'solver': 'lbfgs'}. Best is trial 37 with value: 0.9255268199233716.
/home/sjoon/projects/brain_connectivity_classifier/masterthesis_venv2/lib/python3.11/site-packages/sklearn/linear_model/_logistic.py:1272: FutureWarning: 'multi_class' was deprecated in version 1.5 and will be removed in 1.8. From then on, it will always use 'multinomial'. Leave it to its default value to avoid this warning.
  warnings.warn(
[I 2026-01-17 14:55:48,260] Trial 48 finished with value: 0.9046934865900383 and parameters: {'C': 0.6412760268099182, 'max_iter': 433, 'solver': 'lbfgs'}. Best is trial 37 with value: 0.9255268199233716.
/home/sjoon/projects/brain_connectivity_classifier/masterthesis_venv2/lib/python3.11/site-packages/sklearn/linear_model/_logistic.py:1272: FutureWarning: 'multi_class' was deprecated in version 1.5 and will be removed in 1.8. From then on, it will always use 'multinomial'. Leave it to its default value to avoid this warning.
  warnings.warn(
[I 2026-01-17 14:55:55,440] Trial 49 finished with value: 0.907088122605364 and parameters: {'C': 0.3097902322810852, 'max_iter': 290, 'solver': 'lbfgs'}. Best is trial 37 with value: 0.9255268199233716.
/home/sjoon/projects/brain_connectivity_classifier/masterthesis_venv2/lib/python3.11/site-packages/sklearn/linear_model/_logistic.py:1272: FutureWarning: 'multi_class' was deprecated in version 1.5 and will be removed in 1.8. From then on, it will always use 'multinomial'. Leave it to its default value to avoid this warning.
  warnings.warn(
[Parallel(n_jobs=-1)]: Using backend LokyBackend with 16 concurrent workers.
[I 2026-01-17 14:56:08,226] A new study created in memory with name: no-name-0065dafd-2bf3-46e9-ac79-e069be990dec
/home/sjoon/projects/brain_connectivity_classifier/masterthesis_venv2/lib/python3.11/site-packages/sklearn/linear_model/_logistic.py:1272: FutureWarning: 'multi_class' was deprecated in version 1.5 and will be removed in 1.8. From then on, it will always use 'multinomial'. Leave it to its default value to avoid this warning.
  warnings.warn(
[I 2026-01-17 14:56:18,916] Trial 0 finished with value: 0.8929597701149425 and parameters: {'C': 2.1845832259915205, 'max_iter': 118, 'solver': 'lbfgs'}. Best is trial 0 with value: 0.8929597701149425.
/home/sjoon/projects/brain_connectivity_classifier/masterthesis_venv2/lib/python3.11/site-packages/sklearn/linear_model/_logistic.py:1272: FutureWarning: 'multi_class' was deprecated in version 1.5 and will be removed in 1.8. From then on, it will always use 'multinomial'. Leave it to its default value to avoid this warning.
  warnings.warn(
[I 2026-01-17 14:56:20,593] Trial 1 finished with value: 0.9049329501915708 and parameters: {'C': 0.02736801827846297, 'max_iter': 266, 'solver': 'newton-cg'}. Best is trial 1 with value: 0.9049329501915708.
/home/sjoon/projects/brain_connectivity_classifier/masterthesis_venv2/lib/python3.11/site-packages/sklearn/linear_model/_logistic.py:1272: FutureWarning: 'multi_class' was deprecated in version 1.5 and will be removed in 1.8. From then on, it will always use 'multinomial'. Leave it to its default value to avoid this warning.
  warnings.warn(
[I 2026-01-17 14:56:28,048] Trial 2 finished with value: 0.9066091954022989 and parameters: {'C': 0.10954930794959702, 'max_iter': 313, 'solver': 'lbfgs'}. Best is trial 2 with value: 0.9066091954022989.
/home/sjoon/projects/brain_connectivity_classifier/masterthesis_venv2/lib/python3.11/site-packages/sklearn/linear_model/_logistic.py:1272: FutureWarning: 'multi_class' was deprecated in version 1.5 and will be removed in 1.8. From then on, it will always use 'multinomial'. Leave it to its default value to avoid this warning.
  warnings.warn(
[I 2026-01-17 14:56:29,482] Trial 3 finished with value: 0.9056513409961686 and parameters: {'C': 0.05135776127610299, 'max_iter': 120, 'solver': 'newton-cg'}. Best is trial 2 with value: 0.9066091954022989.
/home/sjoon/projects/brain_connectivity_classifier/masterthesis_venv2/lib/python3.11/site-packages/sklearn/linear_model/_logistic.py:1272: FutureWarning: 'multi_class' was deprecated in version 1.5 and will be removed in 1.8. From then on, it will always use 'multinomial'. Leave it to its default value to avoid this warning.
  warnings.warn(
[I 2026-01-17 14:56:41,496] Trial 4 finished with value: 0.8836206896551724 and parameters: {'C': 5.934756183514231, 'max_iter': 414, 'solver': 'lbfgs'}. Best is trial 2 with value: 0.9066091954022989.
/home/sjoon/projects/brain_connectivity_classifier/masterthesis_venv2/lib/python3.11/site-packages/sklearn/linear_model/_logistic.py:1272: FutureWarning: 'multi_class' was deprecated in version 1.5 and will be removed in 1.8. From then on, it will always use 'multinomial'. Leave it to its default value to avoid this warning.
  warnings.warn(
[I 2026-01-17 14:56:42,677] Trial 5 finished with value: 0.9061302681992337 and parameters: {'C': 0.3526371437712786, 'max_iter': 125, 'solver': 'newton-cg'}. Best is trial 2 with value: 0.9066091954022989.
/home/sjoon/projects/brain_connectivity_classifier/masterthesis_venv2/lib/python3.11/site-packages/sklearn/linear_model/_logistic.py:1272: FutureWarning: 'multi_class' was deprecated in version 1.5 and will be removed in 1.8. From then on, it will always use 'multinomial'. Leave it to its default value to avoid this warning.
  warnings.warn(
[I 2026-01-17 14:56:56,416] Trial 6 finished with value: 0.8864942528735632 and parameters: {'C': 0.010809390923666368, 'max_iter': 291, 'solver': 'lbfgs'}. Best is trial 2 with value: 0.9066091954022989.
/home/sjoon/projects/brain_connectivity_classifier/masterthesis_venv2/lib/python3.11/site-packages/sklearn/linear_model/_logistic.py:1272: FutureWarning: 'multi_class' was deprecated in version 1.5 and will be removed in 1.8. From then on, it will always use 'multinomial'. Leave it to its default value to avoid this warning.
  warnings.warn(
[I 2026-01-17 14:57:04,728] Trial 7 finished with value: 0.9171455938697318 and parameters: {'C': 0.17856643681849566, 'max_iter': 129, 'solver': 'lbfgs'}. Best is trial 7 with value: 0.9171455938697318.
/home/sjoon/projects/brain_connectivity_classifier/masterthesis_venv2/lib/python3.11/site-packages/sklearn/linear_model/_logistic.py:1272: FutureWarning: 'multi_class' was deprecated in version 1.5 and will be removed in 1.8. From then on, it will always use 'multinomial'. Leave it to its default value to avoid this warning.
  warnings.warn(
[I 2026-01-17 14:57:06,529] Trial 8 finished with value: 0.8680555555555556 and parameters: {'C': 0.006482617122786845, 'max_iter': 208, 'solver': 'newton-cg'}. Best is trial 7 with value: 0.9171455938697318.
/home/sjoon/projects/brain_connectivity_classifier/masterthesis_venv2/lib/python3.11/site-packages/sklearn/linear_model/_logistic.py:1272: FutureWarning: 'multi_class' was deprecated in version 1.5 and will be removed in 1.8. From then on, it will always use 'multinomial'. Leave it to its default value to avoid this warning.
  warnings.warn(
[I 2026-01-17 14:57:15,836] Trial 9 finished with value: 0.8994252873563219 and parameters: {'C': 1.659849845334228, 'max_iter': 183, 'solver': 'lbfgs'}. Best is trial 7 with value: 0.9171455938697318.
/home/sjoon/projects/brain_connectivity_classifier/masterthesis_venv2/lib/python3.11/site-packages/sklearn/linear_model/_logistic.py:1272: FutureWarning: 'multi_class' was deprecated in version 1.5 and will be removed in 1.8. From then on, it will always use 'multinomial'. Leave it to its default value to avoid this warning.
  warnings.warn(
[I 2026-01-17 14:57:24,616] Trial 10 finished with value: 0.8158524904214559 and parameters: {'C': 0.0017881095717767353, 'max_iter': 161, 'solver': 'lbfgs'}. Best is trial 7 with value: 0.9171455938697318.
/home/sjoon/projects/brain_connectivity_classifier/masterthesis_venv2/lib/python3.11/site-packages/sklearn/linear_model/_logistic.py:1272: FutureWarning: 'multi_class' was deprecated in version 1.5 and will be removed in 1.8. From then on, it will always use 'multinomial'. Leave it to its default value to avoid this warning.
  warnings.warn(
[I 2026-01-17 14:57:34,192] Trial 11 finished with value: 0.9063697318007663 and parameters: {'C': 0.22757039128829426, 'max_iter': 395, 'solver': 'lbfgs'}. Best is trial 7 with value: 0.9171455938697318.
/home/sjoon/projects/brain_connectivity_classifier/masterthesis_venv2/lib/python3.11/site-packages/sklearn/linear_model/_logistic.py:1272: FutureWarning: 'multi_class' was deprecated in version 1.5 and will be removed in 1.8. From then on, it will always use 'multinomial'. Leave it to its default value to avoid this warning.
  warnings.warn(
[I 2026-01-17 14:57:43,316] Trial 12 finished with value: 0.8991858237547893 and parameters: {'C': 0.25185814011528773, 'max_iter': 311, 'solver': 'lbfgs'}. Best is trial 7 with value: 0.9171455938697318.
/home/sjoon/projects/brain_connectivity_classifier/masterthesis_venv2/lib/python3.11/site-packages/sklearn/linear_model/_logistic.py:1272: FutureWarning: 'multi_class' was deprecated in version 1.5 and will be removed in 1.8. From then on, it will always use 'multinomial'. Leave it to its default value to avoid this warning.
  warnings.warn(
[I 2026-01-17 14:57:52,960] Trial 13 finished with value: 0.9147509578544061 and parameters: {'C': 0.10354199614635211, 'max_iter': 246, 'solver': 'lbfgs'}. Best is trial 7 with value: 0.9171455938697318.
/home/sjoon/projects/brain_connectivity_classifier/masterthesis_venv2/lib/python3.11/site-packages/sklearn/linear_model/_logistic.py:1272: FutureWarning: 'multi_class' was deprecated in version 1.5 and will be removed in 1.8. From then on, it will always use 'multinomial'. Leave it to its default value to avoid this warning.
  warnings.warn(
[I 2026-01-17 14:58:01,396] Trial 14 finished with value: 0.898227969348659 and parameters: {'C': 0.8772130322040956, 'max_iter': 155, 'solver': 'lbfgs'}. Best is trial 7 with value: 0.9171455938697318.
/home/sjoon/projects/brain_connectivity_classifier/masterthesis_venv2/lib/python3.11/site-packages/sklearn/linear_model/_logistic.py:1272: FutureWarning: 'multi_class' was deprecated in version 1.5 and will be removed in 1.8. From then on, it will always use 'multinomial'. Leave it to its default value to avoid this warning.
  warnings.warn(
[I 2026-01-17 14:58:13,204] Trial 15 finished with value: 0.9013409961685823 and parameters: {'C': 0.028779521496683752, 'max_iter': 243, 'solver': 'lbfgs'}. Best is trial 7 with value: 0.9171455938697318.
/home/sjoon/projects/brain_connectivity_classifier/masterthesis_venv2/lib/python3.11/site-packages/sklearn/linear_model/_logistic.py:1272: FutureWarning: 'multi_class' was deprecated in version 1.5 and will be removed in 1.8. From then on, it will always use 'multinomial'. Leave it to its default value to avoid this warning.
  warnings.warn(
[I 2026-01-17 14:58:23,336] Trial 16 finished with value: 0.9087643678160919 and parameters: {'C': 0.09438648347783382, 'max_iter': 206, 'solver': 'lbfgs'}. Best is trial 7 with value: 0.9171455938697318.
/home/sjoon/projects/brain_connectivity_classifier/masterthesis_venv2/lib/python3.11/site-packages/sklearn/linear_model/_logistic.py:1272: FutureWarning: 'multi_class' was deprecated in version 1.5 and will be removed in 1.8. From then on, it will always use 'multinomial'. Leave it to its default value to avoid this warning.
  warnings.warn(
[I 2026-01-17 14:58:31,972] Trial 17 finished with value: 0.9092432950191571 and parameters: {'C': 0.6319033551768506, 'max_iter': 145, 'solver': 'lbfgs'}. Best is trial 7 with value: 0.9171455938697318.
/home/sjoon/projects/brain_connectivity_classifier/masterthesis_venv2/lib/python3.11/site-packages/sklearn/linear_model/_logistic.py:1272: FutureWarning: 'multi_class' was deprecated in version 1.5 and will be removed in 1.8. From then on, it will always use 'multinomial'. Leave it to its default value to avoid this warning.
  warnings.warn(
[I 2026-01-17 14:58:33,768] Trial 18 finished with value: 0.8833812260536399 and parameters: {'C': 0.010104043893918144, 'max_iter': 352, 'solver': 'newton-cg'}. Best is trial 7 with value: 0.9171455938697318.
/home/sjoon/projects/brain_connectivity_classifier/masterthesis_venv2/lib/python3.11/site-packages/sklearn/linear_model/_logistic.py:1272: FutureWarning: 'multi_class' was deprecated in version 1.5 and will be removed in 1.8. From then on, it will always use 'multinomial'. Leave it to its default value to avoid this warning.
  warnings.warn(
[I 2026-01-17 14:58:41,472] Trial 19 finished with value: 0.7531130268199234 and parameters: {'C': 0.001148350785346714, 'max_iter': 186, 'solver': 'lbfgs'}. Best is trial 7 with value: 0.9171455938697318.
/home/sjoon/projects/brain_connectivity_classifier/masterthesis_venv2/lib/python3.11/site-packages/sklearn/linear_model/_logistic.py:1272: FutureWarning: 'multi_class' was deprecated in version 1.5 and will be removed in 1.8. From then on, it will always use 'multinomial'. Leave it to its default value to avoid this warning.
  warnings.warn(
[I 2026-01-17 14:58:49,604] Trial 20 finished with value: 0.899904214559387 and parameters: {'C': 8.482029646636363, 'max_iter': 486, 'solver': 'lbfgs'}. Best is trial 7 with value: 0.9171455938697318.
/home/sjoon/projects/brain_connectivity_classifier/masterthesis_venv2/lib/python3.11/site-packages/sklearn/linear_model/_logistic.py:1272: FutureWarning: 'multi_class' was deprecated in version 1.5 and will be removed in 1.8. From then on, it will always use 'multinomial'. Leave it to its default value to avoid this warning.
  warnings.warn(
[I 2026-01-17 14:59:00,873] Trial 21 finished with value: 0.9181034482758621 and parameters: {'C': 0.6185651376079204, 'max_iter': 104, 'solver': 'lbfgs'}. Best is trial 21 with value: 0.9181034482758621.
/home/sjoon/projects/brain_connectivity_classifier/masterthesis_venv2/lib/python3.11/site-packages/sklearn/linear_model/_logistic.py:1272: FutureWarning: 'multi_class' was deprecated in version 1.5 and will be removed in 1.8. From then on, it will always use 'multinomial'. Leave it to its default value to avoid this warning.
  warnings.warn(
[I 2026-01-17 14:59:10,052] Trial 22 finished with value: 0.9123563218390804 and parameters: {'C': 0.12019831269760135, 'max_iter': 106, 'solver': 'lbfgs'}. Best is trial 21 with value: 0.9181034482758621.
/home/sjoon/projects/brain_connectivity_classifier/masterthesis_venv2/lib/python3.11/site-packages/sklearn/linear_model/_logistic.py:1272: FutureWarning: 'multi_class' was deprecated in version 1.5 and will be removed in 1.8. From then on, it will always use 'multinomial'. Leave it to its default value to avoid this warning.
  warnings.warn(
[I 2026-01-17 14:59:19,352] Trial 23 finished with value: 0.914272030651341 and parameters: {'C': 0.5773961224697026, 'max_iter': 105, 'solver': 'lbfgs'}. Best is trial 21 with value: 0.9181034482758621.
/home/sjoon/projects/brain_connectivity_classifier/masterthesis_venv2/lib/python3.11/site-packages/sklearn/linear_model/_logistic.py:1272: FutureWarning: 'multi_class' was deprecated in version 1.5 and will be removed in 1.8. From then on, it will always use 'multinomial'. Leave it to its default value to avoid this warning.
  warnings.warn(
[I 2026-01-17 14:59:29,296] Trial 24 finished with value: 0.9099616858237548 and parameters: {'C': 2.73722541614168, 'max_iter': 134, 'solver': 'lbfgs'}. Best is trial 21 with value: 0.9181034482758621.
/home/sjoon/projects/brain_connectivity_classifier/masterthesis_venv2/lib/python3.11/site-packages/sklearn/linear_model/_logistic.py:1272: FutureWarning: 'multi_class' was deprecated in version 1.5 and will be removed in 1.8. From then on, it will always use 'multinomial'. Leave it to its default value to avoid this warning.
  warnings.warn(
[I 2026-01-17 14:59:40,924] Trial 25 finished with value: 0.9154693486590039 and parameters: {'C': 0.040509058625608795, 'max_iter': 102, 'solver': 'lbfgs'}. Best is trial 21 with value: 0.9181034482758621.
/home/sjoon/projects/brain_connectivity_classifier/masterthesis_venv2/lib/python3.11/site-packages/sklearn/linear_model/_logistic.py:1272: FutureWarning: 'multi_class' was deprecated in version 1.5 and will be removed in 1.8. From then on, it will always use 'multinomial'. Leave it to its default value to avoid this warning.
  warnings.warn(
[I 2026-01-17 14:59:42,770] Trial 26 finished with value: 0.905411877394636 and parameters: {'C': 0.03644107133971653, 'max_iter': 100, 'solver': 'newton-cg'}. Best is trial 21 with value: 0.9181034482758621.
/home/sjoon/projects/brain_connectivity_classifier/masterthesis_venv2/lib/python3.11/site-packages/sklearn/linear_model/_logistic.py:1272: FutureWarning: 'multi_class' was deprecated in version 1.5 and will be removed in 1.8. From then on, it will always use 'multinomial'. Leave it to its default value to avoid this warning.
  warnings.warn(
[I 2026-01-17 14:59:56,688] Trial 27 finished with value: 0.8551245210727969 and parameters: {'C': 0.0040913909456605484, 'max_iter': 115, 'solver': 'lbfgs'}. Best is trial 21 with value: 0.9181034482758621.
/home/sjoon/projects/brain_connectivity_classifier/masterthesis_venv2/lib/python3.11/site-packages/sklearn/linear_model/_logistic.py:1272: FutureWarning: 'multi_class' was deprecated in version 1.5 and will be removed in 1.8. From then on, it will always use 'multinomial'. Leave it to its default value to avoid this warning.
  warnings.warn(
