[I 2026-01-17 15:06:27,036] Trial 4 finished with value: 0.8352490421455939 and parameters: {'C': 0.002607939962442735, 'max_iter': 364, 'solver': 'newton-cg'}. Best is trial 3 with value: 0.9056513409961686.
/home/sjoon/projects/brain_connectivity_classifier/masterthesis_venv2/lib/python3.11/site-packages/sklearn/linear_model/_logistic.py:1272: FutureWarning: 'multi_class' was deprecated in version 1.5 and will be removed in 1.8. From then on, it will always use 'multinomial'. Leave it to its default value to avoid this warning.
  warnings.warn(
[I 2026-01-17 15:06:28,062] Trial 5 finished with value: 0.7935823754789272 and parameters: {'C': 0.001393009808491993, 'max_iter': 162, 'solver': 'newton-cg'}. Best is trial 3 with value: 0.9056513409961686.
/home/sjoon/projects/brain_connectivity_classifier/masterthesis_venv2/lib/python3.11/site-packages/sklearn/linear_model/_logistic.py:1272: FutureWarning: 'multi_class' was deprecated in version 1.5 and will be removed in 1.8. From then on, it will always use 'multinomial'. Leave it to its default value to avoid this warning.
  warnings.warn(
[I 2026-01-17 15:06:43,896] Trial 6 finished with value: 0.8852969348659003 and parameters: {'C': 0.011211424217817453, 'max_iter': 493, 'solver': 'lbfgs'}. Best is trial 3 with value: 0.9056513409961686.
/home/sjoon/projects/brain_connectivity_classifier/masterthesis_venv2/lib/python3.11/site-packages/sklearn/linear_model/_logistic.py:1272: FutureWarning: 'multi_class' was deprecated in version 1.5 and will be removed in 1.8. From then on, it will always use 'multinomial'. Leave it to its default value to avoid this warning.
  warnings.warn(
[I 2026-01-17 15:06:45,537] Trial 7 finished with value: 0.876676245210728 and parameters: {'C': 0.007663100925476637, 'max_iter': 221, 'solver': 'newton-cg'}. Best is trial 3 with value: 0.9056513409961686.
/home/sjoon/projects/brain_connectivity_classifier/masterthesis_venv2/lib/python3.11/site-packages/sklearn/linear_model/_logistic.py:1272: FutureWarning: 'multi_class' was deprecated in version 1.5 and will be removed in 1.8. From then on, it will always use 'multinomial'. Leave it to its default value to avoid this warning.
  warnings.warn(
[I 2026-01-17 15:06:47,037] Trial 8 finished with value: 0.8833812260536399 and parameters: {'C': 0.00870565720849901, 'max_iter': 472, 'solver': 'newton-cg'}. Best is trial 3 with value: 0.9056513409961686.
/home/sjoon/projects/brain_connectivity_classifier/masterthesis_venv2/lib/python3.11/site-packages/sklearn/linear_model/_logistic.py:1272: FutureWarning: 'multi_class' was deprecated in version 1.5 and will be removed in 1.8. From then on, it will always use 'multinomial'. Leave it to its default value to avoid this warning.
  warnings.warn(
[I 2026-01-17 15:06:48,331] Trial 9 finished with value: 0.8180076628352491 and parameters: {'C': 0.002292667236983871, 'max_iter': 127, 'solver': 'newton-cg'}. Best is trial 3 with value: 0.9056513409961686.
/home/sjoon/projects/brain_connectivity_classifier/masterthesis_venv2/lib/python3.11/site-packages/sklearn/linear_model/_logistic.py:1272: FutureWarning: 'multi_class' was deprecated in version 1.5 and will be removed in 1.8. From then on, it will always use 'multinomial'. Leave it to its default value to avoid this warning.
  warnings.warn(
[I 2026-01-17 15:06:57,240] Trial 10 finished with value: 0.9243295019157088 and parameters: {'C': 0.2786345154934639, 'max_iter': 310, 'solver': 'lbfgs'}. Best is trial 10 with value: 0.9243295019157088.
/home/sjoon/projects/brain_connectivity_classifier/masterthesis_venv2/lib/python3.11/site-packages/sklearn/linear_model/_logistic.py:1272: FutureWarning: 'multi_class' was deprecated in version 1.5 and will be removed in 1.8. From then on, it will always use 'multinomial'. Leave it to its default value to avoid this warning.
  warnings.warn(
[I 2026-01-17 15:07:07,048] Trial 11 finished with value: 0.9130747126436781 and parameters: {'C': 0.26903250444960153, 'max_iter': 301, 'solver': 'lbfgs'}. Best is trial 10 with value: 0.9243295019157088.
/home/sjoon/projects/brain_connectivity_classifier/masterthesis_venv2/lib/python3.11/site-packages/sklearn/linear_model/_logistic.py:1272: FutureWarning: 'multi_class' was deprecated in version 1.5 and will be removed in 1.8. From then on, it will always use 'multinomial'. Leave it to its default value to avoid this warning.
  warnings.warn(
[I 2026-01-17 15:07:17,840] Trial 12 finished with value: 0.9113984674329502 and parameters: {'C': 0.34942149676605216, 'max_iter': 283, 'solver': 'lbfgs'}. Best is trial 10 with value: 0.9243295019157088.
/home/sjoon/projects/brain_connectivity_classifier/masterthesis_venv2/lib/python3.11/site-packages/sklearn/linear_model/_logistic.py:1272: FutureWarning: 'multi_class' was deprecated in version 1.5 and will be removed in 1.8. From then on, it will always use 'multinomial'. Leave it to its default value to avoid this warning.
  warnings.warn(
[I 2026-01-17 15:07:28,216] Trial 13 finished with value: 0.9154693486590039 and parameters: {'C': 0.22118323418840433, 'max_iter': 271, 'solver': 'lbfgs'}. Best is trial 10 with value: 0.9243295019157088.
/home/sjoon/projects/brain_connectivity_classifier/masterthesis_venv2/lib/python3.11/site-packages/sklearn/linear_model/_logistic.py:1272: FutureWarning: 'multi_class' was deprecated in version 1.5 and will be removed in 1.8. From then on, it will always use 'multinomial'. Leave it to its default value to avoid this warning.
  warnings.warn(
[I 2026-01-17 15:07:40,576] Trial 14 finished with value: 0.9104406130268199 and parameters: {'C': 0.13528097608009407, 'max_iter': 174, 'solver': 'lbfgs'}. Best is trial 10 with value: 0.9243295019157088.
/home/sjoon/projects/brain_connectivity_classifier/masterthesis_venv2/lib/python3.11/site-packages/sklearn/linear_model/_logistic.py:1272: FutureWarning: 'multi_class' was deprecated in version 1.5 and will be removed in 1.8. From then on, it will always use 'multinomial'. Leave it to its default value to avoid this warning.
  warnings.warn(
[I 2026-01-17 15:07:52,708] Trial 15 finished with value: 0.9118773946360154 and parameters: {'C': 1.2677106848301645, 'max_iter': 102, 'solver': 'lbfgs'}. Best is trial 10 with value: 0.9243295019157088.
/home/sjoon/projects/brain_connectivity_classifier/masterthesis_venv2/lib/python3.11/site-packages/sklearn/linear_model/_logistic.py:1272: FutureWarning: 'multi_class' was deprecated in version 1.5 and will be removed in 1.8. From then on, it will always use 'multinomial'. Leave it to its default value to avoid this warning.
  warnings.warn(
[I 2026-01-17 15:08:08,616] Trial 16 finished with value: 0.9161877394636015 and parameters: {'C': 0.0523344306792589, 'max_iter': 383, 'solver': 'lbfgs'}. Best is trial 10 with value: 0.9243295019157088.
/home/sjoon/projects/brain_connectivity_classifier/masterthesis_venv2/lib/python3.11/site-packages/sklearn/linear_model/_logistic.py:1272: FutureWarning: 'multi_class' was deprecated in version 1.5 and will be removed in 1.8. From then on, it will always use 'multinomial'. Leave it to its default value to avoid this warning.
  warnings.warn(
[I 2026-01-17 15:08:23,856] Trial 17 finished with value: 0.9037356321839081 and parameters: {'C': 0.0510956827010067, 'max_iter': 381, 'solver': 'lbfgs'}. Best is trial 10 with value: 0.9243295019157088.
/home/sjoon/projects/brain_connectivity_classifier/masterthesis_venv2/lib/python3.11/site-packages/sklearn/linear_model/_logistic.py:1272: FutureWarning: 'multi_class' was deprecated in version 1.5 and will be removed in 1.8. From then on, it will always use 'multinomial'. Leave it to its default value to avoid this warning.
  warnings.warn(
[I 2026-01-17 15:08:39,592] Trial 18 finished with value: 0.8929597701149425 and parameters: {'C': 0.0372688442179361, 'max_iter': 414, 'solver': 'lbfgs'}. Best is trial 10 with value: 0.9243295019157088.
/home/sjoon/projects/brain_connectivity_classifier/masterthesis_venv2/lib/python3.11/site-packages/sklearn/linear_model/_logistic.py:1272: FutureWarning: 'multi_class' was deprecated in version 1.5 and will be removed in 1.8. From then on, it will always use 'multinomial'. Leave it to its default value to avoid this warning.
  warnings.warn(
[I 2026-01-17 15:08:51,732] Trial 19 finished with value: 0.9015804597701149 and parameters: {'C': 1.1736258209117738, 'max_iter': 336, 'solver': 'lbfgs'}. Best is trial 10 with value: 0.9243295019157088.
/home/sjoon/projects/brain_connectivity_classifier/masterthesis_venv2/lib/python3.11/site-packages/sklearn/linear_model/_logistic.py:1272: FutureWarning: 'multi_class' was deprecated in version 1.5 and will be removed in 1.8. From then on, it will always use 'multinomial'. Leave it to its default value to avoid this warning.
  warnings.warn(
[I 2026-01-17 15:09:05,572] Trial 20 finished with value: 0.8872126436781609 and parameters: {'C': 7.517267069055538, 'max_iter': 241, 'solver': 'lbfgs'}. Best is trial 10 with value: 0.9243295019157088.
/home/sjoon/projects/brain_connectivity_classifier/masterthesis_venv2/lib/python3.11/site-packages/sklearn/linear_model/_logistic.py:1272: FutureWarning: 'multi_class' was deprecated in version 1.5 and will be removed in 1.8. From then on, it will always use 'multinomial'. Leave it to its default value to avoid this warning.
  warnings.warn(
[I 2026-01-17 15:09:16,624] Trial 21 finished with value: 0.9106800766283525 and parameters: {'C': 0.3470281425056154, 'max_iter': 243, 'solver': 'lbfgs'}. Best is trial 10 with value: 0.9243295019157088.
/home/sjoon/projects/brain_connectivity_classifier/masterthesis_venv2/lib/python3.11/site-packages/sklearn/linear_model/_logistic.py:1272: FutureWarning: 'multi_class' was deprecated in version 1.5 and will be removed in 1.8. From then on, it will always use 'multinomial'. Leave it to its default value to avoid this warning.
  warnings.warn(
[I 2026-01-17 15:09:28,628] Trial 22 finished with value: 0.9123563218390804 and parameters: {'C': 0.12603842374295715, 'max_iter': 308, 'solver': 'lbfgs'}. Best is trial 10 with value: 0.9243295019157088.
/home/sjoon/projects/brain_connectivity_classifier/masterthesis_venv2/lib/python3.11/site-packages/sklearn/linear_model/_logistic.py:1272: FutureWarning: 'multi_class' was deprecated in version 1.5 and will be removed in 1.8. From then on, it will always use 'multinomial'. Leave it to its default value to avoid this warning.
  warnings.warn(
[I 2026-01-17 15:09:40,648] Trial 23 finished with value: 0.8991858237547893 and parameters: {'C': 0.5506188858955972, 'max_iter': 396, 'solver': 'lbfgs'}. Best is trial 10 with value: 0.9243295019157088.
/home/sjoon/projects/brain_connectivity_classifier/masterthesis_venv2/lib/python3.11/site-packages/sklearn/linear_model/_logistic.py:1272: FutureWarning: 'multi_class' was deprecated in version 1.5 and will be removed in 1.8. From then on, it will always use 'multinomial'. Leave it to its default value to avoid this warning.
  warnings.warn(
[I 2026-01-17 15:09:52,712] Trial 24 finished with value: 0.9066091954022989 and parameters: {'C': 0.11938487957627716, 'max_iter': 262, 'solver': 'lbfgs'}. Best is trial 10 with value: 0.9243295019157088.
/home/sjoon/projects/brain_connectivity_classifier/masterthesis_venv2/lib/python3.11/site-packages/sklearn/linear_model/_logistic.py:1272: FutureWarning: 'multi_class' was deprecated in version 1.5 and will be removed in 1.8. From then on, it will always use 'multinomial'. Leave it to its default value to avoid this warning.
  warnings.warn(
[I 2026-01-17 15:10:08,832] Trial 25 finished with value: 0.9030172413793104 and parameters: {'C': 0.03645213439070726, 'max_iter': 205, 'solver': 'lbfgs'}. Best is trial 10 with value: 0.9243295019157088.
/home/sjoon/projects/brain_connectivity_classifier/masterthesis_venv2/lib/python3.11/site-packages/sklearn/linear_model/_logistic.py:1272: FutureWarning: 'multi_class' was deprecated in version 1.5 and will be removed in 1.8. From then on, it will always use 'multinomial'. Leave it to its default value to avoid this warning.
  warnings.warn(
[I 2026-01-17 15:10:19,488] Trial 26 finished with value: 0.9149904214559387 and parameters: {'C': 0.6605727770298478, 'max_iter': 350, 'solver': 'lbfgs'}. Best is trial 10 with value: 0.9243295019157088.
/home/sjoon/projects/brain_connectivity_classifier/masterthesis_venv2/lib/python3.11/site-packages/sklearn/linear_model/_logistic.py:1272: FutureWarning: 'multi_class' was deprecated in version 1.5 and will be removed in 1.8. From then on, it will always use 'multinomial'. Leave it to its default value to avoid this warning.
  warnings.warn(
[I 2026-01-17 15:10:31,796] Trial 27 finished with value: 0.9092432950191571 and parameters: {'C': 2.818064653866759, 'max_iter': 183, 'solver': 'lbfgs'}. Best is trial 10 with value: 0.9243295019157088.
/home/sjoon/projects/brain_connectivity_classifier/masterthesis_venv2/lib/python3.11/site-packages/sklearn/linear_model/_logistic.py:1272: FutureWarning: 'multi_class' was deprecated in version 1.5 and will be removed in 1.8. From then on, it will always use 'multinomial'. Leave it to its default value to avoid this warning.
  warnings.warn(
[I 2026-01-17 15:10:42,004] Trial 28 finished with value: 0.9111590038314177 and parameters: {'C': 0.19092736076730227, 'max_iter': 417, 'solver': 'lbfgs'}. Best is trial 10 with value: 0.9243295019157088.
/home/sjoon/projects/brain_connectivity_classifier/masterthesis_venv2/lib/python3.11/site-packages/sklearn/linear_model/_logistic.py:1272: FutureWarning: 'multi_class' was deprecated in version 1.5 and will be removed in 1.8. From then on, it will always use 'multinomial'. Leave it to its default value to avoid this warning.
  warnings.warn(
[I 2026-01-17 15:10:55,744] Trial 29 finished with value: 0.914272030651341 and parameters: {'C': 0.057622067807291864, 'max_iter': 270, 'solver': 'lbfgs'}. Best is trial 10 with value: 0.9243295019157088.
/home/sjoon/projects/brain_connectivity_classifier/masterthesis_venv2/lib/python3.11/site-packages/sklearn/linear_model/_logistic.py:1272: FutureWarning: 'multi_class' was deprecated in version 1.5 and will be removed in 1.8. From then on, it will always use 'multinomial'. Leave it to its default value to avoid this warning.
  warnings.warn(
[I 2026-01-17 15:11:07,228] Trial 30 finished with value: 0.9025383141762452 and parameters: {'C': 2.4007797805077455, 'max_iter': 307, 'solver': 'lbfgs'}. Best is trial 10 with value: 0.9243295019157088.
/home/sjoon/projects/brain_connectivity_classifier/masterthesis_venv2/lib/python3.11/site-packages/sklearn/linear_model/_logistic.py:1272: FutureWarning: 'multi_class' was deprecated in version 1.5 and will be removed in 1.8. From then on, it will always use 'multinomial'. Leave it to its default value to avoid this warning.
  warnings.warn(
[I 2026-01-17 15:11:17,992] Trial 31 finished with value: 0.9164272030651341 and parameters: {'C': 0.7926019154211043, 'max_iter': 348, 'solver': 'lbfgs'}. Best is trial 10 with value: 0.9243295019157088.
/home/sjoon/projects/brain_connectivity_classifier/masterthesis_venv2/lib/python3.11/site-packages/sklearn/linear_model/_logistic.py:1272: FutureWarning: 'multi_class' was deprecated in version 1.5 and will be removed in 1.8. From then on, it will always use 'multinomial'. Leave it to its default value to avoid this warning.
  warnings.warn(
[I 2026-01-17 15:11:31,188] Trial 32 finished with value: 0.9013409961685823 and parameters: {'C': 0.709620688126334, 'max_iter': 440, 'solver': 'lbfgs'}. Best is trial 10 with value: 0.9243295019157088.
/home/sjoon/projects/brain_connectivity_classifier/masterthesis_venv2/lib/python3.11/site-packages/sklearn/linear_model/_logistic.py:1272: FutureWarning: 'multi_class' was deprecated in version 1.5 and will be removed in 1.8. From then on, it will always use 'multinomial'. Leave it to its default value to avoid this warning.
  warnings.warn(
[I 2026-01-17 15:11:39,556] Trial 33 finished with value: 0.9094827586206896 and parameters: {'C': 0.2232761739624512, 'max_iter': 324, 'solver': 'lbfgs'}. Best is trial 10 with value: 0.9243295019157088.
/home/sjoon/projects/brain_connectivity_classifier/masterthesis_venv2/lib/python3.11/site-packages/sklearn/linear_model/_logistic.py:1272: FutureWarning: 'multi_class' was deprecated in version 1.5 and will be removed in 1.8. From then on, it will always use 'multinomial'. Leave it to its default value to avoid this warning.
  warnings.warn(
[I 2026-01-17 15:11:53,080] Trial 34 finished with value: 0.9090038314176245 and parameters: {'C': 0.08635166657873491, 'max_iter': 367, 'solver': 'lbfgs'}. Best is trial 10 with value: 0.9243295019157088.
/home/sjoon/projects/brain_connectivity_classifier/masterthesis_venv2/lib/python3.11/site-packages/sklearn/linear_model/_logistic.py:1272: FutureWarning: 'multi_class' was deprecated in version 1.5 and will be removed in 1.8. From then on, it will always use 'multinomial'. Leave it to its default value to avoid this warning.
  warnings.warn(
[I 2026-01-17 15:11:54,611] Trial 35 finished with value: 0.9099616858237548 and parameters: {'C': 0.468745780084547, 'max_iter': 244, 'solver': 'newton-cg'}. Best is trial 10 with value: 0.9243295019157088.
/home/sjoon/projects/brain_connectivity_classifier/masterthesis_venv2/lib/python3.11/site-packages/sklearn/linear_model/_logistic.py:1272: FutureWarning: 'multi_class' was deprecated in version 1.5 and will be removed in 1.8. From then on, it will always use 'multinomial'. Leave it to its default value to avoid this warning.
  warnings.warn(
[I 2026-01-17 15:12:11,720] Trial 36 finished with value: 0.8963122605363985 and parameters: {'C': 0.02363983858217068, 'max_iter': 284, 'solver': 'lbfgs'}. Best is trial 10 with value: 0.9243295019157088.
/home/sjoon/projects/brain_connectivity_classifier/masterthesis_venv2/lib/python3.11/site-packages/sklearn/linear_model/_logistic.py:1272: FutureWarning: 'multi_class' was deprecated in version 1.5 and will be removed in 1.8. From then on, it will always use 'multinomial'. Leave it to its default value to avoid this warning.
  warnings.warn(
[I 2026-01-17 15:12:26,080] Trial 37 finished with value: 0.9032567049808429 and parameters: {'C': 0.9100435252755729, 'max_iter': 364, 'solver': 'lbfgs'}. Best is trial 10 with value: 0.9243295019157088.
/home/sjoon/projects/brain_connectivity_classifier/masterthesis_venv2/lib/python3.11/site-packages/sklearn/linear_model/_logistic.py:1272: FutureWarning: 'multi_class' was deprecated in version 1.5 and will be removed in 1.8. From then on, it will always use 'multinomial'. Leave it to its default value to avoid this warning.
  warnings.warn(
[I 2026-01-17 15:12:27,722] Trial 38 finished with value: 0.9015804597701149 and parameters: {'C': 1.9049444484251374, 'max_iter': 324, 'solver': 'newton-cg'}. Best is trial 10 with value: 0.9243295019157088.
/home/sjoon/projects/brain_connectivity_classifier/masterthesis_venv2/lib/python3.11/site-packages/sklearn/linear_model/_logistic.py:1272: FutureWarning: 'multi_class' was deprecated in version 1.5 and will be removed in 1.8. From then on, it will always use 'multinomial'. Leave it to its default value to avoid this warning.
  warnings.warn(
[I 2026-01-17 15:12:45,060] Trial 39 finished with value: 0.8840996168582376 and parameters: {'C': 0.016144929379448048, 'max_iter': 206, 'solver': 'lbfgs'}. Best is trial 10 with value: 0.9243295019157088.
/home/sjoon/projects/brain_connectivity_classifier/masterthesis_venv2/lib/python3.11/site-packages/sklearn/linear_model/_logistic.py:1272: FutureWarning: 'multi_class' was deprecated in version 1.5 and will be removed in 1.8. From then on, it will always use 'multinomial'. Leave it to its default value to avoid this warning.
  warnings.warn(
[I 2026-01-17 15:12:46,568] Trial 40 finished with value: 0.907088122605364 and parameters: {'C': 0.08329147071092241, 'max_iter': 463, 'solver': 'newton-cg'}. Best is trial 10 with value: 0.9243295019157088.
/home/sjoon/projects/brain_connectivity_classifier/masterthesis_venv2/lib/python3.11/site-packages/sklearn/linear_model/_logistic.py:1272: FutureWarning: 'multi_class' was deprecated in version 1.5 and will be removed in 1.8. From then on, it will always use 'multinomial'. Leave it to its default value to avoid this warning.
  warnings.warn(
[I 2026-01-17 15:12:58,984] Trial 41 finished with value: 0.9032567049808429 and parameters: {'C': 0.753953892501283, 'max_iter': 348, 'solver': 'lbfgs'}. Best is trial 10 with value: 0.9243295019157088.
/home/sjoon/projects/brain_connectivity_classifier/masterthesis_venv2/lib/python3.11/site-packages/sklearn/linear_model/_logistic.py:1272: FutureWarning: 'multi_class' was deprecated in version 1.5 and will be removed in 1.8. From then on, it will always use 'multinomial'. Leave it to its default value to avoid this warning.
  warnings.warn(
[I 2026-01-17 15:13:13,944] Trial 42 finished with value: 0.8987068965517241 and parameters: {'C': 4.305076566121991, 'max_iter': 352, 'solver': 'lbfgs'}. Best is trial 10 with value: 0.9243295019157088.
/home/sjoon/projects/brain_connectivity_classifier/masterthesis_venv2/lib/python3.11/site-packages/sklearn/linear_model/_logistic.py:1272: FutureWarning: 'multi_class' was deprecated in version 1.5 and will be removed in 1.8. From then on, it will always use 'multinomial'. Leave it to its default value to avoid this warning.
  warnings.warn(
[I 2026-01-17 15:13:23,032] Trial 43 finished with value: 0.9226532567049809 and parameters: {'C': 0.4312633476557789, 'max_iter': 392, 'solver': 'lbfgs'}. Best is trial 10 with value: 0.9243295019157088.
/home/sjoon/projects/brain_connectivity_classifier/masterthesis_venv2/lib/python3.11/site-packages/sklearn/linear_model/_logistic.py:1272: FutureWarning: 'multi_class' was deprecated in version 1.5 and will be removed in 1.8. From then on, it will always use 'multinomial'. Leave it to its default value to avoid this warning.
  warnings.warn(
