[I 2026-01-17 15:19:07,870] Trial 49 finished with value: 0.8924808429118773 and parameters: {'C': 3.496812652192747, 'max_iter': 330, 'solver': 'newton-cg'}. Best is trial 47 with value: 0.9267241379310345.
/home/sjoon/projects/brain_connectivity_classifier/masterthesis_venv2/lib/python3.11/site-packages/sklearn/linear_model/_logistic.py:1272: FutureWarning: 'multi_class' was deprecated in version 1.5 and will be removed in 1.8. From then on, it will always use 'multinomial'. Leave it to its default value to avoid this warning.
  warnings.warn(
[Parallel(n_jobs=-1)]: Using backend LokyBackend with 16 concurrent workers.
/home/sjoon/projects/brain_connectivity_classifier/masterthesis_venv2/lib/python3.11/site-packages/sklearn/linear_model/_logistic.py:1272: FutureWarning: 'multi_class' was deprecated in version 1.5 and will be removed in 1.8. From then on, it will always use 'multinomial'. Leave it to its default value to avoid this warning.
  warnings.warn(
/home/sjoon/projects/brain_connectivity_classifier/masterthesis_venv2/lib/python3.11/site-packages/sklearn/linear_model/_logistic.py:1272: FutureWarning: 'multi_class' was deprecated in version 1.5 and will be removed in 1.8. From then on, it will always use 'multinomial'. Leave it to its default value to avoid this warning.
  warnings.warn(
/home/sjoon/projects/brain_connectivity_classifier/masterthesis_venv2/lib/python3.11/site-packages/sklearn/linear_model/_logistic.py:1272: FutureWarning: 'multi_class' was deprecated in version 1.5 and will be removed in 1.8. From then on, it will always use 'multinomial'. Leave it to its default value to avoid this warning.
  warnings.warn(
/home/sjoon/projects/brain_connectivity_classifier/masterthesis_venv2/lib/python3.11/site-packages/sklearn/linear_model/_logistic.py:1272: FutureWarning: 'multi_class' was deprecated in version 1.5 and will be removed in 1.8. From then on, it will always use 'multinomial'. Leave it to its default value to avoid this warning.
  warnings.warn(
/home/sjoon/projects/brain_connectivity_classifier/masterthesis_venv2/lib/python3.11/site-packages/sklearn/linear_model/_logistic.py:1272: FutureWarning: 'multi_class' was deprecated in version 1.5 and will be removed in 1.8. From then on, it will always use 'multinomial'. Leave it to its default value to avoid this warning.
  warnings.warn(
/home/sjoon/projects/brain_connectivity_classifier/masterthesis_venv2/lib/python3.11/site-packages/sklearn/linear_model/_logistic.py:1272: FutureWarning: 'multi_class' was deprecated in version 1.5 and will be removed in 1.8. From then on, it will always use 'multinomial'. Leave it to its default value to avoid this warning.
  warnings.warn(
/home/sjoon/projects/brain_connectivity_classifier/masterthesis_venv2/lib/python3.11/site-packages/sklearn/linear_model/_logistic.py:1272: FutureWarning: 'multi_class' was deprecated in version 1.5 and will be removed in 1.8. From then on, it will always use 'multinomial'. Leave it to its default value to avoid this warning.
  warnings.warn(
/home/sjoon/projects/brain_connectivity_classifier/masterthesis_venv2/lib/python3.11/site-packages/sklearn/linear_model/_logistic.py:1272: FutureWarning: 'multi_class' was deprecated in version 1.5 and will be removed in 1.8. From then on, it will always use 'multinomial'. Leave it to its default value to avoid this warning.
  warnings.warn(
/home/sjoon/projects/brain_connectivity_classifier/masterthesis_venv2/lib/python3.11/site-packages/sklearn/linear_model/_logistic.py:1272: FutureWarning: 'multi_class' was deprecated in version 1.5 and will be removed in 1.8. From then on, it will always use 'multinomial'. Leave it to its default value to avoid this warning.
  warnings.warn(
/home/sjoon/projects/brain_connectivity_classifier/masterthesis_venv2/lib/python3.11/site-packages/sklearn/linear_model/_logistic.py:1272: FutureWarning: 'multi_class' was deprecated in version 1.5 and will be removed in 1.8. From then on, it will always use 'multinomial'. Leave it to its default value to avoid this warning.
  warnings.warn(
/home/sjoon/projects/brain_connectivity_classifier/masterthesis_venv2/lib/python3.11/site-packages/sklearn/linear_model/_logistic.py:1272: FutureWarning: 'multi_class' was deprecated in version 1.5 and will be removed in 1.8. From then on, it will always use 'multinomial'. Leave it to its default value to avoid this warning.
  warnings.warn(
/home/sjoon/projects/brain_connectivity_classifier/masterthesis_venv2/lib/python3.11/site-packages/sklearn/linear_model/_logistic.py:1272: FutureWarning: 'multi_class' was deprecated in version 1.5 and will be removed in 1.8. From then on, it will always use 'multinomial'. Leave it to its default value to avoid this warning.
  warnings.warn(
/home/sjoon/projects/brain_connectivity_classifier/masterthesis_venv2/lib/python3.11/site-packages/sklearn/linear_model/_logistic.py:1272: FutureWarning: 'multi_class' was deprecated in version 1.5 and will be removed in 1.8. From then on, it will always use 'multinomial'. Leave it to its default value to avoid this warning.
  warnings.warn(
/home/sjoon/projects/brain_connectivity_classifier/masterthesis_venv2/lib/python3.11/site-packages/sklearn/linear_model/_logistic.py:1272: FutureWarning: 'multi_class' was deprecated in version 1.5 and will be removed in 1.8. From then on, it will always use 'multinomial'. Leave it to its default value to avoid this warning.
  warnings.warn(
/home/sjoon/projects/brain_connectivity_classifier/masterthesis_venv2/lib/python3.11/site-packages/sklearn/linear_model/_logistic.py:1272: FutureWarning: 'multi_class' was deprecated in version 1.5 and will be removed in 1.8. From then on, it will always use 'multinomial'. Leave it to its default value to avoid this warning.
  warnings.warn(
/home/sjoon/projects/brain_connectivity_classifier/masterthesis_venv2/lib/python3.11/site-packages/sklearn/linear_model/_logistic.py:1272: FutureWarning: 'multi_class' was deprecated in version 1.5 and will be removed in 1.8. From then on, it will always use 'multinomial'. Leave it to its default value to avoid this warning.
  warnings.warn(
/home/sjoon/projects/brain_connectivity_classifier/masterthesis_venv2/lib/python3.11/site-packages/sklearn/linear_model/_logistic.py:1272: FutureWarning: 'multi_class' was deprecated in version 1.5 and will be removed in 1.8. From then on, it will always use 'multinomial'. Leave it to its default value to avoid this warning.
  warnings.warn(
/home/sjoon/projects/brain_connectivity_classifier/masterthesis_venv2/lib/python3.11/site-packages/sklearn/linear_model/_logistic.py:1272: FutureWarning: 'multi_class' was deprecated in version 1.5 and will be removed in 1.8. From then on, it will always use 'multinomial'. Leave it to its default value to avoid this warning.
  warnings.warn(
/home/sjoon/projects/brain_connectivity_classifier/masterthesis_venv2/lib/python3.11/site-packages/sklearn/linear_model/_logistic.py:1272: FutureWarning: 'multi_class' was deprecated in version 1.5 and will be removed in 1.8. From then on, it will always use 'multinomial'. Leave it to its default value to avoid this warning.
  warnings.warn(
/home/sjoon/projects/brain_connectivity_classifier/masterthesis_venv2/lib/python3.11/site-packages/sklearn/linear_model/_logistic.py:1272: FutureWarning: 'multi_class' was deprecated in version 1.5 and will be removed in 1.8. From then on, it will always use 'multinomial'. Leave it to its default value to avoid this warning.
  warnings.warn(
/home/sjoon/projects/brain_connectivity_classifier/masterthesis_venv2/lib/python3.11/site-packages/sklearn/linear_model/_logistic.py:1272: FutureWarning: 'multi_class' was deprecated in version 1.5 and will be removed in 1.8. From then on, it will always use 'multinomial'. Leave it to its default value to avoid this warning.
  warnings.warn(
/home/sjoon/projects/brain_connectivity_classifier/masterthesis_venv2/lib/python3.11/site-packages/sklearn/linear_model/_logistic.py:1272: FutureWarning: 'multi_class' was deprecated in version 1.5 and will be removed in 1.8. From then on, it will always use 'multinomial'. Leave it to its default value to avoid this warning.
  warnings.warn(
/home/sjoon/projects/brain_connectivity_classifier/masterthesis_venv2/lib/python3.11/site-packages/sklearn/linear_model/_logistic.py:1272: FutureWarning: 'multi_class' was deprecated in version 1.5 and will be removed in 1.8. From then on, it will always use 'multinomial'. Leave it to its default value to avoid this warning.
  warnings.warn(
/home/sjoon/projects/brain_connectivity_classifier/masterthesis_venv2/lib/python3.11/site-packages/sklearn/linear_model/_logistic.py:1272: FutureWarning: 'multi_class' was deprecated in version 1.5 and will be removed in 1.8. From then on, it will always use 'multinomial'. Leave it to its default value to avoid this warning.
  warnings.warn(
/home/sjoon/projects/brain_connectivity_classifier/masterthesis_venv2/lib/python3.11/site-packages/sklearn/linear_model/_logistic.py:1272: FutureWarning: 'multi_class' was deprecated in version 1.5 and will be removed in 1.8. From then on, it will always use 'multinomial'. Leave it to its default value to avoid this warning.
  warnings.warn(
/home/sjoon/projects/brain_connectivity_classifier/masterthesis_venv2/lib/python3.11/site-packages/sklearn/linear_model/_logistic.py:1272: FutureWarning: 'multi_class' was deprecated in version 1.5 and will be removed in 1.8. From then on, it will always use 'multinomial'. Leave it to its default value to avoid this warning.
  warnings.warn(
/home/sjoon/projects/brain_connectivity_classifier/masterthesis_venv2/lib/python3.11/site-packages/sklearn/linear_model/_logistic.py:1272: FutureWarning: 'multi_class' was deprecated in version 1.5 and will be removed in 1.8. From then on, it will always use 'multinomial'. Leave it to its default value to avoid this warning.
  warnings.warn(
/home/sjoon/projects/brain_connectivity_classifier/masterthesis_venv2/lib/python3.11/site-packages/sklearn/linear_model/_logistic.py:1272: FutureWarning: 'multi_class' was deprecated in version 1.5 and will be removed in 1.8. From then on, it will always use 'multinomial'. Leave it to its default value to avoid this warning.
  warnings.warn(
/home/sjoon/projects/brain_connectivity_classifier/masterthesis_venv2/lib/python3.11/site-packages/sklearn/linear_model/_logistic.py:1272: FutureWarning: 'multi_class' was deprecated in version 1.5 and will be removed in 1.8. From then on, it will always use 'multinomial'. Leave it to its default value to avoid this warning.
  warnings.warn(
/home/sjoon/projects/brain_connectivity_classifier/masterthesis_venv2/lib/python3.11/site-packages/sklearn/linear_model/_logistic.py:1272: FutureWarning: 'multi_class' was deprecated in version 1.5 and will be removed in 1.8. From then on, it will always use 'multinomial'. Leave it to its default value to avoid this warning.
  warnings.warn(
/home/sjoon/projects/brain_connectivity_classifier/masterthesis_venv2/lib/python3.11/site-packages/sklearn/linear_model/_logistic.py:1272: FutureWarning: 'multi_class' was deprecated in version 1.5 and will be removed in 1.8. From then on, it will always use 'multinomial'. Leave it to its default value to avoid this warning.
  warnings.warn(
/home/sjoon/projects/brain_connectivity_classifier/masterthesis_venv2/lib/python3.11/site-packages/sklearn/linear_model/_logistic.py:1272: FutureWarning: 'multi_class' was deprecated in version 1.5 and will be removed in 1.8. From then on, it will always use 'multinomial'. Leave it to its default value to avoid this warning.
  warnings.warn(
/home/sjoon/projects/brain_connectivity_classifier/masterthesis_venv2/lib/python3.11/site-packages/sklearn/linear_model/_logistic.py:1272: FutureWarning: 'multi_class' was deprecated in version 1.5 and will be removed in 1.8. From then on, it will always use 'multinomial'. Leave it to its default value to avoid this warning.
  warnings.warn(
/home/sjoon/projects/brain_connectivity_classifier/masterthesis_venv2/lib/python3.11/site-packages/sklearn/linear_model/_logistic.py:1272: FutureWarning: 'multi_class' was deprecated in version 1.5 and will be removed in 1.8. From then on, it will always use 'multinomial'. Leave it to its default value to avoid this warning.
  warnings.warn(
/home/sjoon/projects/brain_connectivity_classifier/masterthesis_venv2/lib/python3.11/site-packages/sklearn/linear_model/_logistic.py:1272: FutureWarning: 'multi_class' was deprecated in version 1.5 and will be removed in 1.8. From then on, it will always use 'multinomial'. Leave it to its default value to avoid this warning.
  warnings.warn(
/home/sjoon/projects/brain_connectivity_classifier/masterthesis_venv2/lib/python3.11/site-packages/sklearn/linear_model/_logistic.py:1272: FutureWarning: 'multi_class' was deprecated in version 1.5 and will be removed in 1.8. From then on, it will always use 'multinomial'. Leave it to its default value to avoid this warning.
  warnings.warn(
/home/sjoon/projects/brain_connectivity_classifier/masterthesis_venv2/lib/python3.11/site-packages/sklearn/linear_model/_logistic.py:1272: FutureWarning: 'multi_class' was deprecated in version 1.5 and will be removed in 1.8. From then on, it will always use 'multinomial'. Leave it to its default value to avoid this warning.
  warnings.warn(
/home/sjoon/projects/brain_connectivity_classifier/masterthesis_venv2/lib/python3.11/site-packages/sklearn/linear_model/_logistic.py:1272: FutureWarning: 'multi_class' was deprecated in version 1.5 and will be removed in 1.8. From then on, it will always use 'multinomial'. Leave it to its default value to avoid this warning.
  warnings.warn(
/home/sjoon/projects/brain_connectivity_classifier/masterthesis_venv2/lib/python3.11/site-packages/sklearn/linear_model/_logistic.py:1272: FutureWarning: 'multi_class' was deprecated in version 1.5 and will be removed in 1.8. From then on, it will always use 'multinomial'. Leave it to its default value to avoid this warning.
  warnings.warn(
/home/sjoon/projects/brain_connectivity_classifier/masterthesis_venv2/lib/python3.11/site-packages/sklearn/linear_model/_logistic.py:1272: FutureWarning: 'multi_class' was deprecated in version 1.5 and will be removed in 1.8. From then on, it will always use 'multinomial'. Leave it to its default value to avoid this warning.
  warnings.warn(
/home/sjoon/projects/brain_connectivity_classifier/masterthesis_venv2/lib/python3.11/site-packages/sklearn/linear_model/_logistic.py:1272: FutureWarning: 'multi_class' was deprecated in version 1.5 and will be removed in 1.8. From then on, it will always use 'multinomial'. Leave it to its default value to avoid this warning.
  warnings.warn(
/home/sjoon/projects/brain_connectivity_classifier/masterthesis_venv2/lib/python3.11/site-packages/sklearn/linear_model/_logistic.py:1272: FutureWarning: 'multi_class' was deprecated in version 1.5 and will be removed in 1.8. From then on, it will always use 'multinomial'. Leave it to its default value to avoid this warning.
  warnings.warn(
/home/sjoon/projects/brain_connectivity_classifier/masterthesis_venv2/lib/python3.11/site-packages/sklearn/linear_model/_logistic.py:1272: FutureWarning: 'multi_class' was deprecated in version 1.5 and will be removed in 1.8. From then on, it will always use 'multinomial'. Leave it to its default value to avoid this warning.
  warnings.warn(
/home/sjoon/projects/brain_connectivity_classifier/masterthesis_venv2/lib/python3.11/site-packages/sklearn/linear_model/_logistic.py:1272: FutureWarning: 'multi_class' was deprecated in version 1.5 and will be removed in 1.8. From then on, it will always use 'multinomial'. Leave it to its default value to avoid this warning.
  warnings.warn(
/home/sjoon/projects/brain_connectivity_classifier/masterthesis_venv2/lib/python3.11/site-packages/sklearn/linear_model/_logistic.py:1272: FutureWarning: 'multi_class' was deprecated in version 1.5 and will be removed in 1.8. From then on, it will always use 'multinomial'. Leave it to its default value to avoid this warning.
  warnings.warn(
/home/sjoon/projects/brain_connectivity_classifier/masterthesis_venv2/lib/python3.11/site-packages/sklearn/linear_model/_logistic.py:1272: FutureWarning: 'multi_class' was deprecated in version 1.5 and will be removed in 1.8. From then on, it will always use 'multinomial'. Leave it to its default value to avoid this warning.
  warnings.warn(
/home/sjoon/projects/brain_connectivity_classifier/masterthesis_venv2/lib/python3.11/site-packages/sklearn/linear_model/_logistic.py:1272: FutureWarning: 'multi_class' was deprecated in version 1.5 and will be removed in 1.8. From then on, it will always use 'multinomial'. Leave it to its default value to avoid this warning.
  warnings.warn(
/home/sjoon/projects/brain_connectivity_classifier/masterthesis_venv2/lib/python3.11/site-packages/sklearn/linear_model/_logistic.py:1272: FutureWarning: 'multi_class' was deprecated in version 1.5 and will be removed in 1.8. From then on, it will always use 'multinomial'. Leave it to its default value to avoid this warning.
  warnings.warn(
/home/sjoon/projects/brain_connectivity_classifier/masterthesis_venv2/lib/python3.11/site-packages/sklearn/linear_model/_logistic.py:1272: FutureWarning: 'multi_class' was deprecated in version 1.5 and will be removed in 1.8. From then on, it will always use 'multinomial'. Leave it to its default value to avoid this warning.
  warnings.warn(
/home/sjoon/projects/brain_connectivity_classifier/masterthesis_venv2/lib/python3.11/site-packages/sklearn/linear_model/_logistic.py:1272: FutureWarning: 'multi_class' was deprecated in version 1.5 and will be removed in 1.8. From then on, it will always use 'multinomial'. Leave it to its default value to avoid this warning.
  warnings.warn(
/home/sjoon/projects/brain_connectivity_classifier/masterthesis_venv2/lib/python3.11/site-packages/sklearn/linear_model/_logistic.py:1272: FutureWarning: 'multi_class' was deprecated in version 1.5 and will be removed in 1.8. From then on, it will always use 'multinomial'. Leave it to its default value to avoid this warning.
  warnings.warn(
/home/sjoon/projects/brain_connectivity_classifier/masterthesis_venv2/lib/python3.11/site-packages/sklearn/linear_model/_logistic.py:1272: FutureWarning: 'multi_class' was deprecated in version 1.5 and will be removed in 1.8. From then on, it will always use 'multinomial'. Leave it to its default value to avoid this warning.
  warnings.warn(
/home/sjoon/projects/brain_connectivity_classifier/masterthesis_venv2/lib/python3.11/site-packages/sklearn/linear_model/_logistic.py:1272: FutureWarning: 'multi_class' was deprecated in version 1.5 and will be removed in 1.8. From then on, it will always use 'multinomial'. Leave it to its default value to avoid this warning.
  warnings.warn(
/home/sjoon/projects/brain_connectivity_classifier/masterthesis_venv2/lib/python3.11/site-packages/sklearn/linear_model/_logistic.py:1272: FutureWarning: 'multi_class' was deprecated in version 1.5 and will be removed in 1.8. From then on, it will always use 'multinomial'. Leave it to its default value to avoid this warning.
  warnings.warn(
/home/sjoon/projects/brain_connectivity_classifier/masterthesis_venv2/lib/python3.11/site-packages/sklearn/linear_model/_logistic.py:1272: FutureWarning: 'multi_class' was deprecated in version 1.5 and will be removed in 1.8. From then on, it will always use 'multinomial'. Leave it to its default value to avoid this warning.
  warnings.warn(
/home/sjoon/projects/brain_connectivity_classifier/masterthesis_venv2/lib/python3.11/site-packages/sklearn/linear_model/_logistic.py:1272: FutureWarning: 'multi_class' was deprecated in version 1.5 and will be removed in 1.8. From then on, it will always use 'multinomial'. Leave it to its default value to avoid this warning.
  warnings.warn(
/home/sjoon/projects/brain_connectivity_classifier/masterthesis_venv2/lib/python3.11/site-packages/sklearn/linear_model/_logistic.py:1272: FutureWarning: 'multi_class' was deprecated in version 1.5 and will be removed in 1.8. From then on, it will always use 'multinomial'. Leave it to its default value to avoid this warning.
  warnings.warn(
/home/sjoon/projects/brain_connectivity_classifier/masterthesis_venv2/lib/python3.11/site-packages/sklearn/linear_model/_logistic.py:1272: FutureWarning: 'multi_class' was deprecated in version 1.5 and will be removed in 1.8. From then on, it will always use 'multinomial'. Leave it to its default value to avoid this warning.
  warnings.warn(
/home/sjoon/projects/brain_connectivity_classifier/masterthesis_venv2/lib/python3.11/site-packages/sklearn/linear_model/_logistic.py:1272: FutureWarning: 'multi_class' was deprecated in version 1.5 and will be removed in 1.8. From then on, it will always use 'multinomial'. Leave it to its default value to avoid this warning.
  warnings.warn(
/home/sjoon/projects/brain_connectivity_classifier/masterthesis_venv2/lib/python3.11/site-packages/sklearn/linear_model/_logistic.py:1272: FutureWarning: 'multi_class' was deprecated in version 1.5 and will be removed in 1.8. From then on, it will always use 'multinomial'. Leave it to its default value to avoid this warning.
  warnings.warn(
/home/sjoon/projects/brain_connectivity_classifier/masterthesis_venv2/lib/python3.11/site-packages/sklearn/linear_model/_logistic.py:1272: FutureWarning: 'multi_class' was deprecated in version 1.5 and will be removed in 1.8. From then on, it will always use 'multinomial'. Leave it to its default value to avoid this warning.
  warnings.warn(
/home/sjoon/projects/brain_connectivity_classifier/masterthesis_venv2/lib/python3.11/site-packages/sklearn/linear_model/_logistic.py:1272: FutureWarning: 'multi_class' was deprecated in version 1.5 and will be removed in 1.8. From then on, it will always use 'multinomial'. Leave it to its default value to avoid this warning.
  warnings.warn(
/home/sjoon/projects/brain_connectivity_cla