[I 2026-01-17 16:01:08,760] Trial 35 finished with value: 0.891044061302682 and parameters: {'C': 2.295388569040906, 'max_iter': 453, 'solver': 'lbfgs'}. Best is trial 20 with value: 0.9243295019157088.
/home/sjoon/projects/brain_connectivity_classifier/masterthesis_venv2/lib/python3.11/site-packages/sklearn/linear_model/_logistic.py:1272: FutureWarning: 'multi_class' was deprecated in version 1.5 and will be removed in 1.8. From then on, it will always use 'multinomial'. Leave it to its default value to avoid this warning.
  warnings.warn(
[I 2026-01-17 16:01:15,784] Trial 36 finished with value: 0.9092432950191571 and parameters: {'C': 0.7009861538721222, 'max_iter': 353, 'solver': 'lbfgs'}. Best is trial 20 with value: 0.9243295019157088.
/home/sjoon/projects/brain_connectivity_classifier/masterthesis_venv2/lib/python3.11/site-packages/sklearn/linear_model/_logistic.py:1272: FutureWarning: 'multi_class' was deprecated in version 1.5 and will be removed in 1.8. From then on, it will always use 'multinomial'. Leave it to its default value to avoid this warning.
  warnings.warn(
[I 2026-01-17 16:01:17,649] Trial 37 finished with value: 0.9135536398467433 and parameters: {'C': 0.04398439808129645, 'max_iter': 296, 'solver': 'newton-cg'}. Best is trial 20 with value: 0.9243295019157088.
/home/sjoon/projects/brain_connectivity_classifier/masterthesis_venv2/lib/python3.11/site-packages/sklearn/linear_model/_logistic.py:1272: FutureWarning: 'multi_class' was deprecated in version 1.5 and will be removed in 1.8. From then on, it will always use 'multinomial'. Leave it to its default value to avoid this warning.
  warnings.warn(
[I 2026-01-17 16:01:32,088] Trial 38 finished with value: 0.8881704980842912 and parameters: {'C': 0.010237623304248667, 'max_iter': 466, 'solver': 'lbfgs'}. Best is trial 20 with value: 0.9243295019157088.
/home/sjoon/projects/brain_connectivity_classifier/masterthesis_venv2/lib/python3.11/site-packages/sklearn/linear_model/_logistic.py:1272: FutureWarning: 'multi_class' was deprecated in version 1.5 and will be removed in 1.8. From then on, it will always use 'multinomial'. Leave it to its default value to avoid this warning.
  warnings.warn(
[I 2026-01-17 16:01:38,252] Trial 39 finished with value: 0.9152298850574713 and parameters: {'C': 0.11361364901734343, 'max_iter': 498, 'solver': 'lbfgs'}. Best is trial 20 with value: 0.9243295019157088.
/home/sjoon/projects/brain_connectivity_classifier/masterthesis_venv2/lib/python3.11/site-packages/sklearn/linear_model/_logistic.py:1272: FutureWarning: 'multi_class' was deprecated in version 1.5 and will be removed in 1.8. From then on, it will always use 'multinomial'. Leave it to its default value to avoid this warning.
  warnings.warn(
[I 2026-01-17 16:01:39,924] Trial 40 finished with value: 0.8807471264367817 and parameters: {'C': 8.492004267410476, 'max_iter': 400, 'solver': 'newton-cg'}. Best is trial 20 with value: 0.9243295019157088.
/home/sjoon/projects/brain_connectivity_classifier/masterthesis_venv2/lib/python3.11/site-packages/sklearn/linear_model/_logistic.py:1272: FutureWarning: 'multi_class' was deprecated in version 1.5 and will be removed in 1.8. From then on, it will always use 'multinomial'. Leave it to its default value to avoid this warning.
  warnings.warn(
[I 2026-01-17 16:01:49,524] Trial 41 finished with value: 0.9063697318007663 and parameters: {'C': 0.14296591556991398, 'max_iter': 273, 'solver': 'lbfgs'}. Best is trial 20 with value: 0.9243295019157088.
/home/sjoon/projects/brain_connectivity_classifier/masterthesis_venv2/lib/python3.11/site-packages/sklearn/linear_model/_logistic.py:1272: FutureWarning: 'multi_class' was deprecated in version 1.5 and will be removed in 1.8. From then on, it will always use 'multinomial'. Leave it to its default value to avoid this warning.
  warnings.warn(
[I 2026-01-17 16:01:59,404] Trial 42 finished with value: 0.9190613026819924 and parameters: {'C': 0.24763055579283677, 'max_iter': 172, 'solver': 'lbfgs'}. Best is trial 20 with value: 0.9243295019157088.
/home/sjoon/projects/brain_connectivity_classifier/masterthesis_venv2/lib/python3.11/site-packages/sklearn/linear_model/_logistic.py:1272: FutureWarning: 'multi_class' was deprecated in version 1.5 and will be removed in 1.8. From then on, it will always use 'multinomial'. Leave it to its default value to avoid this warning.
  warnings.warn(
[I 2026-01-17 16:02:06,668] Trial 43 finished with value: 0.912595785440613 and parameters: {'C': 0.2493469213817249, 'max_iter': 165, 'solver': 'lbfgs'}. Best is trial 20 with value: 0.9243295019157088.
/home/sjoon/projects/brain_connectivity_classifier/masterthesis_venv2/lib/python3.11/site-packages/sklearn/linear_model/_logistic.py:1272: FutureWarning: 'multi_class' was deprecated in version 1.5 and will be removed in 1.8. From then on, it will always use 'multinomial'. Leave it to its default value to avoid this warning.
  warnings.warn(
[I 2026-01-17 16:02:16,716] Trial 44 finished with value: 0.9094827586206896 and parameters: {'C': 1.0679065976664672, 'max_iter': 137, 'solver': 'lbfgs'}. Best is trial 20 with value: 0.9243295019157088.
/home/sjoon/projects/brain_connectivity_classifier/masterthesis_venv2/lib/python3.11/site-packages/sklearn/linear_model/_logistic.py:1272: FutureWarning: 'multi_class' was deprecated in version 1.5 and will be removed in 1.8. From then on, it will always use 'multinomial'. Leave it to its default value to avoid this warning.
  warnings.warn(
[I 2026-01-17 16:02:24,788] Trial 45 finished with value: 0.9080459770114943 and parameters: {'C': 0.4944748036141616, 'max_iter': 314, 'solver': 'lbfgs'}. Best is trial 20 with value: 0.9243295019157088.
/home/sjoon/projects/brain_connectivity_classifier/masterthesis_venv2/lib/python3.11/site-packages/sklearn/linear_model/_logistic.py:1272: FutureWarning: 'multi_class' was deprecated in version 1.5 and will be removed in 1.8. From then on, it will always use 'multinomial'. Leave it to its default value to avoid this warning.
  warnings.warn(
[I 2026-01-17 16:02:36,884] Trial 46 finished with value: 0.8991858237547893 and parameters: {'C': 0.05073396627106304, 'max_iter': 368, 'solver': 'lbfgs'}. Best is trial 20 with value: 0.9243295019157088.
/home/sjoon/projects/brain_connectivity_classifier/masterthesis_venv2/lib/python3.11/site-packages/sklearn/linear_model/_logistic.py:1272: FutureWarning: 'multi_class' was deprecated in version 1.5 and will be removed in 1.8. From then on, it will always use 'multinomial'. Leave it to its default value to avoid this warning.
  warnings.warn(
[I 2026-01-17 16:02:49,348] Trial 47 finished with value: 0.907088122605364 and parameters: {'C': 0.027041873163104795, 'max_iter': 170, 'solver': 'lbfgs'}. Best is trial 20 with value: 0.9243295019157088.
/home/sjoon/projects/brain_connectivity_classifier/masterthesis_venv2/lib/python3.11/site-packages/sklearn/linear_model/_logistic.py:1272: FutureWarning: 'multi_class' was deprecated in version 1.5 and will be removed in 1.8. From then on, it will always use 'multinomial'. Leave it to its default value to avoid this warning.
  warnings.warn(
[I 2026-01-17 16:02:59,644] Trial 48 finished with value: 0.9128352490421456 and parameters: {'C': 0.059371444909650684, 'max_iter': 430, 'solver': 'lbfgs'}. Best is trial 20 with value: 0.9243295019157088.
/home/sjoon/projects/brain_connectivity_classifier/masterthesis_venv2/lib/python3.11/site-packages/sklearn/linear_model/_logistic.py:1272: FutureWarning: 'multi_class' was deprecated in version 1.5 and will be removed in 1.8. From then on, it will always use 'multinomial'. Leave it to its default value to avoid this warning.
  warnings.warn(
