[I 2026-01-17 14:49:10,895] A new study created in memory with name: no-name-197004fd-ac02-4281-b390-93db1e916c75
/home/sjoon/projects/brain_connectivity_classifier/masterthesis_venv2/lib/python3.11/site-packages/sklearn/linear_model/_logistic.py:1272: FutureWarning: 'multi_class' was deprecated in version 1.5 and will be removed in 1.8. From then on, it will always use 'multinomial'. Leave it to its default value to avoid this warning.
  warnings.warn(
[I 2026-01-17 14:49:12,221] Trial 0 finished with value: 0.8479406130268199 and parameters: {'C': 0.0028854813096126047, 'max_iter': 266, 'solver': 'newton-cg'}. Best is trial 0 with value: 0.8479406130268199.
/home/sjoon/projects/brain_connectivity_classifier/masterthesis_venv2/lib/python3.11/site-packages/sklearn/linear_model/_logistic.py:1272: FutureWarning: 'multi_class' was deprecated in version 1.5 and will be removed in 1.8. From then on, it will always use 'multinomial'. Leave it to its default value to avoid this warning.
  warnings.warn(
[I 2026-01-17 14:49:24,296] Trial 1 finished with value: 0.9106800766283525 and parameters: {'C': 0.02034961622498155, 'max_iter': 399, 'solver': 'lbfgs'}. Best is trial 1 with value: 0.9106800766283525.
/home/sjoon/projects/brain_connectivity_classifier/masterthesis_venv2/lib/python3.11/site-packages/sklearn/linear_model/_logistic.py:1272: FutureWarning: 'multi_class' was deprecated in version 1.5 and will be removed in 1.8. From then on, it will always use 'multinomial'. Leave it to its default value to avoid this warning.
  warnings.warn(
[I 2026-01-17 14:49:25,737] Trial 2 finished with value: 0.7842432950191571 and parameters: {'C': 0.0013063372103949843, 'max_iter': 326, 'solver': 'newton-cg'}. Best is trial 1 with value: 0.9106800766283525.
/home/sjoon/projects/brain_connectivity_classifier/masterthesis_venv2/lib/python3.11/site-packages/sklearn/linear_model/_logistic.py:1272: FutureWarning: 'multi_class' was deprecated in version 1.5 and will be removed in 1.8. From then on, it will always use 'multinomial'. Leave it to its default value to avoid this warning.
  warnings.warn(
[I 2026-01-17 14:49:38,100] Trial 3 finished with value: 0.8800287356321839 and parameters: {'C': 0.01041560504864896, 'max_iter': 109, 'solver': 'lbfgs'}. Best is trial 1 with value: 0.9106800766283525.
/home/sjoon/projects/brain_connectivity_classifier/masterthesis_venv2/lib/python3.11/site-packages/sklearn/linear_model/_logistic.py:1272: FutureWarning: 'multi_class' was deprecated in version 1.5 and will be removed in 1.8. From then on, it will always use 'multinomial'. Leave it to its default value to avoid this warning.
  warnings.warn(
[I 2026-01-17 14:49:39,444] Trial 4 finished with value: 0.9066091954022989 and parameters: {'C': 0.0416828871122416, 'max_iter': 166, 'solver': 'newton-cg'}. Best is trial 1 with value: 0.9106800766283525.
/home/sjoon/projects/brain_connectivity_classifier/masterthesis_venv2/lib/python3.11/site-packages/sklearn/linear_model/_logistic.py:1272: FutureWarning: 'multi_class' was deprecated in version 1.5 and will be removed in 1.8. From then on, it will always use 'multinomial'. Leave it to its default value to avoid this warning.
  warnings.warn(
[I 2026-01-17 14:49:40,936] Trial 5 finished with value: 0.8915229885057471 and parameters: {'C': 2.487462779300572, 'max_iter': 478, 'solver': 'newton-cg'}. Best is trial 1 with value: 0.9106800766283525.
/home/sjoon/projects/brain_connectivity_classifier/masterthesis_venv2/lib/python3.11/site-packages/sklearn/linear_model/_logistic.py:1272: FutureWarning: 'multi_class' was deprecated in version 1.5 and will be removed in 1.8. From then on, it will always use 'multinomial'. Leave it to its default value to avoid this warning.
  warnings.warn(
[I 2026-01-17 14:49:42,359] Trial 6 finished with value: 0.8991858237547893 and parameters: {'C': 0.060678305383428034, 'max_iter': 294, 'solver': 'newton-cg'}. Best is trial 1 with value: 0.9106800766283525.
/home/sjoon/projects/brain_connectivity_classifier/masterthesis_venv2/lib/python3.11/site-packages/sklearn/linear_model/_logistic.py:1272: FutureWarning: 'multi_class' was deprecated in version 1.5 and will be removed in 1.8. From then on, it will always use 'multinomial'. Leave it to its default value to avoid this warning.
  warnings.warn(
[I 2026-01-17 14:49:43,557] Trial 7 finished with value: 0.9001436781609196 and parameters: {'C': 0.015560158006902589, 'max_iter': 152, 'solver': 'newton-cg'}. Best is trial 1 with value: 0.9106800766283525.
/home/sjoon/projects/brain_connectivity_classifier/masterthesis_venv2/lib/python3.11/site-packages/sklearn/linear_model/_logistic.py:1272: FutureWarning: 'multi_class' was deprecated in version 1.5 and will be removed in 1.8. From then on, it will always use 'multinomial'. Leave it to its default value to avoid this warning.
  warnings.warn(
[I 2026-01-17 14:49:52,638] Trial 8 finished with value: 0.9145114942528736 and parameters: {'C': 0.07987032801740344, 'max_iter': 278, 'solver': 'lbfgs'}. Best is trial 8 with value: 0.9145114942528736.
/home/sjoon/projects/brain_connectivity_classifier/masterthesis_venv2/lib/python3.11/site-packages/sklearn/linear_model/_logistic.py:1272: FutureWarning: 'multi_class' was deprecated in version 1.5 and will be removed in 1.8. From then on, it will always use 'multinomial'. Leave it to its default value to avoid this warning.
  warnings.warn(
[I 2026-01-17 14:49:54,188] Trial 9 finished with value: 0.9003831417624522 and parameters: {'C': 4.371317012469823, 'max_iter': 232, 'solver': 'newton-cg'}. Best is trial 8 with value: 0.9145114942528736.
/home/sjoon/projects/brain_connectivity_classifier/masterthesis_venv2/lib/python3.11/site-packages/sklearn/linear_model/_logistic.py:1272: FutureWarning: 'multi_class' was deprecated in version 1.5 and will be removed in 1.8. From then on, it will always use 'multinomial'. Leave it to its default value to avoid this warning.
  warnings.warn(
[I 2026-01-17 14:50:02,488] Trial 10 finished with value: 0.9046934865900383 and parameters: {'C': 0.46141959069413924, 'max_iter': 175, 'solver': 'lbfgs'}. Best is trial 8 with value: 0.9145114942528736.
/home/sjoon/projects/brain_connectivity_classifier/masterthesis_venv2/lib/python3.11/site-packages/sklearn/linear_model/_logistic.py:1272: FutureWarning: 'multi_class' was deprecated in version 1.5 and will be removed in 1.8. From then on, it will always use 'multinomial'. Leave it to its default value to avoid this warning.
  warnings.warn(
[I 2026-01-17 14:50:09,888] Trial 11 finished with value: 0.9011015325670498 and parameters: {'C': 0.24469116729061696, 'max_iter': 412, 'solver': 'lbfgs'}. Best is trial 8 with value: 0.9145114942528736.
/home/sjoon/projects/brain_connectivity_classifier/masterthesis_venv2/lib/python3.11/site-packages/sklearn/linear_model/_logistic.py:1272: FutureWarning: 'multi_class' was deprecated in version 1.5 and will be removed in 1.8. From then on, it will always use 'multinomial'. Leave it to its default value to avoid this warning.
  warnings.warn(
[I 2026-01-17 14:50:17,924] Trial 12 finished with value: 0.9135536398467433 and parameters: {'C': 0.30013978932205615, 'max_iter': 370, 'solver': 'lbfgs'}. Best is trial 8 with value: 0.9145114942528736.
/home/sjoon/projects/brain_connectivity_classifier/masterthesis_venv2/lib/python3.11/site-packages/sklearn/linear_model/_logistic.py:1272: FutureWarning: 'multi_class' was deprecated in version 1.5 and will be removed in 1.8. From then on, it will always use 'multinomial'. Leave it to its default value to avoid this warning.
  warnings.warn(
[I 2026-01-17 14:50:25,656] Trial 13 finished with value: 0.9135536398467433 and parameters: {'C': 0.4375807463690035, 'max_iter': 355, 'solver': 'lbfgs'}. Best is trial 8 with value: 0.9145114942528736.
/home/sjoon/projects/brain_connectivity_classifier/masterthesis_venv2/lib/python3.11/site-packages/sklearn/linear_model/_logistic.py:1272: FutureWarning: 'multi_class' was deprecated in version 1.5 and will be removed in 1.8. From then on, it will always use 'multinomial'. Leave it to its default value to avoid this warning.
  warnings.warn(
[I 2026-01-17 14:50:33,600] Trial 14 finished with value: 0.9073275862068966 and parameters: {'C': 1.4652439579068244, 'max_iter': 230, 'solver': 'lbfgs'}. Best is trial 8 with value: 0.9145114942528736.
/home/sjoon/projects/brain_connectivity_classifier/masterthesis_venv2/lib/python3.11/site-packages/sklearn/linear_model/_logistic.py:1272: FutureWarning: 'multi_class' was deprecated in version 1.5 and will be removed in 1.8. From then on, it will always use 'multinomial'. Leave it to its default value to avoid this warning.
  warnings.warn(
[I 2026-01-17 14:50:42,400] Trial 15 finished with value: 0.9087643678160919 and parameters: {'C': 9.772661923459571, 'max_iter': 483, 'solver': 'lbfgs'}. Best is trial 8 with value: 0.9145114942528736.
/home/sjoon/projects/brain_connectivity_classifier/masterthesis_venv2/lib/python3.11/site-packages/sklearn/linear_model/_logistic.py:1272: FutureWarning: 'multi_class' was deprecated in version 1.5 and will be removed in 1.8. From then on, it will always use 'multinomial'. Leave it to its default value to avoid this warning.
  warnings.warn(
[I 2026-01-17 14:50:52,535] Trial 16 finished with value: 0.9204980842911877 and parameters: {'C': 0.09915909184391404, 'max_iter': 277, 'solver': 'lbfgs'}. Best is trial 16 with value: 0.9204980842911877.
/home/sjoon/projects/brain_connectivity_classifier/masterthesis_venv2/lib/python3.11/site-packages/sklearn/linear_model/_logistic.py:1272: FutureWarning: 'multi_class' was deprecated in version 1.5 and will be removed in 1.8. From then on, it will always use 'multinomial'. Leave it to its default value to avoid this warning.
  warnings.warn(
[I 2026-01-17 14:51:03,092] Trial 17 finished with value: 0.9063697318007663 and parameters: {'C': 0.11512733778587535, 'max_iter': 200, 'solver': 'lbfgs'}. Best is trial 16 with value: 0.9204980842911877.
/home/sjoon/projects/brain_connectivity_classifier/masterthesis_venv2/lib/python3.11/site-packages/sklearn/linear_model/_logistic.py:1272: FutureWarning: 'multi_class' was deprecated in version 1.5 and will be removed in 1.8. From then on, it will always use 'multinomial'. Leave it to its default value to avoid this warning.
  warnings.warn(
[I 2026-01-17 14:51:16,668] Trial 18 finished with value: 0.8587164750957854 and parameters: {'C': 0.004411587305378313, 'max_iter': 286, 'solver': 'lbfgs'}. Best is trial 16 with value: 0.9204980842911877.
/home/sjoon/projects/brain_connectivity_classifier/masterthesis_venv2/lib/python3.11/site-packages/sklearn/linear_model/_logistic.py:1272: FutureWarning: 'multi_class' was deprecated in version 1.5 and will be removed in 1.8. From then on, it will always use 'multinomial'. Leave it to its default value to avoid this warning.
  warnings.warn(
[I 2026-01-17 14:51:26,920] Trial 19 finished with value: 0.9202586206896551 and parameters: {'C': 0.10579547447171937, 'max_iter': 130, 'solver': 'lbfgs'}. Best is trial 16 with value: 0.9204980842911877.
/home/sjoon/projects/brain_connectivity_classifier/masterthesis_venv2/lib/python3.11/site-packages/sklearn/linear_model/_logistic.py:1272: FutureWarning: 'multi_class' was deprecated in version 1.5 and will be removed in 1.8. From then on, it will always use 'multinomial'. Leave it to its default value to avoid this warning.
  warnings.warn(
[I 2026-01-17 14:51:36,532] Trial 20 finished with value: 0.9034961685823755 and parameters: {'C': 0.947056114263568, 'max_iter': 100, 'solver': 'lbfgs'}. Best is trial 16 with value: 0.9204980842911877.
/home/sjoon/projects/brain_connectivity_classifier/masterthesis_venv2/lib/python3.11/site-packages/sklearn/linear_model/_logistic.py:1272: FutureWarning: 'multi_class' was deprecated in version 1.5 and will be removed in 1.8. From then on, it will always use 'multinomial'. Leave it to its default value to avoid this warning.
  warnings.warn(
[I 2026-01-17 14:51:46,488] Trial 21 finished with value: 0.9066091954022989 and parameters: {'C': 0.1259869621092303, 'max_iter': 134, 'solver': 'lbfgs'}. Best is trial 16 with value: 0.9204980842911877.
/home/sjoon/projects/brain_connectivity_classifier/masterthesis_venv2/lib/python3.11/site-packages/sklearn/linear_model/_logistic.py:1272: FutureWarning: 'multi_class' was deprecated in version 1.5 and will be removed in 1.8. From then on, it will always use 'multinomial'. Leave it to its default value to avoid this warning.
  warnings.warn(
[I 2026-01-17 14:51:57,828] Trial 22 finished with value: 0.8987068965517241 and parameters: {'C': 0.04218862330732029, 'max_iter': 256, 'solver': 'lbfgs'}. Best is trial 16 with value: 0.9204980842911877.
/home/sjoon/projects/brain_connectivity_classifier/masterthesis_venv2/lib/python3.11/site-packages/sklearn/linear_model/_logistic.py:1272: FutureWarning: 'multi_class' was deprecated in version 1.5 and will be removed in 1.8. From then on, it will always use 'multinomial'. Leave it to its default value to avoid this warning.
  warnings.warn(
[I 2026-01-17 14:52:06,413] Trial 23 finished with value: 0.9245689655172413 and parameters: {'C': 0.14567851179212687, 'max_iter': 191, 'solver': 'lbfgs'}. Best is trial 23 with value: 0.9245689655172413.
/home/sjoon/projects/brain_connectivity_classifier/masterthesis_venv2/lib/python3.11/site-packages/sklearn/linear_model/_logistic.py:1272: FutureWarning: 'multi_class' was deprecated in version 1.5 and will be removed in 1.8. From then on, it will always use 'multinomial'. Leave it to its default value to avoid this warning.
  warnings.warn(
[I 2026-01-17 14:52:14,380] Trial 24 finished with value: 0.9178639846743295 and parameters: {'C': 0.16439231755975794, 'max_iter': 136, 'solver': 'lbfgs'}. Best is trial 23 with value: 0.9245689655172413.
/home/sjoon/projects/brain_connectivity_classifier/masterthesis_venv2/lib/python3.11/site-packages/sklearn/linear_model/_logistic.py:1272: FutureWarning: 'multi_class' was deprecated in version 1.5 and will be removed in 1.8. From then on, it will always use 'multinomial'. Leave it to its default value to avoid this warning.
  warnings.warn(
[I 2026-01-17 14:52:23,624] Trial 25 finished with value: 0.9063697318007663 and parameters: {'C': 0.8441837342829549, 'max_iter': 196, 'solver': 'lbfgs'}. Best is trial 23 with value: 0.9245689655172413.
/home/sjoon/projects/brain_connectivity_classifier/masterthesis_venv2/lib/python3.11/site-packages/sklearn/linear_model/_logistic.py:1272: FutureWarning: 'multi_class' was deprecated in version 1.5 and will be removed in 1.8. From then on, it will always use 'multinomial'. Leave it to its default value to avoid this warning.
  warnings.warn(
[I 2026-01-17 14:52:37,532] Trial 26 finished with value: 0.8905651340996169 and parameters: {'C': 0.00764863710339975, 'max_iter': 126, 'solver': 'lbfgs'}. Best is trial 23 with value: 0.9245689655172413.
/home/sjoon/projects/brain_connectivity_classifier/masterthesis_venv2/lib/python3.11/site-packages/sklearn/linear_model/_logistic.py:1272: FutureWarning: 'multi_class' was deprecated in version 1.5 and will be removed in 1.8. From then on, it will always use 'multinomial'. Leave it to its default value to avoid this warning.
  warnings.warn(
[I 2026-01-17 14:52:48,740] Trial 27 finished with value: 0.9106800766283525 and parameters: {'C': 0.03168421701935126, 'max_iter': 199, 'solver': 'lbfgs'}. Best is trial 23 with value: 0.9245689655172413.
/home/sjoon/projects/brain_connectivity_classifier/masterthesis_venv2/lib/python3.11/site-packages/sklearn/linear_model/_logistic.py:1272: FutureWarning: 'multi_class' was deprecated in version 1.5 and will be removed in 1.8. From then on, it will always use 'multinomial'. Leave it to its default value to avoid this warning.
  warnings.warn(
[I 2026-01-17 14:52:56,856] Trial 28 finished with value: 0.9195402298850575 and parameters: {'C': 0.2109500773131639, 'max_iter': 158, 'solver': 'lbfgs'}. Best is trial 23 with value: 0.9245689655172413.
/home/sjoon/projects/brain_connectivity_classifier/masterthesis_venv2/lib/python3.11/site-packages/sklearn/linear_model/_logistic.py:1272: FutureWarning: 'multi_class' was deprecated in version 1.5 and will be removed in 1.8. From then on, it will always use 'multinomial'. Leave it to its default value to avoid this warning.
  warnings.warn(
[I 2026-01-17 14:53:06,436] Trial 29 finished with value: 0.9181034482758621 and parameters: {'C': 0.08228359492874894, 'max_iter': 115, 'solver': 'lbfgs'}. Best is trial 23 with value: 0.9245689655172413.
/home/sjoon/projects/brain_connectivity_classifier/masterthesis_venv2/lib/python3.11/site-packages/sklearn/linear_model/_logistic.py:1272: FutureWarning: 'multi_class' was deprecated in version 1.5 and will be removed in 1.8. From then on, it will always use 'multinomial'. Leave it to its default value to avoid this warning.
  warnings.warn(
[I 2026-01-17 14:53:15,237] Trial 30 finished with value: 0.9049329501915708 and parameters: {'C': 0.4991601675506114, 'max_iter': 188, 'solver': 'lbfgs'}. Best is trial 23 with value: 0.9245689655172413.
/home/sjoon/projects/brain_connectivity_classifier/masterthesis_venv2/lib/python3.11/site-packages/sklearn/linear_model/_logistic.py:1272: FutureWarning: 'multi_class' was deprecated in version 1.5 and will be removed in 1.8. From then on, it will always use 'multinomial'. Leave it to its default value to avoid this warning.
  warnings.warn(
[I 2026-01-17 14:53:22,132] Trial 31 finished with value: 0.9152298850574713 and parameters: {'C': 0.1928942094741565, 'max_iter': 148, 'solver': 'lbfgs'}. Best is trial 23 with value: 0.9245689655172413.
/home/sjoon/projects/brain_connectivity_classifier/masterthesis_venv2/lib/python3.11/site-packages/sklearn/linear_model/_logistic.py:1272: FutureWarning: 'multi_class' was deprecated in version 1.5 and will be removed in 1.8. From then on, it will always use 'multinomial'. Leave it to its default value to avoid this warning.
  warnings.warn(
[I 2026-01-17 14:53:34,465] Trial 32 finished with value: 0.899904214559387 and parameters: {'C': 0.021206780523168368, 'max_iter': 165, 'solver': 'lbfgs'}. Best is trial 23 with value: 0.9245689655172413.
/home/sjoon/projects/brain_connectivity_classifier/masterthesis_venv2/lib/python3.11/site-packages/sklearn/linear_model/_logistic.py:1272: FutureWarning: 'multi_class' was deprecated in version 1.5 and will be removed in 1.8. From then on, it will always use 'multinomial'. Leave it to its default value to avoid this warning.
  warnings.warn(
[I 2026-01-17 14:53:42,316] Trial 33 finished with value: 0.9080459770114943 and parameters: {'C': 0.29031800690304943, 'max_iter': 149, 'solver': 'lbfgs'}. Best is trial 23 with value: 0.9245689655172413.
/home/sjoon/projects/brain_connectivity_classifier/masterthesis_venv2/lib/python3.11/site-packages/sklearn/linear_model/_logistic.py:1272: FutureWarning: 'multi_class' was deprecated in version 1.5 and will be removed in 1.8. From then on, it will always use 'multinomial'. Leave it to its default value to avoid this warning.
  warnings.warn(
[I 2026-01-17 14:53:51,681] Trial 34 finished with value: 0.921455938697318 and parameters: {'C': 0.1412037317464007, 'max_iter': 255, 'solver': 'lbfgs'}. Best is trial 23 with value: 0.9245689655172413.
/home/sjoon/projects/brain_connectivity_classifier/masterthesis_venv2/lib/python3.11/site-packages/sklearn/linear_model/_logistic.py:1272: FutureWarning: 'multi_class' was deprecated in version 1.5 and will be removed in 1.8. From then on, it will always use 'multinomial'. Leave it to its default value to avoid this warning.
  warnings.warn(
[I 2026-01-17 14:54:03,960] Trial 35 finished with value: 0.9066091954022989 and parameters: {'C': 0.066883114533696, 'max_iter': 258, 'solver': 'lbfgs'}. Best is trial 23 with value: 0.9245689655172413.
/home/sjoon/projects/brain_connectivity_classifier/masterthesis_venv2/lib/python3.11/site-packages/sklearn/linear_model/_logistic.py:1272: FutureWarning: 'multi_class' was deprecated in version 1.5 and will be removed in 1.8. From then on, it will always use 'multinomial'. Leave it to its default value to avoid this warning.
  warnings.warn(
[I 2026-01-17 14:54:05,172] Trial 36 finished with value: 0.7940613026819924 and parameters: {'C': 0.0016905953133224834, 'max_iter': 306, 'solver': 'newton-cg'}. Best is trial 23 with value: 0.9245689655172413.
/home/sjoon/projects/brain_connectivity_classifier/masterthesis_venv2/lib/python3.11/site-packages/sklearn/linear_model/_logistic.py:1272: FutureWarning: 'multi_class' was deprecated in version 1.5 and will be removed in 1.8. From then on, it will always use 'multinomial'. Leave it to its default value to avoid this warning.
  warnings.warn(
[I 2026-01-17 14:54:15,939] Trial 37 finished with value: 0.9255268199233716 and parameters: {'C': 0.033044169872206465, 'max_iter': 221, 'solver': 'lbfgs'}. Best is trial 37 with value: 0.9255268199233716.
/home/sjoon/projects/brain_connectivity_classifier/masterthesis_venv2/lib/python3.11/site-packages/sklearn/linear_model/_logistic.py:1272: FutureWarning: 'multi_class' was deprecated in version 1.5 and will be removed in 1.8. From then on, it will always use 'multinomial'. Leave it to its default value to avoid this warning.
  warnings.warn(
[I 2026-01-17 14:54:17,403] Trial 38 finished with value: 0.9011015325670498 and parameters: {'C': 0.027151600859077935, 'max_iter': 221, 'solver': 'newton-cg'}. Best is trial 37 with value: 0.9255268199233716.
/home/sjoon/projects/brain_connectivity_classifier/masterthesis_venv2/lib/python3.11/site-packages/sklearn/linear_model/_logistic.py:1272: FutureWarning: 'multi_class' was deprecated in version 1.5 and will be removed in 1.8. From then on, it will always use 'multinomial'. Leave it to its default value to avoid this warning.
  warnings.warn(
