[I 2026-01-17 15:27:45,012] Trial 0 finished with value: 0.8529693486590039 and parameters: {'C': 0.0028854813096126047, 'max_iter': 266, 'solver': 'newton-cg'}. Best is trial 0 with value: 0.8529693486590039.
/home/sjoon/projects/brain_connectivity_classifier/masterthesis_venv2/lib/python3.11/site-packages/sklearn/linear_model/_logistic.py:1272: FutureWarning: 'multi_class' was deprecated in version 1.5 and will be removed in 1.8. From then on, it will always use 'multinomial'. Leave it to its default value to avoid this warning.
  warnings.warn(
[I 2026-01-17 15:28:04,412] Trial 1 finished with value: 0.8936781609195402 and parameters: {'C': 0.02034961622498155, 'max_iter': 399, 'solver': 'lbfgs'}. Best is trial 1 with value: 0.8936781609195402.
/home/sjoon/projects/brain_connectivity_classifier/masterthesis_venv2/lib/python3.11/site-packages/sklearn/linear_model/_logistic.py:1272: FutureWarning: 'multi_class' was deprecated in version 1.5 and will be removed in 1.8. From then on, it will always use 'multinomial'. Leave it to its default value to avoid this warning.
  warnings.warn(
[I 2026-01-17 15:28:06,796] Trial 2 finished with value: 0.7579022988505747 and parameters: {'C': 0.0013063372103949843, 'max_iter': 326, 'solver': 'newton-cg'}. Best is trial 1 with value: 0.8936781609195402.
/home/sjoon/projects/brain_connectivity_classifier/masterthesis_venv2/lib/python3.11/site-packages/sklearn/linear_model/_logistic.py:1272: FutureWarning: 'multi_class' was deprecated in version 1.5 and will be removed in 1.8. From then on, it will always use 'multinomial'. Leave it to its default value to avoid this warning.
  warnings.warn(
[I 2026-01-17 15:28:22,652] Trial 3 finished with value: 0.8716475095785441 and parameters: {'C': 0.01041560504864896, 'max_iter': 109, 'solver': 'lbfgs'}. Best is trial 1 with value: 0.8936781609195402.
/home/sjoon/projects/brain_connectivity_classifier/masterthesis_venv2/lib/python3.11/site-packages/sklearn/linear_model/_logistic.py:1272: FutureWarning: 'multi_class' was deprecated in version 1.5 and will be removed in 1.8. From then on, it will always use 'multinomial'. Leave it to its default value to avoid this warning.
  warnings.warn(
[I 2026-01-17 15:28:24,165] Trial 4 finished with value: 0.9008620689655172 and parameters: {'C': 0.0416828871122416, 'max_iter': 166, 'solver': 'newton-cg'}. Best is trial 4 with value: 0.9008620689655172.
/home/sjoon/projects/brain_connectivity_classifier/masterthesis_venv2/lib/python3.11/site-packages/sklearn/linear_model/_logistic.py:1272: FutureWarning: 'multi_class' was deprecated in version 1.5 and will be removed in 1.8. From then on, it will always use 'multinomial'. Leave it to its default value to avoid this warning.
  warnings.warn(
[I 2026-01-17 15:28:25,815] Trial 5 finished with value: 0.8920019157088123 and parameters: {'C': 2.487462779300572, 'max_iter': 478, 'solver': 'newton-cg'}. Best is trial 4 with value: 0.9008620689655172.
/home/sjoon/projects/brain_connectivity_classifier/masterthesis_venv2/lib/python3.11/site-packages/sklearn/linear_model/_logistic.py:1272: FutureWarning: 'multi_class' was deprecated in version 1.5 and will be removed in 1.8. From then on, it will always use 'multinomial'. Leave it to its default value to avoid this warning.
  warnings.warn(
[I 2026-01-17 15:28:27,240] Trial 6 finished with value: 0.9046934865900383 and parameters: {'C': 0.060678305383428034, 'max_iter': 294, 'solver': 'newton-cg'}. Best is trial 6 with value: 0.9046934865900383.
/home/sjoon/projects/brain_connectivity_classifier/masterthesis_venv2/lib/python3.11/site-packages/sklearn/linear_model/_logistic.py:1272: FutureWarning: 'multi_class' was deprecated in version 1.5 and will be removed in 1.8. From then on, it will always use 'multinomial'. Leave it to its default value to avoid this warning.
  warnings.warn(
[I 2026-01-17 15:28:28,939] Trial 7 finished with value: 0.8941570881226054 and parameters: {'C': 0.015560158006902589, 'max_iter': 152, 'solver': 'newton-cg'}. Best is trial 6 with value: 0.9046934865900383.
/home/sjoon/projects/brain_connectivity_classifier/masterthesis_venv2/lib/python3.11/site-packages/sklearn/linear_model/_logistic.py:1272: FutureWarning: 'multi_class' was deprecated in version 1.5 and will be removed in 1.8. From then on, it will always use 'multinomial'. Leave it to its default value to avoid this warning.
  warnings.warn(
[I 2026-01-17 15:28:44,064] Trial 8 finished with value: 0.9176245210727969 and parameters: {'C': 0.07987032801740344, 'max_iter': 278, 'solver': 'lbfgs'}. Best is trial 8 with value: 0.9176245210727969.
/home/sjoon/projects/brain_connectivity_classifier/masterthesis_venv2/lib/python3.11/site-packages/sklearn/linear_model/_logistic.py:1272: FutureWarning: 'multi_class' was deprecated in version 1.5 and will be removed in 1.8. From then on, it will always use 'multinomial'. Leave it to its default value to avoid this warning.
  warnings.warn(
[I 2026-01-17 15:28:46,383] Trial 9 finished with value: 0.882183908045977 and parameters: {'C': 4.371317012469823, 'max_iter': 232, 'solver': 'newton-cg'}. Best is trial 8 with value: 0.9176245210727969.
/home/sjoon/projects/brain_connectivity_classifier/masterthesis_venv2/lib/python3.11/site-packages/sklearn/linear_model/_logistic.py:1272: FutureWarning: 'multi_class' was deprecated in version 1.5 and will be removed in 1.8. From then on, it will always use 'multinomial'. Leave it to its default value to avoid this warning.
  warnings.warn(
[I 2026-01-17 15:28:59,684] Trial 10 finished with value: 0.9034961685823755 and parameters: {'C': 0.46141959069413924, 'max_iter': 175, 'solver': 'lbfgs'}. Best is trial 8 with value: 0.9176245210727969.
/home/sjoon/projects/brain_connectivity_classifier/masterthesis_venv2/lib/python3.11/site-packages/sklearn/linear_model/_logistic.py:1272: FutureWarning: 'multi_class' was deprecated in version 1.5 and will be removed in 1.8. From then on, it will always use 'multinomial'. Leave it to its default value to avoid this warning.
  warnings.warn(
[I 2026-01-17 15:29:12,124] Trial 11 finished with value: 0.8963122605363985 and parameters: {'C': 0.21922398411668018, 'max_iter': 306, 'solver': 'lbfgs'}. Best is trial 8 with value: 0.9176245210727969.
/home/sjoon/projects/brain_connectivity_classifier/masterthesis_venv2/lib/python3.11/site-packages/sklearn/linear_model/_logistic.py:1272: FutureWarning: 'multi_class' was deprecated in version 1.5 and will be removed in 1.8. From then on, it will always use 'multinomial'. Leave it to its default value to avoid this warning.
  warnings.warn(
[I 2026-01-17 15:29:26,920] Trial 12 finished with value: 0.9135536398467433 and parameters: {'C': 0.10239964932239483, 'max_iter': 370, 'solver': 'lbfgs'}. Best is trial 8 with value: 0.9176245210727969.
/home/sjoon/projects/brain_connectivity_classifier/masterthesis_venv2/lib/python3.11/site-packages/sklearn/linear_model/_logistic.py:1272: FutureWarning: 'multi_class' was deprecated in version 1.5 and will be removed in 1.8. From then on, it will always use 'multinomial'. Leave it to its default value to avoid this warning.
  warnings.warn(
[I 2026-01-17 15:29:43,080] Trial 13 finished with value: 0.9027777777777778 and parameters: {'C': 0.7302211579867567, 'max_iter': 372, 'solver': 'lbfgs'}. Best is trial 8 with value: 0.9176245210727969.
/home/sjoon/projects/brain_connectivity_classifier/masterthesis_venv2/lib/python3.11/site-packages/sklearn/linear_model/_logistic.py:1272: FutureWarning: 'multi_class' was deprecated in version 1.5 and will be removed in 1.8. From then on, it will always use 'multinomial'. Leave it to its default value to avoid this warning.
  warnings.warn(
[I 2026-01-17 15:29:57,016] Trial 14 finished with value: 0.9087643678160919 and parameters: {'C': 0.1394995770537248, 'max_iter': 484, 'solver': 'lbfgs'}. Best is trial 8 with value: 0.9176245210727969.
/home/sjoon/projects/brain_connectivity_classifier/masterthesis_venv2/lib/python3.11/site-packages/sklearn/linear_model/_logistic.py:1272: FutureWarning: 'multi_class' was deprecated in version 1.5 and will be removed in 1.8. From then on, it will always use 'multinomial'. Leave it to its default value to avoid this warning.
  warnings.warn(
[I 2026-01-17 15:30:10,324] Trial 15 finished with value: 0.9025383141762452 and parameters: {'C': 1.1747138228021334, 'max_iter': 214, 'solver': 'lbfgs'}. Best is trial 8 with value: 0.9176245210727969.
/home/sjoon/projects/brain_connectivity_classifier/masterthesis_venv2/lib/python3.11/site-packages/sklearn/linear_model/_logistic.py:1272: FutureWarning: 'multi_class' was deprecated in version 1.5 and will be removed in 1.8. From then on, it will always use 'multinomial'. Leave it to its default value to avoid this warning.
  warnings.warn(
[I 2026-01-17 15:30:29,853] Trial 16 finished with value: 0.889367816091954 and parameters: {'C': 9.078506802415761, 'max_iter': 378, 'solver': 'lbfgs'}. Best is trial 8 with value: 0.9176245210727969.
/home/sjoon/projects/brain_connectivity_classifier/masterthesis_venv2/lib/python3.11/site-packages/sklearn/linear_model/_logistic.py:1272: FutureWarning: 'multi_class' was deprecated in version 1.5 and will be removed in 1.8. From then on, it will always use 'multinomial'. Leave it to its default value to avoid this warning.
  warnings.warn(
[I 2026-01-17 15:30:42,836] Trial 17 finished with value: 0.9022988505747126 and parameters: {'C': 0.23486522853200334, 'max_iter': 233, 'solver': 'lbfgs'}. Best is trial 8 with value: 0.9176245210727969.
/home/sjoon/projects/brain_connectivity_classifier/masterthesis_venv2/lib/python3.11/site-packages/sklearn/linear_model/_logistic.py:1272: FutureWarning: 'multi_class' was deprecated in version 1.5 and will be removed in 1.8. From then on, it will always use 'multinomial'. Leave it to its default value to avoid this warning.
  warnings.warn(
[I 2026-01-17 15:31:02,980] Trial 18 finished with value: 0.8618295019157088 and parameters: {'C': 0.007164902014262751, 'max_iter': 408, 'solver': 'lbfgs'}. Best is trial 8 with value: 0.9176245210727969.
/home/sjoon/projects/brain_connectivity_classifier/masterthesis_venv2/lib/python3.11/site-packages/sklearn/linear_model/_logistic.py:1272: FutureWarning: 'multi_class' was deprecated in version 1.5 and will be removed in 1.8. From then on, it will always use 'multinomial'. Leave it to its default value to avoid this warning.
  warnings.warn(
[I 2026-01-17 15:31:18,356] Trial 19 finished with value: 0.9137931034482759 and parameters: {'C': 0.08616952820026222, 'max_iter': 200, 'solver': 'lbfgs'}. Best is trial 8 with value: 0.9176245210727969.
/home/sjoon/projects/brain_connectivity_classifier/masterthesis_venv2/lib/python3.11/site-packages/sklearn/linear_model/_logistic.py:1272: FutureWarning: 'multi_class' was deprecated in version 1.5 and will be removed in 1.8. From then on, it will always use 'multinomial'. Leave it to its default value to avoid this warning.
  warnings.warn(
[I 2026-01-17 15:31:34,368] Trial 20 finished with value: 0.912595785440613 and parameters: {'C': 0.07253091573385208, 'max_iter': 122, 'solver': 'lbfgs'}. Best is trial 8 with value: 0.9176245210727969.
/home/sjoon/projects/brain_connectivity_classifier/masterthesis_venv2/lib/python3.11/site-packages/sklearn/linear_model/_logistic.py:1272: FutureWarning: 'multi_class' was deprecated in version 1.5 and will be removed in 1.8. From then on, it will always use 'multinomial'. Leave it to its default value to avoid this warning.
  warnings.warn(
[I 2026-01-17 15:31:51,112] Trial 21 finished with value: 0.9080459770114943 and parameters: {'C': 0.033910858290219746, 'max_iter': 188, 'solver': 'lbfgs'}. Best is trial 8 with value: 0.9176245210727969.
/home/sjoon/projects/brain_connectivity_classifier/masterthesis_venv2/lib/python3.11/site-packages/sklearn/linear_model/_logistic.py:1272: FutureWarning: 'multi_class' was deprecated in version 1.5 and will be removed in 1.8. From then on, it will always use 'multinomial'. Leave it to its default value to avoid this warning.
  warnings.warn(
[I 2026-01-17 15:32:06,072] Trial 22 finished with value: 0.9082854406130269 and parameters: {'C': 0.12844695923926136, 'max_iter': 269, 'solver': 'lbfgs'}. Best is trial 8 with value: 0.9176245210727969.
/home/sjoon/projects/brain_connectivity_classifier/masterthesis_venv2/lib/python3.11/site-packages/sklearn/linear_model/_logistic.py:1272: FutureWarning: 'multi_class' was deprecated in version 1.5 and will be removed in 1.8. From then on, it will always use 'multinomial'. Leave it to its default value to avoid this warning.
  warnings.warn(
[I 2026-01-17 15:32:18,188] Trial 23 finished with value: 0.9154693486590039 and parameters: {'C': 0.43887942601632735, 'max_iter': 140, 'solver': 'lbfgs'}. Best is trial 8 with value: 0.9176245210727969.
/home/sjoon/projects/brain_connectivity_classifier/masterthesis_venv2/lib/python3.11/site-packages/sklearn/linear_model/_logistic.py:1272: FutureWarning: 'multi_class' was deprecated in version 1.5 and will be removed in 1.8. From then on, it will always use 'multinomial'. Leave it to its default value to avoid this warning.
  warnings.warn(
[I 2026-01-17 15:32:29,856] Trial 24 finished with value: 0.9116379310344828 and parameters: {'C': 0.418264523850837, 'max_iter': 148, 'solver': 'lbfgs'}. Best is trial 8 with value: 0.9176245210727969.
/home/sjoon/projects/brain_connectivity_classifier/masterthesis_venv2/lib/python3.11/site-packages/sklearn/linear_model/_logistic.py:1272: FutureWarning: 'multi_class' was deprecated in version 1.5 and will be removed in 1.8. From then on, it will always use 'multinomial'. Leave it to its default value to avoid this warning.
  warnings.warn(
[I 2026-01-17 15:32:43,196] Trial 25 finished with value: 0.9020593869731801 and parameters: {'C': 1.459950208479494, 'max_iter': 134, 'solver': 'lbfgs'}. Best is trial 8 with value: 0.9176245210727969.
/home/sjoon/projects/brain_connectivity_classifier/masterthesis_venv2/lib/python3.11/site-packages/sklearn/linear_model/_logistic.py:1272: FutureWarning: 'multi_class' was deprecated in version 1.5 and will be removed in 1.8. From then on, it will always use 'multinomial'. Leave it to its default value to avoid this warning.
  warnings.warn(
[I 2026-01-17 15:32:56,784] Trial 26 finished with value: 0.9176245210727969 and parameters: {'C': 0.359875442034685, 'max_iter': 194, 'solver': 'lbfgs'}. Best is trial 8 with value: 0.9176245210727969.
/home/sjoon/projects/brain_connectivity_classifier/masterthesis_venv2/lib/python3.11/site-packages/sklearn/linear_model/_logistic.py:1272: FutureWarning: 'multi_class' was deprecated in version 1.5 and will be removed in 1.8. From then on, it will always use 'multinomial'. Leave it to its default value to avoid this warning.
  warnings.warn(
[I 2026-01-17 15:33:11,236] Trial 27 finished with value: 0.9037356321839081 and parameters: {'C': 0.35078401056697084, 'max_iter': 108, 'solver': 'lbfgs'}. Best is trial 8 with value: 0.9176245210727969.
/home/sjoon/projects/brain_connectivity_classifier/masterthesis_venv2/lib/python3.11/site-packages/sklearn/linear_model/_logistic.py:1272: FutureWarning: 'multi_class' was deprecated in version 1.5 and will be removed in 1.8. From then on, it will always use 'multinomial'. Leave it to its default value to avoid this warning.
  warnings.warn(
[I 2026-01-17 15:33:24,804] Trial 28 finished with value: 0.9121168582375478 and parameters: {'C': 0.8161732456550728, 'max_iter': 129, 'solver': 'lbfgs'}. Best is trial 8 with value: 0.9176245210727969.
/home/sjoon/projects/brain_connectivity_classifier/masterthesis_venv2/lib/python3.11/site-packages/sklearn/linear_model/_logistic.py:1272: FutureWarning: 'multi_class' was deprecated in version 1.5 and will be removed in 1.8. From then on, it will always use 'multinomial'. Leave it to its default value to avoid this warning.
  warnings.warn(
[I 2026-01-17 15:33:41,156] Trial 29 finished with value: 0.9094827586206896 and parameters: {'C': 3.0195364035335963, 'max_iter': 247, 'solver': 'lbfgs'}. Best is trial 8 with value: 0.9176245210727969.
/home/sjoon/projects/brain_connectivity_classifier/masterthesis_venv2/lib/python3.11/site-packages/sklearn/linear_model/_logistic.py:1272: FutureWarning: 'multi_class' was deprecated in version 1.5 and will be removed in 1.8. From then on, it will always use 'multinomial'. Leave it to its default value to avoid this warning.
  warnings.warn(
[I 2026-01-17 15:33:54,676] Trial 30 finished with value: 0.9173850574712644 and parameters: {'C': 0.21530190631095716, 'max_iter': 264, 'solver': 'lbfgs'}. Best is trial 8 with value: 0.9176245210727969.
/home/sjoon/projects/brain_connectivity_classifier/masterthesis_venv2/lib/python3.11/site-packages/sklearn/linear_model/_logistic.py:1272: FutureWarning: 'multi_class' was deprecated in version 1.5 and will be removed in 1.8. From then on, it will always use 'multinomial'. Leave it to its default value to avoid this warning.
  warnings.warn(
[I 2026-01-17 15:34:07,608] Trial 31 finished with value: 0.9068486590038314 and parameters: {'C': 0.2192312502144648, 'max_iter': 270, 'solver': 'lbfgs'}. Best is trial 8 with value: 0.9176245210727969.
/home/sjoon/projects/brain_connectivity_classifier/masterthesis_venv2/lib/python3.11/site-packages/sklearn/linear_model/_logistic.py:1272: FutureWarning: 'multi_class' was deprecated in version 1.5 and will be removed in 1.8. From then on, it will always use 'multinomial'. Leave it to its default value to avoid this warning.
  warnings.warn(
[I 2026-01-17 15:34:21,392] Trial 32 finished with value: 0.9078065134099617 and parameters: {'C': 0.5731035095800421, 'max_iter': 207, 'solver': 'lbfgs'}. Best is trial 8 with value: 0.9176245210727969.
/home/sjoon/projects/brain_connectivity_classifier/masterthesis_venv2/lib/python3.11/site-packages/sklearn/linear_model/_logistic.py:1272: FutureWarning: 'multi_class' was deprecated in version 1.5 and will be removed in 1.8. From then on, it will always use 'multinomial'. Leave it to its default value to avoid this warning.
  warnings.warn(
[I 2026-01-17 15:34:38,968] Trial 33 finished with value: 0.9020593869731801 and parameters: {'C': 0.03519605451419719, 'max_iter': 250, 'solver': 'lbfgs'}. Best is trial 8 with value: 0.9176245210727969.
/home/sjoon/projects/brain_connectivity_classifier/masterthesis_venv2/lib/python3.11/site-packages/sklearn/linear_model/_logistic.py:1272: FutureWarning: 'multi_class' was deprecated in version 1.5 and will be removed in 1.8. From then on, it will always use 'multinomial'. Leave it to its default value to avoid this warning.
  warnings.warn(
[I 2026-01-17 15:34:53,076] Trial 34 finished with value: 0.9102011494252874 and parameters: {'C': 0.267158446680331, 'max_iter': 302, 'solver': 'lbfgs'}. Best is trial 8 with value: 0.9176245210727969.
/home/sjoon/projects/brain_connectivity_classifier/masterthesis_venv2/lib/python3.11/site-packages/sklearn/linear_model/_logistic.py:1272: FutureWarning: 'multi_class' was deprecated in version 1.5 and will be removed in 1.8. From then on, it will always use 'multinomial'. Leave it to its default value to avoid this warning.
  warnings.warn(
[I 2026-01-17 15:35:11,368] Trial 35 finished with value: 0.8603927203065134 and parameters: {'C': 0.004786615062679496, 'max_iter': 334, 'solver': 'lbfgs'}. Best is trial 8 with value: 0.9176245210727969.
/home/sjoon/projects/brain_connectivity_classifier/masterthesis_venv2/lib/python3.11/site-packages/sklearn/linear_model/_logistic.py:1272: FutureWarning: 'multi_class' was deprecated in version 1.5 and will be removed in 1.8. From then on, it will always use 'multinomial'. Leave it to its default value to avoid this warning.
  warnings.warn(
[I 2026-01-17 15:35:13,360] Trial 36 finished with value: 0.7890325670498084 and parameters: {'C': 0.0016905953133224834, 'max_iter': 187, 'solver': 'newton-cg'}. Best is trial 8 with value: 0.9176245210727969.
/home/sjoon/projects/brain_connectivity_classifier/masterthesis_venv2/lib/python3.11/site-packages/sklearn/linear_model/_logistic.py:1272: FutureWarning: 'multi_class' was deprecated in version 1.5 and will be removed in 1.8. From then on, it will always use 'multinomial'. Leave it to its default value to avoid this warning.
  warnings.warn(
[I 2026-01-17 15:35:31,128] Trial 37 finished with value: 0.9154693486590039 and parameters: {'C': 0.019606854498157595, 'max_iter': 100, 'solver': 'lbfgs'}. Best is trial 8 with value: 0.9176245210727969.
/home/sjoon/projects/brain_connectivity_classifier/masterthesis_venv2/lib/python3.11/site-packages/sklearn/linear_model/_logistic.py:1272: FutureWarning: 'multi_class' was deprecated in version 1.5 and will be removed in 1.8. From then on, it will always use 'multinomial'. Leave it to its default value to avoid this warning.
  warnings.warn(
[I 2026-01-17 15:35:33,743] Trial 38 finished with value: 0.8936781609195402 and parameters: {'C': 1.560988411712436, 'max_iter': 158, 'solver': 'newton-cg'}. Best is trial 8 with value: 0.9176245210727969.
/home/sjoon/projects/brain_connectivity_classifier/masterthesis_venv2/lib/python3.11/site-packages/sklearn/linear_model/_logistic.py:1272: FutureWarning: 'multi_class' was deprecated in version 1.5 and will be removed in 1.8. From then on, it will always use 'multinomial'. Leave it to its default value to avoid this warning.
  warnings.warn(
[I 2026-01-17 15:35:35,067] Trial 39 finished with value: 0.9202586206896551 and parameters: {'C': 0.04721577323386001, 'max_iter': 143, 'solver': 'newton-cg'}. Best is trial 39 with value: 0.9202586206896551.
/home/sjoon/projects/brain_connectivity_classifier/masterthesis_venv2/lib/python3.11/site-packages/sklearn/linear_model/_logistic.py:1272: FutureWarning: 'multi_class' was deprecated in version 1.5 and will be removed in 1.8. From then on, it will always use 'multinomial'. Leave it to its default value to avoid this warning.
  warnings.warn(
