[I 2026-01-17 15:00:09,384] Trial 28 finished with value: 0.9102011494252874 and parameters: {'C': 1.312257902754191, 'max_iter': 137, 'solver': 'lbfgs'}. Best is trial 21 with value: 0.9181034482758621.
/home/sjoon/projects/brain_connectivity_classifier/masterthesis_venv2/lib/python3.11/site-packages/sklearn/linear_model/_logistic.py:1272: FutureWarning: 'multi_class' was deprecated in version 1.5 and will be removed in 1.8. From then on, it will always use 'multinomial'. Leave it to its default value to avoid this warning.
  warnings.warn(
[I 2026-01-17 15:00:23,052] Trial 29 finished with value: 0.891044061302682 and parameters: {'C': 3.4525586204435434, 'max_iter': 112, 'solver': 'lbfgs'}. Best is trial 21 with value: 0.9181034482758621.
/home/sjoon/projects/brain_connectivity_classifier/masterthesis_venv2/lib/python3.11/site-packages/sklearn/linear_model/_logistic.py:1272: FutureWarning: 'multi_class' was deprecated in version 1.5 and will be removed in 1.8. From then on, it will always use 'multinomial'. Leave it to its default value to avoid this warning.
  warnings.warn(
[I 2026-01-17 15:00:39,964] Trial 30 finished with value: 0.8917624521072797 and parameters: {'C': 0.017459885995566728, 'max_iter': 127, 'solver': 'lbfgs'}. Best is trial 21 with value: 0.9181034482758621.
/home/sjoon/projects/brain_connectivity_classifier/masterthesis_venv2/lib/python3.11/site-packages/sklearn/linear_model/_logistic.py:1272: FutureWarning: 'multi_class' was deprecated in version 1.5 and will be removed in 1.8. From then on, it will always use 'multinomial'. Leave it to its default value to avoid this warning.
  warnings.warn(
[I 2026-01-17 15:00:51,776] Trial 31 finished with value: 0.9087643678160919 and parameters: {'C': 0.07899423259185359, 'max_iter': 229, 'solver': 'lbfgs'}. Best is trial 21 with value: 0.9181034482758621.
/home/sjoon/projects/brain_connectivity_classifier/masterthesis_venv2/lib/python3.11/site-packages/sklearn/linear_model/_logistic.py:1272: FutureWarning: 'multi_class' was deprecated in version 1.5 and will be removed in 1.8. From then on, it will always use 'multinomial'. Leave it to its default value to avoid this warning.
  warnings.warn(
[I 2026-01-17 15:01:03,220] Trial 32 finished with value: 0.9152298850574713 and parameters: {'C': 0.15400121620267138, 'max_iter': 177, 'solver': 'lbfgs'}. Best is trial 21 with value: 0.9181034482758621.
/home/sjoon/projects/brain_connectivity_classifier/masterthesis_venv2/lib/python3.11/site-packages/sklearn/linear_model/_logistic.py:1272: FutureWarning: 'multi_class' was deprecated in version 1.5 and will be removed in 1.8. From then on, it will always use 'multinomial'. Leave it to its default value to avoid this warning.
  warnings.warn(
[I 2026-01-17 15:01:12,440] Trial 33 finished with value: 0.9099616858237548 and parameters: {'C': 0.19640369098136876, 'max_iter': 167, 'solver': 'lbfgs'}. Best is trial 21 with value: 0.9181034482758621.
/home/sjoon/projects/brain_connectivity_classifier/masterthesis_venv2/lib/python3.11/site-packages/sklearn/linear_model/_logistic.py:1272: FutureWarning: 'multi_class' was deprecated in version 1.5 and will be removed in 1.8. From then on, it will always use 'multinomial'. Leave it to its default value to avoid this warning.
  warnings.warn(
[I 2026-01-17 15:01:15,276] Trial 34 finished with value: 0.9046934865900383 and parameters: {'C': 0.4116464782906415, 'max_iter': 146, 'solver': 'newton-cg'}. Best is trial 21 with value: 0.9181034482758621.
/home/sjoon/projects/brain_connectivity_classifier/masterthesis_venv2/lib/python3.11/site-packages/sklearn/linear_model/_logistic.py:1272: FutureWarning: 'multi_class' was deprecated in version 1.5 and will be removed in 1.8. From then on, it will always use 'multinomial'. Leave it to its default value to avoid this warning.
  warnings.warn(
[I 2026-01-17 15:01:30,440] Trial 35 finished with value: 0.8994252873563219 and parameters: {'C': 0.0501501162872276, 'max_iter': 116, 'solver': 'lbfgs'}. Best is trial 21 with value: 0.9181034482758621.
/home/sjoon/projects/brain_connectivity_classifier/masterthesis_venv2/lib/python3.11/site-packages/sklearn/linear_model/_logistic.py:1272: FutureWarning: 'multi_class' was deprecated in version 1.5 and will be removed in 1.8. From then on, it will always use 'multinomial'. Leave it to its default value to avoid this warning.
  warnings.warn(
[I 2026-01-17 15:01:39,776] Trial 36 finished with value: 0.9152298850574713 and parameters: {'C': 0.16757171310071045, 'max_iter': 127, 'solver': 'lbfgs'}. Best is trial 21 with value: 0.9181034482758621.
/home/sjoon/projects/brain_connectivity_classifier/masterthesis_venv2/lib/python3.11/site-packages/sklearn/linear_model/_logistic.py:1272: FutureWarning: 'multi_class' was deprecated in version 1.5 and will be removed in 1.8. From then on, it will always use 'multinomial'. Leave it to its default value to avoid this warning.
  warnings.warn(
[I 2026-01-17 15:01:42,058] Trial 37 finished with value: 0.9068486590038314 and parameters: {'C': 0.06349521529431873, 'max_iter': 107, 'solver': 'newton-cg'}. Best is trial 21 with value: 0.9181034482758621.
/home/sjoon/projects/brain_connectivity_classifier/masterthesis_venv2/lib/python3.11/site-packages/sklearn/linear_model/_logistic.py:1272: FutureWarning: 'multi_class' was deprecated in version 1.5 and will be removed in 1.8. From then on, it will always use 'multinomial'. Leave it to its default value to avoid this warning.
  warnings.warn(
[I 2026-01-17 15:01:51,720] Trial 38 finished with value: 0.9116379310344828 and parameters: {'C': 0.3703696350867577, 'max_iter': 179, 'solver': 'lbfgs'}. Best is trial 21 with value: 0.9181034482758621.
/home/sjoon/projects/brain_connectivity_classifier/masterthesis_venv2/lib/python3.11/site-packages/sklearn/linear_model/_logistic.py:1272: FutureWarning: 'multi_class' was deprecated in version 1.5 and will be removed in 1.8. From then on, it will always use 'multinomial'. Leave it to its default value to avoid this warning.
  warnings.warn(
[I 2026-01-17 15:02:03,212] Trial 39 finished with value: 0.9085249042145593 and parameters: {'C': 1.0608667929614726, 'max_iter': 101, 'solver': 'lbfgs'}. Best is trial 21 with value: 0.9181034482758621.
/home/sjoon/projects/brain_connectivity_classifier/masterthesis_venv2/lib/python3.11/site-packages/sklearn/linear_model/_logistic.py:1272: FutureWarning: 'multi_class' was deprecated in version 1.5 and will be removed in 1.8. From then on, it will always use 'multinomial'. Leave it to its default value to avoid this warning.
  warnings.warn(
[I 2026-01-17 15:02:05,088] Trial 40 finished with value: 0.9274425287356322 and parameters: {'C': 0.14812855289261087, 'max_iter': 124, 'solver': 'newton-cg'}. Best is trial 40 with value: 0.9274425287356322.
/home/sjoon/projects/brain_connectivity_classifier/masterthesis_venv2/lib/python3.11/site-packages/sklearn/linear_model/_logistic.py:1272: FutureWarning: 'multi_class' was deprecated in version 1.5 and will be removed in 1.8. From then on, it will always use 'multinomial'. Leave it to its default value to avoid this warning.
  warnings.warn(
[I 2026-01-17 15:02:06,337] Trial 41 finished with value: 0.9111590038314177 and parameters: {'C': 0.1346494971791079, 'max_iter': 139, 'solver': 'newton-cg'}. Best is trial 40 with value: 0.9274425287356322.
/home/sjoon/projects/brain_connectivity_classifier/masterthesis_venv2/lib/python3.11/site-packages/sklearn/linear_model/_logistic.py:1272: FutureWarning: 'multi_class' was deprecated in version 1.5 and will be removed in 1.8. From then on, it will always use 'multinomial'. Leave it to its default value to avoid this warning.
  warnings.warn(
[I 2026-01-17 15:02:07,675] Trial 42 finished with value: 0.9102011494252874 and parameters: {'C': 0.0449312067673254, 'max_iter': 121, 'solver': 'newton-cg'}. Best is trial 40 with value: 0.9274425287356322.
/home/sjoon/projects/brain_connectivity_classifier/masterthesis_venv2/lib/python3.11/site-packages/sklearn/linear_model/_logistic.py:1272: FutureWarning: 'multi_class' was deprecated in version 1.5 and will be removed in 1.8. From then on, it will always use 'multinomial'. Leave it to its default value to avoid this warning.
  warnings.warn(
[I 2026-01-17 15:02:09,009] Trial 43 finished with value: 0.9013409961685823 and parameters: {'C': 0.022195941620191045, 'max_iter': 112, 'solver': 'newton-cg'}. Best is trial 40 with value: 0.9274425287356322.
/home/sjoon/projects/brain_connectivity_classifier/masterthesis_venv2/lib/python3.11/site-packages/sklearn/linear_model/_logistic.py:1272: FutureWarning: 'multi_class' was deprecated in version 1.5 and will be removed in 1.8. From then on, it will always use 'multinomial'. Leave it to its default value to avoid this warning.
  warnings.warn(
[I 2026-01-17 15:02:10,453] Trial 44 finished with value: 0.9116379310344828 and parameters: {'C': 0.6279508012065774, 'max_iter': 154, 'solver': 'newton-cg'}. Best is trial 40 with value: 0.9274425287356322.
/home/sjoon/projects/brain_connectivity_classifier/masterthesis_venv2/lib/python3.11/site-packages/sklearn/linear_model/_logistic.py:1272: FutureWarning: 'multi_class' was deprecated in version 1.5 and will be removed in 1.8. From then on, it will always use 'multinomial'. Leave it to its default value to avoid this warning.
  warnings.warn(
[I 2026-01-17 15:02:12,033] Trial 45 finished with value: 0.9157088122605364 and parameters: {'C': 0.2681601316765557, 'max_iter': 129, 'solver': 'newton-cg'}. Best is trial 40 with value: 0.9274425287356322.
/home/sjoon/projects/brain_connectivity_classifier/masterthesis_venv2/lib/python3.11/site-packages/sklearn/linear_model/_logistic.py:1272: FutureWarning: 'multi_class' was deprecated in version 1.5 and will be removed in 1.8. From then on, it will always use 'multinomial'. Leave it to its default value to avoid this warning.
  warnings.warn(
[I 2026-01-17 15:02:13,275] Trial 46 finished with value: 0.9034961685823755 and parameters: {'C': 0.3057888594434089, 'max_iter': 124, 'solver': 'newton-cg'}. Best is trial 40 with value: 0.9274425287356322.
/home/sjoon/projects/brain_connectivity_classifier/masterthesis_venv2/lib/python3.11/site-packages/sklearn/linear_model/_logistic.py:1272: FutureWarning: 'multi_class' was deprecated in version 1.5 and will be removed in 1.8. From then on, it will always use 'multinomial'. Leave it to its default value to avoid this warning.
  warnings.warn(
[I 2026-01-17 15:02:14,423] Trial 47 finished with value: 0.8922413793103449 and parameters: {'C': 0.4637925989102689, 'max_iter': 129, 'solver': 'newton-cg'}. Best is trial 40 with value: 0.9274425287356322.
/home/sjoon/projects/brain_connectivity_classifier/masterthesis_venv2/lib/python3.11/site-packages/sklearn/linear_model/_logistic.py:1272: FutureWarning: 'multi_class' was deprecated in version 1.5 and will be removed in 1.8. From then on, it will always use 'multinomial'. Leave it to its default value to avoid this warning.
  warnings.warn(
[I 2026-01-17 15:02:15,729] Trial 48 finished with value: 0.905411877394636 and parameters: {'C': 0.22465668627414345, 'max_iter': 118, 'solver': 'newton-cg'}. Best is trial 40 with value: 0.9274425287356322.
/home/sjoon/projects/brain_connectivity_classifier/masterthesis_venv2/lib/python3.11/site-packages/sklearn/linear_model/_logistic.py:1272: FutureWarning: 'multi_class' was deprecated in version 1.5 and will be removed in 1.8. From then on, it will always use 'multinomial'. Leave it to its default value to avoid this warning.
  warnings.warn(
[I 2026-01-17 15:02:17,076] Trial 49 finished with value: 0.9183429118773946 and parameters: {'C': 0.08219904548007431, 'max_iter': 146, 'solver': 'newton-cg'}. Best is trial 40 with value: 0.9274425287356322.
/home/sjoon/projects/brain_connectivity_classifier/masterthesis_venv2/lib/python3.11/site-packages/sklearn/linear_model/_logistic.py:1272: FutureWarning: 'multi_class' was deprecated in version 1.5 and will be removed in 1.8. From then on, it will always use 'multinomial'. Leave it to its default value to avoid this warning.
  warnings.warn(
[Parallel(n_jobs=-1)]: Using backend LokyBackend with 16 concurrent workers.
[I 2026-01-17 15:02:20,676] A new study created in memory with name: no-name-0c057cc5-8605-4041-b5fc-466f10202f52
/home/sjoon/projects/brain_connectivity_classifier/masterthesis_venv2/lib/python3.11/site-packages/sklearn/linear_model/_logistic.py:1272: FutureWarning: 'multi_class' was deprecated in version 1.5 and will be removed in 1.8. From then on, it will always use 'multinomial'. Leave it to its default value to avoid this warning.
  warnings.warn(
[I 2026-01-17 15:02:33,484] Trial 0 finished with value: 0.8896072796934866 and parameters: {'C': 9.037453045307826, 'max_iter': 242, 'solver': 'lbfgs'}. Best is trial 0 with value: 0.8896072796934866.
/home/sjoon/projects/brain_connectivity_classifier/masterthesis_venv2/lib/python3.11/site-packages/sklearn/linear_model/_logistic.py:1272: FutureWarning: 'multi_class' was deprecated in version 1.5 and will be removed in 1.8. From then on, it will always use 'multinomial'. Leave it to its default value to avoid this warning.
  warnings.warn(
[I 2026-01-17 15:02:35,310] Trial 1 finished with value: 0.9087643678160919 and parameters: {'C': 0.0599622587133535, 'max_iter': 214, 'solver': 'newton-cg'}. Best is trial 1 with value: 0.9087643678160919.
/home/sjoon/projects/brain_connectivity_classifier/masterthesis_venv2/lib/python3.11/site-packages/sklearn/linear_model/_logistic.py:1272: FutureWarning: 'multi_class' was deprecated in version 1.5 and will be removed in 1.8. From then on, it will always use 'multinomial'. Leave it to its default value to avoid this warning.
  warnings.warn(
[I 2026-01-17 15:02:49,904] Trial 2 finished with value: 0.8486590038314177 and parameters: {'C': 0.002909396057508643, 'max_iter': 274, 'solver': 'lbfgs'}. Best is trial 1 with value: 0.9087643678160919.
/home/sjoon/projects/brain_connectivity_classifier/masterthesis_venv2/lib/python3.11/site-packages/sklearn/linear_model/_logistic.py:1272: FutureWarning: 'multi_class' was deprecated in version 1.5 and will be removed in 1.8. From then on, it will always use 'multinomial'. Leave it to its default value to avoid this warning.
  warnings.warn(
[I 2026-01-17 15:03:01,180] Trial 3 finished with value: 0.8912835249042146 and parameters: {'C': 9.180931329804336, 'max_iter': 213, 'solver': 'lbfgs'}. Best is trial 1 with value: 0.9087643678160919.
/home/sjoon/projects/brain_connectivity_classifier/masterthesis_venv2/lib/python3.11/site-packages/sklearn/linear_model/_logistic.py:1272: FutureWarning: 'multi_class' was deprecated in version 1.5 and will be removed in 1.8. From then on, it will always use 'multinomial'. Leave it to its default value to avoid this warning.
  warnings.warn(
[I 2026-01-17 15:03:14,252] Trial 4 finished with value: 0.8996647509578544 and parameters: {'C': 8.017025468558087, 'max_iter': 295, 'solver': 'lbfgs'}. Best is trial 1 with value: 0.9087643678160919.
/home/sjoon/projects/brain_connectivity_classifier/masterthesis_venv2/lib/python3.11/site-packages/sklearn/linear_model/_logistic.py:1272: FutureWarning: 'multi_class' was deprecated in version 1.5 and will be removed in 1.8. From then on, it will always use 'multinomial'. Leave it to its default value to avoid this warning.
  warnings.warn(
[I 2026-01-17 15:03:16,053] Trial 5 finished with value: 0.9183429118773946 and parameters: {'C': 0.10934495147517145, 'max_iter': 119, 'solver': 'newton-cg'}. Best is trial 5 with value: 0.9183429118773946.
/home/sjoon/projects/brain_connectivity_classifier/masterthesis_venv2/lib/python3.11/site-packages/sklearn/linear_model/_logistic.py:1272: FutureWarning: 'multi_class' was deprecated in version 1.5 and will be removed in 1.8. From then on, it will always use 'multinomial'. Leave it to its default value to avoid this warning.
  warnings.warn(
[I 2026-01-17 15:03:30,856] Trial 6 finished with value: 0.8884099616858238 and parameters: {'C': 0.009354759507486167, 'max_iter': 186, 'solver': 'lbfgs'}. Best is trial 5 with value: 0.9183429118773946.
/home/sjoon/projects/brain_connectivity_classifier/masterthesis_venv2/lib/python3.11/site-packages/sklearn/linear_model/_logistic.py:1272: FutureWarning: 'multi_class' was deprecated in version 1.5 and will be removed in 1.8. From then on, it will always use 'multinomial'. Leave it to its default value to avoid this warning.
  warnings.warn(
[I 2026-01-17 15:03:42,280] Trial 7 finished with value: 0.89272030651341 and parameters: {'C': 4.927176912697252, 'max_iter': 143, 'solver': 'lbfgs'}. Best is trial 5 with value: 0.9183429118773946.
/home/sjoon/projects/brain_connectivity_classifier/masterthesis_venv2/lib/python3.11/site-packages/sklearn/linear_model/_logistic.py:1272: FutureWarning: 'multi_class' was deprecated in version 1.5 and will be removed in 1.8. From then on, it will always use 'multinomial'. Leave it to its default value to avoid this warning.
  warnings.warn(
[I 2026-01-17 15:03:52,620] Trial 8 finished with value: 0.9085249042145593 and parameters: {'C': 0.25352249141085603, 'max_iter': 192, 'solver': 'lbfgs'}. Best is trial 5 with value: 0.9183429118773946.
/home/sjoon/projects/brain_connectivity_classifier/masterthesis_venv2/lib/python3.11/site-packages/sklearn/linear_model/_logistic.py:1272: FutureWarning: 'multi_class' was deprecated in version 1.5 and will be removed in 1.8. From then on, it will always use 'multinomial'. Leave it to its default value to avoid this warning.
  warnings.warn(
[I 2026-01-17 15:04:05,612] Trial 9 finished with value: 0.9015804597701149 and parameters: {'C': 0.06775665627513389, 'max_iter': 245, 'solver': 'lbfgs'}. Best is trial 5 with value: 0.9183429118773946.
/home/sjoon/projects/brain_connectivity_classifier/masterthesis_venv2/lib/python3.11/site-packages/sklearn/linear_model/_logistic.py:1272: FutureWarning: 'multi_class' was deprecated in version 1.5 and will be removed in 1.8. From then on, it will always use 'multinomial'. Leave it to its default value to avoid this warning.
  warnings.warn(
[I 2026-01-17 15:04:07,138] Trial 10 finished with value: 0.9022988505747126 and parameters: {'C': 0.5750861266072848, 'max_iter': 491, 'solver': 'newton-cg'}. Best is trial 5 with value: 0.9183429118773946.
/home/sjoon/projects/brain_connectivity_classifier/masterthesis_venv2/lib/python3.11/site-packages/sklearn/linear_model/_logistic.py:1272: FutureWarning: 'multi_class' was deprecated in version 1.5 and will be removed in 1.8. From then on, it will always use 'multinomial'. Leave it to its default value to avoid this warning.
  warnings.warn(
[I 2026-01-17 15:04:08,491] Trial 11 finished with value: 0.9063697318007663 and parameters: {'C': 0.0358497315752199, 'max_iter': 102, 'solver': 'newton-cg'}. Best is trial 5 with value: 0.9183429118773946.
/home/sjoon/projects/brain_connectivity_classifier/masterthesis_venv2/lib/python3.11/site-packages/sklearn/linear_model/_logistic.py:1272: FutureWarning: 'multi_class' was deprecated in version 1.5 and will be removed in 1.8. From then on, it will always use 'multinomial'. Leave it to its default value to avoid this warning.
  warnings.warn(
[I 2026-01-17 15:04:09,770] Trial 12 finished with value: 0.8994252873563219 and parameters: {'C': 0.8017702133436594, 'max_iter': 101, 'solver': 'newton-cg'}. Best is trial 5 with value: 0.9183429118773946.
/home/sjoon/projects/brain_connectivity_classifier/masterthesis_venv2/lib/python3.11/site-packages/sklearn/linear_model/_logistic.py:1272: FutureWarning: 'multi_class' was deprecated in version 1.5 and will be removed in 1.8. From then on, it will always use 'multinomial'. Leave it to its default value to avoid this warning.
  warnings.warn(
[I 2026-01-17 15:04:11,282] Trial 13 finished with value: 0.9068486590038314 and parameters: {'C': 0.016691123385296113, 'max_iter': 137, 'solver': 'newton-cg'}. Best is trial 5 with value: 0.9183429118773946.
/home/sjoon/projects/brain_connectivity_classifier/masterthesis_venv2/lib/python3.11/site-packages/sklearn/linear_model/_logistic.py:1272: FutureWarning: 'multi_class' was deprecated in version 1.5 and will be removed in 1.8. From then on, it will always use 'multinomial'. Leave it to its default value to avoid this warning.
  warnings.warn(
[I 2026-01-17 15:04:12,600] Trial 14 finished with value: 0.9209770114942529 and parameters: {'C': 0.17822760749941913, 'max_iter': 348, 'solver': 'newton-cg'}. Best is trial 14 with value: 0.9209770114942529.
/home/sjoon/projects/brain_connectivity_classifier/masterthesis_venv2/lib/python3.11/site-packages/sklearn/linear_model/_logistic.py:1272: FutureWarning: 'multi_class' was deprecated in version 1.5 and will be removed in 1.8. From then on, it will always use 'multinomial'. Leave it to its default value to avoid this warning.
  warnings.warn(
[I 2026-01-17 15:04:13,928] Trial 15 finished with value: 0.9233716475095786 and parameters: {'C': 0.22218596939082375, 'max_iter': 367, 'solver': 'newton-cg'}. Best is trial 15 with value: 0.9233716475095786.
/home/sjoon/projects/brain_connectivity_classifier/masterthesis_venv2/lib/python3.11/site-packages/sklearn/linear_model/_logistic.py:1272: FutureWarning: 'multi_class' was deprecated in version 1.5 and will be removed in 1.8. From then on, it will always use 'multinomial'. Leave it to its default value to avoid this warning.
  warnings.warn(
