[I 2026-01-17 15:47:03,205] Trial 18 finished with value: 0.9011015325670498 and parameters: {'C': 0.21671223318020763, 'max_iter': 452, 'solver': 'newton-cg'}. Best is trial 14 with value: 0.9149904214559387.
/home/sjoon/projects/brain_connectivity_classifier/masterthesis_venv2/lib/python3.11/site-packages/sklearn/linear_model/_logistic.py:1272: FutureWarning: 'multi_class' was deprecated in version 1.5 and will be removed in 1.8. From then on, it will always use 'multinomial'. Leave it to its default value to avoid this warning.
  warnings.warn(
[I 2026-01-17 15:47:05,149] Trial 19 finished with value: 0.8943965517241379 and parameters: {'C': 1.7353774836107525, 'max_iter': 373, 'solver': 'newton-cg'}. Best is trial 14 with value: 0.9149904214559387.
/home/sjoon/projects/brain_connectivity_classifier/masterthesis_venv2/lib/python3.11/site-packages/sklearn/linear_model/_logistic.py:1272: FutureWarning: 'multi_class' was deprecated in version 1.5 and will be removed in 1.8. From then on, it will always use 'multinomial'. Leave it to its default value to avoid this warning.
  warnings.warn(
[I 2026-01-17 15:47:06,554] Trial 20 finished with value: 0.8989463601532567 and parameters: {'C': 0.019136455953109012, 'max_iter': 426, 'solver': 'newton-cg'}. Best is trial 14 with value: 0.9149904214559387.
/home/sjoon/projects/brain_connectivity_classifier/masterthesis_venv2/lib/python3.11/site-packages/sklearn/linear_model/_logistic.py:1272: FutureWarning: 'multi_class' was deprecated in version 1.5 and will be removed in 1.8. From then on, it will always use 'multinomial'. Leave it to its default value to avoid this warning.
  warnings.warn(
[I 2026-01-17 15:47:08,140] Trial 21 finished with value: 0.8953544061302682 and parameters: {'C': 0.10061361636405919, 'max_iter': 304, 'solver': 'newton-cg'}. Best is trial 14 with value: 0.9149904214559387.
/home/sjoon/projects/brain_connectivity_classifier/masterthesis_venv2/lib/python3.11/site-packages/sklearn/linear_model/_logistic.py:1272: FutureWarning: 'multi_class' was deprecated in version 1.5 and will be removed in 1.8. From then on, it will always use 'multinomial'. Leave it to its default value to avoid this warning.
  warnings.warn(
[I 2026-01-17 15:47:09,557] Trial 22 finished with value: 0.898227969348659 and parameters: {'C': 0.04351493723788819, 'max_iter': 163, 'solver': 'newton-cg'}. Best is trial 14 with value: 0.9149904214559387.
/home/sjoon/projects/brain_connectivity_classifier/masterthesis_venv2/lib/python3.11/site-packages/sklearn/linear_model/_logistic.py:1272: FutureWarning: 'multi_class' was deprecated in version 1.5 and will be removed in 1.8. From then on, it will always use 'multinomial'. Leave it to its default value to avoid this warning.
  warnings.warn(
[I 2026-01-17 15:47:11,088] Trial 23 finished with value: 0.8994252873563219 and parameters: {'C': 0.20307227024926122, 'max_iter': 404, 'solver': 'newton-cg'}. Best is trial 14 with value: 0.9149904214559387.
/home/sjoon/projects/brain_connectivity_classifier/masterthesis_venv2/lib/python3.11/site-packages/sklearn/linear_model/_logistic.py:1272: FutureWarning: 'multi_class' was deprecated in version 1.5 and will be removed in 1.8. From then on, it will always use 'multinomial'. Leave it to its default value to avoid this warning.
  warnings.warn(
[I 2026-01-17 15:47:12,591] Trial 24 finished with value: 0.8697318007662835 and parameters: {'C': 0.005648442537881318, 'max_iter': 336, 'solver': 'newton-cg'}. Best is trial 14 with value: 0.9149904214559387.
/home/sjoon/projects/brain_connectivity_classifier/masterthesis_venv2/lib/python3.11/site-packages/sklearn/linear_model/_logistic.py:1272: FutureWarning: 'multi_class' was deprecated in version 1.5 and will be removed in 1.8. From then on, it will always use 'multinomial'. Leave it to its default value to avoid this warning.
  warnings.warn(
[I 2026-01-17 15:47:14,196] Trial 25 finished with value: 0.905411877394636 and parameters: {'C': 0.41940214735209463, 'max_iter': 268, 'solver': 'newton-cg'}. Best is trial 14 with value: 0.9149904214559387.
/home/sjoon/projects/brain_connectivity_classifier/masterthesis_venv2/lib/python3.11/site-packages/sklearn/linear_model/_logistic.py:1272: FutureWarning: 'multi_class' was deprecated in version 1.5 and will be removed in 1.8. From then on, it will always use 'multinomial'. Leave it to its default value to avoid this warning.
  warnings.warn(
[I 2026-01-17 15:47:15,948] Trial 26 finished with value: 0.9164272030651341 and parameters: {'C': 0.03352340999365558, 'max_iter': 495, 'solver': 'newton-cg'}. Best is trial 26 with value: 0.9164272030651341.
/home/sjoon/projects/brain_connectivity_classifier/masterthesis_venv2/lib/python3.11/site-packages/sklearn/linear_model/_logistic.py:1272: FutureWarning: 'multi_class' was deprecated in version 1.5 and will be removed in 1.8. From then on, it will always use 'multinomial'. Leave it to its default value to avoid this warning.
  warnings.warn(
[I 2026-01-17 15:47:17,340] Trial 27 finished with value: 0.8975095785440613 and parameters: {'C': 0.024529810731751537, 'max_iter': 495, 'solver': 'newton-cg'}. Best is trial 26 with value: 0.9164272030651341.
/home/sjoon/projects/brain_connectivity_classifier/masterthesis_venv2/lib/python3.11/site-packages/sklearn/linear_model/_logistic.py:1272: FutureWarning: 'multi_class' was deprecated in version 1.5 and will be removed in 1.8. From then on, it will always use 'multinomial'. Leave it to its default value to avoid this warning.
  warnings.warn(
[I 2026-01-17 15:47:18,938] Trial 28 finished with value: 0.9113984674329502 and parameters: {'C': 0.12210723342610916, 'max_iter': 429, 'solver': 'newton-cg'}. Best is trial 26 with value: 0.9164272030651341.
/home/sjoon/projects/brain_connectivity_classifier/masterthesis_venv2/lib/python3.11/site-packages/sklearn/linear_model/_logistic.py:1272: FutureWarning: 'multi_class' was deprecated in version 1.5 and will be removed in 1.8. From then on, it will always use 'multinomial'. Leave it to its default value to avoid this warning.
  warnings.warn(
[I 2026-01-17 15:47:20,445] Trial 29 finished with value: 0.8860153256704981 and parameters: {'C': 0.0104625768518045, 'max_iter': 405, 'solver': 'newton-cg'}. Best is trial 26 with value: 0.9164272030651341.
/home/sjoon/projects/brain_connectivity_classifier/masterthesis_venv2/lib/python3.11/site-packages/sklearn/linear_model/_logistic.py:1272: FutureWarning: 'multi_class' was deprecated in version 1.5 and will be removed in 1.8. From then on, it will always use 'multinomial'. Leave it to its default value to avoid this warning.
  warnings.warn(
[I 2026-01-17 15:47:22,083] Trial 30 finished with value: 0.898227969348659 and parameters: {'C': 0.8307760059248107, 'max_iter': 483, 'solver': 'newton-cg'}. Best is trial 26 with value: 0.9164272030651341.
/home/sjoon/projects/brain_connectivity_classifier/masterthesis_venv2/lib/python3.11/site-packages/sklearn/linear_model/_logistic.py:1272: FutureWarning: 'multi_class' was deprecated in version 1.5 and will be removed in 1.8. From then on, it will always use 'multinomial'. Leave it to its default value to avoid this warning.
  warnings.warn(
[I 2026-01-17 15:47:23,413] Trial 31 finished with value: 0.9011015325670498 and parameters: {'C': 0.06585322849702069, 'max_iter': 228, 'solver': 'newton-cg'}. Best is trial 26 with value: 0.9164272030651341.
/home/sjoon/projects/brain_connectivity_classifier/masterthesis_venv2/lib/python3.11/site-packages/sklearn/linear_model/_logistic.py:1272: FutureWarning: 'multi_class' was deprecated in version 1.5 and will be removed in 1.8. From then on, it will always use 'multinomial'. Leave it to its default value to avoid this warning.
  warnings.warn(
[I 2026-01-17 15:47:24,812] Trial 32 finished with value: 0.89272030651341 and parameters: {'C': 0.045538818064157265, 'max_iter': 328, 'solver': 'newton-cg'}. Best is trial 26 with value: 0.9164272030651341.
/home/sjoon/projects/brain_connectivity_classifier/masterthesis_venv2/lib/python3.11/site-packages/sklearn/linear_model/_logistic.py:1272: FutureWarning: 'multi_class' was deprecated in version 1.5 and will be removed in 1.8. From then on, it will always use 'multinomial'. Leave it to its default value to avoid this warning.
  warnings.warn(
[I 2026-01-17 15:47:26,272] Trial 33 finished with value: 0.9061302681992337 and parameters: {'C': 0.16616554764316988, 'max_iter': 257, 'solver': 'newton-cg'}. Best is trial 26 with value: 0.9164272030651341.
/home/sjoon/projects/brain_connectivity_classifier/masterthesis_venv2/lib/python3.11/site-packages/sklearn/linear_model/_logistic.py:1272: FutureWarning: 'multi_class' was deprecated in version 1.5 and will be removed in 1.8. From then on, it will always use 'multinomial'. Leave it to its default value to avoid this warning.
  warnings.warn(
[I 2026-01-17 15:47:27,888] Trial 34 finished with value: 0.9185823754789272 and parameters: {'C': 0.06996758689417608, 'max_iter': 208, 'solver': 'newton-cg'}. Best is trial 34 with value: 0.9185823754789272.
/home/sjoon/projects/brain_connectivity_classifier/masterthesis_venv2/lib/python3.11/site-packages/sklearn/linear_model/_logistic.py:1272: FutureWarning: 'multi_class' was deprecated in version 1.5 and will be removed in 1.8. From then on, it will always use 'multinomial'. Leave it to its default value to avoid this warning.
  warnings.warn(
[I 2026-01-17 15:47:29,383] Trial 35 finished with value: 0.9049329501915708 and parameters: {'C': 0.36778055590441855, 'max_iter': 201, 'solver': 'newton-cg'}. Best is trial 34 with value: 0.9185823754789272.
/home/sjoon/projects/brain_connectivity_classifier/masterthesis_venv2/lib/python3.11/site-packages/sklearn/linear_model/_logistic.py:1272: FutureWarning: 'multi_class' was deprecated in version 1.5 and will be removed in 1.8. From then on, it will always use 'multinomial'. Leave it to its default value to avoid this warning.
  warnings.warn(
[I 2026-01-17 15:47:31,005] Trial 36 finished with value: 0.9157088122605364 and parameters: {'C': 0.10198974229245611, 'max_iter': 292, 'solver': 'newton-cg'}. Best is trial 34 with value: 0.9185823754789272.
/home/sjoon/projects/brain_connectivity_classifier/masterthesis_venv2/lib/python3.11/site-packages/sklearn/linear_model/_logistic.py:1272: FutureWarning: 'multi_class' was deprecated in version 1.5 and will be removed in 1.8. From then on, it will always use 'multinomial'. Leave it to its default value to avoid this warning.
  warnings.warn(
[I 2026-01-17 15:47:49,832] Trial 37 finished with value: 0.9039750957854407 and parameters: {'C': 0.030033324263617617, 'max_iter': 288, 'solver': 'lbfgs'}. Best is trial 34 with value: 0.9185823754789272.
/home/sjoon/projects/brain_connectivity_classifier/masterthesis_venv2/lib/python3.11/site-packages/sklearn/linear_model/_logistic.py:1272: FutureWarning: 'multi_class' was deprecated in version 1.5 and will be removed in 1.8. From then on, it will always use 'multinomial'. Leave it to its default value to avoid this warning.
  warnings.warn(
[I 2026-01-17 15:47:52,043] Trial 38 finished with value: 0.9042145593869731 and parameters: {'C': 0.06973769096282235, 'max_iter': 229, 'solver': 'newton-cg'}. Best is trial 34 with value: 0.9185823754789272.
/home/sjoon/projects/brain_connectivity_classifier/masterthesis_venv2/lib/python3.11/site-packages/sklearn/linear_model/_logistic.py:1272: FutureWarning: 'multi_class' was deprecated in version 1.5 and will be removed in 1.8. From then on, it will always use 'multinomial'. Leave it to its default value to avoid this warning.
  warnings.warn(
[I 2026-01-17 15:48:08,928] Trial 39 finished with value: 0.8431513409961686 and parameters: {'C': 0.003907666546215803, 'max_iter': 178, 'solver': 'lbfgs'}. Best is trial 34 with value: 0.9185823754789272.
/home/sjoon/projects/brain_connectivity_classifier/masterthesis_venv2/lib/python3.11/site-packages/sklearn/linear_model/_logistic.py:1272: FutureWarning: 'multi_class' was deprecated in version 1.5 and will be removed in 1.8. From then on, it will always use 'multinomial'. Leave it to its default value to avoid this warning.
  warnings.warn(
[I 2026-01-17 15:48:11,512] Trial 40 finished with value: 0.8778735632183908 and parameters: {'C': 0.010891489515467563, 'max_iter': 301, 'solver': 'newton-cg'}. Best is trial 34 with value: 0.9185823754789272.
/home/sjoon/projects/brain_connectivity_classifier/masterthesis_venv2/lib/python3.11/site-packages/sklearn/linear_model/_logistic.py:1272: FutureWarning: 'multi_class' was deprecated in version 1.5 and will be removed in 1.8. From then on, it will always use 'multinomial'. Leave it to its default value to avoid this warning.
  warnings.warn(
[I 2026-01-17 15:48:12,998] Trial 41 finished with value: 0.9116379310344828 and parameters: {'C': 0.15288662074278228, 'max_iter': 375, 'solver': 'newton-cg'}. Best is trial 34 with value: 0.9185823754789272.
/home/sjoon/projects/brain_connectivity_classifier/masterthesis_venv2/lib/python3.11/site-packages/sklearn/linear_model/_logistic.py:1272: FutureWarning: 'multi_class' was deprecated in version 1.5 and will be removed in 1.8. From then on, it will always use 'multinomial'. Leave it to its default value to avoid this warning.
  warnings.warn(
[I 2026-01-17 15:48:14,525] Trial 42 finished with value: 0.9102011494252874 and parameters: {'C': 0.09064744858821067, 'max_iter': 321, 'solver': 'newton-cg'}. Best is trial 34 with value: 0.9185823754789272.
/home/sjoon/projects/brain_connectivity_classifier/masterthesis_venv2/lib/python3.11/site-packages/sklearn/linear_model/_logistic.py:1272: FutureWarning: 'multi_class' was deprecated in version 1.5 and will be removed in 1.8. From then on, it will always use 'multinomial'. Leave it to its default value to avoid this warning.
  warnings.warn(
[I 2026-01-17 15:48:16,045] Trial 43 finished with value: 0.9087643678160919 and parameters: {'C': 0.323381839957972, 'max_iter': 449, 'solver': 'newton-cg'}. Best is trial 34 with value: 0.9185823754789272.
/home/sjoon/projects/brain_connectivity_classifier/masterthesis_venv2/lib/python3.11/site-packages/sklearn/linear_model/_logistic.py:1272: FutureWarning: 'multi_class' was deprecated in version 1.5 and will be removed in 1.8. From then on, it will always use 'multinomial'. Leave it to its default value to avoid this warning.
  warnings.warn(
[I 2026-01-17 15:48:32,392] Trial 44 finished with value: 0.8943965517241379 and parameters: {'C': 0.05030951356545361, 'max_iter': 397, 'solver': 'lbfgs'}. Best is trial 34 with value: 0.9185823754789272.
/home/sjoon/projects/brain_connectivity_classifier/masterthesis_venv2/lib/python3.11/site-packages/sklearn/linear_model/_logistic.py:1272: FutureWarning: 'multi_class' was deprecated in version 1.5 and will be removed in 1.8. From then on, it will always use 'multinomial'. Leave it to its default value to avoid this warning.
  warnings.warn(
[I 2026-01-17 15:48:33,901] Trial 45 finished with value: 0.9181034482758621 and parameters: {'C': 0.09026456631180228, 'max_iter': 212, 'solver': 'newton-cg'}. Best is trial 34 with value: 0.9185823754789272.
/home/sjoon/projects/brain_connectivity_classifier/masterthesis_venv2/lib/python3.11/site-packages/sklearn/linear_model/_logistic.py:1272: FutureWarning: 'multi_class' was deprecated in version 1.5 and will be removed in 1.8. From then on, it will always use 'multinomial'. Leave it to its default value to avoid this warning.
  warnings.warn(
[I 2026-01-17 15:48:35,386] Trial 46 finished with value: 0.9063697318007663 and parameters: {'C': 0.09162033006117404, 'max_iter': 211, 'solver': 'newton-cg'}. Best is trial 34 with value: 0.9185823754789272.
/home/sjoon/projects/brain_connectivity_classifier/masterthesis_venv2/lib/python3.11/site-packages/sklearn/linear_model/_logistic.py:1272: FutureWarning: 'multi_class' was deprecated in version 1.5 and will be removed in 1.8. From then on, it will always use 'multinomial'. Leave it to its default value to avoid this warning.
  warnings.warn(
[I 2026-01-17 15:48:36,779] Trial 47 finished with value: 0.8891283524904214 and parameters: {'C': 0.02189609945347137, 'max_iter': 169, 'solver': 'newton-cg'}. Best is trial 34 with value: 0.9185823754789272.
/home/sjoon/projects/brain_connectivity_classifier/masterthesis_venv2/lib/python3.11/site-packages/sklearn/linear_model/_logistic.py:1272: FutureWarning: 'multi_class' was deprecated in version 1.5 and will be removed in 1.8. From then on, it will always use 'multinomial'. Leave it to its default value to avoid this warning.
  warnings.warn(
[I 2026-01-17 15:48:50,444] Trial 48 finished with value: 0.8872126436781609 and parameters: {'C': 0.6866337787221292, 'max_iter': 244, 'solver': 'lbfgs'}. Best is trial 34 with value: 0.9185823754789272.
/home/sjoon/projects/brain_connectivity_classifier/masterthesis_venv2/lib/python3.11/site-packages/sklearn/linear_model/_logistic.py:1272: FutureWarning: 'multi_class' was deprecated in version 1.5 and will be removed in 1.8. From then on, it will always use 'multinomial'. Leave it to its default value to avoid this warning.
  warnings.warn(
[I 2026-01-17 15:48:52,749] Trial 49 finished with value: 0.896551724137931 and parameters: {'C': 0.035326610714711146, 'max_iter': 277, 'solver': 'newton-cg'}. Best is trial 34 with value: 0.9185823754789272.
/home/sjoon/projects/brain_connectivity_classifier/masterthesis_venv2/lib/python3.11/site-packages/sklearn/linear_model/_logistic.py:1272: FutureWarning: 'multi_class' was deprecated in version 1.5 and will be removed in 1.8. From then on, it will always use 'multinomial'. Leave it to its default value to avoid this warning.
  warnings.warn(
[Parallel(n_jobs=-1)]: Using backend LokyBackend with 16 concurrent workers.
[I 2026-01-17 15:48:57,160] A new study created in memory with name: no-name-1a9a8f48-a4c4-42e8-ac1f-6842895b4089
/home/sjoon/projects/brain_connectivity_classifier/masterthesis_venv2/lib/python3.11/site-packages/sklearn/linear_model/_logistic.py:1272: FutureWarning: 'multi_class' was deprecated in version 1.5 and will be removed in 1.8. From then on, it will always use 'multinomial'. Leave it to its default value to avoid this warning.
  warnings.warn(
[I 2026-01-17 15:48:58,573] Trial 0 finished with value: 0.8946360153256705 and parameters: {'C': 1.3656185367897316, 'max_iter': 277, 'solver': 'newton-cg'}. Best is trial 0 with value: 0.8946360153256705.
/home/sjoon/projects/brain_connectivity_classifier/masterthesis_venv2/lib/python3.11/site-packages/sklearn/linear_model/_logistic.py:1272: FutureWarning: 'multi_class' was deprecated in version 1.5 and will be removed in 1.8. From then on, it will always use 'multinomial'. Leave it to its default value to avoid this warning.
  warnings.warn(
[I 2026-01-17 15:49:00,281] Trial 1 finished with value: 0.8984674329501916 and parameters: {'C': 0.017877539345607523, 'max_iter': 452, 'solver': 'newton-cg'}. Best is trial 1 with value: 0.8984674329501916.
/home/sjoon/projects/brain_connectivity_classifier/masterthesis_venv2/lib/python3.11/site-packages/sklearn/linear_model/_logistic.py:1272: FutureWarning: 'multi_class' was deprecated in version 1.5 and will be removed in 1.8. From then on, it will always use 'multinomial'. Leave it to its default value to avoid this warning.
  warnings.warn(
[I 2026-01-17 15:49:12,624] Trial 2 finished with value: 0.8955938697318008 and parameters: {'C': 4.47599053757093, 'max_iter': 208, 'solver': 'lbfgs'}. Best is trial 1 with value: 0.8984674329501916.
/home/sjoon/projects/brain_connectivity_classifier/masterthesis_venv2/lib/python3.11/site-packages/sklearn/linear_model/_logistic.py:1272: FutureWarning: 'multi_class' was deprecated in version 1.5 and will be removed in 1.8. From then on, it will always use 'multinomial'. Leave it to its default value to avoid this warning.
  warnings.warn(
[I 2026-01-17 15:49:26,180] Trial 3 finished with value: 0.9020593869731801 and parameters: {'C': 0.05074569025512076, 'max_iter': 332, 'solver': 'lbfgs'}. Best is trial 3 with value: 0.9020593869731801.
/home/sjoon/projects/brain_connectivity_classifier/masterthesis_venv2/lib/python3.11/site-packages/sklearn/linear_model/_logistic.py:1272: FutureWarning: 'multi_class' was deprecated in version 1.5 and will be removed in 1.8. From then on, it will always use 'multinomial'. Leave it to its default value to avoid this warning.
  warnings.warn(
[I 2026-01-17 15:49:28,748] Trial 4 finished with value: 0.8249521072796935 and parameters: {'C': 0.002607939962442735, 'max_iter': 364, 'solver': 'newton-cg'}. Best is trial 3 with value: 0.9020593869731801.
/home/sjoon/projects/brain_connectivity_classifier/masterthesis_venv2/lib/python3.11/site-packages/sklearn/linear_model/_logistic.py:1272: FutureWarning: 'multi_class' was deprecated in version 1.5 and will be removed in 1.8. From then on, it will always use 'multinomial'. Leave it to its default value to avoid this warning.
  warnings.warn(
[I 2026-01-17 15:49:30,139] Trial 5 finished with value: 0.7751436781609196 and parameters: {'C': 0.001393009808491993, 'max_iter': 162, 'solver': 'newton-cg'}. Best is trial 3 with value: 0.9020593869731801.
/home/sjoon/projects/brain_connectivity_classifier/masterthesis_venv2/lib/python3.11/site-packages/sklearn/linear_model/_logistic.py:1272: FutureWarning: 'multi_class' was deprecated in version 1.5 and will be removed in 1.8. From then on, it will always use 'multinomial'. Leave it to its default value to avoid this warning.
  warnings.warn(
