[I 2026-01-17 15:49:46,160] Trial 6 finished with value: 0.875 and parameters: {'C': 0.011211424217817453, 'max_iter': 493, 'solver': 'lbfgs'}. Best is trial 3 with value: 0.9020593869731801.
/home/sjoon/projects/brain_connectivity_classifier/masterthesis_venv2/lib/python3.11/site-packages/sklearn/linear_model/_logistic.py:1272: FutureWarning: 'multi_class' was deprecated in version 1.5 and will be removed in 1.8. From then on, it will always use 'multinomial'. Leave it to its default value to avoid this warning.
  warnings.warn(
[I 2026-01-17 15:49:47,770] Trial 7 finished with value: 0.8781130268199234 and parameters: {'C': 0.007663100925476637, 'max_iter': 221, 'solver': 'newton-cg'}. Best is trial 3 with value: 0.9020593869731801.
/home/sjoon/projects/brain_connectivity_classifier/masterthesis_venv2/lib/python3.11/site-packages/sklearn/linear_model/_logistic.py:1272: FutureWarning: 'multi_class' was deprecated in version 1.5 and will be removed in 1.8. From then on, it will always use 'multinomial'. Leave it to its default value to avoid this warning.
  warnings.warn(
[I 2026-01-17 15:49:49,269] Trial 8 finished with value: 0.876676245210728 and parameters: {'C': 0.00870565720849901, 'max_iter': 472, 'solver': 'newton-cg'}. Best is trial 3 with value: 0.9020593869731801.
/home/sjoon/projects/brain_connectivity_classifier/masterthesis_venv2/lib/python3.11/site-packages/sklearn/linear_model/_logistic.py:1272: FutureWarning: 'multi_class' was deprecated in version 1.5 and will be removed in 1.8. From then on, it will always use 'multinomial'. Leave it to its default value to avoid this warning.
  warnings.warn(
[I 2026-01-17 15:49:50,665] Trial 9 finished with value: 0.8144157088122606 and parameters: {'C': 0.002292667236983871, 'max_iter': 127, 'solver': 'newton-cg'}. Best is trial 3 with value: 0.9020593869731801.
/home/sjoon/projects/brain_connectivity_classifier/masterthesis_venv2/lib/python3.11/site-packages/sklearn/linear_model/_logistic.py:1272: FutureWarning: 'multi_class' was deprecated in version 1.5 and will be removed in 1.8. From then on, it will always use 'multinomial'. Leave it to its default value to avoid this warning.
  warnings.warn(
[I 2026-01-17 15:50:04,684] Trial 10 finished with value: 0.923132183908046 and parameters: {'C': 0.2786345154934639, 'max_iter': 310, 'solver': 'lbfgs'}. Best is trial 10 with value: 0.923132183908046.
/home/sjoon/projects/brain_connectivity_classifier/masterthesis_venv2/lib/python3.11/site-packages/sklearn/linear_model/_logistic.py:1272: FutureWarning: 'multi_class' was deprecated in version 1.5 and will be removed in 1.8. From then on, it will always use 'multinomial'. Leave it to its default value to avoid this warning.
  warnings.warn(
[I 2026-01-17 15:50:16,856] Trial 11 finished with value: 0.9099616858237548 and parameters: {'C': 0.26903250444960153, 'max_iter': 301, 'solver': 'lbfgs'}. Best is trial 10 with value: 0.923132183908046.
/home/sjoon/projects/brain_connectivity_classifier/masterthesis_venv2/lib/python3.11/site-packages/sklearn/linear_model/_logistic.py:1272: FutureWarning: 'multi_class' was deprecated in version 1.5 and will be removed in 1.8. From then on, it will always use 'multinomial'. Leave it to its default value to avoid this warning.
  warnings.warn(
[I 2026-01-17 15:50:29,812] Trial 12 finished with value: 0.9087643678160919 and parameters: {'C': 0.34942149676605216, 'max_iter': 283, 'solver': 'lbfgs'}. Best is trial 10 with value: 0.923132183908046.
/home/sjoon/projects/brain_connectivity_classifier/masterthesis_venv2/lib/python3.11/site-packages/sklearn/linear_model/_logistic.py:1272: FutureWarning: 'multi_class' was deprecated in version 1.5 and will be removed in 1.8. From then on, it will always use 'multinomial'. Leave it to its default value to avoid this warning.
  warnings.warn(
[I 2026-01-17 15:50:38,964] Trial 13 finished with value: 0.91977969348659 and parameters: {'C': 0.22118323418840433, 'max_iter': 271, 'solver': 'lbfgs'}. Best is trial 10 with value: 0.923132183908046.
/home/sjoon/projects/brain_connectivity_classifier/masterthesis_venv2/lib/python3.11/site-packages/sklearn/linear_model/_logistic.py:1272: FutureWarning: 'multi_class' was deprecated in version 1.5 and will be removed in 1.8. From then on, it will always use 'multinomial'. Leave it to its default value to avoid this warning.
  warnings.warn(
[I 2026-01-17 15:50:49,360] Trial 14 finished with value: 0.9082854406130269 and parameters: {'C': 0.13528097608009407, 'max_iter': 174, 'solver': 'lbfgs'}. Best is trial 10 with value: 0.923132183908046.
/home/sjoon/projects/brain_connectivity_classifier/masterthesis_venv2/lib/python3.11/site-packages/sklearn/linear_model/_logistic.py:1272: FutureWarning: 'multi_class' was deprecated in version 1.5 and will be removed in 1.8. From then on, it will always use 'multinomial'. Leave it to its default value to avoid this warning.
  warnings.warn(
[I 2026-01-17 15:50:59,524] Trial 15 finished with value: 0.9078065134099617 and parameters: {'C': 1.2677106848301645, 'max_iter': 102, 'solver': 'lbfgs'}. Best is trial 10 with value: 0.923132183908046.
/home/sjoon/projects/brain_connectivity_classifier/masterthesis_venv2/lib/python3.11/site-packages/sklearn/linear_model/_logistic.py:1272: FutureWarning: 'multi_class' was deprecated in version 1.5 and will be removed in 1.8. From then on, it will always use 'multinomial'. Leave it to its default value to avoid this warning.
  warnings.warn(
[I 2026-01-17 15:51:09,016] Trial 16 finished with value: 0.9061302681992337 and parameters: {'C': 0.0523344306792589, 'max_iter': 383, 'solver': 'lbfgs'}. Best is trial 10 with value: 0.923132183908046.
/home/sjoon/projects/brain_connectivity_classifier/masterthesis_venv2/lib/python3.11/site-packages/sklearn/linear_model/_logistic.py:1272: FutureWarning: 'multi_class' was deprecated in version 1.5 and will be removed in 1.8. From then on, it will always use 'multinomial'. Leave it to its default value to avoid this warning.
  warnings.warn(
[I 2026-01-17 15:51:16,676] Trial 17 finished with value: 0.9008620689655172 and parameters: {'C': 0.6613034439129616, 'max_iter': 234, 'solver': 'lbfgs'}. Best is trial 10 with value: 0.923132183908046.
/home/sjoon/projects/brain_connectivity_classifier/masterthesis_venv2/lib/python3.11/site-packages/sklearn/linear_model/_logistic.py:1272: FutureWarning: 'multi_class' was deprecated in version 1.5 and will be removed in 1.8. From then on, it will always use 'multinomial'. Leave it to its default value to avoid this warning.
  warnings.warn(
[I 2026-01-17 15:51:26,176] Trial 18 finished with value: 0.8769157088122606 and parameters: {'C': 4.607874907546153, 'max_iter': 248, 'solver': 'lbfgs'}. Best is trial 10 with value: 0.923132183908046.
/home/sjoon/projects/brain_connectivity_classifier/masterthesis_venv2/lib/python3.11/site-packages/sklearn/linear_model/_logistic.py:1272: FutureWarning: 'multi_class' was deprecated in version 1.5 and will be removed in 1.8. From then on, it will always use 'multinomial'. Leave it to its default value to avoid this warning.
  warnings.warn(
[I 2026-01-17 15:51:35,144] Trial 19 finished with value: 0.9030172413793104 and parameters: {'C': 0.1329359415465126, 'max_iter': 188, 'solver': 'lbfgs'}. Best is trial 10 with value: 0.923132183908046.
/home/sjoon/projects/brain_connectivity_classifier/masterthesis_venv2/lib/python3.11/site-packages/sklearn/linear_model/_logistic.py:1272: FutureWarning: 'multi_class' was deprecated in version 1.5 and will be removed in 1.8. From then on, it will always use 'multinomial'. Leave it to its default value to avoid this warning.
  warnings.warn(
[I 2026-01-17 15:51:45,380] Trial 20 finished with value: 0.8984674329501916 and parameters: {'C': 0.034091776384669564, 'max_iter': 394, 'solver': 'lbfgs'}. Best is trial 10 with value: 0.923132183908046.
/home/sjoon/projects/brain_connectivity_classifier/masterthesis_venv2/lib/python3.11/site-packages/sklearn/linear_model/_logistic.py:1272: FutureWarning: 'multi_class' was deprecated in version 1.5 and will be removed in 1.8. From then on, it will always use 'multinomial'. Leave it to its default value to avoid this warning.
  warnings.warn(
[I 2026-01-17 15:51:52,936] Trial 21 finished with value: 0.9099616858237548 and parameters: {'C': 0.30569511502530244, 'max_iter': 305, 'solver': 'lbfgs'}. Best is trial 10 with value: 0.923132183908046.
/home/sjoon/projects/brain_connectivity_classifier/masterthesis_venv2/lib/python3.11/site-packages/sklearn/linear_model/_logistic.py:1272: FutureWarning: 'multi_class' was deprecated in version 1.5 and will be removed in 1.8. From then on, it will always use 'multinomial'. Leave it to its default value to avoid this warning.
  warnings.warn(
[I 2026-01-17 15:51:58,208] Trial 22 finished with value: 0.8908045977011494 and parameters: {'C': 0.28270434186057075, 'max_iter': 264, 'solver': 'lbfgs'}. Best is trial 10 with value: 0.923132183908046.
/home/sjoon/projects/brain_connectivity_classifier/masterthesis_venv2/lib/python3.11/site-packages/sklearn/linear_model/_logistic.py:1272: FutureWarning: 'multi_class' was deprecated in version 1.5 and will be removed in 1.8. From then on, it will always use 'multinomial'. Leave it to its default value to avoid this warning.
  warnings.warn(
[I 2026-01-17 15:52:08,088] Trial 23 finished with value: 0.8939176245210728 and parameters: {'C': 1.476386242211943, 'max_iter': 327, 'solver': 'lbfgs'}. Best is trial 10 with value: 0.923132183908046.
/home/sjoon/projects/brain_connectivity_classifier/masterthesis_venv2/lib/python3.11/site-packages/sklearn/linear_model/_logistic.py:1272: FutureWarning: 'multi_class' was deprecated in version 1.5 and will be removed in 1.8. From then on, it will always use 'multinomial'. Leave it to its default value to avoid this warning.
  warnings.warn(
[I 2026-01-17 15:52:17,632] Trial 24 finished with value: 0.9085249042145593 and parameters: {'C': 0.11938487957627711, 'max_iter': 314, 'solver': 'lbfgs'}. Best is trial 10 with value: 0.923132183908046.
/home/sjoon/projects/brain_connectivity_classifier/masterthesis_venv2/lib/python3.11/site-packages/sklearn/linear_model/_logistic.py:1272: FutureWarning: 'multi_class' was deprecated in version 1.5 and will be removed in 1.8. From then on, it will always use 'multinomial'. Leave it to its default value to avoid this warning.
  warnings.warn(
[I 2026-01-17 15:52:26,520] Trial 25 finished with value: 0.9034961685823755 and parameters: {'C': 0.7084847402069414, 'max_iter': 406, 'solver': 'lbfgs'}. Best is trial 10 with value: 0.923132183908046.
/home/sjoon/projects/brain_connectivity_classifier/masterthesis_venv2/lib/python3.11/site-packages/sklearn/linear_model/_logistic.py:1272: FutureWarning: 'multi_class' was deprecated in version 1.5 and will be removed in 1.8. From then on, it will always use 'multinomial'. Leave it to its default value to avoid this warning.
  warnings.warn(
[I 2026-01-17 15:52:35,320] Trial 26 finished with value: 0.8920019157088123 and parameters: {'C': 8.648561351396395, 'max_iter': 209, 'solver': 'lbfgs'}. Best is trial 10 with value: 0.923132183908046.
/home/sjoon/projects/brain_connectivity_classifier/masterthesis_venv2/lib/python3.11/site-packages/sklearn/linear_model/_logistic.py:1272: FutureWarning: 'multi_class' was deprecated in version 1.5 and will be removed in 1.8. From then on, it will always use 'multinomial'. Leave it to its default value to avoid this warning.
  warnings.warn(
[I 2026-01-17 15:52:44,356] Trial 27 finished with value: 0.9204980842911877 and parameters: {'C': 0.5412393673670333, 'max_iter': 342, 'solver': 'lbfgs'}. Best is trial 10 with value: 0.923132183908046.
/home/sjoon/projects/brain_connectivity_classifier/masterthesis_venv2/lib/python3.11/site-packages/sklearn/linear_model/_logistic.py:1272: FutureWarning: 'multi_class' was deprecated in version 1.5 and will be removed in 1.8. From then on, it will always use 'multinomial'. Leave it to its default value to avoid this warning.
  warnings.warn(
[I 2026-01-17 15:52:53,256] Trial 28 finished with value: 0.8936781609195402 and parameters: {'C': 0.6128543267001819, 'max_iter': 359, 'solver': 'lbfgs'}. Best is trial 10 with value: 0.923132183908046.
/home/sjoon/projects/brain_connectivity_classifier/masterthesis_venv2/lib/python3.11/site-packages/sklearn/linear_model/_logistic.py:1272: FutureWarning: 'multi_class' was deprecated in version 1.5 and will be removed in 1.8. From then on, it will always use 'multinomial'. Leave it to its default value to avoid this warning.
  warnings.warn(
[I 2026-01-17 15:53:05,040] Trial 29 finished with value: 0.9030172413793104 and parameters: {'C': 1.7986179054810467, 'max_iter': 265, 'solver': 'lbfgs'}. Best is trial 10 with value: 0.923132183908046.
/home/sjoon/projects/brain_connectivity_classifier/masterthesis_venv2/lib/python3.11/site-packages/sklearn/linear_model/_logistic.py:1272: FutureWarning: 'multi_class' was deprecated in version 1.5 and will be removed in 1.8. From then on, it will always use 'multinomial'. Leave it to its default value to avoid this warning.
  warnings.warn(
[I 2026-01-17 15:53:15,104] Trial 30 finished with value: 0.9090038314176245 and parameters: {'C': 0.0755740181877534, 'max_iter': 430, 'solver': 'lbfgs'}. Best is trial 10 with value: 0.923132183908046.
/home/sjoon/projects/brain_connectivity_classifier/masterthesis_venv2/lib/python3.11/site-packages/sklearn/linear_model/_logistic.py:1272: FutureWarning: 'multi_class' was deprecated in version 1.5 and will be removed in 1.8. From then on, it will always use 'multinomial'. Leave it to its default value to avoid this warning.
  warnings.warn(
[I 2026-01-17 15:53:22,948] Trial 31 finished with value: 0.9161877394636015 and parameters: {'C': 0.22034164474946935, 'max_iter': 300, 'solver': 'lbfgs'}. Best is trial 10 with value: 0.923132183908046.
/home/sjoon/projects/brain_connectivity_classifier/masterthesis_venv2/lib/python3.11/site-packages/sklearn/linear_model/_logistic.py:1272: FutureWarning: 'multi_class' was deprecated in version 1.5 and will be removed in 1.8. From then on, it will always use 'multinomial'. Leave it to its default value to avoid this warning.
  warnings.warn(
[I 2026-01-17 15:53:32,732] Trial 32 finished with value: 0.9003831417624522 and parameters: {'C': 0.2115281840532208, 'max_iter': 283, 'solver': 'lbfgs'}. Best is trial 10 with value: 0.923132183908046.
/home/sjoon/projects/brain_connectivity_classifier/masterthesis_venv2/lib/python3.11/site-packages/sklearn/linear_model/_logistic.py:1272: FutureWarning: 'multi_class' was deprecated in version 1.5 and will be removed in 1.8. From then on, it will always use 'multinomial'. Leave it to its default value to avoid this warning.
  warnings.warn(
[I 2026-01-17 15:53:41,228] Trial 33 finished with value: 0.9030172413793104 and parameters: {'C': 0.6649428131703911, 'max_iter': 357, 'solver': 'lbfgs'}. Best is trial 10 with value: 0.923132183908046.
/home/sjoon/projects/brain_connectivity_classifier/masterthesis_venv2/lib/python3.11/site-packages/sklearn/linear_model/_logistic.py:1272: FutureWarning: 'multi_class' was deprecated in version 1.5 and will be removed in 1.8. From then on, it will always use 'multinomial'. Leave it to its default value to avoid this warning.
  warnings.warn(
[I 2026-01-17 15:53:52,492] Trial 34 finished with value: 0.8994252873563219 and parameters: {'C': 0.031208654705031105, 'max_iter': 244, 'solver': 'lbfgs'}. Best is trial 10 with value: 0.923132183908046.
/home/sjoon/projects/brain_connectivity_classifier/masterthesis_venv2/lib/python3.11/site-packages/sklearn/linear_model/_logistic.py:1272: FutureWarning: 'multi_class' was deprecated in version 1.5 and will be removed in 1.8. From then on, it will always use 'multinomial'. Leave it to its default value to avoid this warning.
  warnings.warn(
[I 2026-01-17 15:53:54,025] Trial 35 finished with value: 0.896551724137931 and parameters: {'C': 2.2724282410431536, 'max_iter': 328, 'solver': 'newton-cg'}. Best is trial 10 with value: 0.923132183908046.
/home/sjoon/projects/brain_connectivity_classifier/masterthesis_venv2/lib/python3.11/site-packages/sklearn/linear_model/_logistic.py:1272: FutureWarning: 'multi_class' was deprecated in version 1.5 and will be removed in 1.8. From then on, it will always use 'multinomial'. Leave it to its default value to avoid this warning.
  warnings.warn(
[I 2026-01-17 15:54:02,532] Trial 36 finished with value: 0.89272030651341 and parameters: {'C': 0.3970135718575797, 'max_iter': 284, 'solver': 'lbfgs'}. Best is trial 10 with value: 0.923132183908046.
/home/sjoon/projects/brain_connectivity_classifier/masterthesis_venv2/lib/python3.11/site-packages/sklearn/linear_model/_logistic.py:1272: FutureWarning: 'multi_class' was deprecated in version 1.5 and will be removed in 1.8. From then on, it will always use 'multinomial'. Leave it to its default value to avoid this warning.
  warnings.warn(
[I 2026-01-17 15:54:11,952] Trial 37 finished with value: 0.9073275862068966 and parameters: {'C': 0.08705390106110225, 'max_iter': 342, 'solver': 'lbfgs'}. Best is trial 10 with value: 0.923132183908046.
/home/sjoon/projects/brain_connectivity_classifier/masterthesis_venv2/lib/python3.11/site-packages/sklearn/linear_model/_logistic.py:1272: FutureWarning: 'multi_class' was deprecated in version 1.5 and will be removed in 1.8. From then on, it will always use 'multinomial'. Leave it to its default value to avoid this warning.
  warnings.warn(
[I 2026-01-17 15:54:13,848] Trial 38 finished with value: 0.8994252873563219 and parameters: {'C': 0.20567419090711633, 'max_iter': 425, 'solver': 'newton-cg'}. Best is trial 10 with value: 0.923132183908046.
/home/sjoon/projects/brain_connectivity_classifier/masterthesis_venv2/lib/python3.11/site-packages/sklearn/linear_model/_logistic.py:1272: FutureWarning: 'multi_class' was deprecated in version 1.5 and will be removed in 1.8. From then on, it will always use 'multinomial'. Leave it to its default value to avoid this warning.
  warnings.warn(
[I 2026-01-17 15:54:23,124] Trial 39 finished with value: 0.8955938697318008 and parameters: {'C': 0.9875290253125694, 'max_iter': 255, 'solver': 'lbfgs'}. Best is trial 10 with value: 0.923132183908046.
/home/sjoon/projects/brain_connectivity_classifier/masterthesis_venv2/lib/python3.11/site-packages/sklearn/linear_model/_logistic.py:1272: FutureWarning: 'multi_class' was deprecated in version 1.5 and will be removed in 1.8. From then on, it will always use 'multinomial'. Leave it to its default value to avoid this warning.
  warnings.warn(
[I 2026-01-17 15:54:24,705] Trial 40 finished with value: 0.8908045977011494 and parameters: {'C': 2.5990504088399664, 'max_iter': 225, 'solver': 'newton-cg'}. Best is trial 10 with value: 0.923132183908046.
/home/sjoon/projects/brain_connectivity_classifier/masterthesis_venv2/lib/python3.11/site-packages/sklearn/linear_model/_logistic.py:1272: FutureWarning: 'multi_class' was deprecated in version 1.5 and will be removed in 1.8. From then on, it will always use 'multinomial'. Leave it to its default value to avoid this warning.
  warnings.warn(
[I 2026-01-17 15:54:33,988] Trial 41 finished with value: 0.9118773946360154 and parameters: {'C': 0.20208741825524573, 'max_iter': 297, 'solver': 'lbfgs'}. Best is trial 10 with value: 0.923132183908046.
/home/sjoon/projects/brain_connectivity_classifier/masterthesis_venv2/lib/python3.11/site-packages/sklearn/linear_model/_logistic.py:1272: FutureWarning: 'multi_class' was deprecated in version 1.5 and will be removed in 1.8. From then on, it will always use 'multinomial'. Leave it to its default value to avoid this warning.
  warnings.warn(
[I 2026-01-17 15:54:43,128] Trial 42 finished with value: 0.9104406130268199 and parameters: {'C': 0.46002146350405987, 'max_iter': 301, 'solver': 'lbfgs'}. Best is trial 10 with value: 0.923132183908046.
/home/sjoon/projects/brain_connectivity_classifier/masterthesis_venv2/lib/python3.11/site-packages/sklearn/linear_model/_logistic.py:1272: FutureWarning: 'multi_class' was deprecated in version 1.5 and will be removed in 1.8. From then on, it will always use 'multinomial'. Leave it to its default value to avoid this warning.
  warnings.warn(
[I 2026-01-17 15:54:53,036] Trial 43 finished with value: 0.9094827586206896 and parameters: {'C': 0.17423908179824796, 'max_iter': 364, 'solver': 'lbfgs'}. Best is trial 10 with value: 0.923132183908046.
/home/sjoon/projects/brain_connectivity_classifier/masterthesis_venv2/lib/python3.11/site-packages/sklearn/linear_model/_logistic.py:1272: FutureWarning: 'multi_class' was deprecated in version 1.5 and will be removed in 1.8. From then on, it will always use 'multinomial'. Leave it to its default value to avoid this warning.
  warnings.warn(
[I 2026-01-17 15:55:04,008] Trial 44 finished with value: 0.9082854406130269 and parameters: {'C': 0.079917380953816, 'max_iter': 277, 'solver': 'lbfgs'}. Best is trial 10 with value: 0.923132183908046.
/home/sjoon/projects/brain_connectivity_classifier/masterthesis_venv2/lib/python3.11/site-packages/sklearn/linear_model/_logistic.py:1272: FutureWarning: 'multi_class' was deprecated in version 1.5 and will be removed in 1.8. From then on, it will always use 'multinomial'. Leave it to its default value to avoid this warning.
  warnings.warn(
[I 2026-01-17 15:55:15,688] Trial 45 finished with value: 0.9085249042145593 and parameters: {'C': 0.04649664469758206, 'max_iter': 204, 'solver': 'lbfgs'}. Best is trial 10 with value: 0.923132183908046.
/home/sjoon/projects/brain_connectivity_classifier/masterthesis_venv2/lib/python3.11/site-packages/sklearn/linear_model/_logistic.py:1272: FutureWarning: 'multi_class' was deprecated in version 1.5 and will be removed in 1.8. From then on, it will always use 'multinomial'. Leave it to its default value to avoid this warning.
  warnings.warn(
