[I 2026-01-17 15:04:15,471] Trial 16 finished with value: 0.9022988505747126 and parameters: {'C': 1.4565037605783118, 'max_iter': 392, 'solver': 'newton-cg'}. Best is trial 15 with value: 0.9233716475095786.
/home/sjoon/projects/brain_connectivity_classifier/masterthesis_venv2/lib/python3.11/site-packages/sklearn/linear_model/_logistic.py:1272: FutureWarning: 'multi_class' was deprecated in version 1.5 and will be removed in 1.8. From then on, it will always use 'multinomial'. Leave it to its default value to avoid this warning.
  warnings.warn(
[I 2026-01-17 15:04:16,749] Trial 17 finished with value: 0.9161877394636015 and parameters: {'C': 0.1958989679004589, 'max_iter': 374, 'solver': 'newton-cg'}. Best is trial 15 with value: 0.9233716475095786.
/home/sjoon/projects/brain_connectivity_classifier/masterthesis_venv2/lib/python3.11/site-packages/sklearn/linear_model/_logistic.py:1272: FutureWarning: 'multi_class' was deprecated in version 1.5 and will be removed in 1.8. From then on, it will always use 'multinomial'. Leave it to its default value to avoid this warning.
  warnings.warn(
[I 2026-01-17 15:04:18,100] Trial 18 finished with value: 0.7636494252873564 and parameters: {'C': 0.0011948558803742528, 'max_iter': 353, 'solver': 'newton-cg'}. Best is trial 15 with value: 0.9233716475095786.
/home/sjoon/projects/brain_connectivity_classifier/masterthesis_venv2/lib/python3.11/site-packages/sklearn/linear_model/_logistic.py:1272: FutureWarning: 'multi_class' was deprecated in version 1.5 and will be removed in 1.8. From then on, it will always use 'multinomial'. Leave it to its default value to avoid this warning.
  warnings.warn(
[I 2026-01-17 15:04:19,560] Trial 19 finished with value: 0.9006226053639846 and parameters: {'C': 2.021839023505998, 'max_iter': 484, 'solver': 'newton-cg'}. Best is trial 15 with value: 0.9233716475095786.
/home/sjoon/projects/brain_connectivity_classifier/masterthesis_venv2/lib/python3.11/site-packages/sklearn/linear_model/_logistic.py:1272: FutureWarning: 'multi_class' was deprecated in version 1.5 and will be removed in 1.8. From then on, it will always use 'multinomial'. Leave it to its default value to avoid this warning.
  warnings.warn(
[I 2026-01-17 15:04:21,108] Trial 20 finished with value: 0.9212164750957854 and parameters: {'C': 0.34966592588041956, 'max_iter': 342, 'solver': 'newton-cg'}. Best is trial 15 with value: 0.9233716475095786.
/home/sjoon/projects/brain_connectivity_classifier/masterthesis_venv2/lib/python3.11/site-packages/sklearn/linear_model/_logistic.py:1272: FutureWarning: 'multi_class' was deprecated in version 1.5 and will be removed in 1.8. From then on, it will always use 'multinomial'. Leave it to its default value to avoid this warning.
  warnings.warn(
[I 2026-01-17 15:04:22,390] Trial 21 finished with value: 0.8912835249042146 and parameters: {'C': 0.34526825886390927, 'max_iter': 322, 'solver': 'newton-cg'}. Best is trial 15 with value: 0.9233716475095786.
/home/sjoon/projects/brain_connectivity_classifier/masterthesis_venv2/lib/python3.11/site-packages/sklearn/linear_model/_logistic.py:1272: FutureWarning: 'multi_class' was deprecated in version 1.5 and will be removed in 1.8. From then on, it will always use 'multinomial'. Leave it to its default value to avoid this warning.
  warnings.warn(
[I 2026-01-17 15:04:23,671] Trial 22 finished with value: 0.9133141762452107 and parameters: {'C': 0.13010014221914654, 'max_iter': 421, 'solver': 'newton-cg'}. Best is trial 15 with value: 0.9233716475095786.
/home/sjoon/projects/brain_connectivity_classifier/masterthesis_venv2/lib/python3.11/site-packages/sklearn/linear_model/_logistic.py:1272: FutureWarning: 'multi_class' was deprecated in version 1.5 and will be removed in 1.8. From then on, it will always use 'multinomial'. Leave it to its default value to avoid this warning.
  warnings.warn(
[I 2026-01-17 15:04:24,847] Trial 23 finished with value: 0.9147509578544061 and parameters: {'C': 0.43227285108372276, 'max_iter': 327, 'solver': 'newton-cg'}. Best is trial 15 with value: 0.9233716475095786.
/home/sjoon/projects/brain_connectivity_classifier/masterthesis_venv2/lib/python3.11/site-packages/sklearn/linear_model/_logistic.py:1272: FutureWarning: 'multi_class' was deprecated in version 1.5 and will be removed in 1.8. From then on, it will always use 'multinomial'. Leave it to its default value to avoid this warning.
  warnings.warn(
[I 2026-01-17 15:04:26,075] Trial 24 finished with value: 0.9104406130268199 and parameters: {'C': 0.027453349185519966, 'max_iter': 420, 'solver': 'newton-cg'}. Best is trial 15 with value: 0.9233716475095786.
/home/sjoon/projects/brain_connectivity_classifier/masterthesis_venv2/lib/python3.11/site-packages/sklearn/linear_model/_logistic.py:1272: FutureWarning: 'multi_class' was deprecated in version 1.5 and will be removed in 1.8. From then on, it will always use 'multinomial'. Leave it to its default value to avoid this warning.
  warnings.warn(
[I 2026-01-17 15:04:27,456] Trial 25 finished with value: 0.8984674329501916 and parameters: {'C': 1.1387140770878788, 'max_iter': 282, 'solver': 'newton-cg'}. Best is trial 15 with value: 0.9233716475095786.
/home/sjoon/projects/brain_connectivity_classifier/masterthesis_venv2/lib/python3.11/site-packages/sklearn/linear_model/_logistic.py:1272: FutureWarning: 'multi_class' was deprecated in version 1.5 and will be removed in 1.8. From then on, it will always use 'multinomial'. Leave it to its default value to avoid this warning.
  warnings.warn(
[I 2026-01-17 15:04:28,765] Trial 26 finished with value: 0.9243295019157088 and parameters: {'C': 0.223883835249996, 'max_iter': 436, 'solver': 'newton-cg'}. Best is trial 26 with value: 0.9243295019157088.
/home/sjoon/projects/brain_connectivity_classifier/masterthesis_venv2/lib/python3.11/site-packages/sklearn/linear_model/_logistic.py:1272: FutureWarning: 'multi_class' was deprecated in version 1.5 and will be removed in 1.8. From then on, it will always use 'multinomial'. Leave it to its default value to avoid this warning.
  warnings.warn(
[I 2026-01-17 15:04:30,085] Trial 27 finished with value: 0.9006226053639846 and parameters: {'C': 2.981611596729892, 'max_iter': 426, 'solver': 'newton-cg'}. Best is trial 26 with value: 0.9243295019157088.
/home/sjoon/projects/brain_connectivity_classifier/masterthesis_venv2/lib/python3.11/site-packages/sklearn/linear_model/_logistic.py:1272: FutureWarning: 'multi_class' was deprecated in version 1.5 and will be removed in 1.8. From then on, it will always use 'multinomial'. Leave it to its default value to avoid this warning.
  warnings.warn(
[I 2026-01-17 15:04:31,369] Trial 28 finished with value: 0.9037356321839081 and parameters: {'C': 0.7055151001224114, 'max_iter': 450, 'solver': 'newton-cg'}. Best is trial 26 with value: 0.9243295019157088.
/home/sjoon/projects/brain_connectivity_classifier/masterthesis_venv2/lib/python3.11/site-packages/sklearn/linear_model/_logistic.py:1272: FutureWarning: 'multi_class' was deprecated in version 1.5 and will be removed in 1.8. From then on, it will always use 'multinomial'. Leave it to its default value to avoid this warning.
  warnings.warn(
[I 2026-01-17 15:04:32,782] Trial 29 finished with value: 0.9123563218390804 and parameters: {'C': 0.07444535366869212, 'max_iter': 257, 'solver': 'newton-cg'}. Best is trial 26 with value: 0.9243295019157088.
/home/sjoon/projects/brain_connectivity_classifier/masterthesis_venv2/lib/python3.11/site-packages/sklearn/linear_model/_logistic.py:1272: FutureWarning: 'multi_class' was deprecated in version 1.5 and will be removed in 1.8. From then on, it will always use 'multinomial'. Leave it to its default value to avoid this warning.
  warnings.warn(
[I 2026-01-17 15:04:34,066] Trial 30 finished with value: 0.9140325670498084 and parameters: {'C': 0.26973894998758846, 'max_iter': 302, 'solver': 'newton-cg'}. Best is trial 26 with value: 0.9243295019157088.
/home/sjoon/projects/brain_connectivity_classifier/masterthesis_venv2/lib/python3.11/site-packages/sklearn/linear_model/_logistic.py:1272: FutureWarning: 'multi_class' was deprecated in version 1.5 and will be removed in 1.8. From then on, it will always use 'multinomial'. Leave it to its default value to avoid this warning.
  warnings.warn(
[I 2026-01-17 15:04:35,340] Trial 31 finished with value: 0.9113984674329502 and parameters: {'C': 0.16466895098187992, 'max_iter': 356, 'solver': 'newton-cg'}. Best is trial 26 with value: 0.9243295019157088.
/home/sjoon/projects/brain_connectivity_classifier/masterthesis_venv2/lib/python3.11/site-packages/sklearn/linear_model/_logistic.py:1272: FutureWarning: 'multi_class' was deprecated in version 1.5 and will be removed in 1.8. From then on, it will always use 'multinomial'. Leave it to its default value to avoid this warning.
  warnings.warn(
[I 2026-01-17 15:04:37,058] Trial 32 finished with value: 0.899904214559387 and parameters: {'C': 0.04813228664439681, 'max_iter': 337, 'solver': 'newton-cg'}. Best is trial 26 with value: 0.9243295019157088.
/home/sjoon/projects/brain_connectivity_classifier/masterthesis_venv2/lib/python3.11/site-packages/sklearn/linear_model/_logistic.py:1272: FutureWarning: 'multi_class' was deprecated in version 1.5 and will be removed in 1.8. From then on, it will always use 'multinomial'. Leave it to its default value to avoid this warning.
  warnings.warn(
[I 2026-01-17 15:04:38,336] Trial 33 finished with value: 0.9130747126436781 and parameters: {'C': 0.39848383989051256, 'max_iter': 391, 'solver': 'newton-cg'}. Best is trial 26 with value: 0.9243295019157088.
/home/sjoon/projects/brain_connectivity_classifier/masterthesis_venv2/lib/python3.11/site-packages/sklearn/linear_model/_logistic.py:1272: FutureWarning: 'multi_class' was deprecated in version 1.5 and will be removed in 1.8. From then on, it will always use 'multinomial'. Leave it to its default value to avoid this warning.
  warnings.warn(
[I 2026-01-17 15:04:39,676] Trial 34 finished with value: 0.921455938697318 and parameters: {'C': 0.11163991717231128, 'max_iter': 225, 'solver': 'newton-cg'}. Best is trial 26 with value: 0.9243295019157088.
/home/sjoon/projects/brain_connectivity_classifier/masterthesis_venv2/lib/python3.11/site-packages/sklearn/linear_model/_logistic.py:1272: FutureWarning: 'multi_class' was deprecated in version 1.5 and will be removed in 1.8. From then on, it will always use 'multinomial'. Leave it to its default value to avoid this warning.
  warnings.warn(
[I 2026-01-17 15:04:41,157] Trial 35 finished with value: 0.9006226053639846 and parameters: {'C': 0.017399405972357125, 'max_iter': 215, 'solver': 'newton-cg'}. Best is trial 26 with value: 0.9243295019157088.
/home/sjoon/projects/brain_connectivity_classifier/masterthesis_venv2/lib/python3.11/site-packages/sklearn/linear_model/_logistic.py:1272: FutureWarning: 'multi_class' was deprecated in version 1.5 and will be removed in 1.8. From then on, it will always use 'multinomial'. Leave it to its default value to avoid this warning.
  warnings.warn(
[I 2026-01-17 15:04:42,524] Trial 36 finished with value: 0.9221743295019157 and parameters: {'C': 0.09840073436093494, 'max_iter': 158, 'solver': 'newton-cg'}. Best is trial 26 with value: 0.9243295019157088.
/home/sjoon/projects/brain_connectivity_classifier/masterthesis_venv2/lib/python3.11/site-packages/sklearn/linear_model/_logistic.py:1272: FutureWarning: 'multi_class' was deprecated in version 1.5 and will be removed in 1.8. From then on, it will always use 'multinomial'. Leave it to its default value to avoid this warning.
  warnings.warn(
[I 2026-01-17 15:04:57,440] Trial 37 finished with value: 0.8884099616858238 and parameters: {'C': 0.006497652673061155, 'max_iter': 163, 'solver': 'lbfgs'}. Best is trial 26 with value: 0.9243295019157088.
/home/sjoon/projects/brain_connectivity_classifier/masterthesis_venv2/lib/python3.11/site-packages/sklearn/linear_model/_logistic.py:1272: FutureWarning: 'multi_class' was deprecated in version 1.5 and will be removed in 1.8. From then on, it will always use 'multinomial'. Leave it to its default value to avoid this warning.
  warnings.warn(
[I 2026-01-17 15:05:00,204] Trial 38 finished with value: 0.9102011494252874 and parameters: {'C': 0.10012363699919914, 'max_iter': 170, 'solver': 'newton-cg'}. Best is trial 26 with value: 0.9243295019157088.
/home/sjoon/projects/brain_connectivity_classifier/masterthesis_venv2/lib/python3.11/site-packages/sklearn/linear_model/_logistic.py:1272: FutureWarning: 'multi_class' was deprecated in version 1.5 and will be removed in 1.8. From then on, it will always use 'multinomial'. Leave it to its default value to avoid this warning.
  warnings.warn(
[I 2026-01-17 15:05:11,940] Trial 39 finished with value: 0.9113984674329502 and parameters: {'C': 0.0847862519602352, 'max_iter': 134, 'solver': 'lbfgs'}. Best is trial 26 with value: 0.9243295019157088.
/home/sjoon/projects/brain_connectivity_classifier/masterthesis_venv2/lib/python3.11/site-packages/sklearn/linear_model/_logistic.py:1272: FutureWarning: 'multi_class' was deprecated in version 1.5 and will be removed in 1.8. From then on, it will always use 'multinomial'. Leave it to its default value to avoid this warning.
  warnings.warn(
[I 2026-01-17 15:05:13,665] Trial 40 finished with value: 0.9044540229885057 and parameters: {'C': 0.04512391461530232, 'max_iter': 160, 'solver': 'newton-cg'}. Best is trial 26 with value: 0.9243295019157088.
/home/sjoon/projects/brain_connectivity_classifier/masterthesis_venv2/lib/python3.11/site-packages/sklearn/linear_model/_logistic.py:1272: FutureWarning: 'multi_class' was deprecated in version 1.5 and will be removed in 1.8. From then on, it will always use 'multinomial'. Leave it to its default value to avoid this warning.
  warnings.warn(
[I 2026-01-17 15:05:14,921] Trial 41 finished with value: 0.9106800766283525 and parameters: {'C': 0.2491506390467782, 'max_iter': 223, 'solver': 'newton-cg'}. Best is trial 26 with value: 0.9243295019157088.
/home/sjoon/projects/brain_connectivity_classifier/masterthesis_venv2/lib/python3.11/site-packages/sklearn/linear_model/_logistic.py:1272: FutureWarning: 'multi_class' was deprecated in version 1.5 and will be removed in 1.8. From then on, it will always use 'multinomial'. Leave it to its default value to avoid this warning.
  warnings.warn(
[I 2026-01-17 15:05:16,305] Trial 42 finished with value: 0.907088122605364 and parameters: {'C': 0.1194020072757915, 'max_iter': 193, 'solver': 'newton-cg'}. Best is trial 26 with value: 0.9243295019157088.
/home/sjoon/projects/brain_connectivity_classifier/masterthesis_venv2/lib/python3.11/site-packages/sklearn/linear_model/_logistic.py:1272: FutureWarning: 'multi_class' was deprecated in version 1.5 and will be removed in 1.8. From then on, it will always use 'multinomial'. Leave it to its default value to avoid this warning.
  warnings.warn(
[I 2026-01-17 15:05:17,841] Trial 43 finished with value: 0.9166666666666666 and parameters: {'C': 0.5199230516957407, 'max_iter': 250, 'solver': 'newton-cg'}. Best is trial 26 with value: 0.9243295019157088.
/home/sjoon/projects/brain_connectivity_classifier/masterthesis_venv2/lib/python3.11/site-packages/sklearn/linear_model/_logistic.py:1272: FutureWarning: 'multi_class' was deprecated in version 1.5 and will be removed in 1.8. From then on, it will always use 'multinomial'. Leave it to its default value to avoid this warning.
  warnings.warn(
[I 2026-01-17 15:05:34,744] Trial 44 finished with value: 0.9015804597701149 and parameters: {'C': 0.027249535708040465, 'max_iter': 306, 'solver': 'lbfgs'}. Best is trial 26 with value: 0.9243295019157088.
/home/sjoon/projects/brain_connectivity_classifier/masterthesis_venv2/lib/python3.11/site-packages/sklearn/linear_model/_logistic.py:1272: FutureWarning: 'multi_class' was deprecated in version 1.5 and will be removed in 1.8. From then on, it will always use 'multinomial'. Leave it to its default value to avoid this warning.
  warnings.warn(
[I 2026-01-17 15:05:37,834] Trial 45 finished with value: 0.9085249042145593 and parameters: {'C': 0.9103685407947956, 'max_iter': 125, 'solver': 'newton-cg'}. Best is trial 26 with value: 0.9243295019157088.
/home/sjoon/projects/brain_connectivity_classifier/masterthesis_venv2/lib/python3.11/site-packages/sklearn/linear_model/_logistic.py:1272: FutureWarning: 'multi_class' was deprecated in version 1.5 and will be removed in 1.8. From then on, it will always use 'multinomial'. Leave it to its default value to avoid this warning.
  warnings.warn(
[I 2026-01-17 15:05:39,043] Trial 46 finished with value: 0.9049329501915708 and parameters: {'C': 0.291855488895124, 'max_iter': 270, 'solver': 'newton-cg'}. Best is trial 26 with value: 0.9243295019157088.
/home/sjoon/projects/brain_connectivity_classifier/masterthesis_venv2/lib/python3.11/site-packages/sklearn/linear_model/_logistic.py:1272: FutureWarning: 'multi_class' was deprecated in version 1.5 and will be removed in 1.8. From then on, it will always use 'multinomial'. Leave it to its default value to avoid this warning.
  warnings.warn(
[I 2026-01-17 15:05:40,404] Trial 47 finished with value: 0.9090038314176245 and parameters: {'C': 0.0624051418619071, 'max_iter': 454, 'solver': 'newton-cg'}. Best is trial 26 with value: 0.9243295019157088.
/home/sjoon/projects/brain_connectivity_classifier/masterthesis_venv2/lib/python3.11/site-packages/sklearn/linear_model/_logistic.py:1272: FutureWarning: 'multi_class' was deprecated in version 1.5 and will be removed in 1.8. From then on, it will always use 'multinomial'. Leave it to its default value to avoid this warning.
  warnings.warn(
[I 2026-01-17 15:05:50,792] Trial 48 finished with value: 0.8975095785440613 and parameters: {'C': 0.1665181063793765, 'max_iter': 235, 'solver': 'lbfgs'}. Best is trial 26 with value: 0.9243295019157088.
/home/sjoon/projects/brain_connectivity_classifier/masterthesis_venv2/lib/python3.11/site-packages/sklearn/linear_model/_logistic.py:1272: FutureWarning: 'multi_class' was deprecated in version 1.5 and will be removed in 1.8. From then on, it will always use 'multinomial'. Leave it to its default value to avoid this warning.
  warnings.warn(
[I 2026-01-17 15:05:52,532] Trial 49 finished with value: 0.9003831417624522 and parameters: {'C': 0.1087388612992392, 'max_iter': 201, 'solver': 'newton-cg'}. Best is trial 26 with value: 0.9243295019157088.
/home/sjoon/projects/brain_connectivity_classifier/masterthesis_venv2/lib/python3.11/site-packages/sklearn/linear_model/_logistic.py:1272: FutureWarning: 'multi_class' was deprecated in version 1.5 and will be removed in 1.8. From then on, it will always use 'multinomial'. Leave it to its default value to avoid this warning.
  warnings.warn(
[Parallel(n_jobs=-1)]: Using backend LokyBackend with 16 concurrent workers.
[I 2026-01-17 15:05:55,756] A new study created in memory with name: no-name-ea1a8955-feae-40fa-9751-082d08964016
/home/sjoon/projects/brain_connectivity_classifier/masterthesis_venv2/lib/python3.11/site-packages/sklearn/linear_model/_logistic.py:1272: FutureWarning: 'multi_class' was deprecated in version 1.5 and will be removed in 1.8. From then on, it will always use 'multinomial'. Leave it to its default value to avoid this warning.
  warnings.warn(
[I 2026-01-17 15:05:57,085] Trial 0 finished with value: 0.889367816091954 and parameters: {'C': 1.3656185367897316, 'max_iter': 277, 'solver': 'newton-cg'}. Best is trial 0 with value: 0.889367816091954.
/home/sjoon/projects/brain_connectivity_classifier/masterthesis_venv2/lib/python3.11/site-packages/sklearn/linear_model/_logistic.py:1272: FutureWarning: 'multi_class' was deprecated in version 1.5 and will be removed in 1.8. From then on, it will always use 'multinomial'. Leave it to its default value to avoid this warning.
  warnings.warn(
[I 2026-01-17 15:05:58,513] Trial 1 finished with value: 0.9022988505747126 and parameters: {'C': 0.017877539345607523, 'max_iter': 452, 'solver': 'newton-cg'}. Best is trial 1 with value: 0.9022988505747126.
/home/sjoon/projects/brain_connectivity_classifier/masterthesis_venv2/lib/python3.11/site-packages/sklearn/linear_model/_logistic.py:1272: FutureWarning: 'multi_class' was deprecated in version 1.5 and will be removed in 1.8. From then on, it will always use 'multinomial'. Leave it to its default value to avoid this warning.
  warnings.warn(
[I 2026-01-17 15:06:10,684] Trial 2 finished with value: 0.9034961685823755 and parameters: {'C': 4.47599053757093, 'max_iter': 208, 'solver': 'lbfgs'}. Best is trial 2 with value: 0.9034961685823755.
/home/sjoon/projects/brain_connectivity_classifier/masterthesis_venv2/lib/python3.11/site-packages/sklearn/linear_model/_logistic.py:1272: FutureWarning: 'multi_class' was deprecated in version 1.5 and will be removed in 1.8. From then on, it will always use 'multinomial'. Leave it to its default value to avoid this warning.
  warnings.warn(
[I 2026-01-17 15:06:24,720] Trial 3 finished with value: 0.9056513409961686 and parameters: {'C': 0.05074569025512076, 'max_iter': 332, 'solver': 'lbfgs'}. Best is trial 3 with value: 0.9056513409961686.
/home/sjoon/projects/brain_connectivity_classifier/masterthesis_venv2/lib/python3.11/site-packages/sklearn/linear_model/_logistic.py:1272: FutureWarning: 'multi_class' was deprecated in version 1.5 and will be removed in 1.8. From then on, it will always use 'multinomial'. Leave it to its default value to avoid this warning.
  warnings.warn(
