[I 2026-01-17 15:35:36,429] Trial 40 finished with value: 0.9027777777777778 and parameters: {'C': 0.054050053488233406, 'max_iter': 180, 'solver': 'newton-cg'}. Best is trial 39 with value: 0.9202586206896551.
/home/sjoon/projects/brain_connectivity_classifier/masterthesis_venv2/lib/python3.11/site-packages/sklearn/linear_model/_logistic.py:1272: FutureWarning: 'multi_class' was deprecated in version 1.5 and will be removed in 1.8. From then on, it will always use 'multinomial'. Leave it to its default value to avoid this warning.
  warnings.warn(
[I 2026-01-17 15:35:37,902] Trial 41 finished with value: 0.9133141762452107 and parameters: {'C': 0.16174645017280043, 'max_iter': 143, 'solver': 'newton-cg'}. Best is trial 39 with value: 0.9202586206896551.
/home/sjoon/projects/brain_connectivity_classifier/masterthesis_venv2/lib/python3.11/site-packages/sklearn/linear_model/_logistic.py:1272: FutureWarning: 'multi_class' was deprecated in version 1.5 and will be removed in 1.8. From then on, it will always use 'multinomial'. Leave it to its default value to avoid this warning.
  warnings.warn(
[I 2026-01-17 15:35:39,525] Trial 42 finished with value: 0.8936781609195402 and parameters: {'C': 0.03259448710071616, 'max_iter': 167, 'solver': 'newton-cg'}. Best is trial 39 with value: 0.9202586206896551.
/home/sjoon/projects/brain_connectivity_classifier/masterthesis_venv2/lib/python3.11/site-packages/sklearn/linear_model/_logistic.py:1272: FutureWarning: 'multi_class' was deprecated in version 1.5 and will be removed in 1.8. From then on, it will always use 'multinomial'. Leave it to its default value to avoid this warning.
  warnings.warn(
[I 2026-01-17 15:35:41,069] Trial 43 finished with value: 0.8975095785440613 and parameters: {'C': 0.05322785128172346, 'max_iter': 118, 'solver': 'newton-cg'}. Best is trial 39 with value: 0.9202586206896551.
/home/sjoon/projects/brain_connectivity_classifier/masterthesis_venv2/lib/python3.11/site-packages/sklearn/linear_model/_logistic.py:1272: FutureWarning: 'multi_class' was deprecated in version 1.5 and will be removed in 1.8. From then on, it will always use 'multinomial'. Leave it to its default value to avoid this warning.
  warnings.warn(
[I 2026-01-17 15:35:42,493] Trial 44 finished with value: 0.9030172413793104 and parameters: {'C': 0.10015940523912156, 'max_iter': 282, 'solver': 'newton-cg'}. Best is trial 39 with value: 0.9202586206896551.
/home/sjoon/projects/brain_connectivity_classifier/masterthesis_venv2/lib/python3.11/site-packages/sklearn/linear_model/_logistic.py:1272: FutureWarning: 'multi_class' was deprecated in version 1.5 and will be removed in 1.8. From then on, it will always use 'multinomial'. Leave it to its default value to avoid this warning.
  warnings.warn(
[I 2026-01-17 15:35:43,928] Trial 45 finished with value: 0.9066091954022989 and parameters: {'C': 0.3439988809643366, 'max_iter': 140, 'solver': 'newton-cg'}. Best is trial 39 with value: 0.9202586206896551.
/home/sjoon/projects/brain_connectivity_classifier/masterthesis_venv2/lib/python3.11/site-packages/sklearn/linear_model/_logistic.py:1272: FutureWarning: 'multi_class' was deprecated in version 1.5 and will be removed in 1.8. From then on, it will always use 'multinomial'. Leave it to its default value to avoid this warning.
  warnings.warn(
[I 2026-01-17 15:35:55,896] Trial 46 finished with value: 0.9018199233716475 and parameters: {'C': 0.8876639189908231, 'max_iter': 319, 'solver': 'lbfgs'}. Best is trial 39 with value: 0.9202586206896551.
/home/sjoon/projects/brain_connectivity_classifier/masterthesis_venv2/lib/python3.11/site-packages/sklearn/linear_model/_logistic.py:1272: FutureWarning: 'multi_class' was deprecated in version 1.5 and will be removed in 1.8. From then on, it will always use 'multinomial'. Leave it to its default value to avoid this warning.
  warnings.warn(
[I 2026-01-17 15:36:09,372] Trial 47 finished with value: 0.9209770114942529 and parameters: {'C': 0.16129762314977625, 'max_iter': 225, 'solver': 'lbfgs'}. Best is trial 47 with value: 0.9209770114942529.
/home/sjoon/projects/brain_connectivity_classifier/masterthesis_venv2/lib/python3.11/site-packages/sklearn/linear_model/_logistic.py:1272: FutureWarning: 'multi_class' was deprecated in version 1.5 and will be removed in 1.8. From then on, it will always use 'multinomial'. Leave it to its default value to avoid this warning.
  warnings.warn(
[I 2026-01-17 15:36:11,000] Trial 48 finished with value: 0.9094827586206896 and parameters: {'C': 0.15336365723361628, 'max_iter': 225, 'solver': 'newton-cg'}. Best is trial 47 with value: 0.9209770114942529.
/home/sjoon/projects/brain_connectivity_classifier/masterthesis_venv2/lib/python3.11/site-packages/sklearn/linear_model/_logistic.py:1272: FutureWarning: 'multi_class' was deprecated in version 1.5 and will be removed in 1.8. From then on, it will always use 'multinomial'. Leave it to its default value to avoid this warning.
  warnings.warn(
[I 2026-01-17 15:36:28,528] Trial 49 finished with value: 0.8888888888888888 and parameters: {'C': 0.026642791822218688, 'max_iter': 252, 'solver': 'lbfgs'}. Best is trial 47 with value: 0.9209770114942529.
/home/sjoon/projects/brain_connectivity_classifier/masterthesis_venv2/lib/python3.11/site-packages/sklearn/linear_model/_logistic.py:1272: FutureWarning: 'multi_class' was deprecated in version 1.5 and will be removed in 1.8. From then on, it will always use 'multinomial'. Leave it to its default value to avoid this warning.
  warnings.warn(
[Parallel(n_jobs=-1)]: Using backend LokyBackend with 16 concurrent workers.
[I 2026-01-17 15:36:41,676] A new study created in memory with name: no-name-213ac803-f439-4f06-b5a2-3434219704e6
/home/sjoon/projects/brain_connectivity_classifier/masterthesis_venv2/lib/python3.11/site-packages/sklearn/linear_model/_logistic.py:1272: FutureWarning: 'multi_class' was deprecated in version 1.5 and will be removed in 1.8. From then on, it will always use 'multinomial'. Leave it to its default value to avoid this warning.
  warnings.warn(
[I 2026-01-17 15:36:56,328] Trial 0 finished with value: 0.8941570881226054 and parameters: {'C': 2.1845832259915205, 'max_iter': 118, 'solver': 'lbfgs'}. Best is trial 0 with value: 0.8941570881226054.
/home/sjoon/projects/brain_connectivity_classifier/masterthesis_venv2/lib/python3.11/site-packages/sklearn/linear_model/_logistic.py:1272: FutureWarning: 'multi_class' was deprecated in version 1.5 and will be removed in 1.8. From then on, it will always use 'multinomial'. Leave it to its default value to avoid this warning.
  warnings.warn(
[I 2026-01-17 15:36:58,956] Trial 1 finished with value: 0.9003831417624522 and parameters: {'C': 0.02736801827846297, 'max_iter': 266, 'solver': 'newton-cg'}. Best is trial 1 with value: 0.9003831417624522.
/home/sjoon/projects/brain_connectivity_classifier/masterthesis_venv2/lib/python3.11/site-packages/sklearn/linear_model/_logistic.py:1272: FutureWarning: 'multi_class' was deprecated in version 1.5 and will be removed in 1.8. From then on, it will always use 'multinomial'. Leave it to its default value to avoid this warning.
  warnings.warn(
[I 2026-01-17 15:37:13,424] Trial 2 finished with value: 0.9075670498084292 and parameters: {'C': 0.10954930794959702, 'max_iter': 313, 'solver': 'lbfgs'}. Best is trial 2 with value: 0.9075670498084292.
/home/sjoon/projects/brain_connectivity_classifier/masterthesis_venv2/lib/python3.11/site-packages/sklearn/linear_model/_logistic.py:1272: FutureWarning: 'multi_class' was deprecated in version 1.5 and will be removed in 1.8. From then on, it will always use 'multinomial'. Leave it to its default value to avoid this warning.
  warnings.warn(
[I 2026-01-17 15:37:15,203] Trial 3 finished with value: 0.8975095785440613 and parameters: {'C': 0.05135776127610299, 'max_iter': 120, 'solver': 'newton-cg'}. Best is trial 2 with value: 0.9075670498084292.
/home/sjoon/projects/brain_connectivity_classifier/masterthesis_venv2/lib/python3.11/site-packages/sklearn/linear_model/_logistic.py:1272: FutureWarning: 'multi_class' was deprecated in version 1.5 and will be removed in 1.8. From then on, it will always use 'multinomial'. Leave it to its default value to avoid this warning.
  warnings.warn(
[I 2026-01-17 15:37:27,824] Trial 4 finished with value: 0.8848180076628352 and parameters: {'C': 5.934756183514231, 'max_iter': 414, 'solver': 'lbfgs'}. Best is trial 2 with value: 0.9075670498084292.
/home/sjoon/projects/brain_connectivity_classifier/masterthesis_venv2/lib/python3.11/site-packages/sklearn/linear_model/_logistic.py:1272: FutureWarning: 'multi_class' was deprecated in version 1.5 and will be removed in 1.8. From then on, it will always use 'multinomial'. Leave it to its default value to avoid this warning.
  warnings.warn(
[I 2026-01-17 15:37:29,404] Trial 5 finished with value: 0.9030172413793104 and parameters: {'C': 0.3526371437712786, 'max_iter': 125, 'solver': 'newton-cg'}. Best is trial 2 with value: 0.9075670498084292.
/home/sjoon/projects/brain_connectivity_classifier/masterthesis_venv2/lib/python3.11/site-packages/sklearn/linear_model/_logistic.py:1272: FutureWarning: 'multi_class' was deprecated in version 1.5 and will be removed in 1.8. From then on, it will always use 'multinomial'. Leave it to its default value to avoid this warning.
  warnings.warn(
[I 2026-01-17 15:37:44,664] Trial 6 finished with value: 0.8807471264367817 and parameters: {'C': 0.010809390923666368, 'max_iter': 291, 'solver': 'lbfgs'}. Best is trial 2 with value: 0.9075670498084292.
/home/sjoon/projects/brain_connectivity_classifier/masterthesis_venv2/lib/python3.11/site-packages/sklearn/linear_model/_logistic.py:1272: FutureWarning: 'multi_class' was deprecated in version 1.5 and will be removed in 1.8. From then on, it will always use 'multinomial'. Leave it to its default value to avoid this warning.
  warnings.warn(
[I 2026-01-17 15:37:58,016] Trial 7 finished with value: 0.9188218390804598 and parameters: {'C': 0.17856643681849566, 'max_iter': 129, 'solver': 'lbfgs'}. Best is trial 7 with value: 0.9188218390804598.
/home/sjoon/projects/brain_connectivity_classifier/masterthesis_venv2/lib/python3.11/site-packages/sklearn/linear_model/_logistic.py:1272: FutureWarning: 'multi_class' was deprecated in version 1.5 and will be removed in 1.8. From then on, it will always use 'multinomial'. Leave it to its default value to avoid this warning.
  warnings.warn(
[I 2026-01-17 15:37:59,655] Trial 8 finished with value: 0.8608716475095786 and parameters: {'C': 0.006482617122786845, 'max_iter': 208, 'solver': 'newton-cg'}. Best is trial 7 with value: 0.9188218390804598.
/home/sjoon/projects/brain_connectivity_classifier/masterthesis_venv2/lib/python3.11/site-packages/sklearn/linear_model/_logistic.py:1272: FutureWarning: 'multi_class' was deprecated in version 1.5 and will be removed in 1.8. From then on, it will always use 'multinomial'. Leave it to its default value to avoid this warning.
  warnings.warn(
[I 2026-01-17 15:38:13,364] Trial 9 finished with value: 0.8864942528735632 and parameters: {'C': 1.659849845334228, 'max_iter': 183, 'solver': 'lbfgs'}. Best is trial 7 with value: 0.9188218390804598.
/home/sjoon/projects/brain_connectivity_classifier/masterthesis_venv2/lib/python3.11/site-packages/sklearn/linear_model/_logistic.py:1272: FutureWarning: 'multi_class' was deprecated in version 1.5 and will be removed in 1.8. From then on, it will always use 'multinomial'. Leave it to its default value to avoid this warning.
  warnings.warn(
[I 2026-01-17 15:38:27,524] Trial 10 finished with value: 0.8065134099616859 and parameters: {'C': 0.0017881095717767353, 'max_iter': 161, 'solver': 'lbfgs'}. Best is trial 7 with value: 0.9188218390804598.
/home/sjoon/projects/brain_connectivity_classifier/masterthesis_venv2/lib/python3.11/site-packages/sklearn/linear_model/_logistic.py:1272: FutureWarning: 'multi_class' was deprecated in version 1.5 and will be removed in 1.8. From then on, it will always use 'multinomial'. Leave it to its default value to avoid this warning.
  warnings.warn(
[I 2026-01-17 15:38:40,000] Trial 11 finished with value: 0.8996647509578544 and parameters: {'C': 0.22757039128829426, 'max_iter': 395, 'solver': 'lbfgs'}. Best is trial 7 with value: 0.9188218390804598.
/home/sjoon/projects/brain_connectivity_classifier/masterthesis_venv2/lib/python3.11/site-packages/sklearn/linear_model/_logistic.py:1272: FutureWarning: 'multi_class' was deprecated in version 1.5 and will be removed in 1.8. From then on, it will always use 'multinomial'. Leave it to its default value to avoid this warning.
  warnings.warn(
[I 2026-01-17 15:38:51,668] Trial 12 finished with value: 0.9032567049808429 and parameters: {'C': 0.25185814011528773, 'max_iter': 311, 'solver': 'lbfgs'}. Best is trial 7 with value: 0.9188218390804598.
/home/sjoon/projects/brain_connectivity_classifier/masterthesis_venv2/lib/python3.11/site-packages/sklearn/linear_model/_logistic.py:1272: FutureWarning: 'multi_class' was deprecated in version 1.5 and will be removed in 1.8. From then on, it will always use 'multinomial'. Leave it to its default value to avoid this warning.
  warnings.warn(
[I 2026-01-17 15:39:08,496] Trial 13 finished with value: 0.9051724137931034 and parameters: {'C': 0.10354199614635211, 'max_iter': 246, 'solver': 'lbfgs'}. Best is trial 7 with value: 0.9188218390804598.
/home/sjoon/projects/brain_connectivity_classifier/masterthesis_venv2/lib/python3.11/site-packages/sklearn/linear_model/_logistic.py:1272: FutureWarning: 'multi_class' was deprecated in version 1.5 and will be removed in 1.8. From then on, it will always use 'multinomial'. Leave it to its default value to avoid this warning.
  warnings.warn(
[I 2026-01-17 15:39:21,996] Trial 14 finished with value: 0.9032567049808429 and parameters: {'C': 0.7725892366115901, 'max_iter': 497, 'solver': 'lbfgs'}. Best is trial 7 with value: 0.9188218390804598.
/home/sjoon/projects/brain_connectivity_classifier/masterthesis_venv2/lib/python3.11/site-packages/sklearn/linear_model/_logistic.py:1272: FutureWarning: 'multi_class' was deprecated in version 1.5 and will be removed in 1.8. From then on, it will always use 'multinomial'. Leave it to its default value to avoid this warning.
  warnings.warn(
[I 2026-01-17 15:39:38,148] Trial 15 finished with value: 0.9037356321839081 and parameters: {'C': 0.0475397884522085, 'max_iter': 100, 'solver': 'lbfgs'}. Best is trial 7 with value: 0.9188218390804598.
/home/sjoon/projects/brain_connectivity_classifier/masterthesis_venv2/lib/python3.11/site-packages/sklearn/linear_model/_logistic.py:1272: FutureWarning: 'multi_class' was deprecated in version 1.5 and will be removed in 1.8. From then on, it will always use 'multinomial'. Leave it to its default value to avoid this warning.
  warnings.warn(
[I 2026-01-17 15:39:56,692] Trial 16 finished with value: 0.8840996168582376 and parameters: {'C': 0.018123317246686876, 'max_iter': 151, 'solver': 'lbfgs'}. Best is trial 7 with value: 0.9188218390804598.
/home/sjoon/projects/brain_connectivity_classifier/masterthesis_venv2/lib/python3.11/site-packages/sklearn/linear_model/_logistic.py:1272: FutureWarning: 'multi_class' was deprecated in version 1.5 and will be removed in 1.8. From then on, it will always use 'multinomial'. Leave it to its default value to avoid this warning.
  warnings.warn(
[I 2026-01-17 15:40:09,508] Trial 17 finished with value: 0.9135536398467433 and parameters: {'C': 0.1082532705193917, 'max_iter': 357, 'solver': 'lbfgs'}. Best is trial 7 with value: 0.9188218390804598.
/home/sjoon/projects/brain_connectivity_classifier/masterthesis_venv2/lib/python3.11/site-packages/sklearn/linear_model/_logistic.py:1272: FutureWarning: 'multi_class' was deprecated in version 1.5 and will be removed in 1.8. From then on, it will always use 'multinomial'. Leave it to its default value to avoid this warning.
  warnings.warn(
[I 2026-01-17 15:40:12,005] Trial 18 finished with value: 0.8496168582375478 and parameters: {'C': 0.00543158029106289, 'max_iter': 216, 'solver': 'newton-cg'}. Best is trial 7 with value: 0.9188218390804598.
/home/sjoon/projects/brain_connectivity_classifier/masterthesis_venv2/lib/python3.11/site-packages/sklearn/linear_model/_logistic.py:1272: FutureWarning: 'multi_class' was deprecated in version 1.5 and will be removed in 1.8. From then on, it will always use 'multinomial'. Leave it to its default value to avoid this warning.
  warnings.warn(
[I 2026-01-17 15:40:25,808] Trial 19 finished with value: 0.8996647509578544 and parameters: {'C': 0.9372114864858216, 'max_iter': 363, 'solver': 'lbfgs'}. Best is trial 7 with value: 0.9188218390804598.
/home/sjoon/projects/brain_connectivity_classifier/masterthesis_venv2/lib/python3.11/site-packages/sklearn/linear_model/_logistic.py:1272: FutureWarning: 'multi_class' was deprecated in version 1.5 and will be removed in 1.8. From then on, it will always use 'multinomial'. Leave it to its default value to avoid this warning.
  warnings.warn(
[I 2026-01-17 15:40:41,952] Trial 20 finished with value: 0.8833812260536399 and parameters: {'C': 8.482029646636363, 'max_iter': 486, 'solver': 'lbfgs'}. Best is trial 7 with value: 0.9188218390804598.
/home/sjoon/projects/brain_connectivity_classifier/masterthesis_venv2/lib/python3.11/site-packages/sklearn/linear_model/_logistic.py:1272: FutureWarning: 'multi_class' was deprecated in version 1.5 and will be removed in 1.8. From then on, it will always use 'multinomial'. Leave it to its default value to avoid this warning.
  warnings.warn(
[I 2026-01-17 15:40:56,936] Trial 21 finished with value: 0.9164272030651341 and parameters: {'C': 0.10030404075685566, 'max_iter': 329, 'solver': 'lbfgs'}. Best is trial 7 with value: 0.9188218390804598.
/home/sjoon/projects/brain_connectivity_classifier/masterthesis_venv2/lib/python3.11/site-packages/sklearn/linear_model/_logistic.py:1272: FutureWarning: 'multi_class' was deprecated in version 1.5 and will be removed in 1.8. From then on, it will always use 'multinomial'. Leave it to its default value to avoid this warning.
  warnings.warn(
[I 2026-01-17 15:41:09,432] Trial 22 finished with value: 0.9113984674329502 and parameters: {'C': 0.14516170068915918, 'max_iter': 375, 'solver': 'lbfgs'}. Best is trial 7 with value: 0.9188218390804598.
/home/sjoon/projects/brain_connectivity_classifier/masterthesis_venv2/lib/python3.11/site-packages/sklearn/linear_model/_logistic.py:1272: FutureWarning: 'multi_class' was deprecated in version 1.5 and will be removed in 1.8. From then on, it will always use 'multinomial'. Leave it to its default value to avoid this warning.
  warnings.warn(
[I 2026-01-17 15:41:17,612] Trial 23 finished with value: 0.8896072796934866 and parameters: {'C': 0.4145840582189552, 'max_iter': 335, 'solver': 'lbfgs'}. Best is trial 7 with value: 0.9188218390804598.
/home/sjoon/projects/brain_connectivity_classifier/masterthesis_venv2/lib/python3.11/site-packages/sklearn/linear_model/_logistic.py:1272: FutureWarning: 'multi_class' was deprecated in version 1.5 and will be removed in 1.8. From then on, it will always use 'multinomial'. Leave it to its default value to avoid this warning.
  warnings.warn(
[I 2026-01-17 15:41:29,872] Trial 24 finished with value: 0.9066091954022989 and parameters: {'C': 0.05379437056360231, 'max_iter': 249, 'solver': 'lbfgs'}. Best is trial 7 with value: 0.9188218390804598.
/home/sjoon/projects/brain_connectivity_classifier/masterthesis_venv2/lib/python3.11/site-packages/sklearn/linear_model/_logistic.py:1272: FutureWarning: 'multi_class' was deprecated in version 1.5 and will be removed in 1.8. From then on, it will always use 'multinomial'. Leave it to its default value to avoid this warning.
  warnings.warn(
[I 2026-01-17 15:41:40,252] Trial 25 finished with value: 0.9161877394636015 and parameters: {'C': 0.5914377224944243, 'max_iter': 174, 'solver': 'lbfgs'}. Best is trial 7 with value: 0.9188218390804598.
/home/sjoon/projects/brain_connectivity_classifier/masterthesis_venv2/lib/python3.11/site-packages/sklearn/linear_model/_logistic.py:1272: FutureWarning: 'multi_class' was deprecated in version 1.5 and will be removed in 1.8. From then on, it will always use 'multinomial'. Leave it to its default value to avoid this warning.
  warnings.warn(
[I 2026-01-17 15:41:42,110] Trial 26 finished with value: 0.9109195402298851 and parameters: {'C': 0.6523316908430875, 'max_iter': 146, 'solver': 'newton-cg'}. Best is trial 7 with value: 0.9188218390804598.
/home/sjoon/projects/brain_connectivity_classifier/masterthesis_venv2/lib/python3.11/site-packages/sklearn/linear_model/_logistic.py:1272: FutureWarning: 'multi_class' was deprecated in version 1.5 and will be removed in 1.8. From then on, it will always use 'multinomial'. Leave it to its default value to avoid this warning.
  warnings.warn(
[I 2026-01-17 15:41:53,384] Trial 27 finished with value: 0.8888888888888888 and parameters: {'C': 3.034187972135854, 'max_iter': 188, 'solver': 'lbfgs'}. Best is trial 7 with value: 0.9188218390804598.
/home/sjoon/projects/brain_connectivity_classifier/masterthesis_venv2/lib/python3.11/site-packages/sklearn/linear_model/_logistic.py:1272: FutureWarning: 'multi_class' was deprecated in version 1.5 and will be removed in 1.8. From then on, it will always use 'multinomial'. Leave it to its default value to avoid this warning.
  warnings.warn(
[I 2026-01-17 15:42:03,212] Trial 28 finished with value: 0.9123563218390804 and parameters: {'C': 0.20265535072878163, 'max_iter': 136, 'solver': 'lbfgs'}. Best is trial 7 with value: 0.9188218390804598.
/home/sjoon/projects/brain_connectivity_classifier/masterthesis_venv2/lib/python3.11/site-packages/sklearn/linear_model/_logistic.py:1272: FutureWarning: 'multi_class' was deprecated in version 1.5 and will be removed in 1.8. From then on, it will always use 'multinomial'. Leave it to its default value to avoid this warning.
  warnings.warn(
