[I 2026-01-04 23:52:17,093] A new study created in memory with name: no-name-5a5d5d39-524d-4808-b186-e5e595d72efd
[I 2026-01-05 00:03:43,089] Trial 0 finished with value: 0.8128728112372523 and parameters: {'C': 0.03148911647956861, 'max_iter': 200, 'solver': 'lbfgs'}. Best is trial 0 with value: 0.8128728112372523.
[I 2026-01-05 00:05:46,726] Trial 1 finished with value: 0.6465268424090822 and parameters: {'C': 0.0017073967431528124, 'max_iter': 200, 'solver': 'saga'}. Best is trial 0 with value: 0.8128728112372523.
[I 2026-01-05 00:08:46,971] Trial 2 finished with value: 0.8482778526072734 and parameters: {'C': 2.1368329072358767, 'max_iter': 200, 'solver': 'saga'}. Best is trial 2 with value: 0.8482778526072734.
[I 2026-01-05 00:13:21,036] Trial 3 finished with value: 0.830190494516067 and parameters: {'C': 0.05342937261279776, 'max_iter': 500, 'solver': 'saga'}. Best is trial 2 with value: 0.8482778526072734.
[I 2026-01-05 00:25:32,557] Trial 4 finished with value: 0.8297094477583221 and parameters: {'C': 0.06672367170464207, 'max_iter': 200, 'solver': 'lbfgs'}. Best is trial 2 with value: 0.8482778526072734.
[I 2026-01-05 00:38:27,639] Trial 5 finished with value: 0.8490475274196652 and parameters: {'C': 0.26926469100861794, 'max_iter': 1000, 'solver': 'lbfgs'}. Best is trial 5 with value: 0.8490475274196652.
[I 2026-01-05 00:42:35,815] Trial 6 finished with value: 0.79064845102944 and parameters: {'C': 0.01653693718282442, 'max_iter': 500, 'solver': 'saga'}. Best is trial 5 with value: 0.8490475274196652.
[I 2026-01-05 00:44:32,002] Trial 7 finished with value: 0.630556090051953 and parameters: {'C': 0.0013726318898045872, 'max_iter': 200, 'solver': 'saga'}. Best is trial 5 with value: 0.8490475274196652.
[I 2026-01-05 00:57:12,017] Trial 8 finished with value: 0.8428901289205311 and parameters: {'C': 0.1537592023548176, 'max_iter': 500, 'solver': 'lbfgs'}. Best is trial 5 with value: 0.8490475274196652.
[I 2026-01-05 01:00:07,577] Trial 9 finished with value: 0.8521262266692322 and parameters: {'C': 0.24637685958997463, 'max_iter': 200, 'solver': 'saga'}. Best is trial 9 with value: 0.8521262266692322.
[I 2026-01-05 01:07:45,978] Trial 10 finished with value: 0.852992110833173 and parameters: {'C': 6.5142520981548735, 'max_iter': 1000, 'solver': 'saga'}. Best is trial 10 with value: 0.852992110833173.
[I 2026-01-05 01:15:00,695] Trial 11 finished with value: 0.8532807388878199 and parameters: {'C': 5.359957765771774, 'max_iter': 1000, 'solver': 'saga'}. Best is trial 11 with value: 0.8532807388878199.
[I 2026-01-05 01:23:18,550] Trial 12 finished with value: 0.8521262266692322 and parameters: {'C': 8.596232686158428, 'max_iter': 1000, 'solver': 'saga'}. Best is trial 11 with value: 0.8532807388878199.
[I 2026-01-05 01:29:30,156] Trial 13 finished with value: 0.8585722532230132 and parameters: {'C': 1.5773500431900689, 'max_iter': 1000, 'solver': 'saga'}. Best is trial 13 with value: 0.8585722532230132.
[I 2026-01-05 01:35:41,388] Trial 14 finished with value: 0.8587646719261112 and parameters: {'C': 1.5399704173328987, 'max_iter': 1000, 'solver': 'saga'}. Best is trial 14 with value: 0.8587646719261112.
[I 2026-01-05 01:41:46,620] Trial 15 finished with value: 0.859149509332307 and parameters: {'C': 1.0437258483189134, 'max_iter': 1000, 'solver': 'saga'}. Best is trial 15 with value: 0.859149509332307.
[I 2026-01-05 01:47:51,492] Trial 16 finished with value: 0.8589570906292091 and parameters: {'C': 0.9955180780510451, 'max_iter': 1000, 'solver': 'saga'}. Best is trial 15 with value: 0.859149509332307.
[I 2026-01-05 01:53:47,372] Trial 17 finished with value: 0.8574177410044256 and parameters: {'C': 0.5729891581071085, 'max_iter': 1000, 'solver': 'saga'}. Best is trial 15 with value: 0.859149509332307.
[I 2026-01-05 02:07:04,095] Trial 18 finished with value: 0.8566480661920338 and parameters: {'C': 0.6377498741418529, 'max_iter': 1000, 'solver': 'lbfgs'}. Best is trial 15 with value: 0.859149509332307.
[I 2026-01-05 02:10:37,593] Trial 19 finished with value: 0.755050990956321 and parameters: {'C': 0.00810132484211601, 'max_iter': 1000, 'solver': 'saga'}. Best is trial 15 with value: 0.859149509332307.
[I 2026-01-05 02:16:38,908] Trial 20 finished with value: 0.8589570906292091 and parameters: {'C': 0.8102137777629879, 'max_iter': 1000, 'solver': 'saga'}. Best is trial 15 with value: 0.859149509332307.
[I 2026-01-05 02:22:36,849] Trial 21 finished with value: 0.8586684625745622 and parameters: {'C': 0.6744937916825595, 'max_iter': 1000, 'solver': 'saga'}. Best is trial 15 with value: 0.859149509332307.
[I 2026-01-05 02:28:59,441] Trial 22 finished with value: 0.8569366942466807 and parameters: {'C': 2.649797385146213, 'max_iter': 1000, 'solver': 'saga'}. Best is trial 15 with value: 0.859149509332307.
[I 2026-01-05 02:35:00,946] Trial 23 finished with value: 0.859149509332307 and parameters: {'C': 0.7723920971341861, 'max_iter': 1000, 'solver': 'saga'}. Best is trial 15 with value: 0.859149509332307.
[I 2026-01-05 02:41:41,928] Trial 24 finished with value: 0.8552049259187993 and parameters: {'C': 3.6815392196986205, 'max_iter': 1000, 'solver': 'saga'}. Best is trial 15 with value: 0.859149509332307.
[I 2026-01-05 02:46:08,824] Trial 25 finished with value: 0.8540504137002116 and parameters: {'C': 0.30008250806600745, 'max_iter': 500, 'solver': 'saga'}. Best is trial 15 with value: 0.859149509332307.
[I 2026-01-05 02:59:16,152] Trial 26 finished with value: 0.8603040215508947 and parameters: {'C': 1.2409933450857489, 'max_iter': 1000, 'solver': 'lbfgs'}. Best is trial 26 with value: 0.8603040215508947.
[I 2026-01-05 03:11:53,391] Trial 27 finished with value: 0.8411583605926496 and parameters: {'C': 0.12807572466131747, 'max_iter': 1000, 'solver': 'lbfgs'}. Best is trial 26 with value: 0.8603040215508947.
[I 2026-01-05 03:25:03,367] Trial 28 finished with value: 0.8542428324033096 and parameters: {'C': 0.432931388555368, 'max_iter': 1000, 'solver': 'lbfgs'}. Best is trial 26 with value: 0.8603040215508947.
[I 2026-01-05 03:37:57,633] Trial 29 finished with value: 0.8620357898787763 and parameters: {'C': 1.5709224758814602, 'max_iter': 500, 'solver': 'lbfgs'}. Best is trial 29 with value: 0.8620357898787763.
[I 2026-01-05 03:49:28,640] Trial 30 finished with value: 0.8667500481046758 and parameters: {'C': 3.8337620108596893, 'max_iter': 500, 'solver': 'lbfgs'}. Best is trial 30 with value: 0.8667500481046758.
[I 2026-01-05 04:01:01,813] Trial 31 finished with value: 0.866269001346931 and parameters: {'C': 3.7768914310565522, 'max_iter': 500, 'solver': 'lbfgs'}. Best is trial 30 with value: 0.8667500481046758.
[I 2026-01-05 04:12:30,370] Trial 32 finished with value: 0.8665576294015779 and parameters: {'C': 3.947496833916507, 'max_iter': 500, 'solver': 'lbfgs'}. Best is trial 30 with value: 0.8667500481046758.
[I 2026-01-05 04:24:07,522] Trial 33 finished with value: 0.866172791995382 and parameters: {'C': 3.6528547892417316, 'max_iter': 500, 'solver': 'lbfgs'}. Best is trial 30 with value: 0.8667500481046758.
[I 2026-01-05 04:35:46,546] Trial 34 finished with value: 0.8654031171829902 and parameters: {'C': 3.59999811253773, 'max_iter': 500, 'solver': 'lbfgs'}. Best is trial 30 with value: 0.8667500481046758.
[I 2026-01-05 04:47:13,575] Trial 35 finished with value: 0.866172791995382 and parameters: {'C': 4.07970344156614, 'max_iter': 500, 'solver': 'lbfgs'}. Best is trial 30 with value: 0.8667500481046758.
[I 2026-01-05 04:57:19,248] Trial 36 finished with value: 0.8708870502212815 and parameters: {'C': 9.356730739490125, 'max_iter': 500, 'solver': 'lbfgs'}. Best is trial 36 with value: 0.8708870502212815.
[I 2026-01-05 05:07:20,125] Trial 37 finished with value: 0.8714643063305754 and parameters: {'C': 9.68209145976759, 'max_iter': 500, 'solver': 'lbfgs'}. Best is trial 37 with value: 0.8714643063305754.
[I 2026-01-05 05:17:23,683] Trial 38 finished with value: 0.8719453530883202 and parameters: {'C': 9.600341441672175, 'max_iter': 500, 'solver': 'lbfgs'}. Best is trial 38 with value: 0.8719453530883202.
[I 2026-01-05 05:27:29,664] Trial 39 finished with value: 0.8706946315181836 and parameters: {'C': 9.298709545475761, 'max_iter': 500, 'solver': 'lbfgs'}. Best is trial 38 with value: 0.8719453530883202.
[I 2026-01-05 05:38:06,001] Trial 40 finished with value: 0.869251491244949 and parameters: {'C': 6.592318760277425, 'max_iter': 500, 'solver': 'lbfgs'}. Best is trial 38 with value: 0.8719453530883202.
[I 2026-01-05 05:48:33,384] Trial 41 finished with value: 0.8705984221666346 and parameters: {'C': 7.252317567703164, 'max_iter': 500, 'solver': 'lbfgs'}. Best is trial 38 with value: 0.8719453530883202.
[I 2026-01-05 05:58:41,194] Trial 42 finished with value: 0.8705984221666346 and parameters: {'C': 9.215388456012844, 'max_iter': 500, 'solver': 'lbfgs'}. Best is trial 38 with value: 0.8719453530883202.
[I 2026-01-05 06:08:45,905] Trial 43 finished with value: 0.8704060034635367 and parameters: {'C': 9.231467609346668, 'max_iter': 500, 'solver': 'lbfgs'}. Best is trial 38 with value: 0.8719453530883202.
[I 2026-01-05 06:21:14,062] Trial 44 finished with value: 0.8632865114489129 and parameters: {'C': 2.2041052379885615, 'max_iter': 500, 'solver': 'lbfgs'}. Best is trial 38 with value: 0.8719453530883202.
[I 2026-01-05 06:31:55,060] Trial 45 finished with value: 0.869540119299596 and parameters: {'C': 6.3653049614048, 'max_iter': 200, 'solver': 'lbfgs'}. Best is trial 38 with value: 0.8719453530883202.
[I 2026-01-05 06:42:11,786] Trial 46 finished with value: 0.7136809697902636 and parameters: {'C': 0.004334873830542053, 'max_iter': 500, 'solver': 'lbfgs'}. Best is trial 38 with value: 0.8719453530883202.
[I 2026-01-05 06:52:16,817] Trial 47 finished with value: 0.8714643063305754 and parameters: {'C': 9.628024003981503, 'max_iter': 500, 'solver': 'lbfgs'}. Best is trial 38 with value: 0.8719453530883202.
[I 2026-01-05 07:04:37,663] Trial 48 finished with value: 0.8322108908985953 and parameters: {'C': 0.07272738925806131, 'max_iter': 500, 'solver': 'lbfgs'}. Best is trial 38 with value: 0.8719453530883202.
[I 2026-01-05 07:16:19,000] Trial 49 finished with value: 0.8173946507600539 and parameters: {'C': 0.03677233630184411, 'max_iter': 200, 'solver': 'lbfgs'}. Best is trial 38 with value: 0.8719453530883202.
