[I 2026-01-04 23:53:03,814] A new study created in memory with name: no-name-26a3ffcd-250d-4ff0-91bc-0da75b5f9fec
[I 2026-01-04 23:53:34,465] Trial 0 finished with value: 0.9343852222436021 and parameters: {'C': 0.03148911647956861, 'max_iter': 200, 'solver': 'lbfgs'}. Best is trial 0 with value: 0.9343852222436021.
[I 2026-01-04 23:53:37,106] Trial 1 finished with value: 0.8410621512411006 and parameters: {'C': 0.0017073967431528124, 'max_iter': 200, 'solver': 'saga'}. Best is trial 0 with value: 0.9343852222436021.
[I 2026-01-04 23:53:57,323] Trial 2 finished with value: 0.9370790840869733 and parameters: {'C': 2.1368329072358767, 'max_iter': 200, 'solver': 'saga'}. Best is trial 2 with value: 0.9370790840869733.
[I 2026-01-04 23:54:05,581] Trial 3 finished with value: 0.9366942466807774 and parameters: {'C': 0.05342937261279776, 'max_iter': 500, 'solver': 'saga'}. Best is trial 2 with value: 0.9370790840869733.
[I 2026-01-04 23:54:35,169] Trial 4 finished with value: 0.9376563401962671 and parameters: {'C': 0.06672367170464207, 'max_iter': 200, 'solver': 'lbfgs'}. Best is trial 4 with value: 0.9376563401962671.
[I 2026-01-04 23:55:06,777] Trial 5 finished with value: 0.9393881085241486 and parameters: {'C': 0.26926469100861794, 'max_iter': 1000, 'solver': 'lbfgs'}. Best is trial 5 with value: 0.9393881085241486.
[I 2026-01-04 23:55:12,627] Trial 6 finished with value: 0.9268808928227824 and parameters: {'C': 0.01653693718282442, 'max_iter': 500, 'solver': 'saga'}. Best is trial 5 with value: 0.9393881085241486.
[I 2026-01-04 23:55:14,887] Trial 7 finished with value: 0.8218202809313065 and parameters: {'C': 0.0013726318898045872, 'max_iter': 200, 'solver': 'saga'}. Best is trial 5 with value: 0.9393881085241486.
[I 2026-01-04 23:55:46,739] Trial 8 finished with value: 0.937848758899365 and parameters: {'C': 0.1537592023548176, 'max_iter': 500, 'solver': 'lbfgs'}. Best is trial 5 with value: 0.9393881085241486.
[I 2026-01-04 23:56:04,389] Trial 9 finished with value: 0.9403502020396383 and parameters: {'C': 0.24637685958997463, 'max_iter': 200, 'solver': 'saga'}. Best is trial 9 with value: 0.9403502020396383.
[I 2026-01-04 23:57:33,527] Trial 10 finished with value: 0.9326534539157206 and parameters: {'C': 6.5142520981548735, 'max_iter': 1000, 'solver': 'saga'}. Best is trial 9 with value: 0.9403502020396383.
[I 2026-01-04 23:58:05,822] Trial 11 finished with value: 0.9397729459303444 and parameters: {'C': 0.5203051191621613, 'max_iter': 1000, 'solver': 'lbfgs'}. Best is trial 9 with value: 0.9403502020396383.
[I 2026-01-04 23:58:38,770] Trial 12 finished with value: 0.9391956898210506 and parameters: {'C': 0.716284167695775, 'max_iter': 1000, 'solver': 'lbfgs'}. Best is trial 9 with value: 0.9403502020396383.
[I 2026-01-04 23:59:11,810] Trial 13 finished with value: 0.938041177602463 and parameters: {'C': 0.8987153901963643, 'max_iter': 1000, 'solver': 'lbfgs'}. Best is trial 9 with value: 0.9403502020396383.
[I 2026-01-04 23:59:16,270] Trial 14 finished with value: 0.9128343274966326 and parameters: {'C': 0.007633157742658479, 'max_iter': 1000, 'solver': 'saga'}. Best is trial 9 with value: 0.9403502020396383.
[I 2026-01-04 23:59:48,398] Trial 15 finished with value: 0.9399653646334424 and parameters: {'C': 0.433735260715236, 'max_iter': 200, 'solver': 'lbfgs'}. Best is trial 9 with value: 0.9403502020396383.
[I 2026-01-05 00:00:08,671] Trial 16 finished with value: 0.9366942466807774 and parameters: {'C': 3.5092247138920962, 'max_iter': 200, 'solver': 'saga'}. Best is trial 9 with value: 0.9403502020396383.
[I 2026-01-05 00:00:41,491] Trial 17 finished with value: 0.9395805272272465 and parameters: {'C': 0.26756282848537805, 'max_iter': 200, 'solver': 'lbfgs'}. Best is trial 9 with value: 0.9403502020396383.
[I 2026-01-05 00:01:01,764] Trial 18 finished with value: 0.9374639214931691 and parameters: {'C': 1.4150485648737194, 'max_iter': 200, 'solver': 'saga'}. Best is trial 9 with value: 0.9403502020396383.
[I 2026-01-05 00:01:36,483] Trial 19 finished with value: 0.9307292668847412 and parameters: {'C': 9.639757903159541, 'max_iter': 200, 'solver': 'lbfgs'}. Best is trial 9 with value: 0.9403502020396383.
[I 2026-01-05 00:01:49,159] Trial 20 finished with value: 0.9391956898210506 and parameters: {'C': 0.13101470133896445, 'max_iter': 200, 'solver': 'saga'}. Best is trial 9 with value: 0.9403502020396383.
[I 2026-01-05 00:02:21,855] Trial 21 finished with value: 0.9403502020396383 and parameters: {'C': 0.45042834710787033, 'max_iter': 1000, 'solver': 'lbfgs'}. Best is trial 9 with value: 0.9403502020396383.
[I 2026-01-05 00:02:54,647] Trial 22 finished with value: 0.9401577833365403 and parameters: {'C': 0.3715456242095289, 'max_iter': 1000, 'solver': 'lbfgs'}. Best is trial 9 with value: 0.9403502020396383.
[I 2026-01-05 00:03:26,000] Trial 23 finished with value: 0.9391956898210506 and parameters: {'C': 0.20907412303866518, 'max_iter': 1000, 'solver': 'lbfgs'}. Best is trial 9 with value: 0.9403502020396383.
[I 2026-01-05 00:03:59,210] Trial 24 finished with value: 0.9365018279776794 and parameters: {'C': 1.442549422323151, 'max_iter': 1000, 'solver': 'lbfgs'}. Best is trial 9 with value: 0.9403502020396383.
[I 2026-01-05 00:04:29,254] Trial 25 finished with value: 0.937848758899365 and parameters: {'C': 0.08184324789356132, 'max_iter': 1000, 'solver': 'lbfgs'}. Best is trial 9 with value: 0.9403502020396383.
[I 2026-01-05 00:05:01,215] Trial 26 finished with value: 0.9401577833365403 and parameters: {'C': 0.3763519332187634, 'max_iter': 1000, 'solver': 'lbfgs'}. Best is trial 9 with value: 0.9403502020396383.
[I 2026-01-05 00:05:34,767] Trial 27 finished with value: 0.9351548970559939 and parameters: {'C': 2.8294973231916143, 'max_iter': 500, 'solver': 'lbfgs'}. Best is trial 9 with value: 0.9403502020396383.
[I 2026-01-05 00:05:41,643] Trial 28 finished with value: 0.9345776409467 and parameters: {'C': 0.03022547526056243, 'max_iter': 1000, 'solver': 'saga'}. Best is trial 9 with value: 0.9403502020396383.
[I 2026-01-05 00:06:09,296] Trial 29 finished with value: 0.9324610352126227 and parameters: {'C': 0.025875344978019486, 'max_iter': 1000, 'solver': 'lbfgs'}. Best is trial 9 with value: 0.9403502020396383.
[I 2026-01-05 00:06:42,971] Trial 30 finished with value: 0.937848758899365 and parameters: {'C': 0.8654520839165118, 'max_iter': 500, 'solver': 'lbfgs'}. Best is trial 9 with value: 0.9403502020396383.
[I 2026-01-05 00:07:15,081] Trial 31 finished with value: 0.9397729459303444 and parameters: {'C': 0.35546426283800997, 'max_iter': 1000, 'solver': 'lbfgs'}. Best is trial 9 with value: 0.9403502020396383.
[I 2026-01-05 00:07:46,226] Trial 32 finished with value: 0.938041177602463 and parameters: {'C': 0.14099801857288644, 'max_iter': 1000, 'solver': 'lbfgs'}. Best is trial 9 with value: 0.9403502020396383.
[I 2026-01-05 00:08:19,256] Trial 33 finished with value: 0.9403502020396383 and parameters: {'C': 0.5290273910371013, 'max_iter': 1000, 'solver': 'lbfgs'}. Best is trial 9 with value: 0.9403502020396383.
[I 2026-01-05 00:08:53,783] Trial 34 finished with value: 0.9366942466807774 and parameters: {'C': 1.4506359101583213, 'max_iter': 1000, 'solver': 'lbfgs'}. Best is trial 9 with value: 0.9403502020396383.
[I 2026-01-05 00:09:02,351] Trial 35 finished with value: 0.9366942466807774 and parameters: {'C': 0.053824802473418386, 'max_iter': 1000, 'solver': 'saga'}. Best is trial 9 with value: 0.9403502020396383.
[I 2026-01-05 00:09:35,271] Trial 36 finished with value: 0.9395805272272465 and parameters: {'C': 0.6437904739361539, 'max_iter': 1000, 'solver': 'lbfgs'}. Best is trial 9 with value: 0.9403502020396383.
[I 2026-01-05 00:09:50,723] Trial 37 finished with value: 0.9397729459303444 and parameters: {'C': 0.1975226705759461, 'max_iter': 200, 'solver': 'saga'}. Best is trial 9 with value: 0.9403502020396383.
[I 2026-01-05 00:10:21,029] Trial 38 finished with value: 0.9376563401962671 and parameters: {'C': 0.07711196702722121, 'max_iter': 500, 'solver': 'lbfgs'}. Best is trial 9 with value: 0.9403502020396383.
[I 2026-01-05 00:10:25,173] Trial 39 finished with value: 0.9072541851067923 and parameters: {'C': 0.006557404063079524, 'max_iter': 1000, 'solver': 'saga'}. Best is trial 9 with value: 0.9403502020396383.
[I 2026-01-05 00:10:55,713] Trial 40 finished with value: 0.9374639214931691 and parameters: {'C': 0.11180417410105135, 'max_iter': 200, 'solver': 'lbfgs'}. Best is trial 9 with value: 0.9403502020396383.
[I 2026-01-05 00:11:27,676] Trial 41 finished with value: 0.9399653646334424 and parameters: {'C': 0.3351158190938736, 'max_iter': 1000, 'solver': 'lbfgs'}. Best is trial 9 with value: 0.9403502020396383.
[I 2026-01-05 00:11:59,962] Trial 42 finished with value: 0.9403502020396383 and parameters: {'C': 0.44936370176425905, 'max_iter': 1000, 'solver': 'lbfgs'}. Best is trial 9 with value: 0.9403502020396383.
[I 2026-01-05 00:12:33,350] Trial 43 finished with value: 0.9361169905714836 and parameters: {'C': 1.2192892088978982, 'max_iter': 1000, 'solver': 'lbfgs'}. Best is trial 9 with value: 0.9403502020396383.
[I 2026-01-05 00:13:05,800] Trial 44 finished with value: 0.9395805272272465 and parameters: {'C': 0.5562409289521428, 'max_iter': 1000, 'solver': 'lbfgs'}. Best is trial 9 with value: 0.9403502020396383.
[I 2026-01-05 00:13:38,279] Trial 45 finished with value: 0.9393881085241486 and parameters: {'C': 0.25486641666572857, 'max_iter': 1000, 'solver': 'lbfgs'}. Best is trial 9 with value: 0.9403502020396383.
[I 2026-01-05 00:14:42,463] Trial 46 finished with value: 0.9343852222436021 and parameters: {'C': 2.0574718680829784, 'max_iter': 1000, 'solver': 'saga'}. Best is trial 9 with value: 0.9403502020396383.
[I 2026-01-05 00:15:15,119] Trial 47 finished with value: 0.9397729459303444 and parameters: {'C': 0.5177050204817863, 'max_iter': 500, 'solver': 'lbfgs'}. Best is trial 9 with value: 0.9403502020396383.
[I 2026-01-05 00:15:46,659] Trial 48 finished with value: 0.9393881085241486 and parameters: {'C': 0.18942208187541243, 'max_iter': 1000, 'solver': 'lbfgs'}. Best is trial 9 with value: 0.9403502020396383.
[I 2026-01-05 00:16:07,307] Trial 49 finished with value: 0.9384260150086589 and parameters: {'C': 1.000328786988958, 'max_iter': 200, 'solver': 'saga'}. Best is trial 9 with value: 0.9403502020396383.
[I 2026-01-05 00:18:04,005] A new study created in memory with name: no-name-5aecee8f-6982-4f6a-818f-c2843bce27a1
[I 2026-01-05 00:18:32,966] Trial 0 finished with value: 0.9320761978064268 and parameters: {'C': 0.03148911647956861, 'max_iter': 200, 'solver': 'lbfgs'}. Best is trial 0 with value: 0.9320761978064268.
[I 2026-01-05 00:18:35,556] Trial 1 finished with value: 0.8379834519915336 and parameters: {'C': 0.0017073967431528124, 'max_iter': 200, 'solver': 'saga'}. Best is trial 0 with value: 0.9320761978064268.
[I 2026-01-05 00:18:56,263] Trial 2 finished with value: 0.9355397344621897 and parameters: {'C': 2.1368329072358767, 'max_iter': 200, 'solver': 'saga'}. Best is trial 2 with value: 0.9355397344621897.
[I 2026-01-05 00:19:04,685] Trial 3 finished with value: 0.9343852222436021 and parameters: {'C': 0.05342937261279776, 'max_iter': 500, 'solver': 'saga'}. Best is trial 2 with value: 0.9355397344621897.
[I 2026-01-05 00:19:36,091] Trial 4 finished with value: 0.9353473157590918 and parameters: {'C': 0.06672367170464207, 'max_iter': 200, 'solver': 'lbfgs'}. Best is trial 2 with value: 0.9355397344621897.
[I 2026-01-05 00:20:09,207] Trial 5 finished with value: 0.9357321531652877 and parameters: {'C': 0.26926469100861794, 'max_iter': 1000, 'solver': 'lbfgs'}. Best is trial 5 with value: 0.9357321531652877.
[I 2026-01-05 00:20:15,446] Trial 6 finished with value: 0.92803540504137 and parameters: {'C': 0.01653693718282442, 'max_iter': 500, 'solver': 'saga'}. Best is trial 5 with value: 0.9357321531652877.
[I 2026-01-05 00:20:17,934] Trial 7 finished with value: 0.8197036751972292 and parameters: {'C': 0.0013726318898045872, 'max_iter': 200, 'solver': 'saga'}. Best is trial 5 with value: 0.9357321531652877.
[I 2026-01-05 00:20:49,918] Trial 8 finished with value: 0.9363094092745815 and parameters: {'C': 0.1537592023548176, 'max_iter': 500, 'solver': 'lbfgs'}. Best is trial 8 with value: 0.9363094092745815.
[I 2026-01-05 00:21:08,225] Trial 9 finished with value: 0.9386184337117568 and parameters: {'C': 0.24637685958997463, 'max_iter': 200, 'solver': 'saga'}. Best is trial 9 with value: 0.9386184337117568.
[I 2026-01-05 00:22:40,020] Trial 10 finished with value: 0.9305368481816433 and parameters: {'C': 6.5142520981548735, 'max_iter': 1000, 'solver': 'saga'}. Best is trial 9 with value: 0.9386184337117568.
[I 2026-01-05 00:23:13,402] Trial 11 finished with value: 0.9349624783528959 and parameters: {'C': 0.5203051191621613, 'max_iter': 500, 'solver': 'lbfgs'}. Best is trial 9 with value: 0.9386184337117568.
[I 2026-01-05 00:23:46,436] Trial 12 finished with value: 0.9355397344621897 and parameters: {'C': 0.4935937942089268, 'max_iter': 500, 'solver': 'lbfgs'}. Best is trial 9 with value: 0.9386184337117568.
[I 2026-01-05 00:24:13,311] Trial 13 finished with value: 0.9155281893400038 and parameters: {'C': 0.008433492996539149, 'max_iter': 500, 'solver': 'lbfgs'}. Best is trial 9 with value: 0.9386184337117568.
[I 2026-01-05 00:24:30,644] Trial 14 finished with value: 0.9382335963055609 and parameters: {'C': 0.2200920159492968, 'max_iter': 1000, 'solver': 'saga'}. Best is trial 9 with value: 0.9386184337117568.
[I 2026-01-05 00:25:22,851] Trial 15 finished with value: 0.9353473157590918 and parameters: {'C': 1.3941165518456244, 'max_iter': 1000, 'solver': 'saga'}. Best is trial 9 with value: 0.9386184337117568.
[I 2026-01-05 00:26:15,119] Trial 16 finished with value: 0.9353473157590918 and parameters: {'C': 1.4021726710723157, 'max_iter': 1000, 'solver': 'saga'}. Best is trial 9 with value: 0.9386184337117568.
[I 2026-01-05 00:27:47,337] Trial 17 finished with value: 0.9301520107754474 and parameters: {'C': 9.606036088506645, 'max_iter': 1000, 'solver': 'saga'}. Best is trial 9 with value: 0.9386184337117568.
[I 2026-01-05 00:28:01,047] Trial 18 finished with value: 0.9390032711179527 and parameters: {'C': 0.1440391093220847, 'max_iter': 200, 'solver': 'saga'}. Best is trial 18 with value: 0.9390032711179527.
[I 2026-01-05 00:28:05,979] Trial 19 finished with value: 0.9059072541851068 and parameters: {'C': 0.006037732475265266, 'max_iter': 200, 'solver': 'saga'}. Best is trial 18 with value: 0.9390032711179527.
[I 2026-01-05 00:28:26,255] Trial 20 finished with value: 0.9368866653838753 and parameters: {'C': 0.6380183777714135, 'max_iter': 200, 'solver': 'saga'}. Best is trial 18 with value: 0.9390032711179527.
[I 2026-01-05 00:28:41,735] Trial 21 finished with value: 0.937848758899365 and parameters: {'C': 0.1805651823579581, 'max_iter': 200, 'solver': 'saga'}. Best is trial 18 with value: 0.9390032711179527.
[I 2026-01-05 00:28:53,279] Trial 22 finished with value: 0.9384260150086589 and parameters: {'C': 0.0985096017039372, 'max_iter': 1000, 'solver': 'saga'}. Best is trial 18 with value: 0.9390032711179527.
[I 2026-01-05 00:29:04,109] Trial 23 finished with value: 0.9376563401962671 and parameters: {'C': 0.0936707210625551, 'max_iter': 200, 'solver': 'saga'}. Best is trial 18 with value: 0.9390032711179527.
[I 2026-01-05 00:29:10,773] Trial 24 finished with value: 0.9307292668847412 and parameters: {'C': 0.024284891686189306, 'max_iter': 200, 'solver': 'saga'}. Best is trial 18 with value: 0.9390032711179527.
[I 2026-01-05 00:29:20,203] Trial 25 finished with value: 0.9368866653838753 and parameters: {'C': 0.06909298442942162, 'max_iter': 1000, 'solver': 'saga'}. Best is trial 18 with value: 0.9390032711179527.
[I 2026-01-05 00:29:40,863] Trial 26 finished with value: 0.938041177602463 and parameters: {'C': 0.34153655933257715, 'max_iter': 200, 'solver': 'saga'}. Best is trial 18 with value: 0.9390032711179527.
[I 2026-01-05 00:29:53,686] Trial 27 finished with value: 0.9388108524148547 and parameters: {'C': 0.13231506937153747, 'max_iter': 1000, 'solver': 'saga'}. Best is trial 18 with value: 0.9390032711179527.
[I 2026-01-05 00:30:14,375] Trial 28 finished with value: 0.9361169905714836 and parameters: {'C': 2.5567886050352517, 'max_iter': 200, 'solver': 'saga'}. Best is trial 18 with value: 0.9390032711179527.
[I 2026-01-05 00:30:21,611] Trial 29 finished with value: 0.9326534539157206 and parameters: {'C': 0.03254920004397887, 'max_iter': 200, 'solver': 'saga'}. Best is trial 18 with value: 0.9390032711179527.
[I 2026-01-05 00:31:01,275] Trial 30 finished with value: 0.9372715027900712 and parameters: {'C': 0.8654520839165118, 'max_iter': 1000, 'solver': 'saga'}. Best is trial 18 with value: 0.9390032711179527.
[I 2026-01-05 00:31:14,611] Trial 31 finished with value: 0.938041177602463 and parameters: {'C': 0.1235763590826492, 'max_iter': 1000, 'solver': 'saga'}. Best is trial 18 with value: 0.9390032711179527.
[I 2026-01-05 00:31:21,898] Trial 32 finished with value: 0.9330382913219165 and parameters: {'C': 0.03502845699979609, 'max_iter': 1000, 'solver': 'saga'}. Best is trial 18 with value: 0.9390032711179527.
[I 2026-01-05 00:31:44,283] Trial 33 finished with value: 0.937848758899365 and parameters: {'C': 0.3233547957550212, 'max_iter': 1000, 'solver': 'saga'}. Best is trial 18 with value: 0.9390032711179527.
[I 2026-01-05 00:31:55,659] Trial 34 finished with value: 0.9384260150086589 and parameters: {'C': 0.0981002148311751, 'max_iter': 200, 'solver': 'saga'}. Best is trial 18 with value: 0.9390032711179527.
[I 2026-01-05 00:32:01,438] Trial 35 finished with value: 0.9241870309794112 and parameters: {'C': 0.013165342185285905, 'max_iter': 1000, 'solver': 'saga'}. Best is trial 18 with value: 0.9390032711179527.
[I 2026-01-05 00:32:05,191] Trial 36 finished with value: 0.8780065422359054 and parameters: {'C': 0.0031078062441888374, 'max_iter': 200, 'solver': 'saga'}. Best is trial 18 with value: 0.9390032711179527.
[I 2026-01-05 00:32:35,127] Trial 37 finished with value: 0.9340003848374062 and parameters: {'C': 0.05368639857596875, 'max_iter': 1000, 'solver': 'lbfgs'}. Best is trial 18 with value: 0.9390032711179527.
[I 2026-01-05 00:32:50,887] Trial 38 finished with value: 0.937848758899365 and parameters: {'C': 0.17638392103919875, 'max_iter': 200, 'solver': 'saga'}. Best is trial 18 with value: 0.9390032711179527.
[I 2026-01-05 00:32:58,712] Trial 39 finished with value: 0.9345776409467 and parameters: {'C': 0.043371846695576775, 'max_iter': 1000, 'solver': 'saga'}. Best is trial 18 with value: 0.9390032711179527.
[I 2026-01-05 00:33:31,611] Trial 40 finished with value: 0.9353473157590918 and parameters: {'C': 0.3206785905409236, 'max_iter': 200, 'solver': 'lbfgs'}. Best is trial 18 with value: 0.9390032711179527.
[I 2026-01-05 00:33:42,070] Trial 41 finished with value: 0.937848758899365 and parameters: {'C': 0.08971591240629398, 'max_iter': 200, 'solver': 'saga'}. Best is trial 18 with value: 0.9390032711179527.
[I 2026-01-05 00:33:54,795] Trial 42 finished with value: 0.9382335963055609 and parameters: {'C': 0.12195271287835874, 'max_iter': 200, 'solver': 'saga'}. Best is trial 18 with value: 0.9390032711179527.
[I 2026-01-05 00:34:04,563] Trial 43 finished with value: 0.9372715027900712 and parameters: {'C': 0.07488084189038474, 'max_iter': 200, 'solver': 'saga'}. Best is trial 18 with value: 0.9390032711179527.
[I 2026-01-05 00:34:22,248] Trial 44 finished with value: 0.9382335963055609 and parameters: {'C': 0.21869232727544027, 'max_iter': 200, 'solver': 'saga'}. Best is trial 18 with value: 0.9390032711179527.
[I 2026-01-05 00:34:28,794] Trial 45 finished with value: 0.9293823359630556 and parameters: {'C': 0.02183509346497857, 'max_iter': 500, 'solver': 'saga'}. Best is trial 18 with value: 0.9390032711179527.
[I 2026-01-05 00:34:41,916] Trial 46 finished with value: 0.9390032711179527 and parameters: {'C': 0.1364444847254442, 'max_iter': 200, 'solver': 'saga'}. Best is trial 18 with value: 0.9390032711179527.
[I 2026-01-05 00:35:15,151] Trial 47 finished with value: 0.9355397344621897 and parameters: {'C': 0.478921912572835, 'max_iter': 500, 'solver': 'lbfgs'}. Best is trial 18 with value: 0.9390032711179527.
[I 2026-01-05 00:35:56,279] Trial 48 finished with value: 0.9370790840869733 and parameters: {'C': 0.8985179718892693, 'max_iter': 1000, 'solver': 'saga'}. Best is trial 18 with value: 0.9390032711179527.
[I 2026-01-05 00:36:10,495] Trial 49 finished with value: 0.9388108524148547 and parameters: {'C': 0.149255053257563, 'max_iter': 200, 'solver': 'saga'}. Best is trial 18 with value: 0.9390032711179527.
