[I 2026-01-04 23:53:24,672] A new study created in memory with name: no-name-e42c0a43-dc4d-4363-b9f3-d066031e1885
[I 2026-01-04 23:55:34,149] Trial 0 finished with value: 0.8327881470078892 and parameters: {'C': 0.03148911647956861, 'max_iter': 200, 'solver': 'lbfgs'}. Best is trial 0 with value: 0.8327881470078892.
[I 2026-01-04 23:55:42,455] Trial 1 finished with value: 0.6967481239176448 and parameters: {'C': 0.0017073967431528124, 'max_iter': 200, 'solver': 'saga'}. Best is trial 0 with value: 0.8327881470078892.
[I 2026-01-04 23:56:03,563] Trial 2 finished with value: 0.8722339811429671 and parameters: {'C': 2.1368329072358767, 'max_iter': 200, 'solver': 'saga'}. Best is trial 2 with value: 0.8722339811429671.
[I 2026-01-04 23:56:29,119] Trial 3 finished with value: 0.849720992880508 and parameters: {'C': 0.05342937261279776, 'max_iter': 500, 'solver': 'saga'}. Best is trial 2 with value: 0.8722339811429671.
[I 2026-01-04 23:58:45,297] Trial 4 finished with value: 0.8551087165672503 and parameters: {'C': 0.06672367170464207, 'max_iter': 200, 'solver': 'lbfgs'}. Best is trial 2 with value: 0.8722339811429671.
[I 2026-01-05 00:01:20,733] Trial 5 finished with value: 0.8720415624398692 and parameters: {'C': 0.26926469100861794, 'max_iter': 1000, 'solver': 'lbfgs'}. Best is trial 2 with value: 0.8722339811429671.
[I 2026-01-05 00:01:38,331] Trial 6 finished with value: 0.8112372522609198 and parameters: {'C': 0.01653693718282442, 'max_iter': 500, 'solver': 'saga'}. Best is trial 2 with value: 0.8722339811429671.
[I 2026-01-05 00:01:46,301] Trial 7 finished with value: 0.6842409082162786 and parameters: {'C': 0.0013726318898045872, 'max_iter': 200, 'solver': 'saga'}. Best is trial 2 with value: 0.8722339811429671.
[I 2026-01-05 00:04:13,386] Trial 8 finished with value: 0.8668462574562248 and parameters: {'C': 0.1537592023548176, 'max_iter': 500, 'solver': 'lbfgs'}. Best is trial 2 with value: 0.8722339811429671.
[I 2026-01-05 00:04:33,042] Trial 9 finished with value: 0.8737733307677507 and parameters: {'C': 0.24637685958997463, 'max_iter': 200, 'solver': 'saga'}. Best is trial 9 with value: 0.8737733307677507.
[I 2026-01-05 00:05:24,063] Trial 10 finished with value: 0.8737733307677507 and parameters: {'C': 6.5142520981548735, 'max_iter': 1000, 'solver': 'saga'}. Best is trial 9 with value: 0.8737733307677507.
[I 2026-01-05 00:06:13,896] Trial 11 finished with value: 0.8747354242832404 and parameters: {'C': 5.359957765771774, 'max_iter': 1000, 'solver': 'saga'}. Best is trial 11 with value: 0.8747354242832404.
[I 2026-01-05 00:07:02,447] Trial 12 finished with value: 0.8803155666730806 and parameters: {'C': 1.039789698228831, 'max_iter': 1000, 'solver': 'saga'}. Best is trial 12 with value: 0.8803155666730806.
[I 2026-01-05 00:07:51,263] Trial 13 finished with value: 0.879161054454493 and parameters: {'C': 1.443322249838249, 'max_iter': 1000, 'solver': 'saga'}. Best is trial 12 with value: 0.8803155666730806.
[I 2026-01-05 00:08:39,699] Trial 14 finished with value: 0.8801231479699827 and parameters: {'C': 1.1950252886317614, 'max_iter': 1000, 'solver': 'saga'}. Best is trial 12 with value: 0.8803155666730806.
[I 2026-01-05 00:09:26,879] Trial 15 finished with value: 0.879161054454493 and parameters: {'C': 0.8389079213738032, 'max_iter': 1000, 'solver': 'saga'}. Best is trial 12 with value: 0.8803155666730806.
[I 2026-01-05 00:10:10,642] Trial 16 finished with value: 0.875889936501828 and parameters: {'C': 0.4270945942438214, 'max_iter': 1000, 'solver': 'saga'}. Best is trial 12 with value: 0.8803155666730806.
[I 2026-01-05 00:11:01,031] Trial 17 finished with value: 0.8774292861266115 and parameters: {'C': 2.832965127104102, 'max_iter': 1000, 'solver': 'saga'}. Best is trial 12 with value: 0.8803155666730806.
[I 2026-01-05 00:13:43,691] Trial 18 finished with value: 0.8780065422359054 and parameters: {'C': 0.6377498741418529, 'max_iter': 1000, 'solver': 'lbfgs'}. Best is trial 12 with value: 0.8803155666730806.
[I 2026-01-05 00:14:37,900] Trial 19 finished with value: 0.872618818549163 and parameters: {'C': 9.639757903159541, 'max_iter': 1000, 'solver': 'saga'}. Best is trial 12 with value: 0.8803155666730806.
[I 2026-01-05 00:15:27,050] Trial 20 finished with value: 0.8781989609390033 and parameters: {'C': 1.5837630309310917, 'max_iter': 1000, 'solver': 'saga'}. Best is trial 12 with value: 0.8803155666730806.
[I 2026-01-05 00:16:15,862] Trial 21 finished with value: 0.8803155666730806 and parameters: {'C': 1.1328121902945856, 'max_iter': 1000, 'solver': 'saga'}. Best is trial 12 with value: 0.8803155666730806.
[I 2026-01-05 00:17:03,561] Trial 22 finished with value: 0.879161054454493 and parameters: {'C': 0.8304993906265253, 'max_iter': 1000, 'solver': 'saga'}. Best is trial 12 with value: 0.8803155666730806.
[I 2026-01-05 00:17:54,038] Trial 23 finished with value: 0.8766596113142198 and parameters: {'C': 3.2995575446337932, 'max_iter': 1000, 'solver': 'saga'}. Best is trial 12 with value: 0.8803155666730806.
[I 2026-01-05 00:18:30,614] Trial 24 finished with value: 0.8699249567057918 and parameters: {'C': 0.17044727115556518, 'max_iter': 1000, 'solver': 'saga'}. Best is trial 12 with value: 0.8803155666730806.
[I 2026-01-05 00:19:04,553] Trial 25 finished with value: 0.8749278429863383 and parameters: {'C': 0.43262779615254593, 'max_iter': 500, 'solver': 'saga'}. Best is trial 12 with value: 0.8803155666730806.
[I 2026-01-05 00:21:49,467] Trial 26 finished with value: 0.8783913796421012 and parameters: {'C': 1.0622840288002442, 'max_iter': 1000, 'solver': 'lbfgs'}. Best is trial 12 with value: 0.8803155666730806.
[I 2026-01-05 00:22:39,936] Trial 27 finished with value: 0.8756975177987301 and parameters: {'C': 4.190489743326639, 'max_iter': 1000, 'solver': 'saga'}. Best is trial 12 with value: 0.8803155666730806.
[I 2026-01-05 00:22:53,753] Trial 28 finished with value: 0.7791033288435636 and parameters: {'C': 0.008444531826929415, 'max_iter': 1000, 'solver': 'saga'}. Best is trial 12 with value: 0.8803155666730806.
[I 2026-01-05 00:25:34,622] Trial 29 finished with value: 0.8781989609390033 and parameters: {'C': 0.48945255960698797, 'max_iter': 500, 'solver': 'lbfgs'}. Best is trial 12 with value: 0.8803155666730806.
[I 2026-01-05 00:26:05,947] Trial 30 finished with value: 0.8610736963632865 and parameters: {'C': 0.09418422659551436, 'max_iter': 1000, 'solver': 'saga'}. Best is trial 12 with value: 0.8803155666730806.
[I 2026-01-05 00:26:57,141] Trial 31 finished with value: 0.8781989609390033 and parameters: {'C': 1.577476594328989, 'max_iter': 1000, 'solver': 'saga'}. Best is trial 12 with value: 0.8803155666730806.
[I 2026-01-05 00:27:46,093] Trial 32 finished with value: 0.878968635751395 and parameters: {'C': 1.5052609975557172, 'max_iter': 1000, 'solver': 'saga'}. Best is trial 12 with value: 0.8803155666730806.
[I 2026-01-05 00:28:36,363] Trial 33 finished with value: 0.8787762170482971 and parameters: {'C': 2.2967853457215592, 'max_iter': 1000, 'solver': 'saga'}. Best is trial 12 with value: 0.8803155666730806.
[I 2026-01-05 00:29:24,904] Trial 34 finished with value: 0.8797383105637868 and parameters: {'C': 1.2615652558085202, 'max_iter': 1000, 'solver': 'saga'}. Best is trial 12 with value: 0.8803155666730806.
[I 2026-01-05 00:29:42,048] Trial 35 finished with value: 0.8299018664614201 and parameters: {'C': 0.026718734153364735, 'max_iter': 200, 'solver': 'saga'}. Best is trial 12 with value: 0.8803155666730806.
[I 2026-01-05 00:30:23,186] Trial 36 finished with value: 0.8747354242832404 and parameters: {'C': 0.30774566645142404, 'max_iter': 1000, 'solver': 'saga'}. Best is trial 12 with value: 0.8803155666730806.
[I 2026-01-05 00:32:35,238] Trial 37 finished with value: 0.8812776601885703 and parameters: {'C': 9.138963360015623, 'max_iter': 200, 'solver': 'lbfgs'}. Best is trial 37 with value: 0.8812776601885703.
[I 2026-01-05 00:34:48,313] Trial 38 finished with value: 0.8814700788916683 and parameters: {'C': 9.464269950957082, 'max_iter': 200, 'solver': 'lbfgs'}. Best is trial 38 with value: 0.8814700788916683.
[I 2026-01-05 00:37:04,790] Trial 39 finished with value: 0.882432172407158 and parameters: {'C': 7.687405824506018, 'max_iter': 200, 'solver': 'lbfgs'}. Best is trial 39 with value: 0.882432172407158.
[I 2026-01-05 00:39:23,986] Trial 40 finished with value: 0.8812776601885703 and parameters: {'C': 6.592318760277425, 'max_iter': 200, 'solver': 'lbfgs'}. Best is trial 39 with value: 0.882432172407158.
[I 2026-01-05 00:41:38,542] Trial 41 finished with value: 0.8801231479699827 and parameters: {'C': 8.501360918380424, 'max_iter': 200, 'solver': 'lbfgs'}. Best is trial 39 with value: 0.882432172407158.
[I 2026-01-05 00:44:06,370] Trial 42 finished with value: 0.8814700788916683 and parameters: {'C': 4.923443917736371, 'max_iter': 200, 'solver': 'lbfgs'}. Best is trial 39 with value: 0.882432172407158.
[I 2026-01-05 00:46:33,635] Trial 43 finished with value: 0.8810852414854724 and parameters: {'C': 5.067570967226382, 'max_iter': 200, 'solver': 'lbfgs'}. Best is trial 39 with value: 0.882432172407158.
[I 2026-01-05 00:48:52,913] Trial 44 finished with value: 0.8812776601885703 and parameters: {'C': 6.590274983436829, 'max_iter': 200, 'solver': 'lbfgs'}. Best is trial 39 with value: 0.882432172407158.
[I 2026-01-05 00:51:05,297] Trial 45 finished with value: 0.8816624975947662 and parameters: {'C': 9.541400402532746, 'max_iter': 200, 'solver': 'lbfgs'}. Best is trial 39 with value: 0.882432172407158.
[I 2026-01-05 00:53:38,997] Trial 46 finished with value: 0.8808928227823745 and parameters: {'C': 3.763925223475905, 'max_iter': 200, 'solver': 'lbfgs'}. Best is trial 39 with value: 0.882432172407158.
[I 2026-01-05 00:55:50,418] Trial 47 finished with value: 0.8820473350009621 and parameters: {'C': 9.622970312565114, 'max_iter': 200, 'solver': 'lbfgs'}. Best is trial 39 with value: 0.882432172407158.
[I 2026-01-05 00:58:28,861] Trial 48 finished with value: 0.8803155666730806 and parameters: {'C': 2.582630503295552, 'max_iter': 200, 'solver': 'lbfgs'}. Best is trial 39 with value: 0.882432172407158.
[I 2026-01-05 01:00:17,919] Trial 49 finished with value: 0.7246488358668463 and parameters: {'C': 0.0028044332718699058, 'max_iter': 200, 'solver': 'lbfgs'}. Best is trial 39 with value: 0.882432172407158.
[I 2026-01-05 01:16:09,220] A new study created in memory with name: no-name-36edef51-5641-487b-90ed-d86b68381d8c
[I 2026-01-05 01:18:15,640] Trial 0 finished with value: 0.8281700981335386 and parameters: {'C': 0.03148911647956861, 'max_iter': 200, 'solver': 'lbfgs'}. Best is trial 0 with value: 0.8281700981335386.
[I 2026-01-05 01:18:24,180] Trial 1 finished with value: 0.6903983067154127 and parameters: {'C': 0.0017073967431528124, 'max_iter': 200, 'solver': 'saga'}. Best is trial 0 with value: 0.8281700981335386.
[I 2026-01-05 01:18:45,020] Trial 2 finished with value: 0.8745430055801424 and parameters: {'C': 2.1368329072358767, 'max_iter': 200, 'solver': 'saga'}. Best is trial 2 with value: 0.8745430055801424.
[I 2026-01-05 01:19:10,332] Trial 3 finished with value: 0.8427939195689821 and parameters: {'C': 0.05342937261279776, 'max_iter': 500, 'solver': 'saga'}. Best is trial 2 with value: 0.8745430055801424.
[I 2026-01-05 01:21:28,000] Trial 4 finished with value: 0.8458726188185491 and parameters: {'C': 0.06672367170464207, 'max_iter': 200, 'solver': 'lbfgs'}. Best is trial 2 with value: 0.8745430055801424.
[I 2026-01-05 01:24:00,856] Trial 5 finished with value: 0.8664614200500289 and parameters: {'C': 0.26926469100861794, 'max_iter': 1000, 'solver': 'lbfgs'}. Best is trial 2 with value: 0.8745430055801424.
[I 2026-01-05 01:24:18,709] Trial 6 finished with value: 0.810659996151626 and parameters: {'C': 0.01653693718282442, 'max_iter': 500, 'solver': 'saga'}. Best is trial 2 with value: 0.8745430055801424.
[I 2026-01-05 01:24:26,638] Trial 7 finished with value: 0.6757744852799692 and parameters: {'C': 0.0013726318898045872, 'max_iter': 200, 'solver': 'saga'}. Best is trial 2 with value: 0.8745430055801424.
[I 2026-01-05 01:26:54,786] Trial 8 finished with value: 0.8610736963632865 and parameters: {'C': 0.1537592023548176, 'max_iter': 500, 'solver': 'lbfgs'}. Best is trial 2 with value: 0.8745430055801424.
[I 2026-01-05 01:27:13,774] Trial 9 finished with value: 0.8687704444872042 and parameters: {'C': 0.24637685958997463, 'max_iter': 200, 'solver': 'saga'}. Best is trial 2 with value: 0.8745430055801424.
[I 2026-01-05 01:28:05,351] Trial 10 finished with value: 0.8745430055801424 and parameters: {'C': 8.165528450509141, 'max_iter': 1000, 'solver': 'saga'}. Best is trial 2 with value: 0.8745430055801424.
[I 2026-01-05 01:28:55,813] Trial 11 finished with value: 0.8756975177987301 and parameters: {'C': 6.464947866087908, 'max_iter': 1000, 'solver': 'saga'}. Best is trial 11 with value: 0.8756975177987301.
[I 2026-01-05 01:29:49,085] Trial 12 finished with value: 0.8751202616894362 and parameters: {'C': 8.819429776626714, 'max_iter': 1000, 'solver': 'saga'}. Best is trial 11 with value: 0.8756975177987301.
[I 2026-01-05 01:30:42,792] Trial 13 finished with value: 0.8751202616894362 and parameters: {'C': 9.790124537563562, 'max_iter': 1000, 'solver': 'saga'}. Best is trial 11 with value: 0.8756975177987301.
[I 2026-01-05 01:31:30,725] Trial 14 finished with value: 0.8781989609390033 and parameters: {'C': 1.559864319752156, 'max_iter': 1000, 'solver': 'saga'}. Best is trial 14 with value: 0.8781989609390033.
[I 2026-01-05 01:32:18,605] Trial 15 finished with value: 0.8770444487204156 and parameters: {'C': 1.2410019295186945, 'max_iter': 1000, 'solver': 'saga'}. Best is trial 14 with value: 0.8781989609390033.
[I 2026-01-05 01:33:05,308] Trial 16 finished with value: 0.8762747739080239 and parameters: {'C': 1.0333471731246633, 'max_iter': 1000, 'solver': 'saga'}. Best is trial 14 with value: 0.8781989609390033.
[I 2026-01-05 01:33:51,954] Trial 17 finished with value: 0.875889936501828 and parameters: {'C': 1.0187004282995953, 'max_iter': 1000, 'solver': 'saga'}. Best is trial 14 with value: 0.8781989609390033.
[I 2026-01-05 01:36:34,221] Trial 18 finished with value: 0.8720415624398692 and parameters: {'C': 0.6377498741418529, 'max_iter': 1000, 'solver': 'lbfgs'}. Best is trial 14 with value: 0.8781989609390033.
[I 2026-01-05 01:37:23,326] Trial 19 finished with value: 0.8770444487204156 and parameters: {'C': 2.407628168654005, 'max_iter': 1000, 'solver': 'saga'}. Best is trial 14 with value: 0.8781989609390033.
[I 2026-01-05 01:38:12,556] Trial 20 finished with value: 0.8780065422359054 and parameters: {'C': 2.8505322089850225, 'max_iter': 1000, 'solver': 'saga'}. Best is trial 14 with value: 0.8781989609390033.
[I 2026-01-05 01:39:02,745] Trial 21 finished with value: 0.8778141235328074 and parameters: {'C': 2.986096970641114, 'max_iter': 1000, 'solver': 'saga'}. Best is trial 14 with value: 0.8781989609390033.
[I 2026-01-05 01:39:52,601] Trial 22 finished with value: 0.8781989609390033 and parameters: {'C': 3.489659465717492, 'max_iter': 1000, 'solver': 'saga'}. Best is trial 14 with value: 0.8781989609390033.
[I 2026-01-05 01:40:36,090] Trial 23 finished with value: 0.8733884933615548 and parameters: {'C': 0.49771331584386064, 'max_iter': 1000, 'solver': 'saga'}. Best is trial 14 with value: 0.8781989609390033.
[I 2026-01-05 01:41:26,073] Trial 24 finished with value: 0.8780065422359054 and parameters: {'C': 3.7863137275354104, 'max_iter': 1000, 'solver': 'saga'}. Best is trial 14 with value: 0.8781989609390033.
[I 2026-01-05 01:42:06,697] Trial 25 finished with value: 0.8762747739080239 and parameters: {'C': 3.7041048873265514, 'max_iter': 500, 'solver': 'saga'}. Best is trial 14 with value: 0.8781989609390033.
[I 2026-01-05 01:44:45,514] Trial 26 finished with value: 0.869347700596498 and parameters: {'C': 0.42050491739718143, 'max_iter': 1000, 'solver': 'lbfgs'}. Best is trial 14 with value: 0.8781989609390033.
[I 2026-01-05 01:45:34,231] Trial 27 finished with value: 0.8785837983451992 and parameters: {'C': 1.6839123065172783, 'max_iter': 1000, 'solver': 'saga'}. Best is trial 27 with value: 0.8785837983451992.
[I 2026-01-05 01:45:49,639] Trial 28 finished with value: 0.7956513373099865 and parameters: {'C': 0.012050610858222928, 'max_iter': 1000, 'solver': 'saga'}. Best is trial 27 with value: 0.8785837983451992.
[I 2026-01-05 01:48:33,307] Trial 29 finished with value: 0.8755050990956321 and parameters: {'C': 1.5709224758814602, 'max_iter': 500, 'solver': 'lbfgs'}. Best is trial 27 with value: 0.8785837983451992.
[I 2026-01-05 01:49:19,559] Trial 30 finished with value: 0.8756975177987301 and parameters: {'C': 0.772292686661597, 'max_iter': 1000, 'solver': 'saga'}. Best is trial 27 with value: 0.8785837983451992.
[I 2026-01-05 01:50:09,724] Trial 31 finished with value: 0.8781989609390033 and parameters: {'C': 3.955187738439099, 'max_iter': 1000, 'solver': 'saga'}. Best is trial 27 with value: 0.8785837983451992.
[I 2026-01-05 01:50:59,812] Trial 32 finished with value: 0.8764671926111218 and parameters: {'C': 4.779358176280234, 'max_iter': 1000, 'solver': 'saga'}. Best is trial 27 with value: 0.8785837983451992.
[I 2026-01-05 01:51:48,820] Trial 33 finished with value: 0.8783913796421012 and parameters: {'C': 1.8029132161525185, 'max_iter': 1000, 'solver': 'saga'}. Best is trial 27 with value: 0.8785837983451992.
[I 2026-01-05 01:52:37,079] Trial 34 finished with value: 0.8781989609390033 and parameters: {'C': 1.781583655980999, 'max_iter': 1000, 'solver': 'saga'}. Best is trial 27 with value: 0.8785837983451992.
[I 2026-01-05 01:52:55,533] Trial 35 finished with value: 0.8624206272849722 and parameters: {'C': 0.14012447838221526, 'max_iter': 200, 'solver': 'saga'}. Best is trial 27 with value: 0.8785837983451992.
[I 2026-01-05 01:53:37,095] Trial 36 finished with value: 0.8708870502212815 and parameters: {'C': 0.3755336640471454, 'max_iter': 1000, 'solver': 'saga'}. Best is trial 27 with value: 0.8785837983451992.
[I 2026-01-05 01:55:48,046] Trial 37 finished with value: 0.8324033096016933 and parameters: {'C': 0.03650668965889911, 'max_iter': 200, 'solver': 'lbfgs'}. Best is trial 27 with value: 0.8785837983451992.
[I 2026-01-05 01:56:25,957] Trial 38 finished with value: 0.8776217048297095 and parameters: {'C': 1.798030401664576, 'max_iter': 500, 'solver': 'saga'}. Best is trial 27 with value: 0.8785837983451992.
[I 2026-01-05 01:56:38,575] Trial 39 finished with value: 0.7677506253607851 and parameters: {'C': 0.006557404063079524, 'max_iter': 1000, 'solver': 'saga'}. Best is trial 27 with value: 0.8785837983451992.
[I 2026-01-05 01:58:56,790] Trial 40 finished with value: 0.8481816432557244 and parameters: {'C': 0.08196358060589026, 'max_iter': 200, 'solver': 'lbfgs'}. Best is trial 27 with value: 0.8785837983451992.
[I 2026-01-05 01:59:47,590] Trial 41 finished with value: 0.8764671926111218 and parameters: {'C': 4.792162569278791, 'max_iter': 1000, 'solver': 'saga'}. Best is trial 27 with value: 0.8785837983451992.
[I 2026-01-05 02:00:37,666] Trial 42 finished with value: 0.8756975177987301 and parameters: {'C': 5.591880738976712, 'max_iter': 1000, 'solver': 'saga'}. Best is trial 27 with value: 0.8785837983451992.
[I 2026-01-05 02:00:47,896] Trial 43 finished with value: 0.7198383682893977 and parameters: {'C': 0.002835345960500369, 'max_iter': 1000, 'solver': 'saga'}. Best is trial 27 with value: 0.8785837983451992.
[I 2026-01-05 02:01:36,670] Trial 44 finished with value: 0.8768520300173177 and parameters: {'C': 2.281380485036502, 'max_iter': 1000, 'solver': 'saga'}. Best is trial 27 with value: 0.8785837983451992.
[I 2026-01-05 02:02:14,054] Trial 45 finished with value: 0.8664614200500289 and parameters: {'C': 0.23755718358558964, 'max_iter': 1000, 'solver': 'saga'}. Best is trial 27 with value: 0.8785837983451992.
[I 2026-01-05 02:02:49,356] Trial 46 finished with value: 0.8766596113142198 and parameters: {'C': 0.8082102268666975, 'max_iter': 500, 'solver': 'saga'}. Best is trial 27 with value: 0.8785837983451992.
[I 2026-01-05 02:03:36,845] Trial 47 finished with value: 0.8774292861266115 and parameters: {'C': 1.3939786750222294, 'max_iter': 1000, 'solver': 'saga'}. Best is trial 27 with value: 0.8785837983451992.
[I 2026-01-05 02:04:27,369] Trial 48 finished with value: 0.8755050990956321 and parameters: {'C': 6.7833282174410465, 'max_iter': 1000, 'solver': 'saga'}. Best is trial 27 with value: 0.8785837983451992.
[I 2026-01-05 02:04:48,471] Trial 49 finished with value: 0.8731960746584568 and parameters: {'C': 3.3795019588729356, 'max_iter': 200, 'solver': 'saga'}. Best is trial 27 with value: 0.8785837983451992.
